ks_imp_rhmc/test/tunecache.tsv
tunecache	0.5.0	cpu_arch=x86_64,gpu_arch=sm_35	# Last updated Mon Sep 23 18:12:46 2013

volume	name	aux	block.x	block.y	block.z	grid.x	grid.y	grid.z	shared_bytes	comment
12x12x12x10	N4quda13fermion_force10MiddleLinkI7double2S2_EE	threads=8640,prec=8,recon=12,sig=0,mu=1	192	1	1	45	1	1	16385	# 0.00 Gflop/s, 0.00 GB/s, tuned Mon Sep 23 17:19:59 2013
12x12x12x10	N4quda13fermion_force10MiddleLinkI7double2S2_EE	threads=8640,prec=8,recon=12,sig=0,mu=2	64	1	1	135	1	1	12289	# 0.00 Gflop/s, 0.00 GB/s, tuned Mon Sep 23 17:19:58 2013
12x12x12x10	N4quda13fermion_force10MiddleLinkI7double2S2_EE	threads=8640,prec=8,recon=12,sig=0,mu=3	352	1	1	25	1	1	8193	# 0.00 Gflop/s, 0.00 GB/s, tuned Mon Sep 23 17:19:58 2013
12x12x12x10	N4quda13fermion_force10MiddleLinkI7double2S2_EE	threads=8640,prec=8,recon=12,sig=0,mu=4	352	1	1	25	1	1	12289	# 0.00 Gflop/s, 0.00 GB/s, tuned Mon Sep 23 17:19:58 2013
12x12x12x10	N4quda13fermion_force10MiddleLinkI7double2S2_EE	threads=8640,prec=8,recon=12,sig=0,mu=5	128	1	1	68	1	1	16385	# 0.00 Gflop/s, 0.00 GB/s, tuned Mon Sep 23 17:19:58 2013
12x12x12x10	N4quda13fermion_force10MiddleLinkI7double2S2_EE	threads=8640,prec=8,recon=12,sig=0,mu=6	192	1	1	45	1	1	9831	# 0.00 Gflop/s, 0.00 GB/s, tuned Mon Sep 23 17:19:59 2013
12x12x12x10	N4quda13fermion_force10MiddleLinkI7double2S2_EE	threads=8640,prec=8,recon=12,sig=1,mu=0	384	1	1	23	1	1	24577	# 0.00 Gflop/s, 0.00 GB/s, tuned Mon Sep 23 17:20:00 2013
12x12x12x10	N4quda13fermion_force10MiddleLinkI7double2S2_EE	threads=8640,prec=8,recon=12,sig=1,mu=2	352	1	1	25	1	1	12289	# 0.00 Gflop/s, 0.00 GB/s, tuned Mon Sep 23 17:19:59 2013
12x12x12x10	N4quda13fermion_force10MiddleLinkI7double2S2_EE	threads=8640,prec=8,recon=12,sig=1,mu=3	128	1	1	68	1	1	6145	# 0.00 Gflop/s, 0.00 GB/s, tuned Mon Sep 23 17:20:00 2013
12x12x12x10	N4quda13fermion_force10MiddleLinkI7double2S2_EE	threads=8640,prec=8,recon=12,sig=1,mu=4	352	1	1	25	1	1	8193	# 0.00 Gflop/s, 0.00 GB/s, tuned Mon Sep 23 17:20:00 2013
12x12x12x10	N4quda13fermion_force10MiddleLinkI7double2S2_EE	threads=8640,prec=8,recon=12,sig=1,mu=5	352	1	1	25	1	1	0	# 0.00 Gflop/s, 0.00 GB/s, tuned Mon Sep 23 17:20:00 2013
12x12x12x10	N4quda13fermion_force10MiddleLinkI7double2S2_EE	threads=8640,prec=8,recon=12,sig=1,mu=7	352	1	1	25	1	1	16385	# 0.00 Gflop/s, 0.00 GB/s, tuned Mon Sep 23 17:20:00 2013
12x12x12x10	N4quda13fermion_force10MiddleLinkI7double2S2_EE	threads=8640,prec=8,recon=12,sig=2,mu=0	96	1	1	90	1	1	24577	# 0.00 Gflop/s, 0.00 GB/s, tuned Mon Sep 23 17:20:02 2013
12x12x12x10	N4quda13fermion_force10MiddleLinkI7double2S2_EE	threads=8640,prec=8,recon=12,sig=2,mu=1	352	1	1	25	1	1	16385	# 0.00 Gflop/s, 0.00 GB/s, tuned Mon Sep 23 17:20:01 2013
12x12x12x10	N4quda13fermion_force10MiddleLinkI7double2S2_EE	threads=8640,prec=8,recon=12,sig=2,mu=3	96	1	1	90	1	1	8193	# 0.00 Gflop/s, 0.00 GB/s, tuned Mon Sep 23 17:20:01 2013
12x12x12x10	N4quda13fermion_force10MiddleLinkI7double2S2_EE	threads=8640,prec=8,recon=12,sig=2,mu=4	32	1	1	270	1	1	6145	# 0.00 Gflop/s, 0.00 GB/s, tuned Mon Sep 23 17:20:02 2013
12x12x12x10	N4quda13fermion_force10MiddleLinkI7double2S2_EE	threads=8640,prec=8,recon=12,sig=2,mu=6	96	1	1	90	1	1	24577	# 0.00 Gflop/s, 0.00 GB/s, tuned Mon Sep 23 17:20:02 2013
12x12x12x10	N4quda13fermion_force10MiddleLinkI7double2S2_EE	threads=8640,prec=8,recon=12,sig=2,mu=7	352	1	1	25	1	1	16385	# 0.00 Gflop/s, 0.00 GB/s, tuned Mon Sep 23 17:20:02 2013
12x12x12x10	N4quda13fermion_force10MiddleLinkI7double2S2_EE	threads=8640,prec=8,recon=12,sig=3,mu=0	96	1	1	90	1	1	12289	# 0.00 Gflop/s, 0.00 GB/s, tuned Mon Sep 23 17:20:04 2013
12x12x12x10	N4quda13fermion_force10MiddleLinkI7double2S2_EE	threads=8640,prec=8,recon=12,sig=3,mu=1	96	1	1	90	1	1	0	# 0.00 Gflop/s, 0.00 GB/s, tuned Mon Sep 23 17:20:03 2013
12x12x12x10	N4quda13fermion_force10MiddleLinkI7double2S2_EE	threads=8640,prec=8,recon=12,sig=3,mu=2	64	1	1	135	1	1	12289	# 0.00 Gflop/s, 0.00 GB/s, tuned Mon Sep 23 17:20:03 2013
12x12x12x10	N4quda13fermion_force10MiddleLinkI7double2S2_EE	threads=8640,prec=8,recon=12,sig=3,mu=5	352	1	1	25	1	1	8193	# 0.00 Gflop/s, 0.00 GB/s, tuned Mon Sep 23 17:20:03 2013
12x12x12x10	N4quda13fermion_force10MiddleLinkI7double2S2_EE	threads=8640,prec=8,recon=12,sig=3,mu=6	352	1	1	25	1	1	24577	# 0.00 Gflop/s, 0.00 GB/s, tuned Mon Sep 23 17:20:03 2013
12x12x12x10	N4quda13fermion_force10MiddleLinkI7double2S2_EE	threads=8640,prec=8,recon=12,sig=3,mu=7	352	1	1	25	1	1	7022	# 0.00 Gflop/s, 0.00 GB/s, tuned Mon Sep 23 17:20:04 2013
12x12x12x10	N4quda13fermion_force10MiddleLinkI7double2S2_EE	threads=8640,prec=8,recon=12,sig=4,mu=0	64	1	1	135	1	1	7022	# 0.00 Gflop/s, 0.00 GB/s, tuned Mon Sep 23 17:20:05 2013
12x12x12x10	N4quda13fermion_force10MiddleLinkI7double2S2_EE	threads=8640,prec=8,recon=12,sig=4,mu=1	128	1	1	68	1	1	8193	# 0.00 Gflop/s, 0.00 GB/s, tuned Mon Sep 23 17:20:04 2013
12x12x12x10	N4quda13fermion_force10MiddleLinkI7double2S2_EE	threads=8640,prec=8,recon=12,sig=4,mu=2	192	1	1	45	1	1	6145	# 0.00 Gflop/s, 0.00 GB/s, tuned Mon Sep 23 17:20:05 2013
12x12x12x10	N4quda13fermion_force10MiddleLinkI7double2S2_EE	threads=8640,prec=8,recon=12,sig=4,mu=5	192	1	1	45	1	1	16385	# 0.00 Gflop/s, 0.00 GB/s, tuned Mon Sep 23 17:20:05 2013
12x12x12x10	N4quda13fermion_force10MiddleLinkI7double2S2_EE	threads=8640,prec=8,recon=12,sig=4,mu=6	96	1	1	90	1	1	12289	# 0.00 Gflop/s, 0.00 GB/s, tuned Mon Sep 23 17:20:05 2013
12x12x12x10	N4quda13fermion_force10MiddleLinkI7double2S2_EE	threads=8640,prec=8,recon=12,sig=4,mu=7	96	1	1	90	1	1	24577	# 0.00 Gflop/s, 0.00 GB/s, tuned Mon Sep 23 17:20:05 2013
12x12x12x10	N4quda13fermion_force10MiddleLinkI7double2S2_EE	threads=8640,prec=8,recon=12,sig=5,mu=0	352	1	1	25	1	1	12289	# 0.00 Gflop/s, 0.00 GB/s, tuned Mon Sep 23 17:20:07 2013
12x12x12x10	N4quda13fermion_force10MiddleLinkI7double2S2_EE	threads=8640,prec=8,recon=12,sig=5,mu=1	96	1	1	90	1	1	24577	# 0.00 Gflop/s, 0.00 GB/s, tuned Mon Sep 23 17:20:06 2013
12x12x12x10	N4quda13fermion_force10MiddleLinkI7double2S2_EE	threads=8640,prec=8,recon=12,sig=5,mu=3	352	1	1	25	1	1	7022	# 0.00 Gflop/s, 0.00 GB/s, tuned Mon Sep 23 17:20:06 2013
12x12x12x10	N4quda13fermion_force10MiddleLinkI7double2S2_EE	threads=8640,prec=8,recon=12,sig=5,mu=4	96	1	1	90	1	1	24577	# 0.00 Gflop/s, 0.00 GB/s, tuned Mon Sep 23 17:20:06 2013
12x12x12x10	N4quda13fermion_force10MiddleLinkI7double2S2_EE	threads=8640,prec=8,recon=12,sig=5,mu=6	352	1	1	25	1	1	7022	# 0.00 Gflop/s, 0.00 GB/s, tuned Mon Sep 23 17:20:07 2013
12x12x12x10	N4quda13fermion_force10MiddleLinkI7double2S2_EE	threads=8640,prec=8,recon=12,sig=5,mu=7	128	1	1	68	1	1	6145	# 0.00 Gflop/s, 0.00 GB/s, tuned Mon Sep 23 17:20:07 2013
12x12x12x10	N4quda13fermion_force10MiddleLinkI7double2S2_EE	threads=8640,prec=8,recon=12,sig=6,mu=0	128	1	1	68	1	1	16385	# 0.00 Gflop/s, 0.00 GB/s, tuned Mon Sep 23 17:20:08 2013
12x12x12x10	N4quda13fermion_force10MiddleLinkI7double2S2_EE	threads=8640,prec=8,recon=12,sig=6,mu=2	64	1	1	135	1	1	7022	# 0.00 Gflop/s, 0.00 GB/s, tuned Mon Sep 23 17:20:08 2013
12x12x12x10	N4quda13fermion_force10MiddleLinkI7double2S2_EE	threads=8640,prec=8,recon=12,sig=6,mu=3	96	1	1	90	1	1	9831	# 0.00 Gflop/s, 0.00 GB/s, tuned Mon Sep 23 17:20:08 2013
12x12x12x10	N4quda13fermion_force10MiddleLinkI7double2S2_EE	threads=8640,prec=8,recon=12,sig=6,mu=4	128	1	1	68	1	1	16385	# 0.00 Gflop/s, 0.00 GB/s, tuned Mon Sep 23 17:20:08 2013
12x12x12x10	N4quda13fermion_force10MiddleLinkI7double2S2_EE	threads=8640,prec=8,recon=12,sig=6,mu=5	192	1	1	45	1	1	7022	# 0.00 Gflop/s, 0.00 GB/s, tuned Mon Sep 23 17:20:08 2013
12x12x12x10	N4quda13fermion_force10MiddleLinkI7double2S2_EE	threads=8640,prec=8,recon=12,sig=6,mu=7	352	1	1	25	1	1	7022	# 0.00 Gflop/s, 0.00 GB/s, tuned Mon Sep 23 17:20:09 2013
12x12x12x10	N4quda13fermion_force10MiddleLinkI7double2S2_EE	threads=8640,prec=8,recon=12,sig=7,mu=1	192	1	1	45	1	1	24577	# 0.00 Gflop/s, 0.00 GB/s, tuned Mon Sep 23 17:20:10 2013
12x12x12x10	N4quda13fermion_force10MiddleLinkI7double2S2_EE	threads=8640,prec=8,recon=12,sig=7,mu=2	192	1	1	45	1	1	8193	# 0.00 Gflop/s, 0.00 GB/s, tuned Mon Sep 23 17:20:09 2013
12x12x12x10	N4quda13fermion_force10MiddleLinkI7double2S2_EE	threads=8640,prec=8,recon=12,sig=7,mu=3	128	1	1	68	1	1	16385	# 0.00 Gflop/s, 0.00 GB/s, tuned Mon Sep 23 17:20:09 2013
12x12x12x10	N4quda13fermion_force10MiddleLinkI7double2S2_EE	threads=8640,prec=8,recon=12,sig=7,mu=4	96	1	1	90	1	1	24577	# 0.00 Gflop/s, 0.00 GB/s, tuned Mon Sep 23 17:20:10 2013
12x12x12x10	N4quda13fermion_force10MiddleLinkI7double2S2_EE	threads=8640,prec=8,recon=12,sig=7,mu=5	352	1	1	25	1	1	9831	# 0.00 Gflop/s, 0.00 GB/s, tuned Mon Sep 23 17:20:10 2013
12x12x12x10	N4quda13fermion_force10MiddleLinkI7double2S2_EE	threads=8640,prec=8,recon=12,sig=7,mu=6	352	1	1	25	1	1	8193	# 0.00 Gflop/s, 0.00 GB/s, tuned Mon Sep 23 17:20:10 2013
12x12x12x10	N4quda13fermion_force10MiddleLinkI7double2S2_EE	threads=8640,prec=8,recon=18,sig=0,mu=1	128	1	1	68	1	1	6145	# 0.00 Gflop/s, 0.00 GB/s, tuned Mon Sep 23 17:19:25 2013
12x12x12x10	N4quda13fermion_force10MiddleLinkI7double2S2_EE	threads=8640,prec=8,recon=18,sig=0,mu=2	64	1	1	135	1	1	7022	# 0.00 Gflop/s, 0.00 GB/s, tuned Mon Sep 23 17:19:25 2013
12x12x12x10	N4quda13fermion_force10MiddleLinkI7double2S2_EE	threads=8640,prec=8,recon=18,sig=0,mu=3	64	1	1	135	1	1	9831	# 0.00 Gflop/s, 0.00 GB/s, tuned Mon Sep 23 17:19:25 2013
12x12x12x10	N4quda13fermion_force10MiddleLinkI7double2S2_EE	threads=8640,prec=8,recon=18,sig=0,mu=4	128	1	1	68	1	1	9831	# 0.00 Gflop/s, 0.00 GB/s, tuned Mon Sep 23 17:19:25 2013
12x12x12x10	N4quda13fermion_force10MiddleLinkI7double2S2_EE	threads=8640,prec=8,recon=18,sig=0,mu=5	128	1	1	68	1	1	12289	# 0.00 Gflop/s, 0.00 GB/s, tuned Mon Sep 23 17:19:25 2013
12x12x12x10	N4quda13fermion_force10MiddleLinkI7double2S2_EE	threads=8640,prec=8,recon=18,sig=0,mu=6	128	1	1	68	1	1	24577	# 0.00 Gflop/s, 0.00 GB/s, tuned Mon Sep 23 17:19:26 2013
12x12x12x10	N4quda13fermion_force10MiddleLinkI7double2S2_EE	threads=8640,prec=8,recon=18,sig=1,mu=0	352	1	1	25	1	1	12289	# 0.00 Gflop/s, 0.00 GB/s, tuned Mon Sep 23 17:19:28 2013
12x12x12x10	N4quda13fermion_force10MiddleLinkI7double2S2_EE	threads=8640,prec=8,recon=18,sig=1,mu=2	352	1	1	25	1	1	24577	# 0.00 Gflop/s, 0.00 GB/s, tuned Mon Sep 23 17:19:27 2013
12x12x12x10	N4quda13fermion_force10MiddleLinkI7double2S2_EE	threads=8640,prec=8,recon=18,sig=1,mu=3	96	1	1	90	1	1	8193	# 0.00 Gflop/s, 0.00 GB/s, tuned Mon Sep 23 17:19:27 2013
12x12x12x10	N4quda13fermion_force10MiddleLinkI7double2S2_EE	threads=8640,prec=8,recon=18,sig=1,mu=4	352	1	1	25	1	1	8193	# 0.00 Gflop/s, 0.00 GB/s, tuned Mon Sep 23 17:19:27 2013
12x12x12x10	N4quda13fermion_force10MiddleLinkI7double2S2_EE	threads=8640,prec=8,recon=18,sig=1,mu=5	384	1	1	23	1	1	6145	# 0.00 Gflop/s, 0.00 GB/s, tuned Mon Sep 23 17:19:28 2013
12x12x12x10	N4quda13fermion_force10MiddleLinkI7double2S2_EE	threads=8640,prec=8,recon=18,sig=1,mu=7	384	1	1	23	1	1	16385	# 0.00 Gflop/s, 0.00 GB/s, tuned Mon Sep 23 17:19:28 2013
12x12x12x10	N4quda13fermion_force10MiddleLinkI7double2S2_EE	threads=8640,prec=8,recon=18,sig=2,mu=0	352	1	1	25	1	1	24577	# 0.00 Gflop/s, 0.00 GB/s, tuned Mon Sep 23 17:19:30 2013
12x12x12x10	N4quda13fermion_force10MiddleLinkI7double2S2_EE	threads=8640,prec=8,recon=18,sig=2,mu=1	352	1	1	25	1	1	6145	# 0.00 Gflop/s, 0.00 GB/s, tuned Mon Sep 23 17:19:29 2013
12x12x12x10	N4quda13fermion_force10MiddleLinkI7double2S2_EE	threads=8640,prec=8,recon=18,sig=2,mu=3	64	1	1	135	1	1	12289	# 0.00 Gflop/s, 0.00 GB/s, tuned Mon Sep 23 17:19:30 2013
12x12x12x10	N4quda13fermion_force10MiddleLinkI7double2S2_EE	threads=8640,prec=8,recon=18,sig=2,mu=4	384	1	1	23	1	1	12289	# 0.00 Gflop/s, 0.00 GB/s, tuned Mon Sep 23 17:19:30 2013
12x12x12x10	N4quda13fermion_force10MiddleLinkI7double2S2_EE	threads=8640,prec=8,recon=18,sig=2,mu=6	192	1	1	45	1	1	9831	# 0.00 Gflop/s, 0.00 GB/s, tuned Mon Sep 23 17:19:30 2013
12x12x12x10	N4quda13fermion_force10MiddleLinkI7double2S2_EE	threads=8640,prec=8,recon=18,sig=2,mu=7	96	1	1	90	1	1	12289	# 0.00 Gflop/s, 0.00 GB/s, tuned Mon Sep 23 17:19:31 2013
12x12x12x10	N4quda13fermion_force10MiddleLinkI7double2S2_EE	threads=8640,prec=8,recon=18,sig=3,mu=0	352	1	1	25	1	1	0	# 0.00 Gflop/s, 0.00 GB/s, tuned Mon Sep 23 17:19:33 2013
12x12x12x10	N4quda13fermion_force10MiddleLinkI7double2S2_EE	threads=8640,prec=8,recon=18,sig=3,mu=1	64	1	1	135	1	1	6145	# 0.00 Gflop/s, 0.00 GB/s, tuned Mon Sep 23 17:19:32 2013
12x12x12x10	N4quda13fermion_force10MiddleLinkI7double2S2_EE	threads=8640,prec=8,recon=18,sig=3,mu=2	32	1	1	270	1	1	16385	# 0.00 Gflop/s, 0.00 GB/s, tuned Mon Sep 23 17:19:32 2013
12x12x12x10	N4quda13fermion_force10MiddleLinkI7double2S2_EE	threads=8640,prec=8,recon=18,sig=3,mu=5	352	1	1	25	1	1	7022	# 0.00 Gflop/s, 0.00 GB/s, tuned Mon Sep 23 17:19:32 2013
12x12x12x10	N4quda13fermion_force10MiddleLinkI7double2S2_EE	threads=8640,prec=8,recon=18,sig=3,mu=6	64	1	1	135	1	1	8193	# 0.00 Gflop/s, 0.00 GB/s, tuned Mon Sep 23 17:19:32 2013
12x12x12x10	N4quda13fermion_force10MiddleLinkI7double2S2_EE	threads=8640,prec=8,recon=18,sig=3,mu=7	32	1	1	270	1	1	9831	# 0.00 Gflop/s, 0.00 GB/s, tuned Mon Sep 23 17:19:33 2013
12x12x12x10	N4quda13fermion_force10MiddleLinkI7double2S2_EE	threads=8640,prec=8,recon=18,sig=4,mu=0	192	1	1	45	1	1	24577	# 0.00 Gflop/s, 0.00 GB/s, tuned Mon Sep 23 17:19:35 2013
12x12x12x10	N4quda13fermion_force10MiddleLinkI7double2S2_EE	threads=8640,prec=8,recon=18,sig=4,mu=1	384	1	1	23	1	1	9831	# 0.00 Gflop/s, 0.00 GB/s, tuned Mon Sep 23 17:19:34 2013
12x12x12x10	N4quda13fermion_force10MiddleLinkI7double2S2_EE	threads=8640,prec=8,recon=18,sig=4,mu=2	96	1	1	90	1	1	9831	# 0.00 Gflop/s, 0.00 GB/s, tuned Mon Sep 23 17:19:34 2013
12x12x12x10	N4quda13fermion_force10MiddleLinkI7double2S2_EE	threads=8640,prec=8,recon=18,sig=4,mu=5	352	1	1	25	1	1	16385	# 0.00 Gflop/s, 0.00 GB/s, tuned Mon Sep 23 17:19:35 2013
12x12x12x10	N4quda13fermion_force10MiddleLinkI7double2S2_EE	threads=8640,prec=8,recon=18,sig=4,mu=6	352	1	1	25	1	1	9831	# 0.00 Gflop/s, 0.00 GB/s, tuned Mon Sep 23 17:19:35 2013
12x12x12x10	N4quda13fermion_force10MiddleLinkI7double2S2_EE	threads=8640,prec=8,recon=18,sig=4,mu=7	352	1	1	25	1	1	7022	# 0.00 Gflop/s, 0.00 GB/s, tuned Mon Sep 23 17:19:35 2013
12x12x12x10	N4quda13fermion_force10MiddleLinkI7double2S2_EE	threads=8640,prec=8,recon=18,sig=5,mu=0	352	1	1	25	1	1	7022	# 0.00 Gflop/s, 0.00 GB/s, tuned Mon Sep 23 17:19:38 2013
12x12x12x10	N4quda13fermion_force10MiddleLinkI7double2S2_EE	threads=8640,prec=8,recon=18,sig=5,mu=1	96	1	1	90	1	1	12289	# 0.00 Gflop/s, 0.00 GB/s, tuned Mon Sep 23 17:19:37 2013
12x12x12x10	N4quda13fermion_force10MiddleLinkI7double2S2_EE	threads=8640,prec=8,recon=18,sig=5,mu=3	192	1	1	45	1	1	9831	# 0.00 Gflop/s, 0.00 GB/s, tuned Mon Sep 23 17:19:37 2013
12x12x12x10	N4quda13fermion_force10MiddleLinkI7double2S2_EE	threads=8640,prec=8,recon=18,sig=5,mu=4	384	1	1	23	1	1	6145	# 0.00 Gflop/s, 0.00 GB/s, tuned Mon Sep 23 17:19:37 2013
12x12x12x10	N4quda13fermion_force10MiddleLinkI7double2S2_EE	threads=8640,prec=8,recon=18,sig=5,mu=6	352	1	1	25	1	1	9831	# 0.00 Gflop/s, 0.00 GB/s, tuned Mon Sep 23 17:19:37 2013
12x12x12x10	N4quda13fermion_force10MiddleLinkI7double2S2_EE	threads=8640,prec=8,recon=18,sig=5,mu=7	384	1	1	23	1	1	8193	# 0.00 Gflop/s, 0.00 GB/s, tuned Mon Sep 23 17:19:38 2013
12x12x12x10	N4quda13fermion_force10MiddleLinkI7double2S2_EE	threads=8640,prec=8,recon=18,sig=6,mu=0	384	1	1	23	1	1	8193	# 0.00 Gflop/s, 0.00 GB/s, tuned Mon Sep 23 17:19:40 2013
12x12x12x10	N4quda13fermion_force10MiddleLinkI7double2S2_EE	threads=8640,prec=8,recon=18,sig=6,mu=2	96	1	1	90	1	1	12289	# 0.00 Gflop/s, 0.00 GB/s, tuned Mon Sep 23 17:19:39 2013
12x12x12x10	N4quda13fermion_force10MiddleLinkI7double2S2_EE	threads=8640,prec=8,recon=18,sig=6,mu=3	384	1	1	23	1	1	8193	# 0.00 Gflop/s, 0.00 GB/s, tuned Mon Sep 23 17:19:39 2013
12x12x12x10	N4quda13fermion_force10MiddleLinkI7double2S2_EE	threads=8640,prec=8,recon=18,sig=6,mu=4	352	1	1	25	1	1	12289	# 0.00 Gflop/s, 0.00 GB/s, tuned Mon Sep 23 17:19:39 2013
12x12x12x10	N4quda13fermion_force10MiddleLinkI7double2S2_EE	threads=8640,prec=8,recon=18,sig=6,mu=5	384	1	1	23	1	1	7022	# 0.00 Gflop/s, 0.00 GB/s, tuned Mon Sep 23 17:19:40 2013
12x12x12x10	N4quda13fermion_force10MiddleLinkI7double2S2_EE	threads=8640,prec=8,recon=18,sig=6,mu=7	384	1	1	23	1	1	0	# 0.00 Gflop/s, 0.00 GB/s, tuned Mon Sep 23 17:19:40 2013
12x12x12x10	N4quda13fermion_force10MiddleLinkI7double2S2_EE	threads=8640,prec=8,recon=18,sig=7,mu=1	352	1	1	25	1	1	24577	# 0.00 Gflop/s, 0.00 GB/s, tuned Mon Sep 23 17:19:42 2013
12x12x12x10	N4quda13fermion_force10MiddleLinkI7double2S2_EE	threads=8640,prec=8,recon=18,sig=7,mu=2	352	1	1	25	1	1	16385	# 0.00 Gflop/s, 0.00 GB/s, tuned Mon Sep 23 17:19:41 2013
12x12x12x10	N4quda13fermion_force10MiddleLinkI7double2S2_EE	threads=8640,prec=8,recon=18,sig=7,mu=3	352	1	1	25	1	1	6145	# 0.00 Gflop/s, 0.00 GB/s, tuned Mon Sep 23 17:19:42 2013
12x12x12x10	N4quda13fermion_force10MiddleLinkI7double2S2_EE	threads=8640,prec=8,recon=18,sig=7,mu=4	384	1	1	23	1	1	9831	# 0.00 Gflop/s, 0.00 GB/s, tuned Mon Sep 23 17:19:42 2013
12x12x12x10	N4quda13fermion_force10MiddleLinkI7double2S2_EE	threads=8640,prec=8,recon=18,sig=7,mu=5	352	1	1	25	1	1	16385	# 0.00 Gflop/s, 0.00 GB/s, tuned Mon Sep 23 17:19:42 2013
12x12x12x10	N4quda13fermion_force10MiddleLinkI7double2S2_EE	threads=8640,prec=8,recon=18,sig=7,mu=6	352	1	1	25	1	1	16385	# 0.00 Gflop/s, 0.00 GB/s, tuned Mon Sep 23 17:19:43 2013
12x12x12x10	N4quda13fermion_force13SideLinkShortI7double2S2_EE	threads=8640,prec=8,recon=12,sig=0,mu=1	512	1	1	17	1	1	12289	# 0.00 Gflop/s, 0.00 GB/s, tuned Mon Sep 23 17:19:58 2013
12x12x12x10	N4quda13fermion_force13SideLinkShortI7double2S2_EE	threads=8640,prec=8,recon=12,sig=0,mu=2	192	1	1	45	1	1	24577	# 0.00 Gflop/s, 0.00 GB/s, tuned Mon Sep 23 17:19:59 2013
12x12x12x10	N4quda13fermion_force13SideLinkShortI7double2S2_EE	threads=8640,prec=8,recon=12,sig=0,mu=3	512	1	1	17	1	1	9831	# 0.00 Gflop/s, 0.00 GB/s, tuned Mon Sep 23 17:19:59 2013
12x12x12x10	N4quda13fermion_force13SideLinkShortI7double2S2_EE	threads=8640,prec=8,recon=12,sig=0,mu=4	384	1	1	23	1	1	16385	# 0.00 Gflop/s, 0.00 GB/s, tuned Mon Sep 23 17:19:59 2013
12x12x12x10	N4quda13fermion_force13SideLinkShortI7double2S2_EE	threads=8640,prec=8,recon=12,sig=0,mu=5	288	1	1	30	1	1	9831	# 0.00 Gflop/s, 0.00 GB/s, tuned Mon Sep 23 17:19:59 2013
12x12x12x10	N4quda13fermion_force13SideLinkShortI7double2S2_EE	threads=8640,prec=8,recon=12,sig=0,mu=6	416	1	1	21	1	1	6145	# 0.00 Gflop/s, 0.00 GB/s, tuned Mon Sep 23 17:19:59 2013
12x12x12x10	N4quda13fermion_force13SideLinkShortI7double2S2_EE	threads=8640,prec=8,recon=12,sig=1,mu=0	480	1	1	18	1	1	8193	# 0.00 Gflop/s, 0.00 GB/s, tuned Mon Sep 23 17:20:00 2013
12x12x12x10	N4quda13fermion_force13SideLinkShortI7double2S2_EE	threads=8640,prec=8,recon=12,sig=1,mu=2	256	1	1	34	1	1	16385	# 0.00 Gflop/s, 0.00 GB/s, tuned Mon Sep 23 17:20:01 2013
12x12x12x10	N4quda13fermion_force13SideLinkShortI7double2S2_EE	threads=8640,prec=8,recon=12,sig=1,mu=3	416	1	1	21	1	1	7022	# 0.00 Gflop/s, 0.00 GB/s, tuned Mon Sep 23 17:20:01 2013
12x12x12x10	N4quda13fermion_force13SideLinkShortI7double2S2_EE	threads=8640,prec=8,recon=12,sig=1,mu=4	384	1	1	23	1	1	8193	# 0.00 Gflop/s, 0.00 GB/s, tuned Mon Sep 23 17:20:01 2013
12x12x12x10	N4quda13fermion_force13SideLinkShortI7double2S2_EE	threads=8640,prec=8,recon=12,sig=1,mu=5	256	1	1	34	1	1	9831	# 0.00 Gflop/s, 0.00 GB/s, tuned Mon Sep 23 17:20:01 2013
12x12x12x10	N4quda13fermion_force13SideLinkShortI7double2S2_EE	threads=8640,prec=8,recon=12,sig=1,mu=7	384	1	1	23	1	1	9831	# 0.00 Gflop/s, 0.00 GB/s, tuned Mon Sep 23 17:20:01 2013
12x12x12x10	N4quda13fermion_force13SideLinkShortI7double2S2_EE	threads=8640,prec=8,recon=12,sig=2,mu=0	448	1	1	20	1	1	6145	# 0.00 Gflop/s, 0.00 GB/s, tuned Mon Sep 23 17:20:02 2013
12x12x12x10	N4quda13fermion_force13SideLinkShortI7double2S2_EE	threads=8640,prec=8,recon=12,sig=2,mu=1	512	1	1	17	1	1	16385	# 0.00 Gflop/s, 0.00 GB/s, tuned Mon Sep 23 17:20:02 2013
12x12x12x10	N4quda13fermion_force13SideLinkShortI7double2S2_EE	threads=8640,prec=8,recon=12,sig=2,mu=3	256	1	1	34	1	1	12289	# 0.00 Gflop/s, 0.00 GB/s, tuned Mon Sep 23 17:20:02 2013
12x12x12x10	N4quda13fermion_force13SideLinkShortI7double2S2_EE	threads=8640,prec=8,recon=12,sig=2,mu=4	480	1	1	18	1	1	7022	# 0.00 Gflop/s, 0.00 GB/s, tuned Mon Sep 23 17:20:02 2013
12x12x12x10	N4quda13fermion_force13SideLinkShortI7double2S2_EE	threads=8640,prec=8,recon=12,sig=2,mu=6	416	1	1	21	1	1	9831	# 0.00 Gflop/s, 0.00 GB/s, tuned Mon Sep 23 17:20:03 2013
12x12x12x10	N4quda13fermion_force13SideLinkShortI7double2S2_EE	threads=8640,prec=8,recon=12,sig=2,mu=7	288	1	1	30	1	1	8193	# 0.00 Gflop/s, 0.00 GB/s, tuned Mon Sep 23 17:20:03 2013
12x12x12x10	N4quda13fermion_force13SideLinkShortI7double2S2_EE	threads=8640,prec=8,recon=12,sig=3,mu=0	416	1	1	21	1	1	16385	# 0.00 Gflop/s, 0.00 GB/s, tuned Mon Sep 23 17:20:03 2013
12x12x12x10	N4quda13fermion_force13SideLinkShortI7double2S2_EE	threads=8640,prec=8,recon=12,sig=3,mu=1	448	1	1	20	1	1	8193	# 0.00 Gflop/s, 0.00 GB/s, tuned Mon Sep 23 17:20:04 2013
12x12x12x10	N4quda13fermion_force13SideLinkShortI7double2S2_EE	threads=8640,prec=8,recon=12,sig=3,mu=2	256	1	1	34	1	1	7022	# 0.00 Gflop/s, 0.00 GB/s, tuned Mon Sep 23 17:20:04 2013
12x12x12x10	N4quda13fermion_force13SideLinkShortI7double2S2_EE	threads=8640,prec=8,recon=12,sig=3,mu=5	416	1	1	21	1	1	24577	# 0.00 Gflop/s, 0.00 GB/s, tuned Mon Sep 23 17:20:04 2013
12x12x12x10	N4quda13fermion_force13SideLinkShortI7double2S2_EE	threads=8640,prec=8,recon=12,sig=3,mu=6	480	1	1	18	1	1	7022	# 0.00 Gflop/s, 0.00 GB/s, tuned Mon Sep 23 17:20:04 2013
12x12x12x10	N4quda13fermion_force13SideLinkShortI7double2S2_EE	threads=8640,prec=8,recon=12,sig=3,mu=7	416	1	1	21	1	1	9831	# 0.00 Gflop/s, 0.00 GB/s, tuned Mon Sep 23 17:20:04 2013
12x12x12x10	N4quda13fermion_force13SideLinkShortI7double2S2_EE	threads=8640,prec=8,recon=12,sig=4,mu=0	416	1	1	21	1	1	8193	# 0.00 Gflop/s, 0.00 GB/s, tuned Mon Sep 23 17:20:05 2013
12x12x12x10	N4quda13fermion_force13SideLinkShortI7double2S2_EE	threads=8640,prec=8,recon=12,sig=4,mu=1	416	1	1	21	1	1	9831	# 0.00 Gflop/s, 0.00 GB/s, tuned Mon Sep 23 17:20:06 2013
12x12x12x10	N4quda13fermion_force13SideLinkShortI7double2S2_EE	threads=8640,prec=8,recon=12,sig=4,mu=2	416	1	1	21	1	1	6145	# 0.00 Gflop/s, 0.00 GB/s, tuned Mon Sep 23 17:20:06 2013
12x12x12x10	N4quda13fermion_force13SideLinkShortI7double2S2_EE	threads=8640,prec=8,recon=12,sig=4,mu=5	256	1	1	34	1	1	24577	# 0.00 Gflop/s, 0.00 GB/s, tuned Mon Sep 23 17:20:06 2013
12x12x12x10	N4quda13fermion_force13SideLinkShortI7double2S2_EE	threads=8640,prec=8,recon=12,sig=4,mu=6	256	1	1	34	1	1	9831	# 0.00 Gflop/s, 0.00 GB/s, tuned Mon Sep 23 17:20:06 2013
12x12x12x10	N4quda13fermion_force13SideLinkShortI7double2S2_EE	threads=8640,prec=8,recon=12,sig=4,mu=7	256	1	1	34	1	1	9831	# 0.00 Gflop/s, 0.00 GB/s, tuned Mon Sep 23 17:20:06 2013
12x12x12x10	N4quda13fermion_force13SideLinkShortI7double2S2_EE	threads=8640,prec=8,recon=12,sig=5,mu=0	416	1	1	21	1	1	8193	# 0.00 Gflop/s, 0.00 GB/s, tuned Mon Sep 23 17:20:07 2013
12x12x12x10	N4quda13fermion_force13SideLinkShortI7double2S2_EE	threads=8640,prec=8,recon=12,sig=5,mu=1	416	1	1	21	1	1	7022	# 0.00 Gflop/s, 0.00 GB/s, tuned Mon Sep 23 17:20:07 2013
12x12x12x10	N4quda13fermion_force13SideLinkShortI7double2S2_EE	threads=8640,prec=8,recon=12,sig=5,mu=3	256	1	1	34	1	1	24577	# 0.00 Gflop/s, 0.00 GB/s, tuned Mon Sep 23 17:20:07 2013
12x12x12x10	N4quda13fermion_force13SideLinkShortI7double2S2_EE	threads=8640,prec=8,recon=12,sig=5,mu=4	256	1	1	34	1	1	12289	# 0.00 Gflop/s, 0.00 GB/s, tuned Mon Sep 23 17:20:07 2013
12x12x12x10	N4quda13fermion_force13SideLinkShortI7double2S2_EE	threads=8640,prec=8,recon=12,sig=5,mu=6	384	1	1	23	1	1	12289	# 0.00 Gflop/s, 0.00 GB/s, tuned Mon Sep 23 17:20:07 2013
12x12x12x10	N4quda13fermion_force13SideLinkShortI7double2S2_EE	threads=8640,prec=8,recon=12,sig=5,mu=7	416	1	1	21	1	1	12289	# 0.00 Gflop/s, 0.00 GB/s, tuned Mon Sep 23 17:20:08 2013
12x12x12x10	N4quda13fermion_force13SideLinkShortI7double2S2_EE	threads=8640,prec=8,recon=12,sig=6,mu=0	416	1	1	21	1	1	16385	# 0.00 Gflop/s, 0.00 GB/s, tuned Mon Sep 23 17:20:08 2013
12x12x12x10	N4quda13fermion_force13SideLinkShortI7double2S2_EE	threads=8640,prec=8,recon=12,sig=6,mu=2	416	1	1	21	1	1	24577	# 0.00 Gflop/s, 0.00 GB/s, tuned Mon Sep 23 17:20:09 2013
12x12x12x10	N4quda13fermion_force13SideLinkShortI7double2S2_EE	threads=8640,prec=8,recon=12,sig=6,mu=3	256	1	1	34	1	1	16385	# 0.00 Gflop/s, 0.00 GB/s, tuned Mon Sep 23 17:20:09 2013
12x12x12x10	N4quda13fermion_force13SideLinkShortI7double2S2_EE	threads=8640,prec=8,recon=12,sig=6,mu=4	256	1	1	34	1	1	9831	# 0.00 Gflop/s, 0.00 GB/s, tuned Mon Sep 23 17:20:09 2013
12x12x12x10	N4quda13fermion_force13SideLinkShortI7double2S2_EE	threads=8640,prec=8,recon=12,sig=6,mu=5	384	1	1	23	1	1	8193	# 0.00 Gflop/s, 0.00 GB/s, tuned Mon Sep 23 17:20:09 2013
12x12x12x10	N4quda13fermion_force13SideLinkShortI7double2S2_EE	threads=8640,prec=8,recon=12,sig=6,mu=7	384	1	1	23	1	1	8193	# 0.00 Gflop/s, 0.00 GB/s, tuned Mon Sep 23 17:20:09 2013
12x12x12x10	N4quda13fermion_force13SideLinkShortI7double2S2_EE	threads=8640,prec=8,recon=12,sig=7,mu=1	480	1	1	18	1	1	0	# 0.00 Gflop/s, 0.00 GB/s, tuned Mon Sep 23 17:20:10 2013
12x12x12x10	N4quda13fermion_force13SideLinkShortI7double2S2_EE	threads=8640,prec=8,recon=12,sig=7,mu=2	448	1	1	20	1	1	16385	# 0.00 Gflop/s, 0.00 GB/s, tuned Mon Sep 23 17:20:10 2013
12x12x12x10	N4quda13fermion_force13SideLinkShortI7double2S2_EE	threads=8640,prec=8,recon=12,sig=7,mu=3	256	1	1	34	1	1	6145	# 0.00 Gflop/s, 0.00 GB/s, tuned Mon Sep 23 17:20:10 2013
12x12x12x10	N4quda13fermion_force13SideLinkShortI7double2S2_EE	threads=8640,prec=8,recon=12,sig=7,mu=4	448	1	1	20	1	1	0	# 0.00 Gflop/s, 0.00 GB/s, tuned Mon Sep 23 17:20:11 2013
12x12x12x10	N4quda13fermion_force13SideLinkShortI7double2S2_EE	threads=8640,prec=8,recon=12,sig=7,mu=5	416	1	1	21	1	1	7022	# 0.00 Gflop/s, 0.00 GB/s, tuned Mon Sep 23 17:20:11 2013
12x12x12x10	N4quda13fermion_force13SideLinkShortI7double2S2_EE	threads=8640,prec=8,recon=12,sig=7,mu=6	256	1	1	34	1	1	6145	# 0.00 Gflop/s, 0.00 GB/s, tuned Mon Sep 23 17:20:11 2013
12x12x12x10	N4quda13fermion_force13SideLinkShortI7double2S2_EE	threads=8640,prec=8,recon=18,sig=0,mu=1	448	1	1	20	1	1	12289	# 0.00 Gflop/s, 0.00 GB/s, tuned Mon Sep 23 17:19:25 2013
12x12x12x10	N4quda13fermion_force13SideLinkShortI7double2S2_EE	threads=8640,prec=8,recon=18,sig=0,mu=2	448	1	1	20	1	1	24577	# 0.00 Gflop/s, 0.00 GB/s, tuned Mon Sep 23 17:19:26 2013
12x12x12x10	N4quda13fermion_force13SideLinkShortI7double2S2_EE	threads=8640,prec=8,recon=18,sig=0,mu=3	416	1	1	21	1	1	9831	# 0.00 Gflop/s, 0.00 GB/s, tuned Mon Sep 23 17:19:26 2013
12x12x12x10	N4quda13fermion_force13SideLinkShortI7double2S2_EE	threads=8640,prec=8,recon=18,sig=0,mu=4	256	1	1	34	1	1	12289	# 0.00 Gflop/s, 0.00 GB/s, tuned Mon Sep 23 17:19:26 2013
12x12x12x10	N4quda13fermion_force13SideLinkShortI7double2S2_EE	threads=8640,prec=8,recon=18,sig=0,mu=5	384	1	1	23	1	1	8193	# 0.00 Gflop/s, 0.00 GB/s, tuned Mon Sep 23 17:19:27 2013
12x12x12x10	N4quda13fermion_force13SideLinkShortI7double2S2_EE	threads=8640,prec=8,recon=18,sig=0,mu=6	416	1	1	21	1	1	24577	# 0.00 Gflop/s, 0.00 GB/s, tuned Mon Sep 23 17:19:27 2013
12x12x12x10	N4quda13fermion_force13SideLinkShortI7double2S2_EE	threads=8640,prec=8,recon=18,sig=1,mu=0	416	1	1	21	1	1	6145	# 0.00 Gflop/s, 0.00 GB/s, tuned Mon Sep 23 17:19:28 2013
12x12x12x10	N4quda13fermion_force13SideLinkShortI7double2S2_EE	threads=8640,prec=8,recon=18,sig=1,mu=2	416	1	1	21	1	1	6145	# 0.00 Gflop/s, 0.00 GB/s, tuned Mon Sep 23 17:19:28 2013
12x12x12x10	N4quda13fermion_force13SideLinkShortI7double2S2_EE	threads=8640,prec=8,recon=18,sig=1,mu=3	416	1	1	21	1	1	6145	# 0.00 Gflop/s, 0.00 GB/s, tuned Mon Sep 23 17:19:29 2013
12x12x12x10	N4quda13fermion_force13SideLinkShortI7double2S2_EE	threads=8640,prec=8,recon=18,sig=1,mu=4	256	1	1	34	1	1	12289	# 0.00 Gflop/s, 0.00 GB/s, tuned Mon Sep 23 17:19:29 2013
12x12x12x10	N4quda13fermion_force13SideLinkShortI7double2S2_EE	threads=8640,prec=8,recon=18,sig=1,mu=5	416	1	1	21	1	1	16385	# 0.00 Gflop/s, 0.00 GB/s, tuned Mon Sep 23 17:19:29 2013
12x12x12x10	N4quda13fermion_force13SideLinkShortI7double2S2_EE	threads=8640,prec=8,recon=18,sig=1,mu=7	480	1	1	18	1	1	16385	# 0.00 Gflop/s, 0.00 GB/s, tuned Mon Sep 23 17:19:29 2013
12x12x12x10	N4quda13fermion_force13SideLinkShortI7double2S2_EE	threads=8640,prec=8,recon=18,sig=2,mu=0	448	1	1	20	1	1	24577	# 0.00 Gflop/s, 0.00 GB/s, tuned Mon Sep 23 17:19:30 2013
12x12x12x10	N4quda13fermion_force13SideLinkShortI7double2S2_EE	threads=8640,prec=8,recon=18,sig=2,mu=1	416	1	1	21	1	1	9831	# 0.00 Gflop/s, 0.00 GB/s, tuned Mon Sep 23 17:19:31 2013
12x12x12x10	N4quda13fermion_force13SideLinkShortI7double2S2_EE	threads=8640,prec=8,recon=18,sig=2,mu=3	416	1	1	21	1	1	7022	# 0.00 Gflop/s, 0.00 GB/s, tuned Mon Sep 23 17:19:31 2013
12x12x12x10	N4quda13fermion_force13SideLinkShortI7double2S2_EE	threads=8640,prec=8,recon=18,sig=2,mu=4	416	1	1	21	1	1	12289	# 0.00 Gflop/s, 0.00 GB/s, tuned Mon Sep 23 17:19:31 2013
12x12x12x10	N4quda13fermion_force13SideLinkShortI7double2S2_EE	threads=8640,prec=8,recon=18,sig=2,mu=6	416	1	1	21	1	1	6145	# 0.00 Gflop/s, 0.00 GB/s, tuned Mon Sep 23 17:19:31 2013
12x12x12x10	N4quda13fermion_force13SideLinkShortI7double2S2_EE	threads=8640,prec=8,recon=18,sig=2,mu=7	352	1	1	25	1	1	8193	# 0.00 Gflop/s, 0.00 GB/s, tuned Mon Sep 23 17:19:32 2013
12x12x12x10	N4quda13fermion_force13SideLinkShortI7double2S2_EE	threads=8640,prec=8,recon=18,sig=3,mu=0	416	1	1	21	1	1	16385	# 0.00 Gflop/s, 0.00 GB/s, tuned Mon Sep 23 17:19:33 2013
12x12x12x10	N4quda13fermion_force13SideLinkShortI7double2S2_EE	threads=8640,prec=8,recon=18,sig=3,mu=1	512	1	1	17	1	1	0	# 0.00 Gflop/s, 0.00 GB/s, tuned Mon Sep 23 17:19:33 2013
12x12x12x10	N4quda13fermion_force13SideLinkShortI7double2S2_EE	threads=8640,prec=8,recon=18,sig=3,mu=2	448	1	1	20	1	1	8193	# 0.00 Gflop/s, 0.00 GB/s, tuned Mon Sep 23 17:19:33 2013
12x12x12x10	N4quda13fermion_force13SideLinkShortI7double2S2_EE	threads=8640,prec=8,recon=18,sig=3,mu=5	288	1	1	30	1	1	9831	# 0.00 Gflop/s, 0.00 GB/s, tuned Mon Sep 23 17:19:34 2013
12x12x12x10	N4quda13fermion_force13SideLinkShortI7double2S2_EE	threads=8640,prec=8,recon=18,sig=3,mu=6	256	1	1	34	1	1	7022	# 0.00 Gflop/s, 0.00 GB/s, tuned Mon Sep 23 17:19:34 2013
12x12x12x10	N4quda13fermion_force13SideLinkShortI7double2S2_EE	threads=8640,prec=8,recon=18,sig=3,mu=7	416	1	1	21	1	1	12289	# 0.00 Gflop/s, 0.00 GB/s, tuned Mon Sep 23 17:19:34 2013
12x12x12x10	N4quda13fermion_force13SideLinkShortI7double2S2_EE	threads=8640,prec=8,recon=18,sig=4,mu=0	448	1	1	20	1	1	24577	# 0.00 Gflop/s, 0.00 GB/s, tuned Mon Sep 23 17:19:35 2013
12x12x12x10	N4quda13fermion_force13SideLinkShortI7double2S2_EE	threads=8640,prec=8,recon=18,sig=4,mu=1	416	1	1	21	1	1	24577	# 0.00 Gflop/s, 0.00 GB/s, tuned Mon Sep 23 17:19:36 2013
12x12x12x10	N4quda13fermion_force13SideLinkShortI7double2S2_EE	threads=8640,prec=8,recon=18,sig=4,mu=2	448	1	1	20	1	1	0	# 0.00 Gflop/s, 0.00 GB/s, tuned Mon Sep 23 17:19:36 2013
12x12x12x10	N4quda13fermion_force13SideLinkShortI7double2S2_EE	threads=8640,prec=8,recon=18,sig=4,mu=5	288	1	1	30	1	1	7022	# 0.00 Gflop/s, 0.00 GB/s, tuned Mon Sep 23 17:19:36 2013
12x12x12x10	N4quda13fermion_force13SideLinkShortI7double2S2_EE	threads=8640,prec=8,recon=18,sig=4,mu=6	384	1	1	23	1	1	9831	# 0.00 Gflop/s, 0.00 GB/s, tuned Mon Sep 23 17:19:36 2013
12x12x12x10	N4quda13fermion_force13SideLinkShortI7double2S2_EE	threads=8640,prec=8,recon=18,sig=4,mu=7	416	1	1	21	1	1	7022	# 0.00 Gflop/s, 0.00 GB/s, tuned Mon Sep 23 17:19:37 2013
12x12x12x10	N4quda13fermion_force13SideLinkShortI7double2S2_EE	threads=8640,prec=8,recon=18,sig=5,mu=0	416	1	1	21	1	1	8193	# 0.00 Gflop/s, 0.00 GB/s, tuned Mon Sep 23 17:19:37 2013
12x12x12x10	N4quda13fermion_force13SideLinkShortI7double2S2_EE	threads=8640,prec=8,recon=18,sig=5,mu=1	416	1	1	21	1	1	12289	# 0.00 Gflop/s, 0.00 GB/s, tuned Mon Sep 23 17:19:38 2013
12x12x12x10	N4quda13fermion_force13SideLinkShortI7double2S2_EE	threads=8640,prec=8,recon=18,sig=5,mu=3	256	1	1	34	1	1	16385	# 0.00 Gflop/s, 0.00 GB/s, tuned Mon Sep 23 17:19:38 2013
12x12x12x10	N4quda13fermion_force13SideLinkShortI7double2S2_EE	threads=8640,prec=8,recon=18,sig=5,mu=4	416	1	1	21	1	1	24577	# 0.00 Gflop/s, 0.00 GB/s, tuned Mon Sep 23 17:19:38 2013
12x12x12x10	N4quda13fermion_force13SideLinkShortI7double2S2_EE	threads=8640,prec=8,recon=18,sig=5,mu=6	416	1	1	21	1	1	7022	# 0.00 Gflop/s, 0.00 GB/s, tuned Mon Sep 23 17:19:39 2013
12x12x12x10	N4quda13fermion_force13SideLinkShortI7double2S2_EE	threads=8640,prec=8,recon=18,sig=5,mu=7	32	1	1	270	1	1	9831	# 0.00 Gflop/s, 0.00 GB/s, tuned Mon Sep 23 17:19:39 2013
12x12x12x10	N4quda13fermion_force13SideLinkShortI7double2S2_EE	threads=8640,prec=8,recon=18,sig=6,mu=0	416	1	1	21	1	1	8193	# 0.00 Gflop/s, 0.00 GB/s, tuned Mon Sep 23 17:19:40 2013
12x12x12x10	N4quda13fermion_force13SideLinkShortI7double2S2_EE	threads=8640,prec=8,recon=18,sig=6,mu=2	512	1	1	17	1	1	12289	# 0.00 Gflop/s, 0.00 GB/s, tuned Mon Sep 23 17:19:40 2013
12x12x12x10	N4quda13fermion_force13SideLinkShortI7double2S2_EE	threads=8640,prec=8,recon=18,sig=6,mu=3	416	1	1	21	1	1	12289	# 0.00 Gflop/s, 0.00 GB/s, tuned Mon Sep 23 17:19:41 2013
12x12x12x10	N4quda13fermion_force13SideLinkShortI7double2S2_EE	threads=8640,prec=8,recon=18,sig=6,mu=4	384	1	1	23	1	1	0	# 0.00 Gflop/s, 0.00 GB/s, tuned Mon Sep 23 17:19:41 2013
12x12x12x10	N4quda13fermion_force13SideLinkShortI7double2S2_EE	threads=8640,prec=8,recon=18,sig=6,mu=5	256	1	1	34	1	1	8193	# 0.00 Gflop/s, 0.00 GB/s, tuned Mon Sep 23 17:19:41 2013
12x12x12x10	N4quda13fermion_force13SideLinkShortI7double2S2_EE	threads=8640,prec=8,recon=18,sig=6,mu=7	352	1	1	25	1	1	9831	# 0.00 Gflop/s, 0.00 GB/s, tuned Mon Sep 23 17:19:41 2013
12x12x12x10	N4quda13fermion_force13SideLinkShortI7double2S2_EE	threads=8640,prec=8,recon=18,sig=7,mu=1	416	1	1	21	1	1	16385	# 0.00 Gflop/s, 0.00 GB/s, tuned Mon Sep 23 17:19:42 2013
12x12x12x10	N4quda13fermion_force13SideLinkShortI7double2S2_EE	threads=8640,prec=8,recon=18,sig=7,mu=2	512	1	1	17	1	1	24577	# 0.00 Gflop/s, 0.00 GB/s, tuned Mon Sep 23 17:19:43 2013
12x12x12x10	N4quda13fermion_force13SideLinkShortI7double2S2_EE	threads=8640,prec=8,recon=18,sig=7,mu=3	416	1	1	21	1	1	24577	# 0.00 Gflop/s, 0.00 GB/s, tuned Mon Sep 23 17:19:43 2013
12x12x12x10	N4quda13fermion_force13SideLinkShortI7double2S2_EE	threads=8640,prec=8,recon=18,sig=7,mu=4	256	1	1	34	1	1	12289	# 0.00 Gflop/s, 0.00 GB/s, tuned Mon Sep 23 17:19:43 2013
12x12x12x10	N4quda13fermion_force13SideLinkShortI7double2S2_EE	threads=8640,prec=8,recon=18,sig=7,mu=5	448	1	1	20	1	1	16385	# 0.00 Gflop/s, 0.00 GB/s, tuned Mon Sep 23 17:19:43 2013
12x12x12x10	N4quda13fermion_force13SideLinkShortI7double2S2_EE	threads=8640,prec=8,recon=18,sig=7,mu=6	480	1	1	18	1	1	12289	# 0.00 Gflop/s, 0.00 GB/s, tuned Mon Sep 23 17:19:44 2013
12x12x12x10	N4quda13fermion_force7AllLinkI7double2S2_EE	threads=8640,prec=8,recon=12,sig=0,mu=1	64	1	1	135	1	1	7022	# 0.00 Gflop/s, 0.00 GB/s, tuned Mon Sep 23 17:19:59 2013
12x12x12x10	N4quda13fermion_force7AllLinkI7double2S2_EE	threads=8640,prec=8,recon=12,sig=0,mu=2	64	1	1	135	1	1	6145	# 0.00 Gflop/s, 0.00 GB/s, tuned Mon Sep 23 17:19:58 2013
12x12x12x10	N4quda13fermion_force7AllLinkI7double2S2_EE	threads=8640,prec=8,recon=12,sig=0,mu=3	32	1	1	270	1	1	8193	# 0.00 Gflop/s, 0.00 GB/s, tuned Mon Sep 23 17:19:58 2013
12x12x12x10	N4quda13fermion_force7AllLinkI7double2S2_EE	threads=8640,prec=8,recon=12,sig=0,mu=4	64	1	1	135	1	1	8193	# 0.00 Gflop/s, 0.00 GB/s, tuned Mon Sep 23 17:19:58 2013
12x12x12x10	N4quda13fermion_force7AllLinkI7double2S2_EE	threads=8640,prec=8,recon=12,sig=0,mu=5	32	1	1	270	1	1	6145	# 0.00 Gflop/s, 0.00 GB/s, tuned Mon Sep 23 17:19:58 2013
12x12x12x10	N4quda13fermion_force7AllLinkI7double2S2_EE	threads=8640,prec=8,recon=12,sig=0,mu=6	64	1	1	135	1	1	12289	# 0.00 Gflop/s, 0.00 GB/s, tuned Mon Sep 23 17:19:59 2013
12x12x12x10	N4quda13fermion_force7AllLinkI7double2S2_EE	threads=8640,prec=8,recon=12,sig=1,mu=0	64	1	1	135	1	1	16385	# 0.00 Gflop/s, 0.00 GB/s, tuned Mon Sep 23 17:20:00 2013
12x12x12x10	N4quda13fermion_force7AllLinkI7double2S2_EE	threads=8640,prec=8,recon=12,sig=1,mu=2	224	1	1	39	1	1	16385	# 0.00 Gflop/s, 0.00 GB/s, tuned Mon Sep 23 17:20:00 2013
12x12x12x10	N4quda13fermion_force7AllLinkI7double2S2_EE	threads=8640,prec=8,recon=12,sig=1,mu=3	32	1	1	270	1	1	12289	# 0.00 Gflop/s, 0.00 GB/s, tuned Mon Sep 23 17:19:59 2013
12x12x12x10	N4quda13fermion_force7AllLinkI7double2S2_EE	threads=8640,prec=8,recon=12,sig=1,mu=4	64	1	1	135	1	1	24577	# 0.00 Gflop/s, 0.00 GB/s, tuned Mon Sep 23 17:20:00 2013
12x12x12x10	N4quda13fermion_force7AllLinkI7double2S2_EE	threads=8640,prec=8,recon=12,sig=1,mu=5	128	1	1	68	1	1	0	# 0.00 Gflop/s, 0.00 GB/s, tuned Mon Sep 23 17:20:00 2013
12x12x12x10	N4quda13fermion_force7AllLinkI7double2S2_EE	threads=8640,prec=8,recon=12,sig=1,mu=7	32	1	1	270	1	1	7022	# 0.00 Gflop/s, 0.00 GB/s, tuned Mon Sep 23 17:20:00 2013
12x12x12x10	N4quda13fermion_force7AllLinkI7double2S2_EE	threads=8640,prec=8,recon=12,sig=2,mu=0	32	1	1	270	1	1	16385	# 0.00 Gflop/s, 0.00 GB/s, tuned Mon Sep 23 17:20:02 2013
12x12x12x10	N4quda13fermion_force7AllLinkI7double2S2_EE	threads=8640,prec=8,recon=12,sig=2,mu=1	32	1	1	270	1	1	8193	# 0.00 Gflop/s, 0.00 GB/s, tuned Mon Sep 23 17:20:01 2013
12x12x12x10	N4quda13fermion_force7AllLinkI7double2S2_EE	threads=8640,prec=8,recon=12,sig=2,mu=3	32	1	1	270	1	1	24577	# 0.00 Gflop/s, 0.00 GB/s, tuned Mon Sep 23 17:20:01 2013
12x12x12x10	N4quda13fermion_force7AllLinkI7double2S2_EE	threads=8640,prec=8,recon=12,sig=2,mu=4	64	1	1	135	1	1	12289	# 0.00 Gflop/s, 0.00 GB/s, tuned Mon Sep 23 17:20:01 2013
12x12x12x10	N4quda13fermion_force7AllLinkI7double2S2_EE	threads=8640,prec=8,recon=12,sig=2,mu=6	32	1	1	270	1	1	8193	# 0.00 Gflop/s, 0.00 GB/s, tuned Mon Sep 23 17:20:01 2013
12x12x12x10	N4quda13fermion_force7AllLinkI7double2S2_EE	threads=8640,prec=8,recon=12,sig=2,mu=7	64	1	1	135	1	1	9831	# 0.00 Gflop/s, 0.00 GB/s, tuned Mon Sep 23 17:20:02 2013
12x12x12x10	N4quda13fermion_force7AllLinkI7double2S2_EE	threads=8640,prec=8,recon=12,sig=3,mu=0	224	1	1	39	1	1	24577	# 0.00 Gflop/s, 0.00 GB/s, tuned Mon Sep 23 17:20:04 2013
12x12x12x10	N4quda13fermion_force7AllLinkI7double2S2_EE	threads=8640,prec=8,recon=12,sig=3,mu=1	64	1	1	135	1	1	9831	# 0.00 Gflop/s, 0.00 GB/s, tuned Mon Sep 23 17:20:03 2013
12x12x12x10	N4quda13fermion_force7AllLinkI7double2S2_EE	threads=8640,prec=8,recon=12,sig=3,mu=2	224	1	1	39	1	1	7022	# 0.00 Gflop/s, 0.00 GB/s, tuned Mon Sep 23 17:20:03 2013
12x12x12x10	N4quda13fermion_force7AllLinkI7double2S2_EE	threads=8640,prec=8,recon=12,sig=3,mu=5	64	1	1	135	1	1	8193	# 0.00 Gflop/s, 0.00 GB/s, tuned Mon Sep 23 17:20:03 2013
12x12x12x10	N4quda13fermion_force7AllLinkI7double2S2_EE	threads=8640,prec=8,recon=12,sig=3,mu=6	64	1	1	135	1	1	12289	# 0.00 Gflop/s, 0.00 GB/s, tuned Mon Sep 23 17:20:03 2013
12x12x12x10	N4quda13fermion_force7AllLinkI7double2S2_EE	threads=8640,prec=8,recon=12,sig=3,mu=7	64	1	1	135	1	1	24577	# 0.00 Gflop/s, 0.00 GB/s, tuned Mon Sep 23 17:20:04 2013
12x12x12x10	N4quda13fermion_force7AllLinkI7double2S2_EE	threads=8640,prec=8,recon=12,sig=4,mu=0	32	1	1	270	1	1	6145	# 0.00 Gflop/s, 0.00 GB/s, tuned Mon Sep 23 17:20:05 2013
12x12x12x10	N4quda13fermion_force7AllLinkI7double2S2_EE	threads=8640,prec=8,recon=12,sig=4,mu=1	32	1	1	270	1	1	9831	# 0.00 Gflop/s, 0.00 GB/s, tuned Mon Sep 23 17:20:05 2013
12x12x12x10	N4quda13fermion_force7AllLinkI7double2S2_EE	threads=8640,prec=8,recon=12,sig=4,mu=2	32	1	1	270	1	1	9831	# 0.00 Gflop/s, 0.00 GB/s, tuned Mon Sep 23 17:20:04 2013
12x12x12x10	N4quda13fermion_force7AllLinkI7double2S2_EE	threads=8640,prec=8,recon=12,sig=4,mu=5	64	1	1	135	1	1	9831	# 0.00 Gflop/s, 0.00 GB/s, tuned Mon Sep 23 17:20:05 2013
12x12x12x10	N4quda13fermion_force7AllLinkI7double2S2_EE	threads=8640,prec=8,recon=12,sig=4,mu=6	32	1	1	270	1	1	9831	# 0.00 Gflop/s, 0.00 GB/s, tuned Mon Sep 23 17:20:05 2013
12x12x12x10	N4quda13fermion_force7AllLinkI7double2S2_EE	threads=8640,prec=8,recon=12,sig=4,mu=7	96	1	1	90	1	1	6145	# 0.00 Gflop/s, 0.00 GB/s, tuned Mon Sep 23 17:20:05 2013
12x12x12x10	N4quda13fermion_force7AllLinkI7double2S2_EE	threads=8640,prec=8,recon=12,sig=5,mu=0	32	1	1	270	1	1	8193	# 0.00 Gflop/s, 0.00 GB/s, tuned Mon Sep 23 17:20:07 2013
12x12x12x10	N4quda13fermion_force7AllLinkI7double2S2_EE	threads=8640,prec=8,recon=12,sig=5,mu=1	128	1	1	68	1	1	16385	# 0.00 Gflop/s, 0.00 GB/s, tuned Mon Sep 23 17:20:06 2013
12x12x12x10	N4quda13fermion_force7AllLinkI7double2S2_EE	threads=8640,prec=8,recon=12,sig=5,mu=3	128	1	1	68	1	1	12289	# 0.00 Gflop/s, 0.00 GB/s, tuned Mon Sep 23 17:20:06 2013
12x12x12x10	N4quda13fermion_force7AllLinkI7double2S2_EE	threads=8640,prec=8,recon=12,sig=5,mu=4	64	1	1	135	1	1	0	# 0.00 Gflop/s, 0.00 GB/s, tuned Mon Sep 23 17:20:06 2013
12x12x12x10	N4quda13fermion_force7AllLinkI7double2S2_EE	threads=8640,prec=8,recon=12,sig=5,mu=6	96	1	1	90	1	1	7022	# 0.00 Gflop/s, 0.00 GB/s, tuned Mon Sep 23 17:20:06 2013
12x12x12x10	N4quda13fermion_force7AllLinkI7double2S2_EE	threads=8640,prec=8,recon=12,sig=5,mu=7	96	1	1	90	1	1	6145	# 0.00 Gflop/s, 0.00 GB/s, tuned Mon Sep 23 17:20:07 2013
12x12x12x10	N4quda13fermion_force7AllLinkI7double2S2_EE	threads=8640,prec=8,recon=12,sig=6,mu=0	32	1	1	270	1	1	6145	# 0.00 Gflop/s, 0.00 GB/s, tuned Mon Sep 23 17:20:09 2013
12x12x12x10	N4quda13fermion_force7AllLinkI7double2S2_EE	threads=8640,prec=8,recon=12,sig=6,mu=2	224	1	1	39	1	1	9831	# 0.00 Gflop/s, 0.00 GB/s, tuned Mon Sep 23 17:20:08 2013
12x12x12x10	N4quda13fermion_force7AllLinkI7double2S2_EE	threads=8640,prec=8,recon=12,sig=6,mu=3	32	1	1	270	1	1	8193	# 0.00 Gflop/s, 0.00 GB/s, tuned Mon Sep 23 17:20:08 2013
12x12x12x10	N4quda13fermion_force7AllLinkI7double2S2_EE	threads=8640,prec=8,recon=12,sig=6,mu=4	32	1	1	270	1	1	6145	# 0.00 Gflop/s, 0.00 GB/s, tuned Mon Sep 23 17:20:08 2013
12x12x12x10	N4quda13fermion_force7AllLinkI7double2S2_EE	threads=8640,prec=8,recon=12,sig=6,mu=5	32	1	1	270	1	1	16385	# 0.00 Gflop/s, 0.00 GB/s, tuned Mon Sep 23 17:20:08 2013
12x12x12x10	N4quda13fermion_force7AllLinkI7double2S2_EE	threads=8640,prec=8,recon=12,sig=6,mu=7	64	1	1	135	1	1	8193	# 0.00 Gflop/s, 0.00 GB/s, tuned Mon Sep 23 17:20:09 2013
12x12x12x10	N4quda13fermion_force7AllLinkI7double2S2_EE	threads=8640,prec=8,recon=12,sig=7,mu=1	64	1	1	135	1	1	7022	# 0.00 Gflop/s, 0.00 GB/s, tuned Mon Sep 23 17:20:10 2013
12x12x12x10	N4quda13fermion_force7AllLinkI7double2S2_EE	threads=8640,prec=8,recon=12,sig=7,mu=2	32	1	1	270	1	1	6145	# 0.00 Gflop/s, 0.00 GB/s, tuned Mon Sep 23 17:20:10 2013
12x12x12x10	N4quda13fermion_force7AllLinkI7double2S2_EE	threads=8640,prec=8,recon=12,sig=7,mu=3	32	1	1	270	1	1	24577	# 0.00 Gflop/s, 0.00 GB/s, tuned Mon Sep 23 17:20:09 2013
12x12x12x10	N4quda13fermion_force7AllLinkI7double2S2_EE	threads=8640,prec=8,recon=12,sig=7,mu=4	64	1	1	135	1	1	16385	# 0.00 Gflop/s, 0.00 GB/s, tuned Mon Sep 23 17:20:09 2013
12x12x12x10	N4quda13fermion_force7AllLinkI7double2S2_EE	threads=8640,prec=8,recon=12,sig=7,mu=5	128	1	1	68	1	1	7022	# 0.00 Gflop/s, 0.00 GB/s, tuned Mon Sep 23 17:20:10 2013
12x12x12x10	N4quda13fermion_force7AllLinkI7double2S2_EE	threads=8640,prec=8,recon=12,sig=7,mu=6	128	1	1	68	1	1	12289	# 0.00 Gflop/s, 0.00 GB/s, tuned Mon Sep 23 17:20:10 2013
12x12x12x10	N4quda13fermion_force7AllLinkI7double2S2_EE	threads=8640,prec=8,recon=18,sig=0,mu=1	32	1	1	270	1	1	12289	# 0.00 Gflop/s, 0.00 GB/s, tuned Mon Sep 23 17:19:26 2013
12x12x12x10	N4quda13fermion_force7AllLinkI7double2S2_EE	threads=8640,prec=8,recon=18,sig=0,mu=2	64	1	1	135	1	1	24577	# 0.00 Gflop/s, 0.00 GB/s, tuned Mon Sep 23 17:19:25 2013
12x12x12x10	N4quda13fermion_force7AllLinkI7double2S2_EE	threads=8640,prec=8,recon=18,sig=0,mu=3	32	1	1	270	1	1	12289	# 0.00 Gflop/s, 0.00 GB/s, tuned Mon Sep 23 17:19:25 2013
12x12x12x10	N4quda13fermion_force7AllLinkI7double2S2_EE	threads=8640,prec=8,recon=18,sig=0,mu=4	32	1	1	270	1	1	12289	# 0.00 Gflop/s, 0.00 GB/s, tuned Mon Sep 23 17:19:25 2013
12x12x12x10	N4quda13fermion_force7AllLinkI7double2S2_EE	threads=8640,prec=8,recon=18,sig=0,mu=5	128	1	1	68	1	1	12289	# 0.00 Gflop/s, 0.00 GB/s, tuned Mon Sep 23 17:19:25 2013
12x12x12x10	N4quda13fermion_force7AllLinkI7double2S2_EE	threads=8640,prec=8,recon=18,sig=0,mu=6	32	1	1	270	1	1	12289	# 0.00 Gflop/s, 0.00 GB/s, tuned Mon Sep 23 17:19:26 2013
12x12x12x10	N4quda13fermion_force7AllLinkI7double2S2_EE	threads=8640,prec=8,recon=18,sig=1,mu=0	64	1	1	135	1	1	16385	# 0.00 Gflop/s, 0.00 GB/s, tuned Mon Sep 23 17:19:28 2013
12x12x12x10	N4quda13fermion_force7AllLinkI7double2S2_EE	threads=8640,prec=8,recon=18,sig=1,mu=2	128	1	1	68	1	1	16385	# 0.00 Gflop/s, 0.00 GB/s, tuned Mon Sep 23 17:19:27 2013
12x12x12x10	N4quda13fermion_force7AllLinkI7double2S2_EE	threads=8640,prec=8,recon=18,sig=1,mu=3	32	1	1	270	1	1	8193	# 0.00 Gflop/s, 0.00 GB/s, tuned Mon Sep 23 17:19:27 2013
12x12x12x10	N4quda13fermion_force7AllLinkI7double2S2_EE	threads=8640,prec=8,recon=18,sig=1,mu=4	32	1	1	270	1	1	12289	# 0.00 Gflop/s, 0.00 GB/s, tuned Mon Sep 23 17:19:27 2013
12x12x12x10	N4quda13fermion_force7AllLinkI7double2S2_EE	threads=8640,prec=8,recon=18,sig=1,mu=5	32	1	1	270	1	1	7022	# 0.00 Gflop/s, 0.00 GB/s, tuned Mon Sep 23 17:19:27 2013
12x12x12x10	N4quda13fermion_force7AllLinkI7double2S2_EE	threads=8640,prec=8,recon=18,sig=1,mu=7	32	1	1	270	1	1	24577	# 0.00 Gflop/s, 0.00 GB/s, tuned Mon Sep 23 17:19:28 2013
12x12x12x10	N4quda13fermion_force7AllLinkI7double2S2_EE	threads=8640,prec=8,recon=18,sig=2,mu=0	32	1	1	270	1	1	8193	# 0.00 Gflop/s, 0.00 GB/s, tuned Mon Sep 23 17:19:30 2013
12x12x12x10	N4quda13fermion_force7AllLinkI7double2S2_EE	threads=8640,prec=8,recon=18,sig=2,mu=1	64	1	1	135	1	1	8193	# 0.00 Gflop/s, 0.00 GB/s, tuned Mon Sep 23 17:19:30 2013
12x12x12x10	N4quda13fermion_force7AllLinkI7double2S2_EE	threads=8640,prec=8,recon=18,sig=2,mu=3	64	1	1	135	1	1	24577	# 0.00 Gflop/s, 0.00 GB/s, tuned Mon Sep 23 17:19:29 2013
12x12x12x10	N4quda13fermion_force7AllLinkI7double2S2_EE	threads=8640,prec=8,recon=18,sig=2,mu=4	128	1	1	68	1	1	16385	# 0.00 Gflop/s, 0.00 GB/s, tuned Mon Sep 23 17:19:30 2013
12x12x12x10	N4quda13fermion_force7AllLinkI7double2S2_EE	threads=8640,prec=8,recon=18,sig=2,mu=6	32	1	1	270	1	1	8193	# 0.00 Gflop/s, 0.00 GB/s, tuned Mon Sep 23 17:19:30 2013
12x12x12x10	N4quda13fermion_force7AllLinkI7double2S2_EE	threads=8640,prec=8,recon=18,sig=2,mu=7	32	1	1	270	1	1	7022	# 0.00 Gflop/s, 0.00 GB/s, tuned Mon Sep 23 17:19:31 2013
12x12x12x10	N4quda13fermion_force7AllLinkI7double2S2_EE	threads=8640,prec=8,recon=18,sig=3,mu=0	32	1	1	270	1	1	9831	# 0.00 Gflop/s, 0.00 GB/s, tuned Mon Sep 23 17:19:33 2013
12x12x12x10	N4quda13fermion_force7AllLinkI7double2S2_EE	threads=8640,prec=8,recon=18,sig=3,mu=1	32	1	1	270	1	1	9831	# 0.00 Gflop/s, 0.00 GB/s, tuned Mon Sep 23 17:19:32 2013
12x12x12x10	N4quda13fermion_force7AllLinkI7double2S2_EE	threads=8640,prec=8,recon=18,sig=3,mu=2	32	1	1	270	1	1	24577	# 0.00 Gflop/s, 0.00 GB/s, tuned Mon Sep 23 17:19:32 2013
12x12x12x10	N4quda13fermion_force7AllLinkI7double2S2_EE	threads=8640,prec=8,recon=18,sig=3,mu=5	64	1	1	135	1	1	0	# 0.00 Gflop/s, 0.00 GB/s, tuned Mon Sep 23 17:19:32 2013
12x12x12x10	N4quda13fermion_force7AllLinkI7double2S2_EE	threads=8640,prec=8,recon=18,sig=3,mu=6	32	1	1	270	1	1	8193	# 0.00 Gflop/s, 0.00 GB/s, tuned Mon Sep 23 17:19:32 2013
12x12x12x10	N4quda13fermion_force7AllLinkI7double2S2_EE	threads=8640,prec=8,recon=18,sig=3,mu=7	32	1	1	270	1	1	12289	# 0.00 Gflop/s, 0.00 GB/s, tuned Mon Sep 23 17:19:33 2013
12x12x12x10	N4quda13fermion_force7AllLinkI7double2S2_EE	threads=8640,prec=8,recon=18,sig=4,mu=0	352	1	1	25	1	1	24577	# 0.00 Gflop/s, 0.00 GB/s, tuned Mon Sep 23 17:19:35 2013
12x12x12x10	N4quda13fermion_force7AllLinkI7double2S2_EE	threads=8640,prec=8,recon=18,sig=4,mu=1	352	1	1	25	1	1	16385	# 0.00 Gflop/s, 0.00 GB/s, tuned Mon Sep 23 17:19:35 2013
12x12x12x10	N4quda13fermion_force7AllLinkI7double2S2_EE	threads=8640,prec=8,recon=18,sig=4,mu=2	352	1	1	25	1	1	7022	# 0.00 Gflop/s, 0.00 GB/s, tuned Mon Sep 23 17:19:34 2013
12x12x12x10	N4quda13fermion_force7AllLinkI7double2S2_EE	threads=8640,prec=8,recon=18,sig=4,mu=5	192	1	1	45	1	1	12289	# 0.00 Gflop/s, 0.00 GB/s, tuned Mon Sep 23 17:19:34 2013
12x12x12x10	N4quda13fermion_force7AllLinkI7double2S2_EE	threads=8640,prec=8,recon=18,sig=4,mu=6	352	1	1	25	1	1	0	# 0.00 Gflop/s, 0.00 GB/s, tuned Mon Sep 23 17:19:35 2013
12x12x12x10	N4quda13fermion_force7AllLinkI7double2S2_EE	threads=8640,prec=8,recon=18,sig=4,mu=7	192	1	1	45	1	1	12289	# 0.00 Gflop/s, 0.00 GB/s, tuned Mon Sep 23 17:19:35 2013
12x12x12x10	N4quda13fermion_force7AllLinkI7double2S2_EE	threads=8640,prec=8,recon=18,sig=5,mu=0	352	1	1	25	1	1	24577	# 0.00 Gflop/s, 0.00 GB/s, tuned Mon Sep 23 17:19:38 2013
12x12x12x10	N4quda13fermion_force7AllLinkI7double2S2_EE	threads=8640,prec=8,recon=18,sig=5,mu=1	192	1	1	45	1	1	24577	# 0.00 Gflop/s, 0.00 GB/s, tuned Mon Sep 23 17:19:37 2013
12x12x12x10	N4quda13fermion_force7AllLinkI7double2S2_EE	threads=8640,prec=8,recon=18,sig=5,mu=3	352	1	1	25	1	1	12289	# 0.00 Gflop/s, 0.00 GB/s, tuned Mon Sep 23 17:19:37 2013
12x12x12x10	N4quda13fermion_force7AllLinkI7double2S2_EE	threads=8640,prec=8,recon=18,sig=5,mu=4	192	1	1	45	1	1	24577	# 0.00 Gflop/s, 0.00 GB/s, tuned Mon Sep 23 17:19:37 2013
12x12x12x10	N4quda13fermion_force7AllLinkI7double2S2_EE	threads=8640,prec=8,recon=18,sig=5,mu=6	352	1	1	25	1	1	7022	# 0.00 Gflop/s, 0.00 GB/s, tuned Mon Sep 23 17:19:37 2013
12x12x12x10	N4quda13fermion_force7AllLinkI7double2S2_EE	threads=8640,prec=8,recon=18,sig=5,mu=7	192	1	1	45	1	1	0	# 0.00 Gflop/s, 0.00 GB/s, tuned Mon Sep 23 17:19:38 2013
12x12x12x10	N4quda13fermion_force7AllLinkI7double2S2_EE	threads=8640,prec=8,recon=18,sig=6,mu=0	352	1	1	25	1	1	24577	# 0.00 Gflop/s, 0.00 GB/s, tuned Mon Sep 23 17:19:40 2013
12x12x12x10	N4quda13fermion_force7AllLinkI7double2S2_EE	threads=8640,prec=8,recon=18,sig=6,mu=2	192	1	1	45	1	1	16385	# 0.00 Gflop/s, 0.00 GB/s, tuned Mon Sep 23 17:19:39 2013
12x12x12x10	N4quda13fermion_force7AllLinkI7double2S2_EE	threads=8640,prec=8,recon=18,sig=6,mu=3	384	1	1	23	1	1	7022	# 0.00 Gflop/s, 0.00 GB/s, tuned Mon Sep 23 17:19:39 2013
12x12x12x10	N4quda13fermion_force7AllLinkI7double2S2_EE	threads=8640,prec=8,recon=18,sig=6,mu=4	192	1	1	45	1	1	6145	# 0.00 Gflop/s, 0.00 GB/s, tuned Mon Sep 23 17:19:39 2013
12x12x12x10	N4quda13fermion_force7AllLinkI7double2S2_EE	threads=8640,prec=8,recon=18,sig=6,mu=5	352	1	1	25	1	1	16385	# 0.00 Gflop/s, 0.00 GB/s, tuned Mon Sep 23 17:19:39 2013
12x12x12x10	N4quda13fermion_force7AllLinkI7double2S2_EE	threads=8640,prec=8,recon=18,sig=6,mu=7	192	1	1	45	1	1	9831	# 0.00 Gflop/s, 0.00 GB/s, tuned Mon Sep 23 17:19:40 2013
12x12x12x10	N4quda13fermion_force7AllLinkI7double2S2_EE	threads=8640,prec=8,recon=18,sig=7,mu=1	352	1	1	25	1	1	0	# 0.00 Gflop/s, 0.00 GB/s, tuned Mon Sep 23 17:19:42 2013
12x12x12x10	N4quda13fermion_force7AllLinkI7double2S2_EE	threads=8640,prec=8,recon=18,sig=7,mu=2	352	1	1	25	1	1	7022	# 0.00 Gflop/s, 0.00 GB/s, tuned Mon Sep 23 17:19:42 2013
12x12x12x10	N4quda13fermion_force7AllLinkI7double2S2_EE	threads=8640,prec=8,recon=18,sig=7,mu=3	192	1	1	45	1	1	8193	# 0.00 Gflop/s, 0.00 GB/s, tuned Mon Sep 23 17:19:41 2013
12x12x12x10	N4quda13fermion_force7AllLinkI7double2S2_EE	threads=8640,prec=8,recon=18,sig=7,mu=4	192	1	1	45	1	1	16385	# 0.00 Gflop/s, 0.00 GB/s, tuned Mon Sep 23 17:19:42 2013
12x12x12x10	N4quda13fermion_force7AllLinkI7double2S2_EE	threads=8640,prec=8,recon=18,sig=7,mu=5	192	1	1	45	1	1	8193	# 0.00 Gflop/s, 0.00 GB/s, tuned Mon Sep 23 17:19:42 2013
12x12x12x10	N4quda13fermion_force7AllLinkI7double2S2_EE	threads=8640,prec=8,recon=18,sig=7,mu=6	352	1	1	25	1	1	16385	# 0.00 Gflop/s, 0.00 GB/s, tuned Mon Sep 23 17:19:43 2013
12x12x12x10	N4quda13fermion_force8SideLinkI7double2S2_EE	threads=8640,prec=8,recon=12,sig=0,mu=1	352	1	1	25	1	1	0	# 0.00 Gflop/s, 0.00 GB/s, tuned Mon Sep 23 17:19:59 2013
12x12x12x10	N4quda13fermion_force8SideLinkI7double2S2_EE	threads=8640,prec=8,recon=12,sig=0,mu=2	192	1	1	45	1	1	16385	# 0.00 Gflop/s, 0.00 GB/s, tuned Mon Sep 23 17:19:58 2013
12x12x12x10	N4quda13fermion_force8SideLinkI7double2S2_EE	threads=8640,prec=8,recon=12,sig=0,mu=3	192	1	1	45	1	1	12289	# 0.00 Gflop/s, 0.00 GB/s, tuned Mon Sep 23 17:19:58 2013
12x12x12x10	N4quda13fermion_force8SideLinkI7double2S2_EE	threads=8640,prec=8,recon=12,sig=0,mu=4	192	1	1	45	1	1	0	# 0.00 Gflop/s, 0.00 GB/s, tuned Mon Sep 23 17:19:58 2013
12x12x12x10	N4quda13fermion_force8SideLinkI7double2S2_EE	threads=8640,prec=8,recon=12,sig=0,mu=5	384	1	1	23	1	1	8193	# 0.00 Gflop/s, 0.00 GB/s, tuned Mon Sep 23 17:19:58 2013
12x12x12x10	N4quda13fermion_force8SideLinkI7double2S2_EE	threads=8640,prec=8,recon=12,sig=0,mu=6	352	1	1	25	1	1	16385	# 0.00 Gflop/s, 0.00 GB/s, tuned Mon Sep 23 17:19:59 2013
12x12x12x10	N4quda13fermion_force8SideLinkI7double2S2_EE	threads=8640,prec=8,recon=12,sig=1,mu=0	192	1	1	45	1	1	12289	# 0.00 Gflop/s, 0.00 GB/s, tuned Mon Sep 23 17:20:00 2013
12x12x12x10	N4quda13fermion_force8SideLinkI7double2S2_EE	threads=8640,prec=8,recon=12,sig=1,mu=2	192	1	1	45	1	1	9831	# 0.00 Gflop/s, 0.00 GB/s, tuned Mon Sep 23 17:20:00 2013
12x12x12x10	N4quda13fermion_force8SideLinkI7double2S2_EE	threads=8640,prec=8,recon=12,sig=1,mu=3	384	1	1	23	1	1	0	# 0.00 Gflop/s, 0.00 GB/s, tuned Mon Sep 23 17:20:00 2013
12x12x12x10	N4quda13fermion_force8SideLinkI7double2S2_EE	threads=8640,prec=8,recon=12,sig=1,mu=4	192	1	1	45	1	1	12289	# 0.00 Gflop/s, 0.00 GB/s, tuned Mon Sep 23 17:20:00 2013
12x12x12x10	N4quda13fermion_force8SideLinkI7double2S2_EE	threads=8640,prec=8,recon=12,sig=1,mu=5	384	1	1	23	1	1	12289	# 0.00 Gflop/s, 0.00 GB/s, tuned Mon Sep 23 17:20:00 2013
12x12x12x10	N4quda13fermion_force8SideLinkI7double2S2_EE	threads=8640,prec=8,recon=12,sig=1,mu=7	192	1	1	45	1	1	12289	# 0.00 Gflop/s, 0.00 GB/s, tuned Mon Sep 23 17:20:00 2013
12x12x12x10	N4quda13fermion_force8SideLinkI7double2S2_EE	threads=8640,prec=8,recon=12,sig=2,mu=0	192	1	1	45	1	1	8193	# 0.00 Gflop/s, 0.00 GB/s, tuned Mon Sep 23 17:20:02 2013
12x12x12x10	N4quda13fermion_force8SideLinkI7double2S2_EE	threads=8640,prec=8,recon=12,sig=2,mu=1	192	1	1	45	1	1	16385	# 0.00 Gflop/s, 0.00 GB/s, tuned Mon Sep 23 17:20:01 2013
12x12x12x10	N4quda13fermion_force8SideLinkI7double2S2_EE	threads=8640,prec=8,recon=12,sig=2,mu=3	192	1	1	45	1	1	9831	# 0.00 Gflop/s, 0.00 GB/s, tuned Mon Sep 23 17:20:01 2013
12x12x12x10	N4quda13fermion_force8SideLinkI7double2S2_EE	threads=8640,prec=8,recon=12,sig=2,mu=4	192	1	1	45	1	1	0	# 0.00 Gflop/s, 0.00 GB/s, tuned Mon Sep 23 17:20:02 2013
12x12x12x10	N4quda13fermion_force8SideLinkI7double2S2_EE	threads=8640,prec=8,recon=12,sig=2,mu=6	352	1	1	25	1	1	16385	# 0.00 Gflop/s, 0.00 GB/s, tuned Mon Sep 23 17:20:02 2013
12x12x12x10	N4quda13fermion_force8SideLinkI7double2S2_EE	threads=8640,prec=8,recon=12,sig=2,mu=7	192	1	1	45	1	1	8193	# 0.00 Gflop/s, 0.00 GB/s, tuned Mon Sep 23 17:20:02 2013
12x12x12x10	N4quda13fermion_force8SideLinkI7double2S2_EE	threads=8640,prec=8,recon=12,sig=3,mu=0	192	1	1	45	1	1	7022	# 0.00 Gflop/s, 0.00 GB/s, tuned Mon Sep 23 17:20:04 2013
12x12x12x10	N4quda13fermion_force8SideLinkI7double2S2_EE	threads=8640,prec=8,recon=12,sig=3,mu=1	352	1	1	25	1	1	6145	# 0.00 Gflop/s, 0.00 GB/s, tuned Mon Sep 23 17:20:03 2013
12x12x12x10	N4quda13fermion_force8SideLinkI7double2S2_EE	threads=8640,prec=8,recon=12,sig=3,mu=2	192	1	1	45	1	1	8193	# 0.00 Gflop/s, 0.00 GB/s, tuned Mon Sep 23 17:20:03 2013
12x12x12x10	N4quda13fermion_force8SideLinkI7double2S2_EE	threads=8640,prec=8,recon=12,sig=3,mu=5	352	1	1	25	1	1	12289	# 0.00 Gflop/s, 0.00 GB/s, tuned Mon Sep 23 17:20:03 2013
12x12x12x10	N4quda13fermion_force8SideLinkI7double2S2_EE	threads=8640,prec=8,recon=12,sig=3,mu=6	192	1	1	45	1	1	0	# 0.00 Gflop/s, 0.00 GB/s, tuned Mon Sep 23 17:20:03 2013
12x12x12x10	N4quda13fermion_force8SideLinkI7double2S2_EE	threads=8640,prec=8,recon=12,sig=3,mu=7	384	1	1	23	1	1	0	# 0.00 Gflop/s, 0.00 GB/s, tuned Mon Sep 23 17:20:04 2013
12x12x12x10	N4quda13fermion_force8SideLinkI7double2S2_EE	threads=8640,prec=8,recon=12,sig=4,mu=0	352	1	1	25	1	1	24577	# 0.00 Gflop/s, 0.00 GB/s, tuned Mon Sep 23 17:20:05 2013
12x12x12x10	N4quda13fermion_force8SideLinkI7double2S2_EE	threads=8640,prec=8,recon=12,sig=4,mu=1	192	1	1	45	1	1	9831	# 0.00 Gflop/s, 0.00 GB/s, tuned Mon Sep 23 17:20:05 2013
12x12x12x10	N4quda13fermion_force8SideLinkI7double2S2_EE	threads=8640,prec=8,recon=12,sig=4,mu=2	192	1	1	45	1	1	0	# 0.00 Gflop/s, 0.00 GB/s, tuned Mon Sep 23 17:20:05 2013
12x12x12x10	N4quda13fermion_force8SideLinkI7double2S2_EE	threads=8640,prec=8,recon=12,sig=4,mu=5	192	1	1	45	1	1	8193	# 0.00 Gflop/s, 0.00 GB/s, tuned Mon Sep 23 17:20:05 2013
12x12x12x10	N4quda13fermion_force8SideLinkI7double2S2_EE	threads=8640,prec=8,recon=12,sig=4,mu=6	192	1	1	45	1	1	6145	# 0.00 Gflop/s, 0.00 GB/s, tuned Mon Sep 23 17:20:05 2013
12x12x12x10	N4quda13fermion_force8SideLinkI7double2S2_EE	threads=8640,prec=8,recon=12,sig=4,mu=7	192	1	1	45	1	1	12289	# 0.00 Gflop/s, 0.00 GB/s, tuned Mon Sep 23 17:20:05 2013
12x12x12x10	N4quda13fermion_force8SideLinkI7double2S2_EE	threads=8640,prec=8,recon=12,sig=5,mu=0	352	1	1	25	1	1	6145	# 0.00 Gflop/s, 0.00 GB/s, tuned Mon Sep 23 17:20:07 2013
12x12x12x10	N4quda13fermion_force8SideLinkI7double2S2_EE	threads=8640,prec=8,recon=12,sig=5,mu=1	352	1	1	25	1	1	8193	# 0.00 Gflop/s, 0.00 GB/s, tuned Mon Sep 23 17:20:06 2013
12x12x12x10	N4quda13fermion_force8SideLinkI7double2S2_EE	threads=8640,prec=8,recon=12,sig=5,mu=3	192	1	1	45	1	1	7022	# 0.00 Gflop/s, 0.00 GB/s, tuned Mon Sep 23 17:20:06 2013
12x12x12x10	N4quda13fermion_force8SideLinkI7double2S2_EE	threads=8640,prec=8,recon=12,sig=5,mu=4	352	1	1	25	1	1	9831	# 0.00 Gflop/s, 0.00 GB/s, tuned Mon Sep 23 17:20:07 2013
12x12x12x10	N4quda13fermion_force8SideLinkI7double2S2_EE	threads=8640,prec=8,recon=12,sig=5,mu=6	384	1	1	23	1	1	8193	# 0.00 Gflop/s, 0.00 GB/s, tuned Mon Sep 23 17:20:07 2013
12x12x12x10	N4quda13fermion_force8SideLinkI7double2S2_EE	threads=8640,prec=8,recon=12,sig=5,mu=7	352	1	1	25	1	1	24577	# 0.00 Gflop/s, 0.00 GB/s, tuned Mon Sep 23 17:20:07 2013
12x12x12x10	N4quda13fermion_force8SideLinkI7double2S2_EE	threads=8640,prec=8,recon=12,sig=6,mu=0	192	1	1	45	1	1	16385	# 0.00 Gflop/s, 0.00 GB/s, tuned Mon Sep 23 17:20:08 2013
12x12x12x10	N4quda13fermion_force8SideLinkI7double2S2_EE	threads=8640,prec=8,recon=12,sig=6,mu=2	352	1	1	25	1	1	9831	# 0.00 Gflop/s, 0.00 GB/s, tuned Mon Sep 23 17:20:08 2013
12x12x12x10	N4quda13fermion_force8SideLinkI7double2S2_EE	threads=8640,prec=8,recon=12,sig=6,mu=3	192	1	1	45	1	1	6145	# 0.00 Gflop/s, 0.00 GB/s, tuned Mon Sep 23 17:20:08 2013
12x12x12x10	N4quda13fermion_force8SideLinkI7double2S2_EE	threads=8640,prec=8,recon=12,sig=6,mu=4	352	1	1	25	1	1	9831	# 0.00 Gflop/s, 0.00 GB/s, tuned Mon Sep 23 17:20:08 2013
12x12x12x10	N4quda13fermion_force8SideLinkI7double2S2_EE	threads=8640,prec=8,recon=12,sig=6,mu=5	352	1	1	25	1	1	6145	# 0.00 Gflop/s, 0.00 GB/s, tuned Mon Sep 23 17:20:08 2013
12x12x12x10	N4quda13fermion_force8SideLinkI7double2S2_EE	threads=8640,prec=8,recon=12,sig=6,mu=7	192	1	1	45	1	1	9831	# 0.00 Gflop/s, 0.00 GB/s, tuned Mon Sep 23 17:20:09 2013
12x12x12x10	N4quda13fermion_force8SideLinkI7double2S2_EE	threads=8640,prec=8,recon=12,sig=7,mu=1	384	1	1	23	1	1	12289	# 0.00 Gflop/s, 0.00 GB/s, tuned Mon Sep 23 17:20:10 2013
12x12x12x10	N4quda13fermion_force8SideLinkI7double2S2_EE	threads=8640,prec=8,recon=12,sig=7,mu=2	352	1	1	25	1	1	12289	# 0.00 Gflop/s, 0.00 GB/s, tuned Mon Sep 23 17:20:09 2013
12x12x12x10	N4quda13fermion_force8SideLinkI7double2S2_EE	threads=8640,prec=8,recon=12,sig=7,mu=3	352	1	1	25	1	1	6145	# 0.00 Gflop/s, 0.00 GB/s, tuned Mon Sep 23 17:20:10 2013
12x12x12x10	N4quda13fermion_force8SideLinkI7double2S2_EE	threads=8640,prec=8,recon=12,sig=7,mu=4	192	1	1	45	1	1	6145	# 0.00 Gflop/s, 0.00 GB/s, tuned Mon Sep 23 17:20:10 2013
12x12x12x10	N4quda13fermion_force8SideLinkI7double2S2_EE	threads=8640,prec=8,recon=12,sig=7,mu=5	192	1	1	45	1	1	0	# 0.00 Gflop/s, 0.00 GB/s, tuned Mon Sep 23 17:20:10 2013
12x12x12x10	N4quda13fermion_force8SideLinkI7double2S2_EE	threads=8640,prec=8,recon=12,sig=7,mu=6	384	1	1	23	1	1	0	# 0.00 Gflop/s, 0.00 GB/s, tuned Mon Sep 23 17:20:10 2013
12x12x12x10	N4quda13fermion_force8SideLinkI7double2S2_EE	threads=8640,prec=8,recon=18,sig=0,mu=1	352	1	1	25	1	1	12289	# 0.00 Gflop/s, 0.00 GB/s, tuned Mon Sep 23 17:19:26 2013
12x12x12x10	N4quda13fermion_force8SideLinkI7double2S2_EE	threads=8640,prec=8,recon=18,sig=0,mu=2	352	1	1	25	1	1	8193	# 0.00 Gflop/s, 0.00 GB/s, tuned Mon Sep 23 17:19:25 2013
12x12x12x10	N4quda13fermion_force8SideLinkI7double2S2_EE	threads=8640,prec=8,recon=18,sig=0,mu=3	352	1	1	25	1	1	16385	# 0.00 Gflop/s, 0.00 GB/s, tuned Mon Sep 23 17:19:25 2013
12x12x12x10	N4quda13fermion_force8SideLinkI7double2S2_EE	threads=8640,prec=8,recon=18,sig=0,mu=4	352	1	1	25	1	1	12289	# 0.00 Gflop/s, 0.00 GB/s, tuned Mon Sep 23 17:19:25 2013
12x12x12x10	N4quda13fermion_force8SideLinkI7double2S2_EE	threads=8640,prec=8,recon=18,sig=0,mu=5	384	1	1	23	1	1	8193	# 0.00 Gflop/s, 0.00 GB/s, tuned Mon Sep 23 17:19:25 2013
12x12x12x10	N4quda13fermion_force8SideLinkI7double2S2_EE	threads=8640,prec=8,recon=18,sig=0,mu=6	416	1	1	21	1	1	12289	# 0.00 Gflop/s, 0.00 GB/s, tuned Mon Sep 23 17:19:26 2013
12x12x12x10	N4quda13fermion_force8SideLinkI7double2S2_EE	threads=8640,prec=8,recon=18,sig=1,mu=0	352	1	1	25	1	1	16385	# 0.00 Gflop/s, 0.00 GB/s, tuned Mon Sep 23 17:19:28 2013
12x12x12x10	N4quda13fermion_force8SideLinkI7double2S2_EE	threads=8640,prec=8,recon=18,sig=1,mu=2	352	1	1	25	1	1	24577	# 0.00 Gflop/s, 0.00 GB/s, tuned Mon Sep 23 17:19:27 2013
12x12x12x10	N4quda13fermion_force8SideLinkI7double2S2_EE	threads=8640,prec=8,recon=18,sig=1,mu=3	384	1	1	23	1	1	12289	# 0.00 Gflop/s, 0.00 GB/s, tuned Mon Sep 23 17:19:27 2013
12x12x12x10	N4quda13fermion_force8SideLinkI7double2S2_EE	threads=8640,prec=8,recon=18,sig=1,mu=4	352	1	1	25	1	1	8193	# 0.00 Gflop/s, 0.00 GB/s, tuned Mon Sep 23 17:19:27 2013
12x12x12x10	N4quda13fermion_force8SideLinkI7double2S2_EE	threads=8640,prec=8,recon=18,sig=1,mu=5	352	1	1	25	1	1	7022	# 0.00 Gflop/s, 0.00 GB/s, tuned Mon Sep 23 17:19:28 2013
12x12x12x10	N4quda13fermion_force8SideLinkI7double2S2_EE	threads=8640,prec=8,recon=18,sig=1,mu=7	352	1	1	25	1	1	24577	# 0.00 Gflop/s, 0.00 GB/s, tuned Mon Sep 23 17:19:28 2013
12x12x12x10	N4quda13fermion_force8SideLinkI7double2S2_EE	threads=8640,prec=8,recon=18,sig=2,mu=0	384	1	1	23	1	1	0	# 0.00 Gflop/s, 0.00 GB/s, tuned Mon Sep 23 17:19:30 2013
12x12x12x10	N4quda13fermion_force8SideLinkI7double2S2_EE	threads=8640,prec=8,recon=18,sig=2,mu=1	352	1	1	25	1	1	16385	# 0.00 Gflop/s, 0.00 GB/s, tuned Mon Sep 23 17:19:30 2013
12x12x12x10	N4quda13fermion_force8SideLinkI7double2S2_EE	threads=8640,prec=8,recon=18,sig=2,mu=3	352	1	1	25	1	1	7022	# 0.00 Gflop/s, 0.00 GB/s, tuned Mon Sep 23 17:19:30 2013
12x12x12x10	N4quda13fermion_force8SideLinkI7double2S2_EE	threads=8640,prec=8,recon=18,sig=2,mu=4	352	1	1	25	1	1	7022	# 0.00 Gflop/s, 0.00 GB/s, tuned Mon Sep 23 17:19:30 2013
12x12x12x10	N4quda13fermion_force8SideLinkI7double2S2_EE	threads=8640,prec=8,recon=18,sig=2,mu=6	384	1	1	23	1	1	6145	# 0.00 Gflop/s, 0.00 GB/s, tuned Mon Sep 23 17:19:30 2013
12x12x12x10	N4quda13fermion_force8SideLinkI7double2S2_EE	threads=8640,prec=8,recon=18,sig=2,mu=7	352	1	1	25	1	1	24577	# 0.00 Gflop/s, 0.00 GB/s, tuned Mon Sep 23 17:19:31 2013
12x12x12x10	N4quda13fermion_force8SideLinkI7double2S2_EE	threads=8640,prec=8,recon=18,sig=3,mu=0	352	1	1	25	1	1	16385	# 0.00 Gflop/s, 0.00 GB/s, tuned Mon Sep 23 17:19:33 2013
12x12x12x10	N4quda13fermion_force8SideLinkI7double2S2_EE	threads=8640,prec=8,recon=18,sig=3,mu=1	352	1	1	25	1	1	16385	# 0.00 Gflop/s, 0.00 GB/s, tuned Mon Sep 23 17:19:32 2013
12x12x12x10	N4quda13fermion_force8SideLinkI7double2S2_EE	threads=8640,prec=8,recon=18,sig=3,mu=2	384	1	1	23	1	1	16385	# 0.00 Gflop/s, 0.00 GB/s, tuned Mon Sep 23 17:19:32 2013
12x12x12x10	N4quda13fermion_force8SideLinkI7double2S2_EE	threads=8640,prec=8,recon=18,sig=3,mu=5	384	1	1	23	1	1	7022	# 0.00 Gflop/s, 0.00 GB/s, tuned Mon Sep 23 17:19:32 2013
12x12x12x10	N4quda13fermion_force8SideLinkI7double2S2_EE	threads=8640,prec=8,recon=18,sig=3,mu=6	384	1	1	23	1	1	12289	# 0.00 Gflop/s, 0.00 GB/s, tuned Mon Sep 23 17:19:32 2013
12x12x12x10	N4quda13fermion_force8SideLinkI7double2S2_EE	threads=8640,prec=8,recon=18,sig=3,mu=7	352	1	1	25	1	1	16385	# 0.00 Gflop/s, 0.00 GB/s, tuned Mon Sep 23 17:19:33 2013
12x12x12x10	N4quda13fermion_force8SideLinkI7double2S2_EE	threads=8640,prec=8,recon=18,sig=4,mu=0	352	1	1	25	1	1	9831	# 0.00 Gflop/s, 0.00 GB/s, tuned Mon Sep 23 17:19:35 2013
12x12x12x10	N4quda13fermion_force8SideLinkI7double2S2_EE	threads=8640,prec=8,recon=18,sig=4,mu=1	384	1	1	23	1	1	7022	# 0.00 Gflop/s, 0.00 GB/s, tuned Mon Sep 23 17:19:34 2013
12x12x12x10	N4quda13fermion_force8SideLinkI7double2S2_EE	threads=8640,prec=8,recon=18,sig=4,mu=2	352	1	1	25	1	1	12289	# 0.00 Gflop/s, 0.00 GB/s, tuned Mon Sep 23 17:19:35 2013
12x12x12x10	N4quda13fermion_force8SideLinkI7double2S2_EE	threads=8640,prec=8,recon=18,sig=4,mu=5	352	1	1	25	1	1	8193	# 0.00 Gflop/s, 0.00 GB/s, tuned Mon Sep 23 17:19:35 2013
12x12x12x10	N4quda13fermion_force8SideLinkI7double2S2_EE	threads=8640,prec=8,recon=18,sig=4,mu=6	384	1	1	23	1	1	9831	# 0.00 Gflop/s, 0.00 GB/s, tuned Mon Sep 23 17:19:35 2013
12x12x12x10	N4quda13fermion_force8SideLinkI7double2S2_EE	threads=8640,prec=8,recon=18,sig=4,mu=7	384	1	1	23	1	1	8193	# 0.00 Gflop/s, 0.00 GB/s, tuned Mon Sep 23 17:19:35 2013
12x12x12x10	N4quda13fermion_force8SideLinkI7double2S2_EE	threads=8640,prec=8,recon=18,sig=5,mu=0	352	1	1	25	1	1	7022	# 0.00 Gflop/s, 0.00 GB/s, tuned Mon Sep 23 17:19:38 2013
12x12x12x10	N4quda13fermion_force8SideLinkI7double2S2_EE	threads=8640,prec=8,recon=18,sig=5,mu=1	352	1	1	25	1	1	9831	# 0.00 Gflop/s, 0.00 GB/s, tuned Mon Sep 23 17:19:37 2013
12x12x12x10	N4quda13fermion_force8SideLinkI7double2S2_EE	threads=8640,prec=8,recon=18,sig=5,mu=3	352	1	1	25	1	1	6145	# 0.00 Gflop/s, 0.00 GB/s, tuned Mon Sep 23 17:19:37 2013
12x12x12x10	N4quda13fermion_force8SideLinkI7double2S2_EE	threads=8640,prec=8,recon=18,sig=5,mu=4	352	1	1	25	1	1	16385	# 0.00 Gflop/s, 0.00 GB/s, tuned Mon Sep 23 17:19:37 2013
12x12x12x10	N4quda13fermion_force8SideLinkI7double2S2_EE	threads=8640,prec=8,recon=18,sig=5,mu=6	352	1	1	25	1	1	12289	# 0.00 Gflop/s, 0.00 GB/s, tuned Mon Sep 23 17:19:37 2013
12x12x12x10	N4quda13fermion_force8SideLinkI7double2S2_EE	threads=8640,prec=8,recon=18,sig=5,mu=7	352	1	1	25	1	1	12289	# 0.00 Gflop/s, 0.00 GB/s, tuned Mon Sep 23 17:19:38 2013
12x12x12x10	N4quda13fermion_force8SideLinkI7double2S2_EE	threads=8640,prec=8,recon=18,sig=6,mu=0	352	1	1	25	1	1	24577	# 0.00 Gflop/s, 0.00 GB/s, tuned Mon Sep 23 17:19:40 2013
12x12x12x10	N4quda13fermion_force8SideLinkI7double2S2_EE	threads=8640,prec=8,recon=18,sig=6,mu=2	352	1	1	25	1	1	9831	# 0.00 Gflop/s, 0.00 GB/s, tuned Mon Sep 23 17:19:39 2013
12x12x12x10	N4quda13fermion_force8SideLinkI7double2S2_EE	threads=8640,prec=8,recon=18,sig=6,mu=3	384	1	1	23	1	1	6145	# 0.00 Gflop/s, 0.00 GB/s, tuned Mon Sep 23 17:19:39 2013
12x12x12x10	N4quda13fermion_force8SideLinkI7double2S2_EE	threads=8640,prec=8,recon=18,sig=6,mu=4	352	1	1	25	1	1	24577	# 0.00 Gflop/s, 0.00 GB/s, tuned Mon Sep 23 17:19:40 2013
12x12x12x10	N4quda13fermion_force8SideLinkI7double2S2_EE	threads=8640,prec=8,recon=18,sig=6,mu=5	352	1	1	25	1	1	12289	# 0.00 Gflop/s, 0.00 GB/s, tuned Mon Sep 23 17:19:40 2013
12x12x12x10	N4quda13fermion_force8SideLinkI7double2S2_EE	threads=8640,prec=8,recon=18,sig=6,mu=7	352	1	1	25	1	1	24577	# 0.00 Gflop/s, 0.00 GB/s, tuned Mon Sep 23 17:19:40 2013
12x12x12x10	N4quda13fermion_force8SideLinkI7double2S2_EE	threads=8640,prec=8,recon=18,sig=7,mu=1	384	1	1	23	1	1	8193	# 0.00 Gflop/s, 0.00 GB/s, tuned Mon Sep 23 17:19:42 2013
12x12x12x10	N4quda13fermion_force8SideLinkI7double2S2_EE	threads=8640,prec=8,recon=18,sig=7,mu=2	352	1	1	25	1	1	12289	# 0.00 Gflop/s, 0.00 GB/s, tuned Mon Sep 23 17:19:42 2013
12x12x12x10	N4quda13fermion_force8SideLinkI7double2S2_EE	threads=8640,prec=8,recon=18,sig=7,mu=3	352	1	1	25	1	1	8193	# 0.00 Gflop/s, 0.00 GB/s, tuned Mon Sep 23 17:19:42 2013
12x12x12x10	N4quda13fermion_force8SideLinkI7double2S2_EE	threads=8640,prec=8,recon=18,sig=7,mu=4	352	1	1	25	1	1	8193	# 0.00 Gflop/s, 0.00 GB/s, tuned Mon Sep 23 17:19:42 2013
12x12x12x10	N4quda13fermion_force8SideLinkI7double2S2_EE	threads=8640,prec=8,recon=18,sig=7,mu=5	352	1	1	25	1	1	16385	# 0.00 Gflop/s, 0.00 GB/s, tuned Mon Sep 23 17:19:42 2013
12x12x12x10	N4quda13fermion_force8SideLinkI7double2S2_EE	threads=8640,prec=8,recon=18,sig=7,mu=6	352	1	1	25	1	1	6145	# 0.00 Gflop/s, 0.00 GB/s, tuned Mon Sep 23 17:19:43 2013
12x12x12x12	N4quda13fermion_force10MiddleLinkI7double2S2_EE	threads=10368,prec=8,recon=12,sig=0,mu=1	288	1	1	36	1	1	0	# 0.00 Gflop/s, 0.00 GB/s, tuned Mon Sep 23 17:19:58 2013
12x12x12x12	N4quda13fermion_force10MiddleLinkI7double2S2_EE	threads=10368,prec=8,recon=12,sig=0,mu=2	64	1	1	162	1	1	8193	# 0.00 Gflop/s, 0.00 GB/s, tuned Mon Sep 23 17:19:58 2013
12x12x12x12	N4quda13fermion_force10MiddleLinkI7double2S2_EE	threads=10368,prec=8,recon=12,sig=0,mu=3	192	1	1	54	1	1	9831	# 0.00 Gflop/s, 0.00 GB/s, tuned Mon Sep 23 17:19:59 2013
12x12x12x12	N4quda13fermion_force10MiddleLinkI7double2S2_EE	threads=10368,prec=8,recon=12,sig=0,mu=4	96	1	1	108	1	1	0	# 0.00 Gflop/s, 0.00 GB/s, tuned Mon Sep 23 17:19:59 2013
12x12x12x12	N4quda13fermion_force10MiddleLinkI7double2S2_EE	threads=10368,prec=8,recon=12,sig=0,mu=5	64	1	1	162	1	1	12289	# 0.00 Gflop/s, 0.00 GB/s, tuned Mon Sep 23 17:19:59 2013
12x12x12x12	N4quda13fermion_force10MiddleLinkI7double2S2_EE	threads=10368,prec=8,recon=12,sig=0,mu=6	64	1	1	162	1	1	8193	# 0.00 Gflop/s, 0.00 GB/s, tuned Mon Sep 23 17:19:59 2013
12x12x12x12	N4quda13fermion_force10MiddleLinkI7double2S2_EE	threads=10368,prec=8,recon=12,sig=1,mu=0	64	1	1	162	1	1	7022	# 0.00 Gflop/s, 0.00 GB/s, tuned Mon Sep 23 17:19:59 2013
12x12x12x12	N4quda13fermion_force10MiddleLinkI7double2S2_EE	threads=10368,prec=8,recon=12,sig=1,mu=2	288	1	1	36	1	1	24577	# 0.00 Gflop/s, 0.00 GB/s, tuned Mon Sep 23 17:20:00 2013
12x12x12x12	N4quda13fermion_force10MiddleLinkI7double2S2_EE	threads=10368,prec=8,recon=12,sig=1,mu=3	192	1	1	54	1	1	0	# 0.00 Gflop/s, 0.00 GB/s, tuned Mon Sep 23 17:20:01 2013
12x12x12x12	N4quda13fermion_force10MiddleLinkI7double2S2_EE	threads=10368,prec=8,recon=12,sig=1,mu=4	64	1	1	162	1	1	6145	# 0.00 Gflop/s, 0.00 GB/s, tuned Mon Sep 23 17:20:01 2013
12x12x12x12	N4quda13fermion_force10MiddleLinkI7double2S2_EE	threads=10368,prec=8,recon=12,sig=1,mu=5	128	1	1	81	1	1	9831	# 0.00 Gflop/s, 0.00 GB/s, tuned Mon Sep 23 17:20:01 2013
12x12x12x12	N4quda13fermion_force10MiddleLinkI7double2S2_EE	threads=10368,prec=8,recon=12,sig=1,mu=7	64	1	1	162	1	1	9831	# 0.00 Gflop/s, 0.00 GB/s, tuned Mon Sep 23 17:20:01 2013
12x12x12x12	N4quda13fermion_force10MiddleLinkI7double2S2_EE	threads=10368,prec=8,recon=12,sig=2,mu=0	64	1	1	162	1	1	6145	# 0.00 Gflop/s, 0.00 GB/s, tuned Mon Sep 23 17:20:01 2013
12x12x12x12	N4quda13fermion_force10MiddleLinkI7double2S2_EE	threads=10368,prec=8,recon=12,sig=2,mu=1	288	1	1	36	1	1	0	# 0.00 Gflop/s, 0.00 GB/s, tuned Mon Sep 23 17:20:02 2013
12x12x12x12	N4quda13fermion_force10MiddleLinkI7double2S2_EE	threads=10368,prec=8,recon=12,sig=2,mu=3	96	1	1	108	1	1	0	# 0.00 Gflop/s, 0.00 GB/s, tuned Mon Sep 23 17:20:02 2013
12x12x12x12	N4quda13fermion_force10MiddleLinkI7double2S2_EE	threads=10368,prec=8,recon=12,sig=2,mu=4	96	1	1	108	1	1	9831	# 0.00 Gflop/s, 0.00 GB/s, tuned Mon Sep 23 17:20:02 2013
12x12x12x12	N4quda13fermion_force10MiddleLinkI7double2S2_EE	threads=10368,prec=8,recon=12,sig=2,mu=6	64	1	1	162	1	1	7022	# 0.00 Gflop/s, 0.00 GB/s, tuned Mon Sep 23 17:20:02 2013
12x12x12x12	N4quda13fermion_force10MiddleLinkI7double2S2_EE	threads=10368,prec=8,recon=12,sig=2,mu=7	96	1	1	108	1	1	16385	# 0.00 Gflop/s, 0.00 GB/s, tuned Mon Sep 23 17:20:03 2013
12x12x12x12	N4quda13fermion_force10MiddleLinkI7double2S2_EE	threads=10368,prec=8,recon=12,sig=3,mu=0	128	1	1	81	1	1	24577	# 0.00 Gflop/s, 0.00 GB/s, tuned Mon Sep 23 17:20:03 2013
12x12x12x12	N4quda13fermion_force10MiddleLinkI7double2S2_EE	threads=10368,prec=8,recon=12,sig=3,mu=1	96	1	1	108	1	1	16385	# 0.00 Gflop/s, 0.00 GB/s, tuned Mon Sep 23 17:20:04 2013
12x12x12x12	N4quda13fermion_force10MiddleLinkI7double2S2_EE	threads=10368,prec=8,recon=12,sig=3,mu=2	96	1	1	108	1	1	24577	# 0.00 Gflop/s, 0.00 GB/s, tuned Mon Sep 23 17:20:04 2013
12x12x12x12	N4quda13fermion_force10MiddleLinkI7double2S2_EE	threads=10368,prec=8,recon=12,sig=3,mu=5	192	1	1	54	1	1	6145	# 0.00 Gflop/s, 0.00 GB/s, tuned Mon Sep 23 17:20:04 2013
12x12x12x12	N4quda13fermion_force10MiddleLinkI7double2S2_EE	threads=10368,prec=8,recon=12,sig=3,mu=6	192	1	1	54	1	1	8193	# 0.00 Gflop/s, 0.00 GB/s, tuned Mon Sep 23 17:20:04 2013
12x12x12x12	N4quda13fermion_force10MiddleLinkI7double2S2_EE	threads=10368,prec=8,recon=12,sig=3,mu=7	96	1	1	108	1	1	16385	# 0.00 Gflop/s, 0.00 GB/s, tuned Mon Sep 23 17:20:04 2013
12x12x12x12	N4quda13fermion_force10MiddleLinkI7double2S2_EE	threads=10368,prec=8,recon=12,sig=4,mu=0	128	1	1	81	1	1	12289	# 0.00 Gflop/s, 0.00 GB/s, tuned Mon Sep 23 17:20:04 2013
12x12x12x12	N4quda13fermion_force10MiddleLinkI7double2S2_EE	threads=10368,prec=8,recon=12,sig=4,mu=1	96	1	1	108	1	1	16385	# 0.00 Gflop/s, 0.00 GB/s, tuned Mon Sep 23 17:20:05 2013
12x12x12x12	N4quda13fermion_force10MiddleLinkI7double2S2_EE	threads=10368,prec=8,recon=12,sig=4,mu=2	384	1	1	27	1	1	7022	# 0.00 Gflop/s, 0.00 GB/s, tuned Mon Sep 23 17:20:06 2013
12x12x12x12	N4quda13fermion_force10MiddleLinkI7double2S2_EE	threads=10368,prec=8,recon=12,sig=4,mu=5	256	1	1	41	1	1	9831	# 0.00 Gflop/s, 0.00 GB/s, tuned Mon Sep 23 17:20:06 2013
12x12x12x12	N4quda13fermion_force10MiddleLinkI7double2S2_EE	threads=10368,prec=8,recon=12,sig=4,mu=6	256	1	1	41	1	1	7022	# 0.00 Gflop/s, 0.00 GB/s, tuned Mon Sep 23 17:20:06 2013
12x12x12x12	N4quda13fermion_force10MiddleLinkI7double2S2_EE	threads=10368,prec=8,recon=12,sig=4,mu=7	64	1	1	162	1	1	12289	# 0.00 Gflop/s, 0.00 GB/s, tuned Mon Sep 23 17:20:06 2013
12x12x12x12	N4quda13fermion_force10MiddleLinkI7double2S2_EE	threads=10368,prec=8,recon=12,sig=5,mu=0	288	1	1	36	1	1	8193	# 0.00 Gflop/s, 0.00 GB/s, tuned Mon Sep 23 17:20:06 2013
12x12x12x12	N4quda13fermion_force10MiddleLinkI7double2S2_EE	threads=10368,prec=8,recon=12,sig=5,mu=1	288	1	1	36	1	1	24577	# 0.00 Gflop/s, 0.00 GB/s, tuned Mon Sep 23 17:20:07 2013
12x12x12x12	N4quda13fermion_force10MiddleLinkI7double2S2_EE	threads=10368,prec=8,recon=12,sig=5,mu=3	96	1	1	108	1	1	16385	# 0.00 Gflop/s, 0.00 GB/s, tuned Mon Sep 23 17:20:07 2013
12x12x12x12	N4quda13fermion_force10MiddleLinkI7double2S2_EE	threads=10368,prec=8,recon=12,sig=5,mu=4	256	1	1	41	1	1	24577	# 0.00 Gflop/s, 0.00 GB/s, tuned Mon Sep 23 17:20:07 2013
12x12x12x12	N4quda13fermion_force10MiddleLinkI7double2S2_EE	threads=10368,prec=8,recon=12,sig=5,mu=6	288	1	1	36	1	1	24577	# 0.00 Gflop/s, 0.00 GB/s, tuned Mon Sep 23 17:20:07 2013
12x12x12x12	N4quda13fermion_force10MiddleLinkI7double2S2_EE	threads=10368,prec=8,recon=12,sig=5,mu=7	288	1	1	36	1	1	6145	# 0.00 Gflop/s, 0.00 GB/s, tuned Mon Sep 23 17:20:07 2013
12x12x12x12	N4quda13fermion_force10MiddleLinkI7double2S2_EE	threads=10368,prec=8,recon=12,sig=6,mu=0	288	1	1	36	1	1	16385	# 0.00 Gflop/s, 0.00 GB/s, tuned Mon Sep 23 17:20:08 2013
12x12x12x12	N4quda13fermion_force10MiddleLinkI7double2S2_EE	threads=10368,prec=8,recon=12,sig=6,mu=2	288	1	1	36	1	1	0	# 0.00 Gflop/s, 0.00 GB/s, tuned Mon Sep 23 17:20:08 2013
12x12x12x12	N4quda13fermion_force10MiddleLinkI7double2S2_EE	threads=10368,prec=8,recon=12,sig=6,mu=3	32	1	1	324	1	1	9831	# 0.00 Gflop/s, 0.00 GB/s, tuned Mon Sep 23 17:20:09 2013
12x12x12x12	N4quda13fermion_force10MiddleLinkI7double2S2_EE	threads=10368,prec=8,recon=12,sig=6,mu=4	256	1	1	41	1	1	0	# 0.00 Gflop/s, 0.00 GB/s, tuned Mon Sep 23 17:20:09 2013
12x12x12x12	N4quda13fermion_force10MiddleLinkI7double2S2_EE	threads=10368,prec=8,recon=12,sig=6,mu=5	96	1	1	108	1	1	8193	# 0.00 Gflop/s, 0.00 GB/s, tuned Mon Sep 23 17:20:09 2013
12x12x12x12	N4quda13fermion_force10MiddleLinkI7double2S2_EE	threads=10368,prec=8,recon=12,sig=6,mu=7	288	1	1	36	1	1	7022	# 0.00 Gflop/s, 0.00 GB/s, tuned Mon Sep 23 17:20:09 2013
12x12x12x12	N4quda13fermion_force10MiddleLinkI7double2S2_EE	threads=10368,prec=8,recon=12,sig=7,mu=1	96	1	1	108	1	1	12289	# 0.00 Gflop/s, 0.00 GB/s, tuned Mon Sep 23 17:20:09 2013
12x12x12x12	N4quda13fermion_force10MiddleLinkI7double2S2_EE	threads=10368,prec=8,recon=12,sig=7,mu=2	288	1	1	36	1	1	12289	# 0.00 Gflop/s, 0.00 GB/s, tuned Mon Sep 23 17:20:10 2013
12x12x12x12	N4quda13fermion_force10MiddleLinkI7double2S2_EE	threads=10368,prec=8,recon=12,sig=7,mu=3	96	1	1	108	1	1	24577	# 0.00 Gflop/s, 0.00 GB/s, tuned Mon Sep 23 17:20:10 2013
12x12x12x12	N4quda13fermion_force10MiddleLinkI7double2S2_EE	threads=10368,prec=8,recon=12,sig=7,mu=4	256	1	1	41	1	1	7022	# 0.00 Gflop/s, 0.00 GB/s, tuned Mon Sep 23 17:20:10 2013
12x12x12x12	N4quda13fermion_force10MiddleLinkI7double2S2_EE	threads=10368,prec=8,recon=12,sig=7,mu=5	288	1	1	36	1	1	0	# 0.00 Gflop/s, 0.00 GB/s, tuned Mon Sep 23 17:20:11 2013
12x12x12x12	N4quda13fermion_force10MiddleLinkI7double2S2_EE	threads=10368,prec=8,recon=12,sig=7,mu=6	64	1	1	162	1	1	12289	# 0.00 Gflop/s, 0.00 GB/s, tuned Mon Sep 23 17:20:11 2013
12x12x12x12	N4quda13fermion_force10MiddleLinkI7double2S2_EE	threads=10368,prec=8,recon=18,sig=0,mu=1	288	1	1	36	1	1	8193	# 0.00 Gflop/s, 0.00 GB/s, tuned Mon Sep 23 17:19:24 2013
12x12x12x12	N4quda13fermion_force10MiddleLinkI7double2S2_EE	threads=10368,prec=8,recon=18,sig=0,mu=2	288	1	1	36	1	1	12289	# 0.00 Gflop/s, 0.00 GB/s, tuned Mon Sep 23 17:19:25 2013
12x12x12x12	N4quda13fermion_force10MiddleLinkI7double2S2_EE	threads=10368,prec=8,recon=18,sig=0,mu=3	96	1	1	108	1	1	24577	# 0.00 Gflop/s, 0.00 GB/s, tuned Mon Sep 23 17:19:26 2013
12x12x12x12	N4quda13fermion_force10MiddleLinkI7double2S2_EE	threads=10368,prec=8,recon=18,sig=0,mu=4	384	1	1	27	1	1	16385	# 0.00 Gflop/s, 0.00 GB/s, tuned Mon Sep 23 17:19:26 2013
12x12x12x12	N4quda13fermion_force10MiddleLinkI7double2S2_EE	threads=10368,prec=8,recon=18,sig=0,mu=5	288	1	1	36	1	1	9831	# 0.00 Gflop/s, 0.00 GB/s, tuned Mon Sep 23 17:19:26 2013
12x12x12x12	N4quda13fermion_force10MiddleLinkI7double2S2_EE	threads=10368,prec=8,recon=18,sig=0,mu=6	288	1	1	36	1	1	16385	# 0.00 Gflop/s, 0.00 GB/s, tuned Mon Sep 23 17:19:27 2013
12x12x12x12	N4quda13fermion_force10MiddleLinkI7double2S2_EE	threads=10368,prec=8,recon=18,sig=1,mu=0	288	1	1	36	1	1	7022	# 0.00 Gflop/s, 0.00 GB/s, tuned Mon Sep 23 17:19:27 2013
12x12x12x12	N4quda13fermion_force10MiddleLinkI7double2S2_EE	threads=10368,prec=8,recon=18,sig=1,mu=2	288	1	1	36	1	1	16385	# 0.00 Gflop/s, 0.00 GB/s, tuned Mon Sep 23 17:19:28 2013
12x12x12x12	N4quda13fermion_force10MiddleLinkI7double2S2_EE	threads=10368,prec=8,recon=18,sig=1,mu=3	256	1	1	41	1	1	9831	# 0.00 Gflop/s, 0.00 GB/s, tuned Mon Sep 23 17:19:28 2013
12x12x12x12	N4quda13fermion_force10MiddleLinkI7double2S2_EE	threads=10368,prec=8,recon=18,sig=1,mu=4	384	1	1	27	1	1	7022	# 0.00 Gflop/s, 0.00 GB/s, tuned Mon Sep 23 17:19:29 2013
12x12x12x12	N4quda13fermion_force10MiddleLinkI7double2S2_EE	threads=10368,prec=8,recon=18,sig=1,mu=5	288	1	1	36	1	1	12289	# 0.00 Gflop/s, 0.00 GB/s, tuned Mon Sep 23 17:19:29 2013
12x12x12x12	N4quda13fermion_force10MiddleLinkI7double2S2_EE	threads=10368,prec=8,recon=18,sig=1,mu=7	288	1	1	36	1	1	6145	# 0.00 Gflop/s, 0.00 GB/s, tuned Mon Sep 23 17:19:29 2013
12x12x12x12	N4quda13fermion_force10MiddleLinkI7double2S2_EE	threads=10368,prec=8,recon=18,sig=2,mu=0	288	1	1	36	1	1	8193	# 0.00 Gflop/s, 0.00 GB/s, tuned Mon Sep 23 17:19:29 2013
12x12x12x12	N4quda13fermion_force10MiddleLinkI7double2S2_EE	threads=10368,prec=8,recon=18,sig=2,mu=1	288	1	1	36	1	1	24577	# 0.00 Gflop/s, 0.00 GB/s, tuned Mon Sep 23 17:19:30 2013
12x12x12x12	N4quda13fermion_force10MiddleLinkI7double2S2_EE	threads=10368,prec=8,recon=18,sig=2,mu=3	256	1	1	41	1	1	6145	# 0.00 Gflop/s, 0.00 GB/s, tuned Mon Sep 23 17:19:31 2013
12x12x12x12	N4quda13fermion_force10MiddleLinkI7double2S2_EE	threads=10368,prec=8,recon=18,sig=2,mu=4	384	1	1	27	1	1	24577	# 0.00 Gflop/s, 0.00 GB/s, tuned Mon Sep 23 17:19:31 2013
12x12x12x12	N4quda13fermion_force10MiddleLinkI7double2S2_EE	threads=10368,prec=8,recon=18,sig=2,mu=6	288	1	1	36	1	1	16385	# 0.00 Gflop/s, 0.00 GB/s, tuned Mon Sep 23 17:19:31 2013
12x12x12x12	N4quda13fermion_force10MiddleLinkI7double2S2_EE	threads=10368,prec=8,recon=18,sig=2,mu=7	288	1	1	36	1	1	24577	# 0.00 Gflop/s, 0.00 GB/s, tuned Mon Sep 23 17:19:32 2013
12x12x12x12	N4quda13fermion_force10MiddleLinkI7double2S2_EE	threads=10368,prec=8,recon=18,sig=3,mu=0	64	1	1	162	1	1	0	# 0.00 Gflop/s, 0.00 GB/s, tuned Mon Sep 23 17:19:32 2013
12x12x12x12	N4quda13fermion_force10MiddleLinkI7double2S2_EE	threads=10368,prec=8,recon=18,sig=3,mu=1	128	1	1	81	1	1	24577	# 0.00 Gflop/s, 0.00 GB/s, tuned Mon Sep 23 17:19:33 2013
12x12x12x12	N4quda13fermion_force10MiddleLinkI7double2S2_EE	threads=10368,prec=8,recon=18,sig=3,mu=2	256	1	1	41	1	1	7022	# 0.00 Gflop/s, 0.00 GB/s, tuned Mon Sep 23 17:19:33 2013
12x12x12x12	N4quda13fermion_force10MiddleLinkI7double2S2_EE	threads=10368,prec=8,recon=18,sig=3,mu=5	384	1	1	27	1	1	16385	# 0.00 Gflop/s, 0.00 GB/s, tuned Mon Sep 23 17:19:34 2013
12x12x12x12	N4quda13fermion_force10MiddleLinkI7double2S2_EE	threads=10368,prec=8,recon=18,sig=3,mu=6	96	1	1	108	1	1	12289	# 0.00 Gflop/s, 0.00 GB/s, tuned Mon Sep 23 17:19:34 2013
12x12x12x12	N4quda13fermion_force10MiddleLinkI7double2S2_EE	threads=10368,prec=8,recon=18,sig=3,mu=7	384	1	1	27	1	1	8193	# 0.00 Gflop/s, 0.00 GB/s, tuned Mon Sep 23 17:19:34 2013
12x12x12x12	N4quda13fermion_force10MiddleLinkI7double2S2_EE	threads=10368,prec=8,recon=18,sig=4,mu=0	256	1	1	41	1	1	16385	# 0.00 Gflop/s, 0.00 GB/s, tuned Mon Sep 23 17:19:34 2013
12x12x12x12	N4quda13fermion_force10MiddleLinkI7double2S2_EE	threads=10368,prec=8,recon=18,sig=4,mu=1	384	1	1	27	1	1	16385	# 0.00 Gflop/s, 0.00 GB/s, tuned Mon Sep 23 17:19:35 2013
12x12x12x12	N4quda13fermion_force10MiddleLinkI7double2S2_EE	threads=10368,prec=8,recon=18,sig=4,mu=2	256	1	1	41	1	1	16385	# 0.00 Gflop/s, 0.00 GB/s, tuned Mon Sep 23 17:19:36 2013
12x12x12x12	N4quda13fermion_force10MiddleLinkI7double2S2_EE	threads=10368,prec=8,recon=18,sig=4,mu=5	256	1	1	41	1	1	7022	# 0.00 Gflop/s, 0.00 GB/s, tuned Mon Sep 23 17:19:36 2013
12x12x12x12	N4quda13fermion_force10MiddleLinkI7double2S2_EE	threads=10368,prec=8,recon=18,sig=4,mu=6	256	1	1	41	1	1	16385	# 0.00 Gflop/s, 0.00 GB/s, tuned Mon Sep 23 17:19:36 2013
12x12x12x12	N4quda13fermion_force10MiddleLinkI7double2S2_EE	threads=10368,prec=8,recon=18,sig=4,mu=7	256	1	1	41	1	1	16385	# 0.00 Gflop/s, 0.00 GB/s, tuned Mon Sep 23 17:19:36 2013
12x12x12x12	N4quda13fermion_force10MiddleLinkI7double2S2_EE	threads=10368,prec=8,recon=18,sig=5,mu=0	288	1	1	36	1	1	8193	# 0.00 Gflop/s, 0.00 GB/s, tuned Mon Sep 23 17:19:37 2013
12x12x12x12	N4quda13fermion_force10MiddleLinkI7double2S2_EE	threads=10368,prec=8,recon=18,sig=5,mu=1	288	1	1	36	1	1	0	# 0.00 Gflop/s, 0.00 GB/s, tuned Mon Sep 23 17:19:38 2013
12x12x12x12	N4quda13fermion_force10MiddleLinkI7double2S2_EE	threads=10368,prec=8,recon=18,sig=5,mu=3	256	1	1	41	1	1	24577	# 0.00 Gflop/s, 0.00 GB/s, tuned Mon Sep 23 17:19:38 2013
12x12x12x12	N4quda13fermion_force10MiddleLinkI7double2S2_EE	threads=10368,prec=8,recon=18,sig=5,mu=4	256	1	1	41	1	1	9831	# 0.00 Gflop/s, 0.00 GB/s, tuned Mon Sep 23 17:19:38 2013
12x12x12x12	N4quda13fermion_force10MiddleLinkI7double2S2_EE	threads=10368,prec=8,recon=18,sig=5,mu=6	288	1	1	36	1	1	24577	# 0.00 Gflop/s, 0.00 GB/s, tuned Mon Sep 23 17:19:39 2013
12x12x12x12	N4quda13fermion_force10MiddleLinkI7double2S2_EE	threads=10368,prec=8,recon=18,sig=5,mu=7	288	1	1	36	1	1	7022	# 0.00 Gflop/s, 0.00 GB/s, tuned Mon Sep 23 17:19:39 2013
12x12x12x12	N4quda13fermion_force10MiddleLinkI7double2S2_EE	threads=10368,prec=8,recon=18,sig=6,mu=0	288	1	1	36	1	1	8193	# 0.00 Gflop/s, 0.00 GB/s, tuned Mon Sep 23 17:19:39 2013
12x12x12x12	N4quda13fermion_force10MiddleLinkI7double2S2_EE	threads=10368,prec=8,recon=18,sig=6,mu=2	288	1	1	36	1	1	9831	# 0.00 Gflop/s, 0.00 GB/s, tuned Mon Sep 23 17:19:40 2013
12x12x12x12	N4quda13fermion_force10MiddleLinkI7double2S2_EE	threads=10368,prec=8,recon=18,sig=6,mu=3	256	1	1	41	1	1	7022	# 0.00 Gflop/s, 0.00 GB/s, tuned Mon Sep 23 17:19:40 2013
12x12x12x12	N4quda13fermion_force10MiddleLinkI7double2S2_EE	threads=10368,prec=8,recon=18,sig=6,mu=4	256	1	1	41	1	1	6145	# 0.00 Gflop/s, 0.00 GB/s, tuned Mon Sep 23 17:19:41 2013
12x12x12x12	N4quda13fermion_force10MiddleLinkI7double2S2_EE	threads=10368,prec=8,recon=18,sig=6,mu=5	288	1	1	36	1	1	9831	# 0.00 Gflop/s, 0.00 GB/s, tuned Mon Sep 23 17:19:41 2013
12x12x12x12	N4quda13fermion_force10MiddleLinkI7double2S2_EE	threads=10368,prec=8,recon=18,sig=6,mu=7	288	1	1	36	1	1	16385	# 0.00 Gflop/s, 0.00 GB/s, tuned Mon Sep 23 17:19:41 2013
12x12x12x12	N4quda13fermion_force10MiddleLinkI7double2S2_EE	threads=10368,prec=8,recon=18,sig=7,mu=1	288	1	1	36	1	1	12289	# 0.00 Gflop/s, 0.00 GB/s, tuned Mon Sep 23 17:19:41 2013
12x12x12x12	N4quda13fermion_force10MiddleLinkI7double2S2_EE	threads=10368,prec=8,recon=18,sig=7,mu=2	288	1	1	36	1	1	8193	# 0.00 Gflop/s, 0.00 GB/s, tuned Mon Sep 23 17:19:42 2013
12x12x12x12	N4quda13fermion_force10MiddleLinkI7double2S2_EE	threads=10368,prec=8,recon=18,sig=7,mu=3	256	1	1	41	1	1	8193	# 0.00 Gflop/s, 0.00 GB/s, tuned Mon Sep 23 17:19:43 2013
12x12x12x12	N4quda13fermion_force10MiddleLinkI7double2S2_EE	threads=10368,prec=8,recon=18,sig=7,mu=4	256	1	1	41	1	1	7022	# 0.00 Gflop/s, 0.00 GB/s, tuned Mon Sep 23 17:19:43 2013
12x12x12x12	N4quda13fermion_force10MiddleLinkI7double2S2_EE	threads=10368,prec=8,recon=18,sig=7,mu=5	288	1	1	36	1	1	16385	# 0.00 Gflop/s, 0.00 GB/s, tuned Mon Sep 23 17:19:43 2013
12x12x12x12	N4quda13fermion_force10MiddleLinkI7double2S2_EE	threads=10368,prec=8,recon=18,sig=7,mu=6	288	1	1	36	1	1	8193	# 0.00 Gflop/s, 0.00 GB/s, tuned Mon Sep 23 17:19:44 2013
12x12x12x12	N4quda13fermion_force16LepageMiddleLinkI7double2S2_EE	threads=10368,prec=8,recon=18,sig=0,mu=1	288	1	1	36	1	1	24577	# 0.00 Gflop/s, 0.00 GB/s, tuned Mon Sep 23 17:19:25 2013
12x12x12x12	N4quda13fermion_force16LepageMiddleLinkI7double2S2_EE	threads=10368,prec=8,recon=18,sig=0,mu=2	288	1	1	36	1	1	9831	# 0.00 Gflop/s, 0.00 GB/s, tuned Mon Sep 23 17:19:26 2013
12x12x12x12	N4quda13fermion_force16LepageMiddleLinkI7double2S2_EE	threads=10368,prec=8,recon=18,sig=0,mu=3	128	1	1	81	1	1	24577	# 0.00 Gflop/s, 0.00 GB/s, tuned Mon Sep 23 17:19:26 2013
12x12x12x12	N4quda13fermion_force16LepageMiddleLinkI7double2S2_EE	threads=10368,prec=8,recon=18,sig=0,mu=4	64	1	1	162	1	1	12289	# 0.00 Gflop/s, 0.00 GB/s, tuned Mon Sep 23 17:19:26 2013
12x12x12x12	N4quda13fermion_force16LepageMiddleLinkI7double2S2_EE	threads=10368,prec=8,recon=18,sig=0,mu=5	288	1	1	36	1	1	6145	# 0.00 Gflop/s, 0.00 GB/s, tuned Mon Sep 23 17:19:26 2013
12x12x12x12	N4quda13fermion_force16LepageMiddleLinkI7double2S2_EE	threads=10368,prec=8,recon=18,sig=0,mu=6	288	1	1	36	1	1	6145	# 0.00 Gflop/s, 0.00 GB/s, tuned Mon Sep 23 17:19:27 2013
12x12x12x12	N4quda13fermion_force16LepageMiddleLinkI7double2S2_EE	threads=10368,prec=8,recon=18,sig=1,mu=0	288	1	1	36	1	1	7022	# 0.00 Gflop/s, 0.00 GB/s, tuned Mon Sep 23 17:19:28 2013
12x12x12x12	N4quda13fermion_force16LepageMiddleLinkI7double2S2_EE	threads=10368,prec=8,recon=18,sig=1,mu=2	288	1	1	36	1	1	24577	# 0.00 Gflop/s, 0.00 GB/s, tuned Mon Sep 23 17:19:28 2013
12x12x12x12	N4quda13fermion_force16LepageMiddleLinkI7double2S2_EE	threads=10368,prec=8,recon=18,sig=1,mu=3	384	1	1	27	1	1	16385	# 0.00 Gflop/s, 0.00 GB/s, tuned Mon Sep 23 17:19:28 2013
12x12x12x12	N4quda13fermion_force16LepageMiddleLinkI7double2S2_EE	threads=10368,prec=8,recon=18,sig=1,mu=4	384	1	1	27	1	1	8193	# 0.00 Gflop/s, 0.00 GB/s, tuned Mon Sep 23 17:19:29 2013
12x12x12x12	N4quda13fermion_force16LepageMiddleLinkI7double2S2_EE	threads=10368,prec=8,recon=18,sig=1,mu=5	288	1	1	36	1	1	0	# 0.00 Gflop/s, 0.00 GB/s, tuned Mon Sep 23 17:19:29 2013
12x12x12x12	N4quda13fermion_force16LepageMiddleLinkI7double2S2_EE	threads=10368,prec=8,recon=18,sig=1,mu=7	160	1	1	65	1	1	9831	# 0.00 Gflop/s, 0.00 GB/s, tuned Mon Sep 23 17:19:29 2013
12x12x12x12	N4quda13fermion_force16LepageMiddleLinkI7double2S2_EE	threads=10368,prec=8,recon=18,sig=2,mu=0	288	1	1	36	1	1	7022	# 0.00 Gflop/s, 0.00 GB/s, tuned Mon Sep 23 17:19:30 2013
12x12x12x12	N4quda13fermion_force16LepageMiddleLinkI7double2S2_EE	threads=10368,prec=8,recon=18,sig=2,mu=1	288	1	1	36	1	1	24577	# 0.00 Gflop/s, 0.00 GB/s, tuned Mon Sep 23 17:19:31 2013
12x12x12x12	N4quda13fermion_force16LepageMiddleLinkI7double2S2_EE	threads=10368,prec=8,recon=18,sig=2,mu=3	128	1	1	81	1	1	8193	# 0.00 Gflop/s, 0.00 GB/s, tuned Mon Sep 23 17:19:31 2013
12x12x12x12	N4quda13fermion_force16LepageMiddleLinkI7double2S2_EE	threads=10368,prec=8,recon=18,sig=2,mu=4	128	1	1	81	1	1	7022	# 0.00 Gflop/s, 0.00 GB/s, tuned Mon Sep 23 17:19:31 2013
12x12x12x12	N4quda13fermion_force16LepageMiddleLinkI7double2S2_EE	threads=10368,prec=8,recon=18,sig=2,mu=6	288	1	1	36	1	1	6145	# 0.00 Gflop/s, 0.00 GB/s, tuned Mon Sep 23 17:19:31 2013
12x12x12x12	N4quda13fermion_force16LepageMiddleLinkI7double2S2_EE	threads=10368,prec=8,recon=18,sig=2,mu=7	288	1	1	36	1	1	24577	# 0.00 Gflop/s, 0.00 GB/s, tuned Mon Sep 23 17:19:32 2013
12x12x12x12	N4quda13fermion_force16LepageMiddleLinkI7double2S2_EE	threads=10368,prec=8,recon=18,sig=3,mu=0	384	1	1	27	1	1	7022	# 0.00 Gflop/s, 0.00 GB/s, tuned Mon Sep 23 17:19:33 2013
12x12x12x12	N4quda13fermion_force16LepageMiddleLinkI7double2S2_EE	threads=10368,prec=8,recon=18,sig=3,mu=1	128	1	1	81	1	1	9831	# 0.00 Gflop/s, 0.00 GB/s, tuned Mon Sep 23 17:19:33 2013
12x12x12x12	N4quda13fermion_force16LepageMiddleLinkI7double2S2_EE	threads=10368,prec=8,recon=18,sig=3,mu=2	64	1	1	162	1	1	6145	# 0.00 Gflop/s, 0.00 GB/s, tuned Mon Sep 23 17:19:33 2013
12x12x12x12	N4quda13fermion_force16LepageMiddleLinkI7double2S2_EE	threads=10368,prec=8,recon=18,sig=3,mu=5	64	1	1	162	1	1	24577	# 0.00 Gflop/s, 0.00 GB/s, tuned Mon Sep 23 17:19:34 2013
12x12x12x12	N4quda13fermion_force16LepageMiddleLinkI7double2S2_EE	threads=10368,prec=8,recon=18,sig=3,mu=6	128	1	1	81	1	1	9831	# 0.00 Gflop/s, 0.00 GB/s, tuned Mon Sep 23 17:19:34 2013
12x12x12x12	N4quda13fermion_force16LepageMiddleLinkI7double2S2_EE	threads=10368,prec=8,recon=18,sig=3,mu=7	96	1	1	108	1	1	16385	# 0.00 Gflop/s, 0.00 GB/s, tuned Mon Sep 23 17:19:34 2013
12x12x12x12	N4quda13fermion_force16LepageMiddleLinkI7double2S2_EE	threads=10368,prec=8,recon=18,sig=4,mu=0	384	1	1	27	1	1	8193	# 0.00 Gflop/s, 0.00 GB/s, tuned Mon Sep 23 17:19:35 2013
12x12x12x12	N4quda13fermion_force16LepageMiddleLinkI7double2S2_EE	threads=10368,prec=8,recon=18,sig=4,mu=1	128	1	1	81	1	1	24577	# 0.00 Gflop/s, 0.00 GB/s, tuned Mon Sep 23 17:19:36 2013
12x12x12x12	N4quda13fermion_force16LepageMiddleLinkI7double2S2_EE	threads=10368,prec=8,recon=18,sig=4,mu=2	96	1	1	108	1	1	0	# 0.00 Gflop/s, 0.00 GB/s, tuned Mon Sep 23 17:19:36 2013
12x12x12x12	N4quda13fermion_force16LepageMiddleLinkI7double2S2_EE	threads=10368,prec=8,recon=18,sig=4,mu=5	384	1	1	27	1	1	7022	# 0.00 Gflop/s, 0.00 GB/s, tuned Mon Sep 23 17:19:36 2013
12x12x12x12	N4quda13fermion_force16LepageMiddleLinkI7double2S2_EE	threads=10368,prec=8,recon=18,sig=4,mu=6	128	1	1	81	1	1	8193	# 0.00 Gflop/s, 0.00 GB/s, tuned Mon Sep 23 17:19:36 2013
12x12x12x12	N4quda13fermion_force16LepageMiddleLinkI7double2S2_EE	threads=10368,prec=8,recon=18,sig=4,mu=7	384	1	1	27	1	1	8193	# 0.00 Gflop/s, 0.00 GB/s, tuned Mon Sep 23 17:19:36 2013
12x12x12x12	N4quda13fermion_force16LepageMiddleLinkI7double2S2_EE	threads=10368,prec=8,recon=18,sig=5,mu=0	32	1	1	324	1	1	7022	# 0.00 Gflop/s, 0.00 GB/s, tuned Mon Sep 23 17:19:37 2013
12x12x12x12	N4quda13fermion_force16LepageMiddleLinkI7double2S2_EE	threads=10368,prec=8,recon=18,sig=5,mu=1	64	1	1	162	1	1	12289	# 0.00 Gflop/s, 0.00 GB/s, tuned Mon Sep 23 17:19:38 2013
12x12x12x12	N4quda13fermion_force16LepageMiddleLinkI7double2S2_EE	threads=10368,prec=8,recon=18,sig=5,mu=3	128	1	1	81	1	1	24577	# 0.00 Gflop/s, 0.00 GB/s, tuned Mon Sep 23 17:19:38 2013
12x12x12x12	N4quda13fermion_force16LepageMiddleLinkI7double2S2_EE	threads=10368,prec=8,recon=18,sig=5,mu=4	96	1	1	108	1	1	0	# 0.00 Gflop/s, 0.00 GB/s, tuned Mon Sep 23 17:19:38 2013
12x12x12x12	N4quda13fermion_force16LepageMiddleLinkI7double2S2_EE	threads=10368,prec=8,recon=18,sig=5,mu=6	160	1	1	65	1	1	8193	# 0.00 Gflop/s, 0.00 GB/s, tuned Mon Sep 23 17:19:39 2013
12x12x12x12	N4quda13fermion_force16LepageMiddleLinkI7double2S2_EE	threads=10368,prec=8,recon=18,sig=5,mu=7	96	1	1	108	1	1	0	# 0.00 Gflop/s, 0.00 GB/s, tuned Mon Sep 23 17:19:39 2013
12x12x12x12	N4quda13fermion_force16LepageMiddleLinkI7double2S2_EE	threads=10368,prec=8,recon=18,sig=6,mu=0	512	1	1	21	1	1	6145	# 0.00 Gflop/s, 0.00 GB/s, tuned Mon Sep 23 17:19:40 2013
12x12x12x12	N4quda13fermion_force16LepageMiddleLinkI7double2S2_EE	threads=10368,prec=8,recon=18,sig=6,mu=2	64	1	1	162	1	1	12289	# 0.00 Gflop/s, 0.00 GB/s, tuned Mon Sep 23 17:19:40 2013
12x12x12x12	N4quda13fermion_force16LepageMiddleLinkI7double2S2_EE	threads=10368,prec=8,recon=18,sig=6,mu=3	192	1	1	54	1	1	24577	# 0.00 Gflop/s, 0.00 GB/s, tuned Mon Sep 23 17:19:41 2013
12x12x12x12	N4quda13fermion_force16LepageMiddleLinkI7double2S2_EE	threads=10368,prec=8,recon=18,sig=6,mu=4	192	1	1	54	1	1	0	# 0.00 Gflop/s, 0.00 GB/s, tuned Mon Sep 23 17:19:41 2013
12x12x12x12	N4quda13fermion_force16LepageMiddleLinkI7double2S2_EE	threads=10368,prec=8,recon=18,sig=6,mu=5	256	1	1	41	1	1	7022	# 0.00 Gflop/s, 0.00 GB/s, tuned Mon Sep 23 17:19:41 2013
12x12x12x12	N4quda13fermion_force16LepageMiddleLinkI7double2S2_EE	threads=10368,prec=8,recon=18,sig=6,mu=7	512	1	1	21	1	1	12289	# 0.00 Gflop/s, 0.00 GB/s, tuned Mon Sep 23 17:19:41 2013
12x12x12x12	N4quda13fermion_force16LepageMiddleLinkI7double2S2_EE	threads=10368,prec=8,recon=18,sig=7,mu=1	256	1	1	41	1	1	8193	# 0.00 Gflop/s, 0.00 GB/s, tuned Mon Sep 23 17:19:42 2013
12x12x12x12	N4quda13fermion_force16LepageMiddleLinkI7double2S2_EE	threads=10368,prec=8,recon=18,sig=7,mu=2	32	1	1	324	1	1	8193	# 0.00 Gflop/s, 0.00 GB/s, tuned Mon Sep 23 17:19:43 2013
12x12x12x12	N4quda13fermion_force16LepageMiddleLinkI7double2S2_EE	threads=10368,prec=8,recon=18,sig=7,mu=3	96	1	1	108	1	1	7022	# 0.00 Gflop/s, 0.00 GB/s, tuned Mon Sep 23 17:19:43 2013
12x12x12x12	N4quda13fermion_force16LepageMiddleLinkI7double2S2_EE	threads=10368,prec=8,recon=18,sig=7,mu=4	384	1	1	27	1	1	8193	# 0.00 Gflop/s, 0.00 GB/s, tuned Mon Sep 23 17:19:43 2013
12x12x12x12	N4quda13fermion_force16LepageMiddleLinkI7double2S2_EE	threads=10368,prec=8,recon=18,sig=7,mu=5	64	1	1	162	1	1	7022	# 0.00 Gflop/s, 0.00 GB/s, tuned Mon Sep 23 17:19:43 2013
12x12x12x12	N4quda13fermion_force16LepageMiddleLinkI7double2S2_EE	threads=10368,prec=8,recon=18,sig=7,mu=6	512	1	1	21	1	1	8193	# 0.00 Gflop/s, 0.00 GB/s, tuned Mon Sep 23 17:19:44 2013
12x12x12x12	N4quda13fermion_force8SideLinkI7double2S2_EE	threads=10368,prec=8,recon=18,sig=0,mu=1	416	1	1	25	1	1	12289	# 0.00 Gflop/s, 0.00 GB/s, tuned Mon Sep 23 17:19:25 2013
12x12x12x12	N4quda13fermion_force8SideLinkI7double2S2_EE	threads=10368,prec=8,recon=18,sig=0,mu=2	416	1	1	25	1	1	6145	# 0.00 Gflop/s, 0.00 GB/s, tuned Mon Sep 23 17:19:26 2013
12x12x12x12	N4quda13fermion_force8SideLinkI7double2S2_EE	threads=10368,prec=8,recon=18,sig=0,mu=3	416	1	1	25	1	1	7022	# 0.00 Gflop/s, 0.00 GB/s, tuned Mon Sep 23 17:19:26 2013
12x12x12x12	N4quda13fermion_force8SideLinkI7double2S2_EE	threads=10368,prec=8,recon=18,sig=0,mu=4	384	1	1	27	1	1	12289	# 0.00 Gflop/s, 0.00 GB/s, tuned Mon Sep 23 17:19:26 2013
12x12x12x12	N4quda13fermion_force8SideLinkI7double2S2_EE	threads=10368,prec=8,recon=18,sig=0,mu=5	224	1	1	47	1	1	16385	# 0.00 Gflop/s, 0.00 GB/s, tuned Mon Sep 23 17:19:27 2013
12x12x12x12	N4quda13fermion_force8SideLinkI7double2S2_EE	threads=10368,prec=8,recon=18,sig=0,mu=6	416	1	1	25	1	1	7022	# 0.00 Gflop/s, 0.00 GB/s, tuned Mon Sep 23 17:19:27 2013
12x12x12x12	N4quda13fermion_force8SideLinkI7double2S2_EE	threads=10368,prec=8,recon=18,sig=1,mu=0	416	1	1	25	1	1	24577	# 0.00 Gflop/s, 0.00 GB/s, tuned Mon Sep 23 17:19:28 2013
12x12x12x12	N4quda13fermion_force8SideLinkI7double2S2_EE	threads=10368,prec=8,recon=18,sig=1,mu=2	416	1	1	25	1	1	9831	# 0.00 Gflop/s, 0.00 GB/s, tuned Mon Sep 23 17:19:28 2013
12x12x12x12	N4quda13fermion_force8SideLinkI7double2S2_EE	threads=10368,prec=8,recon=18,sig=1,mu=3	416	1	1	25	1	1	24577	# 0.00 Gflop/s, 0.00 GB/s, tuned Mon Sep 23 17:19:29 2013
12x12x12x12	N4quda13fermion_force8SideLinkI7double2S2_EE	threads=10368,prec=8,recon=18,sig=1,mu=4	384	1	1	27	1	1	24577	# 0.00 Gflop/s, 0.00 GB/s, tuned Mon Sep 23 17:19:29 2013
12x12x12x12	N4quda13fermion_force8SideLinkI7double2S2_EE	threads=10368,prec=8,recon=18,sig=1,mu=5	416	1	1	25	1	1	6145	# 0.00 Gflop/s, 0.00 GB/s, tuned Mon Sep 23 17:19:29 2013
12x12x12x12	N4quda13fermion_force8SideLinkI7double2S2_EE	threads=10368,prec=8,recon=18,sig=1,mu=7	416	1	1	25	1	1	8193	# 0.00 Gflop/s, 0.00 GB/s, tuned Mon Sep 23 17:19:29 2013
12x12x12x12	N4quda13fermion_force8SideLinkI7double2S2_EE	threads=10368,prec=8,recon=18,sig=2,mu=0	416	1	1	25	1	1	24577	# 0.00 Gflop/s, 0.00 GB/s, tuned Mon Sep 23 17:19:30 2013
12x12x12x12	N4quda13fermion_force8SideLinkI7double2S2_EE	threads=10368,prec=8,recon=18,sig=2,mu=1	416	1	1	25	1	1	0	# 0.00 Gflop/s, 0.00 GB/s, tuned Mon Sep 23 17:19:31 2013
12x12x12x12	N4quda13fermion_force8SideLinkI7double2S2_EE	threads=10368,prec=8,recon=18,sig=2,mu=3	416	1	1	25	1	1	7022	# 0.00 Gflop/s, 0.00 GB/s, tuned Mon Sep 23 17:19:31 2013
12x12x12x12	N4quda13fermion_force8SideLinkI7double2S2_EE	threads=10368,prec=8,recon=18,sig=2,mu=4	384	1	1	27	1	1	24577	# 0.00 Gflop/s, 0.00 GB/s, tuned Mon Sep 23 17:19:31 2013
12x12x12x12	N4quda13fermion_force8SideLinkI7double2S2_EE	threads=10368,prec=8,recon=18,sig=2,mu=6	416	1	1	25	1	1	16385	# 0.00 Gflop/s, 0.00 GB/s, tuned Mon Sep 23 17:19:31 2013
12x12x12x12	N4quda13fermion_force8SideLinkI7double2S2_EE	threads=10368,prec=8,recon=18,sig=2,mu=7	480	1	1	22	1	1	24577	# 0.00 Gflop/s, 0.00 GB/s, tuned Mon Sep 23 17:19:32 2013
12x12x12x12	N4quda13fermion_force8SideLinkI7double2S2_EE	threads=10368,prec=8,recon=18,sig=3,mu=0	416	1	1	25	1	1	9831	# 0.00 Gflop/s, 0.00 GB/s, tuned Mon Sep 23 17:19:33 2013
12x12x12x12	N4quda13fermion_force8SideLinkI7double2S2_EE	threads=10368,prec=8,recon=18,sig=3,mu=1	224	1	1	47	1	1	7022	# 0.00 Gflop/s, 0.00 GB/s, tuned Mon Sep 23 17:19:33 2013
12x12x12x12	N4quda13fermion_force8SideLinkI7double2S2_EE	threads=10368,prec=8,recon=18,sig=3,mu=2	416	1	1	25	1	1	0	# 0.00 Gflop/s, 0.00 GB/s, tuned Mon Sep 23 17:19:33 2013
12x12x12x12	N4quda13fermion_force8SideLinkI7double2S2_EE	threads=10368,prec=8,recon=18,sig=3,mu=5	416	1	1	25	1	1	7022	# 0.00 Gflop/s, 0.00 GB/s, tuned Mon Sep 23 17:19:34 2013
12x12x12x12	N4quda13fermion_force8SideLinkI7double2S2_EE	threads=10368,prec=8,recon=18,sig=3,mu=6	416	1	1	25	1	1	8193	# 0.00 Gflop/s, 0.00 GB/s, tuned Mon Sep 23 17:19:34 2013
12x12x12x12	N4quda13fermion_force8SideLinkI7double2S2_EE	threads=10368,prec=8,recon=18,sig=3,mu=7	416	1	1	25	1	1	16385	# 0.00 Gflop/s, 0.00 GB/s, tuned Mon Sep 23 17:19:34 2013
12x12x12x12	N4quda13fermion_force8SideLinkI7double2S2_EE	threads=10368,prec=8,recon=18,sig=4,mu=0	416	1	1	25	1	1	6145	# 0.00 Gflop/s, 0.00 GB/s, tuned Mon Sep 23 17:19:35 2013
12x12x12x12	N4quda13fermion_force8SideLinkI7double2S2_EE	threads=10368,prec=8,recon=18,sig=4,mu=1	416	1	1	25	1	1	12289	# 0.00 Gflop/s, 0.00 GB/s, tuned Mon Sep 23 17:19:36 2013
12x12x12x12	N4quda13fermion_force8SideLinkI7double2S2_EE	threads=10368,prec=8,recon=18,sig=4,mu=2	224	1	1	47	1	1	12289	# 0.00 Gflop/s, 0.00 GB/s, tuned Mon Sep 23 17:19:36 2013
12x12x12x12	N4quda13fermion_force8SideLinkI7double2S2_EE	threads=10368,prec=8,recon=18,sig=4,mu=5	416	1	1	25	1	1	9831	# 0.00 Gflop/s, 0.00 GB/s, tuned Mon Sep 23 17:19:36 2013
12x12x12x12	N4quda13fermion_force8SideLinkI7double2S2_EE	threads=10368,prec=8,recon=18,sig=4,mu=6	416	1	1	25	1	1	16385	# 0.00 Gflop/s, 0.00 GB/s, tuned Mon Sep 23 17:19:36 2013
12x12x12x12	N4quda13fermion_force8SideLinkI7double2S2_EE	threads=10368,prec=8,recon=18,sig=4,mu=7	416	1	1	25	1	1	0	# 0.00 Gflop/s, 0.00 GB/s, tuned Mon Sep 23 17:19:36 2013
12x12x12x12	N4quda13fermion_force8SideLinkI7double2S2_EE	threads=10368,prec=8,recon=18,sig=5,mu=0	224	1	1	47	1	1	24577	# 0.00 Gflop/s, 0.00 GB/s, tuned Mon Sep 23 17:19:37 2013
12x12x12x12	N4quda13fermion_force8SideLinkI7double2S2_EE	threads=10368,prec=8,recon=18,sig=5,mu=1	416	1	1	25	1	1	16385	# 0.00 Gflop/s, 0.00 GB/s, tuned Mon Sep 23 17:19:38 2013
12x12x12x12	N4quda13fermion_force8SideLinkI7double2S2_EE	threads=10368,prec=8,recon=18,sig=5,mu=3	416	1	1	25	1	1	8193	# 0.00 Gflop/s, 0.00 GB/s, tuned Mon Sep 23 17:19:38 2013
12x12x12x12	N4quda13fermion_force8SideLinkI7double2S2_EE	threads=10368,prec=8,recon=18,sig=5,mu=4	384	1	1	27	1	1	16385	# 0.00 Gflop/s, 0.00 GB/s, tuned Mon Sep 23 17:19:38 2013
12x12x12x12	N4quda13fermion_force8SideLinkI7double2S2_EE	threads=10368,prec=8,recon=18,sig=5,mu=6	448	1	1	24	1	1	8193	# 0.00 Gflop/s, 0.00 GB/s, tuned Mon Sep 23 17:19:39 2013
12x12x12x12	N4quda13fermion_force8SideLinkI7double2S2_EE	threads=10368,prec=8,recon=18,sig=5,mu=7	416	1	1	25	1	1	7022	# 0.00 Gflop/s, 0.00 GB/s, tuned Mon Sep 23 17:19:39 2013
12x12x12x12	N4quda13fermion_force8SideLinkI7double2S2_EE	threads=10368,prec=8,recon=18,sig=6,mu=0	416	1	1	25	1	1	6145	# 0.00 Gflop/s, 0.00 GB/s, tuned Mon Sep 23 17:19:40 2013
12x12x12x12	N4quda13fermion_force8SideLinkI7double2S2_EE	threads=10368,prec=8,recon=18,sig=6,mu=2	416	1	1	25	1	1	6145	# 0.00 Gflop/s, 0.00 GB/s, tuned Mon Sep 23 17:19:40 2013
12x12x12x12	N4quda13fermion_force8SideLinkI7double2S2_EE	threads=10368,prec=8,recon=18,sig=6,mu=3	416	1	1	25	1	1	16385	# 0.00 Gflop/s, 0.00 GB/s, tuned Mon Sep 23 17:19:41 2013
12x12x12x12	N4quda13fermion_force8SideLinkI7double2S2_EE	threads=10368,prec=8,recon=18,sig=6,mu=4	384	1	1	27	1	1	6145	# 0.00 Gflop/s, 0.00 GB/s, tuned Mon Sep 23 17:19:41 2013
12x12x12x12	N4quda13fermion_force8SideLinkI7double2S2_EE	threads=10368,prec=8,recon=18,sig=6,mu=5	448	1	1	24	1	1	24577	# 0.00 Gflop/s, 0.00 GB/s, tuned Mon Sep 23 17:19:41 2013
12x12x12x12	N4quda13fermion_force8SideLinkI7double2S2_EE	threads=10368,prec=8,recon=18,sig=6,mu=7	416	1	1	25	1	1	24577	# 0.00 Gflop/s, 0.00 GB/s, tuned Mon Sep 23 17:19:41 2013
12x12x12x12	N4quda13fermion_force8SideLinkI7double2S2_EE	threads=10368,prec=8,recon=18,sig=7,mu=1	416	1	1	25	1	1	12289	# 0.00 Gflop/s, 0.00 GB/s, tuned Mon Sep 23 17:19:42 2013
12x12x12x12	N4quda13fermion_force8SideLinkI7double2S2_EE	threads=10368,prec=8,recon=18,sig=7,mu=2	416	1	1	25	1	1	24577	# 0.00 Gflop/s, 0.00 GB/s, tuned Mon Sep 23 17:19:43 2013
12x12x12x12	N4quda13fermion_force8SideLinkI7double2S2_EE	threads=10368,prec=8,recon=18,sig=7,mu=3	416	1	1	25	1	1	6145	# 0.00 Gflop/s, 0.00 GB/s, tuned Mon Sep 23 17:19:43 2013
12x12x12x12	N4quda13fermion_force8SideLinkI7double2S2_EE	threads=10368,prec=8,recon=18,sig=7,mu=4	384	1	1	27	1	1	0	# 0.00 Gflop/s, 0.00 GB/s, tuned Mon Sep 23 17:19:43 2013
12x12x12x12	N4quda13fermion_force8SideLinkI7double2S2_EE	threads=10368,prec=8,recon=18,sig=7,mu=5	448	1	1	24	1	1	16385	# 0.00 Gflop/s, 0.00 GB/s, tuned Mon Sep 23 17:19:43 2013
12x12x12x12	N4quda13fermion_force8SideLinkI7double2S2_EE	threads=10368,prec=8,recon=18,sig=7,mu=6	416	1	1	25	1	1	9831	# 0.00 Gflop/s, 0.00 GB/s, tuned Mon Sep 23 17:19:44 2013
12x12x12x12x	N4quda13fermion_force18UnitarizeForceCudaE	threads=20736,prec=8stride=10368	32	1	1	648	1	1	24577	# 0.00 Gflop/s, 0.00 GB/s, tuned Mon Sep 23 17:14:17 2013
12x12x12x8	N4quda13fermion_force11OneLinkTermI7double2S2_EE	threads=6912,prec=8,sig=0,coeff=0	64	1	1	108	1	1	24577	# 0.00 Gflop/s, 0.00 GB/s, tuned Mon Sep 23 17:19:24 2013
12x12x12x8	N4quda13fermion_force11OneLinkTermI7double2S2_EE	threads=6912,prec=8,sig=0,coeff=0.125	192	1	1	36	1	1	0	# 0.00 Gflop/s, 0.00 GB/s, tuned Mon Sep 23 17:19:57 2013
12x12x12x8	N4quda13fermion_force11OneLinkTermI7double2S2_EE	threads=6912,prec=8,sig=1,coeff=0	96	1	1	72	1	1	12289	# 0.00 Gflop/s, 0.00 GB/s, tuned Mon Sep 23 17:19:24 2013
12x12x12x8	N4quda13fermion_force11OneLinkTermI7double2S2_EE	threads=6912,prec=8,sig=1,coeff=0.125	64	1	1	108	1	1	0	# 0.00 Gflop/s, 0.00 GB/s, tuned Mon Sep 23 17:19:58 2013
12x12x12x8	N4quda13fermion_force11OneLinkTermI7double2S2_EE	threads=6912,prec=8,sig=2,coeff=0	288	1	1	24	1	1	0	# 0.00 Gflop/s, 0.00 GB/s, tuned Mon Sep 23 17:19:24 2013
12x12x12x8	N4quda13fermion_force11OneLinkTermI7double2S2_EE	threads=6912,prec=8,sig=2,coeff=0.125	96	1	1	72	1	1	6145	# 0.00 Gflop/s, 0.00 GB/s, tuned Mon Sep 23 17:19:58 2013
12x12x12x8	N4quda13fermion_force11OneLinkTermI7double2S2_EE	threads=6912,prec=8,sig=3,coeff=0	288	1	1	24	1	1	7022	# 0.00 Gflop/s, 0.00 GB/s, tuned Mon Sep 23 17:19:24 2013
12x12x12x8	N4quda13fermion_force11OneLinkTermI7double2S2_EE	threads=6912,prec=8,sig=3,coeff=0.125	96	1	1	72	1	1	24577	# 0.00 Gflop/s, 0.00 GB/s, tuned Mon Sep 23 17:19:58 2013
12x12x12x8	N4quda13fermion_force12LongLinkTermI7double2S2_EE	threads=6912,prec=8,sig=0	96	1	1	72	1	1	9831	# 0.00 Gflop/s, 0.00 GB/s, tuned Mon Sep 23 17:19:56 2013
12x12x12x8	N4quda13fermion_force12LongLinkTermI7double2S2_EE	threads=6912,prec=8,sig=1	96	1	1	72	1	1	12289	# 0.00 Gflop/s, 0.00 GB/s, tuned Mon Sep 23 17:19:56 2013
12x12x12x8	N4quda13fermion_force12LongLinkTermI7double2S2_EE	threads=6912,prec=8,sig=2	192	1	1	36	1	1	6145	# 0.00 Gflop/s, 0.00 GB/s, tuned Mon Sep 23 17:19:56 2013
12x12x12x8	N4quda13fermion_force12LongLinkTermI7double2S2_EE	threads=6912,prec=8,sig=3	96	1	1	72	1	1	6145	# 0.00 Gflop/s, 0.00 GB/s, tuned Mon Sep 23 17:19:56 2013
12x12x12x8	N4quda13fermion_force13CompleteForceI7double2S2_EE	threads=6912,prec=8,sig=0	576	1	1	12	1	1	6145	# 0.00 Gflop/s, 0.00 GB/s, tuned Mon Sep 23 17:20:11 2013
12x12x12x8	N4quda13fermion_force13CompleteForceI7double2S2_EE	threads=6912,prec=8,sig=1	288	1	1	24	1	1	6145	# 0.00 Gflop/s, 0.00 GB/s, tuned Mon Sep 23 17:20:11 2013
12x12x12x8	N4quda13fermion_force13CompleteForceI7double2S2_EE	threads=6912,prec=8,sig=2	288	1	1	24	1	1	6145	# 0.00 Gflop/s, 0.00 GB/s, tuned Mon Sep 23 17:20:11 2013
12x12x12x8	N4quda13fermion_force13CompleteForceI7double2S2_EE	threads=6912,prec=8,sig=3	608	1	1	12	1	1	6145	# 0.00 Gflop/s, 0.00 GB/s, tuned Mon Sep 23 17:20:11 2013
12x12x12x8	N4quda19StaggeredDslashCudaI6float2S1_6float4fEE	type=exterior_t,comm=0001,reconstruct=18	512	1	1	14	1	1	12289	# 307.88 Gflop/s, 0.00 GB/s, tuned Mon Sep 23 17:19:11 2013
12x12x12x8	N4quda19StaggeredDslashCudaI6float2S1_6float4fEE	type=exterior_t,comm=0001,reconstruct=18,Axpy	224	1	1	31	1	1	16385	# 303.92 Gflop/s, 0.00 GB/s, tuned Mon Sep 23 17:19:11 2013
12x12x12x8	N4quda19StaggeredDslashCudaI6float2S1_6float4fEE	type=interior,comm=0001,ghost=0001,reconstruct=18	608	1	1	12	1	1	14592	# 98.11 Gflop/s, 0.00 GB/s, tuned Mon Sep 23 17:19:10 2013
12x12x12x8	N4quda19StaggeredDslashCudaI6float2S1_6float4fEE	type=interior,comm=0001,ghost=0001,reconstruct=18,Axpy	640	1	1	11	1	1	15360	# 95.98 Gflop/s, 0.00 GB/s, tuned Mon Sep 23 17:19:11 2013
12x12x12x8	N4quda19StaggeredDslashCudaI7double2S1_S1_dEE	type=exterior_t,comm=0001,reconstruct=18	256	1	1	27	1	1	16385	# 257.85 Gflop/s, 0.00 GB/s, tuned Mon Sep 23 17:19:15 2013
12x12x12x8	N4quda19StaggeredDslashCudaI7double2S1_S1_dEE	type=exterior_t,comm=0001,reconstruct=18,Axpy	288	1	1	24	1	1	16385	# 242.61 Gflop/s, 0.00 GB/s, tuned Mon Sep 23 17:19:15 2013
12x12x12x8	N4quda19StaggeredDslashCudaI7double2S1_S1_dEE	type=interior,comm=0001,ghost=0001,reconstruct=18	32	1	1	216	1	1	1536	# 55.61 Gflop/s, 0.00 GB/s, tuned Mon Sep 23 17:19:14 2013
12x12x12x8	N4quda19StaggeredDslashCudaI7double2S1_S1_dEE	type=interior,comm=0001,ghost=0001,reconstruct=18,Axpy	544	1	1	13	1	1	26112	# 53.62 Gflop/s, 0.00 GB/s, tuned Mon Sep 23 17:19:15 2013
12x24x24x12	N4quda11axpyCGNorm2I7double26float2S2_EE	stride=89856,prec=4	128	1	1	89	1	1	2048	# 39.05 Gflop/s, 78.09 GB/s, tuned Mon Sep 23 17:08:44 2013
12x24x24x12	N4quda22HeavyQuarkResidualNormI7double37double2S2_EE	stride=89856,prec=8	96	1	1	75	1	1	2304	# 20.65 Gflop/s, 82.59 GB/s, tuned Mon Sep 23 17:08:57 2013
12x24x24x12	N4quda3DotId6float2S1_EE	stride=89856,prec=4	96	1	1	157	1	1	768	# 17.89 Gflop/s, 71.54 GB/s, tuned Mon Sep 23 17:08:43 2013
12x24x24x12	N4quda3xpyI7double2S1_EE	stride=89856,prec=8	288	1	1	64	1	1	0	# 5.38 Gflop/s, 129.23 GB/s, tuned Mon Sep 23 17:08:50 2013
12x24x24x12	N4quda4axpyI6float2S1_EE	stride=89856,prec=4	1024	1	1	245	1	1	0	# 18.10 Gflop/s, 108.58 GB/s, tuned Mon Sep 23 17:08:48 2013
12x24x24x12	N4quda4axpyI7double2S1_EE	stride=89856,prec=8	800	1	1	184	1	1	0	# 10.73 Gflop/s, 128.77 GB/s, tuned Mon Sep 23 17:08:59 2013
12x24x24x12	N4quda4xpayI6float2S1_EE	stride=89856,prec=4	128	1	1	183	1	1	0	# 18.16 Gflop/s, 108.93 GB/s, tuned Mon Sep 23 17:08:54 2013
12x24x24x12	N4quda5Norm2Id7double2S1_EE	stride=89856,prec=8	96	1	1	200	1	1	768	# 18.01 Gflop/s, 72.04 GB/s, tuned Mon Sep 23 17:08:40 2013
12x24x24x12	N4quda5axpbyI6float2S1_EE	stride=89856,prec=4	992	1	1	250	1	1	0	# 27.25 Gflop/s, 108.99 GB/s, tuned Mon Sep 23 17:08:55 2013
12x24x24x12	N4quda8axpyZpbxI6float2S1_EE	stride=89856,prec=4	928	1	1	225	1	1	0	# 49.16 Gflop/s, 122.89 GB/s, tuned Mon Sep 23 17:08:46 2013
12x24x24x12	N4quda8xmyNorm2Id7double2S1_EE	stride=89856,prec=8	288	1	1	68	1	1	2304	# 13.92 Gflop/s, 111.33 GB/s, tuned Mon Sep 23 17:08:53 2013
12x24x24x12	N4quda9axpyBzpcxI6float2S1_EE	stride=89856,prec=4	992	1	1	181	1	1	0	# 61.27 Gflop/s, 122.53 GB/s, tuned Mon Sep 23 17:08:47 2013
12x24x24x12	copyKernel	stride=89856,out_prec=4,in_prec=8	640	1	1	184	1	1	0	# 0.00 Gflop/s, 111.55 GB/s, tuned Mon Sep 23 17:08:41 2013
12x24x24x12	copyKernel	stride=89856,out_prec=8,in_prec=4	608	1	1	177	1	1	0	# 0.00 Gflop/s, 114.28 GB/s, tuned Mon Sep 23 17:08:49 2013
12x24x24x8	N4quda11axpyCGNorm2I7double26float2S2_EE	stride=62208,prec=4	128	1	1	90	1	1	2048	# 33.34 Gflop/s, 66.68 GB/s, tuned Mon Sep 23 17:27:11 2013
12x24x24x8	N4quda22HeavyQuarkResidualNormI7double37double2S2_EE	stride=62208,prec=8	96	1	1	75	1	1	2304	# 17.60 Gflop/s, 70.41 GB/s, tuned Mon Sep 23 17:27:33 2013
12x24x24x8	N4quda3DotId6float2S1_EE	stride=62208,prec=4	96	1	1	171	1	1	768	# 15.99 Gflop/s, 63.96 GB/s, tuned Mon Sep 23 17:27:07 2013
12x24x24x8	N4quda3xpyI7double2S1_EE	stride=62208,prec=8	928	1	1	195	1	1	0	# 5.68 Gflop/s, 136.42 GB/s, tuned Mon Sep 23 17:27:20 2013
12x24x24x8	N4quda4axpyI6float2S1_EE	stride=62208,prec=4	128	1	1	202	1	1	0	# 20.08 Gflop/s, 120.45 GB/s, tuned Mon Sep 23 17:27:17 2013
12x24x24x8	N4quda4axpyI7double2S1_EE	stride=62208,prec=8	896	1	1	211	1	1	0	# 10.09 Gflop/s, 121.13 GB/s, tuned Mon Sep 23 17:27:36 2013
12x24x24x8	N4quda4xpayI6float2S1_EE	stride=62208,prec=4	640	1	1	206	1	1	0	# 19.75 Gflop/s, 118.52 GB/s, tuned Mon Sep 23 17:27:27 2013
12x24x24x8	N4quda5Norm2Id7double2S1_EE	stride=62208,prec=8	160	1	1	84	1	1	1280	# 15.88 Gflop/s, 63.52 GB/s, tuned Mon Sep 23 17:27:03 2013
12x24x24x8	N4quda5axpbyI6float2S1_EE	stride=62208,prec=4	384	1	1	195	1	1	0	# 29.36 Gflop/s, 117.42 GB/s, tuned Mon Sep 23 17:27:28 2013
12x24x24x8	N4quda8axpyZpbxI6float2S1_EE	stride=62208,prec=4	896	1	1	188	1	1	0	# 52.36 Gflop/s, 130.91 GB/s, tuned Mon Sep 23 17:27:13 2013
12x24x24x8	N4quda8xmyNorm2Id7double2S1_EE	stride=62208,prec=8	96	1	1	106	1	1	768	# 13.32 Gflop/s, 106.56 GB/s, tuned Mon Sep 23 17:27:25 2013
12x24x24x8	N4quda9axpyBzpcxI6float2S1_EE	stride=62208,prec=4	160	1	1	153	1	1	0	# 65.23 Gflop/s, 130.47 GB/s, tuned Mon Sep 23 17:27:15 2013
12x24x24x8	copyKernel	stride=62208,out_prec=4,in_prec=8	512	1	1	248	1	1	0	# 0.00 Gflop/s, 121.62 GB/s, tuned Mon Sep 23 17:27:05 2013
12x24x24x8	copyKernel	stride=62208,out_prec=8,in_prec=4	544	1	1	216	1	1	0	# 0.00 Gflop/s, 131.52 GB/s, tuned Mon Sep 23 17:27:18 2013
16x16x16x10	N4quda13fermion_force10MiddleLinkI7double2S2_EE	threads=20480,prec=8,recon=12,sig=0,mu=1	160	1	1	128	1	1	8193	# 0.00 Gflop/s, 0.00 GB/s, tuned Mon Sep 23 17:41:11 2013
16x16x16x10	N4quda13fermion_force10MiddleLinkI7double2S2_EE	threads=20480,prec=8,recon=12,sig=0,mu=2	160	1	1	128	1	1	9831	# 0.00 Gflop/s, 0.00 GB/s, tuned Mon Sep 23 17:41:10 2013
16x16x16x10	N4quda13fermion_force10MiddleLinkI7double2S2_EE	threads=20480,prec=8,recon=12,sig=0,mu=3	160	1	1	128	1	1	8193	# 0.00 Gflop/s, 0.00 GB/s, tuned Mon Sep 23 17:41:10 2013
16x16x16x10	N4quda13fermion_force10MiddleLinkI7double2S2_EE	threads=20480,prec=8,recon=12,sig=0,mu=4	320	1	1	64	1	1	12289	# 0.00 Gflop/s, 0.00 GB/s, tuned Mon Sep 23 17:41:11 2013
16x16x16x10	N4quda13fermion_force10MiddleLinkI7double2S2_EE	threads=20480,prec=8,recon=12,sig=0,mu=5	288	1	1	72	1	1	16385	# 0.00 Gflop/s, 0.00 GB/s, tuned Mon Sep 23 17:41:11 2013
16x16x16x10	N4quda13fermion_force10MiddleLinkI7double2S2_EE	threads=20480,prec=8,recon=12,sig=0,mu=6	320	1	1	64	1	1	0	# 0.00 Gflop/s, 0.00 GB/s, tuned Mon Sep 23 17:41:12 2013
16x16x16x10	N4quda13fermion_force10MiddleLinkI7double2S2_EE	threads=20480,prec=8,recon=12,sig=1,mu=0	320	1	1	64	1	1	0	# 0.00 Gflop/s, 0.00 GB/s, tuned Mon Sep 23 17:41:15 2013
16x16x16x10	N4quda13fermion_force10MiddleLinkI7double2S2_EE	threads=20480,prec=8,recon=12,sig=1,mu=2	320	1	1	64	1	1	9831	# 0.00 Gflop/s, 0.00 GB/s, tuned Mon Sep 23 17:41:13 2013
16x16x16x10	N4quda13fermion_force10MiddleLinkI7double2S2_EE	threads=20480,prec=8,recon=12,sig=1,mu=3	160	1	1	128	1	1	16385	# 0.00 Gflop/s, 0.00 GB/s, tuned Mon Sep 23 17:41:13 2013
16x16x16x10	N4quda13fermion_force10MiddleLinkI7double2S2_EE	threads=20480,prec=8,recon=12,sig=1,mu=4	320	1	1	64	1	1	0	# 0.00 Gflop/s, 0.00 GB/s, tuned Mon Sep 23 17:41:14 2013
16x16x16x10	N4quda13fermion_force10MiddleLinkI7double2S2_EE	threads=20480,prec=8,recon=12,sig=1,mu=5	320	1	1	64	1	1	12289	# 0.00 Gflop/s, 0.00 GB/s, tuned Mon Sep 23 17:41:14 2013
16x16x16x10	N4quda13fermion_force10MiddleLinkI7double2S2_EE	threads=20480,prec=8,recon=12,sig=1,mu=7	160	1	1	128	1	1	16385	# 0.00 Gflop/s, 0.00 GB/s, tuned Mon Sep 23 17:41:15 2013
16x16x16x10	N4quda13fermion_force10MiddleLinkI7double2S2_EE	threads=20480,prec=8,recon=12,sig=2,mu=0	320	1	1	64	1	1	24577	# 0.00 Gflop/s, 0.00 GB/s, tuned Mon Sep 23 17:41:18 2013
16x16x16x10	N4quda13fermion_force10MiddleLinkI7double2S2_EE	threads=20480,prec=8,recon=12,sig=2,mu=1	320	1	1	64	1	1	8193	# 0.00 Gflop/s, 0.00 GB/s, tuned Mon Sep 23 17:41:16 2013
16x16x16x10	N4quda13fermion_force10MiddleLinkI7double2S2_EE	threads=20480,prec=8,recon=12,sig=2,mu=3	160	1	1	128	1	1	16385	# 0.00 Gflop/s, 0.00 GB/s, tuned Mon Sep 23 17:41:17 2013
16x16x16x10	N4quda13fermion_force10MiddleLinkI7double2S2_EE	threads=20480,prec=8,recon=12,sig=2,mu=4	320	1	1	64	1	1	16385	# 0.00 Gflop/s, 0.00 GB/s, tuned Mon Sep 23 17:41:17 2013
16x16x16x10	N4quda13fermion_force10MiddleLinkI7double2S2_EE	threads=20480,prec=8,recon=12,sig=2,mu=6	288	1	1	72	1	1	7022	# 0.00 Gflop/s, 0.00 GB/s, tuned Mon Sep 23 17:41:17 2013
16x16x16x10	N4quda13fermion_force10MiddleLinkI7double2S2_EE	threads=20480,prec=8,recon=12,sig=2,mu=7	320	1	1	64	1	1	12289	# 0.00 Gflop/s, 0.00 GB/s, tuned Mon Sep 23 17:41:18 2013
16x16x16x10	N4quda13fermion_force10MiddleLinkI7double2S2_EE	threads=20480,prec=8,recon=12,sig=3,mu=0	320	1	1	64	1	1	16385	# 0.00 Gflop/s, 0.00 GB/s, tuned Mon Sep 23 17:41:21 2013
16x16x16x10	N4quda13fermion_force10MiddleLinkI7double2S2_EE	threads=20480,prec=8,recon=12,sig=3,mu=1	320	1	1	64	1	1	6145	# 0.00 Gflop/s, 0.00 GB/s, tuned Mon Sep 23 17:41:20 2013
16x16x16x10	N4quda13fermion_force10MiddleLinkI7double2S2_EE	threads=20480,prec=8,recon=12,sig=3,mu=2	160	1	1	128	1	1	8193	# 0.00 Gflop/s, 0.00 GB/s, tuned Mon Sep 23 17:41:20 2013
16x16x16x10	N4quda13fermion_force10MiddleLinkI7double2S2_EE	threads=20480,prec=8,recon=12,sig=3,mu=5	160	1	1	128	1	1	7022	# 0.00 Gflop/s, 0.00 GB/s, tuned Mon Sep 23 17:41:21 2013
16x16x16x10	N4quda13fermion_force10MiddleLinkI7double2S2_EE	threads=20480,prec=8,recon=12,sig=3,mu=6	320	1	1	64	1	1	24577	# 0.00 Gflop/s, 0.00 GB/s, tuned Mon Sep 23 17:41:21 2013
16x16x16x10	N4quda13fermion_force10MiddleLinkI7double2S2_EE	threads=20480,prec=8,recon=12,sig=3,mu=7	160	1	1	128	1	1	24577	# 0.00 Gflop/s, 0.00 GB/s, tuned Mon Sep 23 17:41:22 2013
16x16x16x10	N4quda13fermion_force10MiddleLinkI7double2S2_EE	threads=20480,prec=8,recon=12,sig=4,mu=0	320	1	1	64	1	1	16385	# 0.00 Gflop/s, 0.00 GB/s, tuned Mon Sep 23 17:41:24 2013
16x16x16x10	N4quda13fermion_force10MiddleLinkI7double2S2_EE	threads=20480,prec=8,recon=12,sig=4,mu=1	320	1	1	64	1	1	0	# 0.00 Gflop/s, 0.00 GB/s, tuned Mon Sep 23 17:41:23 2013
16x16x16x10	N4quda13fermion_force10MiddleLinkI7double2S2_EE	threads=20480,prec=8,recon=12,sig=4,mu=2	320	1	1	64	1	1	8193	# 0.00 Gflop/s, 0.00 GB/s, tuned Mon Sep 23 17:41:23 2013
16x16x16x10	N4quda13fermion_force10MiddleLinkI7double2S2_EE	threads=20480,prec=8,recon=12,sig=4,mu=5	320	1	1	64	1	1	0	# 0.00 Gflop/s, 0.00 GB/s, tuned Mon Sep 23 17:41:24 2013
16x16x16x10	N4quda13fermion_force10MiddleLinkI7double2S2_EE	threads=20480,prec=8,recon=12,sig=4,mu=6	160	1	1	128	1	1	8193	# 0.00 Gflop/s, 0.00 GB/s, tuned Mon Sep 23 17:41:24 2013
16x16x16x10	N4quda13fermion_force10MiddleLinkI7double2S2_EE	threads=20480,prec=8,recon=12,sig=4,mu=7	320	1	1	64	1	1	7022	# 0.00 Gflop/s, 0.00 GB/s, tuned Mon Sep 23 17:41:25 2013
16x16x16x10	N4quda13fermion_force10MiddleLinkI7double2S2_EE	threads=20480,prec=8,recon=12,sig=5,mu=0	160	1	1	128	1	1	12289	# 0.00 Gflop/s, 0.00 GB/s, tuned Mon Sep 23 17:41:28 2013
16x16x16x10	N4quda13fermion_force10MiddleLinkI7double2S2_EE	threads=20480,prec=8,recon=12,sig=5,mu=1	320	1	1	64	1	1	16385	# 0.00 Gflop/s, 0.00 GB/s, tuned Mon Sep 23 17:41:26 2013
16x16x16x10	N4quda13fermion_force10MiddleLinkI7double2S2_EE	threads=20480,prec=8,recon=12,sig=5,mu=3	320	1	1	64	1	1	6145	# 0.00 Gflop/s, 0.00 GB/s, tuned Mon Sep 23 17:41:27 2013
16x16x16x10	N4quda13fermion_force10MiddleLinkI7double2S2_EE	threads=20480,prec=8,recon=12,sig=5,mu=4	320	1	1	64	1	1	7022	# 0.00 Gflop/s, 0.00 GB/s, tuned Mon Sep 23 17:41:27 2013
16x16x16x10	N4quda13fermion_force10MiddleLinkI7double2S2_EE	threads=20480,prec=8,recon=12,sig=5,mu=6	320	1	1	64	1	1	7022	# 0.00 Gflop/s, 0.00 GB/s, tuned Mon Sep 23 17:41:27 2013
16x16x16x10	N4quda13fermion_force10MiddleLinkI7double2S2_EE	threads=20480,prec=8,recon=12,sig=5,mu=7	288	1	1	72	1	1	9831	# 0.00 Gflop/s, 0.00 GB/s, tuned Mon Sep 23 17:41:28 2013
16x16x16x10	N4quda13fermion_force10MiddleLinkI7double2S2_EE	threads=20480,prec=8,recon=12,sig=6,mu=0	320	1	1	64	1	1	16385	# 0.00 Gflop/s, 0.00 GB/s, tuned Mon Sep 23 17:41:31 2013
16x16x16x10	N4quda13fermion_force10MiddleLinkI7double2S2_EE	threads=20480,prec=8,recon=12,sig=6,mu=2	320	1	1	64	1	1	9831	# 0.00 Gflop/s, 0.00 GB/s, tuned Mon Sep 23 17:41:29 2013
16x16x16x10	N4quda13fermion_force10MiddleLinkI7double2S2_EE	threads=20480,prec=8,recon=12,sig=6,mu=3	320	1	1	64	1	1	0	# 0.00 Gflop/s, 0.00 GB/s, tuned Mon Sep 23 17:41:30 2013
16x16x16x10	N4quda13fermion_force10MiddleLinkI7double2S2_EE	threads=20480,prec=8,recon=12,sig=6,mu=4	160	1	1	128	1	1	16385	# 0.00 Gflop/s, 0.00 GB/s, tuned Mon Sep 23 17:41:30 2013
16x16x16x10	N4quda13fermion_force10MiddleLinkI7double2S2_EE	threads=20480,prec=8,recon=12,sig=6,mu=5	320	1	1	64	1	1	16385	# 0.00 Gflop/s, 0.00 GB/s, tuned Mon Sep 23 17:41:30 2013
16x16x16x10	N4quda13fermion_force10MiddleLinkI7double2S2_EE	threads=20480,prec=8,recon=12,sig=6,mu=7	160	1	1	128	1	1	9831	# 0.00 Gflop/s, 0.00 GB/s, tuned Mon Sep 23 17:41:31 2013
16x16x16x10	N4quda13fermion_force10MiddleLinkI7double2S2_EE	threads=20480,prec=8,recon=12,sig=7,mu=1	256	1	1	80	1	1	16385	# 0.00 Gflop/s, 0.00 GB/s, tuned Mon Sep 23 17:41:34 2013
16x16x16x10	N4quda13fermion_force10MiddleLinkI7double2S2_EE	threads=20480,prec=8,recon=12,sig=7,mu=2	256	1	1	80	1	1	16385	# 0.00 Gflop/s, 0.00 GB/s, tuned Mon Sep 23 17:41:32 2013
16x16x16x10	N4quda13fermion_force10MiddleLinkI7double2S2_EE	threads=20480,prec=8,recon=12,sig=7,mu=3	320	1	1	64	1	1	12289	# 0.00 Gflop/s, 0.00 GB/s, tuned Mon Sep 23 17:41:33 2013
16x16x16x10	N4quda13fermion_force10MiddleLinkI7double2S2_EE	threads=20480,prec=8,recon=12,sig=7,mu=4	320	1	1	64	1	1	16385	# 0.00 Gflop/s, 0.00 GB/s, tuned Mon Sep 23 17:41:33 2013
16x16x16x10	N4quda13fermion_force10MiddleLinkI7double2S2_EE	threads=20480,prec=8,recon=12,sig=7,mu=5	288	1	1	72	1	1	6145	# 0.00 Gflop/s, 0.00 GB/s, tuned Mon Sep 23 17:41:34 2013
16x16x16x10	N4quda13fermion_force10MiddleLinkI7double2S2_EE	threads=20480,prec=8,recon=12,sig=7,mu=6	320	1	1	64	1	1	12289	# 0.00 Gflop/s, 0.00 GB/s, tuned Mon Sep 23 17:41:34 2013
16x16x16x10	N4quda13fermion_force10MiddleLinkI7double2S2_EE	threads=20480,prec=8,recon=18,sig=0,mu=1	320	1	1	64	1	1	7022	# 0.00 Gflop/s, 0.00 GB/s, tuned Mon Sep 23 17:40:15 2013
16x16x16x10	N4quda13fermion_force10MiddleLinkI7double2S2_EE	threads=20480,prec=8,recon=18,sig=0,mu=2	288	1	1	72	1	1	16385	# 0.00 Gflop/s, 0.00 GB/s, tuned Mon Sep 23 17:40:13 2013
16x16x16x10	N4quda13fermion_force10MiddleLinkI7double2S2_EE	threads=20480,prec=8,recon=18,sig=0,mu=3	320	1	1	64	1	1	9831	# 0.00 Gflop/s, 0.00 GB/s, tuned Mon Sep 23 17:40:14 2013
16x16x16x10	N4quda13fermion_force10MiddleLinkI7double2S2_EE	threads=20480,prec=8,recon=18,sig=0,mu=4	320	1	1	64	1	1	16385	# 0.00 Gflop/s, 0.00 GB/s, tuned Mon Sep 23 17:40:14 2013
16x16x16x10	N4quda13fermion_force10MiddleLinkI7double2S2_EE	threads=20480,prec=8,recon=18,sig=0,mu=5	320	1	1	64	1	1	0	# 0.00 Gflop/s, 0.00 GB/s, tuned Mon Sep 23 17:40:14 2013
16x16x16x10	N4quda13fermion_force10MiddleLinkI7double2S2_EE	threads=20480,prec=8,recon=18,sig=0,mu=6	320	1	1	64	1	1	0	# 0.00 Gflop/s, 0.00 GB/s, tuned Mon Sep 23 17:40:16 2013
16x16x16x10	N4quda13fermion_force10MiddleLinkI7double2S2_EE	threads=20480,prec=8,recon=18,sig=1,mu=0	288	1	1	72	1	1	6145	# 0.00 Gflop/s, 0.00 GB/s, tuned Mon Sep 23 17:40:20 2013
16x16x16x10	N4quda13fermion_force10MiddleLinkI7double2S2_EE	threads=20480,prec=8,recon=18,sig=1,mu=2	288	1	1	72	1	1	0	# 0.00 Gflop/s, 0.00 GB/s, tuned Mon Sep 23 17:40:18 2013
16x16x16x10	N4quda13fermion_force10MiddleLinkI7double2S2_EE	threads=20480,prec=8,recon=18,sig=1,mu=3	288	1	1	72	1	1	6145	# 0.00 Gflop/s, 0.00 GB/s, tuned Mon Sep 23 17:40:19 2013
16x16x16x10	N4quda13fermion_force10MiddleLinkI7double2S2_EE	threads=20480,prec=8,recon=18,sig=1,mu=4	320	1	1	64	1	1	24577	# 0.00 Gflop/s, 0.00 GB/s, tuned Mon Sep 23 17:40:19 2013
16x16x16x10	N4quda13fermion_force10MiddleLinkI7double2S2_EE	threads=20480,prec=8,recon=18,sig=1,mu=5	288	1	1	72	1	1	7022	# 0.00 Gflop/s, 0.00 GB/s, tuned Mon Sep 23 17:40:19 2013
16x16x16x10	N4quda13fermion_force10MiddleLinkI7double2S2_EE	threads=20480,prec=8,recon=18,sig=1,mu=7	320	1	1	64	1	1	16385	# 0.00 Gflop/s, 0.00 GB/s, tuned Mon Sep 23 17:40:21 2013
16x16x16x10	N4quda13fermion_force10MiddleLinkI7double2S2_EE	threads=20480,prec=8,recon=18,sig=2,mu=0	288	1	1	72	1	1	0	# 0.00 Gflop/s, 0.00 GB/s, tuned Mon Sep 23 17:40:25 2013
16x16x16x10	N4quda13fermion_force10MiddleLinkI7double2S2_EE	threads=20480,prec=8,recon=18,sig=2,mu=1	288	1	1	72	1	1	16385	# 0.00 Gflop/s, 0.00 GB/s, tuned Mon Sep 23 17:40:23 2013
16x16x16x10	N4quda13fermion_force10MiddleLinkI7double2S2_EE	threads=20480,prec=8,recon=18,sig=2,mu=3	288	1	1	72	1	1	24577	# 0.00 Gflop/s, 0.00 GB/s, tuned Mon Sep 23 17:40:24 2013
16x16x16x10	N4quda13fermion_force10MiddleLinkI7double2S2_EE	threads=20480,prec=8,recon=18,sig=2,mu=4	320	1	1	64	1	1	9831	# 0.00 Gflop/s, 0.00 GB/s, tuned Mon Sep 23 17:40:24 2013
16x16x16x10	N4quda13fermion_force10MiddleLinkI7double2S2_EE	threads=20480,prec=8,recon=18,sig=2,mu=6	320	1	1	64	1	1	16385	# 0.00 Gflop/s, 0.00 GB/s, tuned Mon Sep 23 17:40:24 2013
16x16x16x10	N4quda13fermion_force10MiddleLinkI7double2S2_EE	threads=20480,prec=8,recon=18,sig=2,mu=7	320	1	1	64	1	1	24577	# 0.00 Gflop/s, 0.00 GB/s, tuned Mon Sep 23 17:40:25 2013
16x16x16x10	N4quda13fermion_force10MiddleLinkI7double2S2_EE	threads=20480,prec=8,recon=18,sig=3,mu=0	320	1	1	64	1	1	0	# 0.00 Gflop/s, 0.00 GB/s, tuned Mon Sep 23 17:40:30 2013
16x16x16x10	N4quda13fermion_force10MiddleLinkI7double2S2_EE	threads=20480,prec=8,recon=18,sig=3,mu=1	320	1	1	64	1	1	7022	# 0.00 Gflop/s, 0.00 GB/s, tuned Mon Sep 23 17:40:28 2013
16x16x16x10	N4quda13fermion_force10MiddleLinkI7double2S2_EE	threads=20480,prec=8,recon=18,sig=3,mu=2	320	1	1	64	1	1	12289	# 0.00 Gflop/s, 0.00 GB/s, tuned Mon Sep 23 17:40:29 2013
16x16x16x10	N4quda13fermion_force10MiddleLinkI7double2S2_EE	threads=20480,prec=8,recon=18,sig=3,mu=5	320	1	1	64	1	1	8193	# 0.00 Gflop/s, 0.00 GB/s, tuned Mon Sep 23 17:40:29 2013
16x16x16x10	N4quda13fermion_force10MiddleLinkI7double2S2_EE	threads=20480,prec=8,recon=18,sig=3,mu=6	160	1	1	128	1	1	8193	# 0.00 Gflop/s, 0.00 GB/s, tuned Mon Sep 23 17:40:29 2013
16x16x16x10	N4quda13fermion_force10MiddleLinkI7double2S2_EE	threads=20480,prec=8,recon=18,sig=3,mu=7	256	1	1	80	1	1	9831	# 0.00 Gflop/s, 0.00 GB/s, tuned Mon Sep 23 17:40:30 2013
16x16x16x10	N4quda13fermion_force10MiddleLinkI7double2S2_EE	threads=20480,prec=8,recon=18,sig=4,mu=0	320	1	1	64	1	1	24577	# 0.00 Gflop/s, 0.00 GB/s, tuned Mon Sep 23 17:40:35 2013
16x16x16x10	N4quda13fermion_force10MiddleLinkI7double2S2_EE	threads=20480,prec=8,recon=18,sig=4,mu=1	320	1	1	64	1	1	12289	# 0.00 Gflop/s, 0.00 GB/s, tuned Mon Sep 23 17:40:33 2013
16x16x16x10	N4quda13fermion_force10MiddleLinkI7double2S2_EE	threads=20480,prec=8,recon=18,sig=4,mu=2	320	1	1	64	1	1	7022	# 0.00 Gflop/s, 0.00 GB/s, tuned Mon Sep 23 17:40:33 2013
16x16x16x10	N4quda13fermion_force10MiddleLinkI7double2S2_EE	threads=20480,prec=8,recon=18,sig=4,mu=5	320	1	1	64	1	1	24577	# 0.00 Gflop/s, 0.00 GB/s, tuned Mon Sep 23 17:40:34 2013
16x16x16x10	N4quda13fermion_force10MiddleLinkI7double2S2_EE	threads=20480,prec=8,recon=18,sig=4,mu=6	320	1	1	64	1	1	7022	# 0.00 Gflop/s, 0.00 GB/s, tuned Mon Sep 23 17:40:34 2013
16x16x16x10	N4quda13fermion_force10MiddleLinkI7double2S2_EE	threads=20480,prec=8,recon=18,sig=4,mu=7	320	1	1	64	1	1	9831	# 0.00 Gflop/s, 0.00 GB/s, tuned Mon Sep 23 17:40:35 2013
16x16x16x10	N4quda13fermion_force10MiddleLinkI7double2S2_EE	threads=20480,prec=8,recon=18,sig=5,mu=0	320	1	1	64	1	1	12289	# 0.00 Gflop/s, 0.00 GB/s, tuned Mon Sep 23 17:40:40 2013
16x16x16x10	N4quda13fermion_force10MiddleLinkI7double2S2_EE	threads=20480,prec=8,recon=18,sig=5,mu=1	320	1	1	64	1	1	9831	# 0.00 Gflop/s, 0.00 GB/s, tuned Mon Sep 23 17:40:38 2013
16x16x16x10	N4quda13fermion_force10MiddleLinkI7double2S2_EE	threads=20480,prec=8,recon=18,sig=5,mu=3	320	1	1	64	1	1	24577	# 0.00 Gflop/s, 0.00 GB/s, tuned Mon Sep 23 17:40:38 2013
16x16x16x10	N4quda13fermion_force10MiddleLinkI7double2S2_EE	threads=20480,prec=8,recon=18,sig=5,mu=4	320	1	1	64	1	1	9831	# 0.00 Gflop/s, 0.00 GB/s, tuned Mon Sep 23 17:40:39 2013
16x16x16x10	N4quda13fermion_force10MiddleLinkI7double2S2_EE	threads=20480,prec=8,recon=18,sig=5,mu=6	320	1	1	64	1	1	6145	# 0.00 Gflop/s, 0.00 GB/s, tuned Mon Sep 23 17:40:39 2013
16x16x16x10	N4quda13fermion_force10MiddleLinkI7double2S2_EE	threads=20480,prec=8,recon=18,sig=5,mu=7	288	1	1	72	1	1	24577	# 0.00 Gflop/s, 0.00 GB/s, tuned Mon Sep 23 17:40:40 2013
16x16x16x10	N4quda13fermion_force10MiddleLinkI7double2S2_EE	threads=20480,prec=8,recon=18,sig=6,mu=0	320	1	1	64	1	1	6145	# 0.00 Gflop/s, 0.00 GB/s, tuned Mon Sep 23 17:40:44 2013
16x16x16x10	N4quda13fermion_force10MiddleLinkI7double2S2_EE	threads=20480,prec=8,recon=18,sig=6,mu=2	288	1	1	72	1	1	0	# 0.00 Gflop/s, 0.00 GB/s, tuned Mon Sep 23 17:40:43 2013
16x16x16x10	N4quda13fermion_force10MiddleLinkI7double2S2_EE	threads=20480,prec=8,recon=18,sig=6,mu=3	320	1	1	64	1	1	8193	# 0.00 Gflop/s, 0.00 GB/s, tuned Mon Sep 23 17:40:43 2013
16x16x16x10	N4quda13fermion_force10MiddleLinkI7double2S2_EE	threads=20480,prec=8,recon=18,sig=6,mu=4	320	1	1	64	1	1	12289	# 0.00 Gflop/s, 0.00 GB/s, tuned Mon Sep 23 17:40:43 2013
16x16x16x10	N4quda13fermion_force10MiddleLinkI7double2S2_EE	threads=20480,prec=8,recon=18,sig=6,mu=5	320	1	1	64	1	1	0	# 0.00 Gflop/s, 0.00 GB/s, tuned Mon Sep 23 17:40:44 2013
16x16x16x10	N4quda13fermion_force10MiddleLinkI7double2S2_EE	threads=20480,prec=8,recon=18,sig=6,mu=7	288	1	1	72	1	1	16385	# 0.00 Gflop/s, 0.00 GB/s, tuned Mon Sep 23 17:40:45 2013
16x16x16x10	N4quda13fermion_force10MiddleLinkI7double2S2_EE	threads=20480,prec=8,recon=18,sig=7,mu=1	288	1	1	72	1	1	9831	# 0.00 Gflop/s, 0.00 GB/s, tuned Mon Sep 23 17:40:49 2013
16x16x16x10	N4quda13fermion_force10MiddleLinkI7double2S2_EE	threads=20480,prec=8,recon=18,sig=7,mu=2	288	1	1	72	1	1	9831	# 0.00 Gflop/s, 0.00 GB/s, tuned Mon Sep 23 17:40:47 2013
16x16x16x10	N4quda13fermion_force10MiddleLinkI7double2S2_EE	threads=20480,prec=8,recon=18,sig=7,mu=3	320	1	1	64	1	1	16385	# 0.00 Gflop/s, 0.00 GB/s, tuned Mon Sep 23 17:40:48 2013
16x16x16x10	N4quda13fermion_force10MiddleLinkI7double2S2_EE	threads=20480,prec=8,recon=18,sig=7,mu=4	320	1	1	64	1	1	9831	# 0.00 Gflop/s, 0.00 GB/s, tuned Mon Sep 23 17:40:48 2013
16x16x16x10	N4quda13fermion_force10MiddleLinkI7double2S2_EE	threads=20480,prec=8,recon=18,sig=7,mu=5	320	1	1	64	1	1	24577	# 0.00 Gflop/s, 0.00 GB/s, tuned Mon Sep 23 17:40:49 2013
16x16x16x10	N4quda13fermion_force10MiddleLinkI7double2S2_EE	threads=20480,prec=8,recon=18,sig=7,mu=6	288	1	1	72	1	1	6145	# 0.00 Gflop/s, 0.00 GB/s, tuned Mon Sep 23 17:40:50 2013
16x16x16x10	N4quda13fermion_force13SideLinkShortI7double2S2_EE	threads=20480,prec=8,recon=12,sig=0,mu=1	32	1	1	640	1	1	7022	# 0.00 Gflop/s, 0.00 GB/s, tuned Mon Sep 23 17:41:11 2013
16x16x16x10	N4quda13fermion_force13SideLinkShortI7double2S2_EE	threads=20480,prec=8,recon=12,sig=0,mu=2	32	1	1	640	1	1	16385	# 0.00 Gflop/s, 0.00 GB/s, tuned Mon Sep 23 17:41:12 2013
16x16x16x10	N4quda13fermion_force13SideLinkShortI7double2S2_EE	threads=20480,prec=8,recon=12,sig=0,mu=3	32	1	1	640	1	1	16385	# 0.00 Gflop/s, 0.00 GB/s, tuned Mon Sep 23 17:41:12 2013
16x16x16x10	N4quda13fermion_force13SideLinkShortI7double2S2_EE	threads=20480,prec=8,recon=12,sig=0,mu=4	544	1	1	38	1	1	12289	# 0.00 Gflop/s, 0.00 GB/s, tuned Mon Sep 23 17:41:12 2013
16x16x16x10	N4quda13fermion_force13SideLinkShortI7double2S2_EE	threads=20480,prec=8,recon=12,sig=0,mu=5	544	1	1	38	1	1	8193	# 0.00 Gflop/s, 0.00 GB/s, tuned Mon Sep 23 17:41:13 2013
16x16x16x10	N4quda13fermion_force13SideLinkShortI7double2S2_EE	threads=20480,prec=8,recon=12,sig=0,mu=6	544	1	1	38	1	1	24577	# 0.00 Gflop/s, 0.00 GB/s, tuned Mon Sep 23 17:41:13 2013
16x16x16x10	N4quda13fermion_force13SideLinkShortI7double2S2_EE	threads=20480,prec=8,recon=12,sig=1,mu=0	544	1	1	38	1	1	9831	# 0.00 Gflop/s, 0.00 GB/s, tuned Mon Sep 23 17:41:14 2013
16x16x16x10	N4quda13fermion_force13SideLinkShortI7double2S2_EE	threads=20480,prec=8,recon=12,sig=1,mu=2	32	1	1	640	1	1	12289	# 0.00 Gflop/s, 0.00 GB/s, tuned Mon Sep 23 17:41:15 2013
16x16x16x10	N4quda13fermion_force13SideLinkShortI7double2S2_EE	threads=20480,prec=8,recon=12,sig=1,mu=3	544	1	1	38	1	1	12289	# 0.00 Gflop/s, 0.00 GB/s, tuned Mon Sep 23 17:41:15 2013
16x16x16x10	N4quda13fermion_force13SideLinkShortI7double2S2_EE	threads=20480,prec=8,recon=12,sig=1,mu=4	544	1	1	38	1	1	24577	# 0.00 Gflop/s, 0.00 GB/s, tuned Mon Sep 23 17:41:16 2013
16x16x16x10	N4quda13fermion_force13SideLinkShortI7double2S2_EE	threads=20480,prec=8,recon=12,sig=1,mu=5	32	1	1	640	1	1	12289	# 0.00 Gflop/s, 0.00 GB/s, tuned Mon Sep 23 17:41:16 2013
16x16x16x10	N4quda13fermion_force13SideLinkShortI7double2S2_EE	threads=20480,prec=8,recon=12,sig=1,mu=7	544	1	1	38	1	1	8193	# 0.00 Gflop/s, 0.00 GB/s, tuned Mon Sep 23 17:41:16 2013
16x16x16x10	N4quda13fermion_force13SideLinkShortI7double2S2_EE	threads=20480,prec=8,recon=12,sig=2,mu=0	32	1	1	640	1	1	16385	# 0.00 Gflop/s, 0.00 GB/s, tuned Mon Sep 23 17:41:18 2013
16x16x16x10	N4quda13fermion_force13SideLinkShortI7double2S2_EE	threads=20480,prec=8,recon=12,sig=2,mu=1	544	1	1	38	1	1	24577	# 0.00 Gflop/s, 0.00 GB/s, tuned Mon Sep 23 17:41:19 2013
16x16x16x10	N4quda13fermion_force13SideLinkShortI7double2S2_EE	threads=20480,prec=8,recon=12,sig=2,mu=3	32	1	1	640	1	1	9831	# 0.00 Gflop/s, 0.00 GB/s, tuned Mon Sep 23 17:41:19 2013
16x16x16x10	N4quda13fermion_force13SideLinkShortI7double2S2_EE	threads=20480,prec=8,recon=12,sig=2,mu=4	544	1	1	38	1	1	6145	# 0.00 Gflop/s, 0.00 GB/s, tuned Mon Sep 23 17:41:19 2013
16x16x16x10	N4quda13fermion_force13SideLinkShortI7double2S2_EE	threads=20480,prec=8,recon=12,sig=2,mu=6	32	1	1	640	1	1	16385	# 0.00 Gflop/s, 0.00 GB/s, tuned Mon Sep 23 17:41:19 2013
16x16x16x10	N4quda13fermion_force13SideLinkShortI7double2S2_EE	threads=20480,prec=8,recon=12,sig=2,mu=7	544	1	1	38	1	1	7022	# 0.00 Gflop/s, 0.00 GB/s, tuned Mon Sep 23 17:41:19 2013
16x16x16x10	N4quda13fermion_force13SideLinkShortI7double2S2_EE	threads=20480,prec=8,recon=12,sig=3,mu=0	544	1	1	38	1	1	16385	# 0.00 Gflop/s, 0.00 GB/s, tuned Mon Sep 23 17:41:21 2013
16x16x16x10	N4quda13fermion_force13SideLinkShortI7double2S2_EE	threads=20480,prec=8,recon=12,sig=3,mu=1	544	1	1	38	1	1	24577	# 0.00 Gflop/s, 0.00 GB/s, tuned Mon Sep 23 17:41:22 2013
16x16x16x10	N4quda13fermion_force13SideLinkShortI7double2S2_EE	threads=20480,prec=8,recon=12,sig=3,mu=2	32	1	1	640	1	1	9831	# 0.00 Gflop/s, 0.00 GB/s, tuned Mon Sep 23 17:41:22 2013
16x16x16x10	N4quda13fermion_force13SideLinkShortI7double2S2_EE	threads=20480,prec=8,recon=12,sig=3,mu=5	544	1	1	38	1	1	8193	# 0.00 Gflop/s, 0.00 GB/s, tuned Mon Sep 23 17:41:22 2013
16x16x16x10	N4quda13fermion_force13SideLinkShortI7double2S2_EE	threads=20480,prec=8,recon=12,sig=3,mu=6	32	1	1	640	1	1	9831	# 0.00 Gflop/s, 0.00 GB/s, tuned Mon Sep 23 17:41:23 2013
16x16x16x10	N4quda13fermion_force13SideLinkShortI7double2S2_EE	threads=20480,prec=8,recon=12,sig=3,mu=7	544	1	1	38	1	1	9831	# 0.00 Gflop/s, 0.00 GB/s, tuned Mon Sep 23 17:41:23 2013
16x16x16x10	N4quda13fermion_force13SideLinkShortI7double2S2_EE	threads=20480,prec=8,recon=12,sig=4,mu=0	544	1	1	38	1	1	16385	# 0.00 Gflop/s, 0.00 GB/s, tuned Mon Sep 23 17:41:24 2013
16x16x16x10	N4quda13fermion_force13SideLinkShortI7double2S2_EE	threads=20480,prec=8,recon=12,sig=4,mu=1	32	1	1	640	1	1	12289	# 0.00 Gflop/s, 0.00 GB/s, tuned Mon Sep 23 17:41:25 2013
16x16x16x10	N4quda13fermion_force13SideLinkShortI7double2S2_EE	threads=20480,prec=8,recon=12,sig=4,mu=2	544	1	1	38	1	1	16385	# 0.00 Gflop/s, 0.00 GB/s, tuned Mon Sep 23 17:41:25 2013
16x16x16x10	N4quda13fermion_force13SideLinkShortI7double2S2_EE	threads=20480,prec=8,recon=12,sig=4,mu=5	544	1	1	38	1	1	6145	# 0.00 Gflop/s, 0.00 GB/s, tuned Mon Sep 23 17:41:25 2013
16x16x16x10	N4quda13fermion_force13SideLinkShortI7double2S2_EE	threads=20480,prec=8,recon=12,sig=4,mu=6	544	1	1	38	1	1	16385	# 0.00 Gflop/s, 0.00 GB/s, tuned Mon Sep 23 17:41:26 2013
16x16x16x10	N4quda13fermion_force13SideLinkShortI7double2S2_EE	threads=20480,prec=8,recon=12,sig=4,mu=7	544	1	1	38	1	1	16385	# 0.00 Gflop/s, 0.00 GB/s, tuned Mon Sep 23 17:41:26 2013
16x16x16x10	N4quda13fermion_force13SideLinkShortI7double2S2_EE	threads=20480,prec=8,recon=12,sig=5,mu=0	32	1	1	640	1	1	16385	# 0.00 Gflop/s, 0.00 GB/s, tuned Mon Sep 23 17:41:27 2013
16x16x16x10	N4quda13fermion_force13SideLinkShortI7double2S2_EE	threads=20480,prec=8,recon=12,sig=5,mu=1	544	1	1	38	1	1	8193	# 0.00 Gflop/s, 0.00 GB/s, tuned Mon Sep 23 17:41:28 2013
16x16x16x10	N4quda13fermion_force13SideLinkShortI7double2S2_EE	threads=20480,prec=8,recon=12,sig=5,mu=3	32	1	1	640	1	1	7022	# 0.00 Gflop/s, 0.00 GB/s, tuned Mon Sep 23 17:41:28 2013
16x16x16x10	N4quda13fermion_force13SideLinkShortI7double2S2_EE	threads=20480,prec=8,recon=12,sig=5,mu=4	544	1	1	38	1	1	12289	# 0.00 Gflop/s, 0.00 GB/s, tuned Mon Sep 23 17:41:29 2013
16x16x16x10	N4quda13fermion_force13SideLinkShortI7double2S2_EE	threads=20480,prec=8,recon=12,sig=5,mu=6	544	1	1	38	1	1	24577	# 0.00 Gflop/s, 0.00 GB/s, tuned Mon Sep 23 17:41:29 2013
16x16x16x10	N4quda13fermion_force13SideLinkShortI7double2S2_EE	threads=20480,prec=8,recon=12,sig=5,mu=7	544	1	1	38	1	1	9831	# 0.00 Gflop/s, 0.00 GB/s, tuned Mon Sep 23 17:41:29 2013
16x16x16x10	N4quda13fermion_force13SideLinkShortI7double2S2_EE	threads=20480,prec=8,recon=12,sig=6,mu=0	544	1	1	38	1	1	24577	# 0.00 Gflop/s, 0.00 GB/s, tuned Mon Sep 23 17:41:31 2013
16x16x16x10	N4quda13fermion_force13SideLinkShortI7double2S2_EE	threads=20480,prec=8,recon=12,sig=6,mu=2	544	1	1	38	1	1	9831	# 0.00 Gflop/s, 0.00 GB/s, tuned Mon Sep 23 17:41:31 2013
16x16x16x10	N4quda13fermion_force13SideLinkShortI7double2S2_EE	threads=20480,prec=8,recon=12,sig=6,mu=3	544	1	1	38	1	1	7022	# 0.00 Gflop/s, 0.00 GB/s, tuned Mon Sep 23 17:41:32 2013
16x16x16x10	N4quda13fermion_force13SideLinkShortI7double2S2_EE	threads=20480,prec=8,recon=12,sig=6,mu=4	32	1	1	640	1	1	24577	# 0.00 Gflop/s, 0.00 GB/s, tuned Mon Sep 23 17:41:32 2013
16x16x16x10	N4quda13fermion_force13SideLinkShortI7double2S2_EE	threads=20480,prec=8,recon=12,sig=6,mu=5	544	1	1	38	1	1	6145	# 0.00 Gflop/s, 0.00 GB/s, tuned Mon Sep 23 17:41:32 2013
16x16x16x10	N4quda13fermion_force13SideLinkShortI7double2S2_EE	threads=20480,prec=8,recon=12,sig=6,mu=7	544	1	1	38	1	1	8193	# 0.00 Gflop/s, 0.00 GB/s, tuned Mon Sep 23 17:41:32 2013
16x16x16x10	N4quda13fermion_force13SideLinkShortI7double2S2_EE	threads=20480,prec=8,recon=12,sig=7,mu=1	32	1	1	640	1	1	6145	# 0.00 Gflop/s, 0.00 GB/s, tuned Mon Sep 23 17:41:34 2013
16x16x16x10	N4quda13fermion_force13SideLinkShortI7double2S2_EE	threads=20480,prec=8,recon=12,sig=7,mu=2	544	1	1	38	1	1	6145	# 0.00 Gflop/s, 0.00 GB/s, tuned Mon Sep 23 17:41:35 2013
16x16x16x10	N4quda13fermion_force13SideLinkShortI7double2S2_EE	threads=20480,prec=8,recon=12,sig=7,mu=3	32	1	1	640	1	1	12289	# 0.00 Gflop/s, 0.00 GB/s, tuned Mon Sep 23 17:41:35 2013
16x16x16x10	N4quda13fermion_force13SideLinkShortI7double2S2_EE	threads=20480,prec=8,recon=12,sig=7,mu=4	32	1	1	640	1	1	24577	# 0.00 Gflop/s, 0.00 GB/s, tuned Mon Sep 23 17:41:35 2013
16x16x16x10	N4quda13fermion_force13SideLinkShortI7double2S2_EE	threads=20480,prec=8,recon=12,sig=7,mu=5	544	1	1	38	1	1	12289	# 0.00 Gflop/s, 0.00 GB/s, tuned Mon Sep 23 17:41:35 2013
16x16x16x10	N4quda13fermion_force13SideLinkShortI7double2S2_EE	threads=20480,prec=8,recon=12,sig=7,mu=6	32	1	1	640	1	1	16385	# 0.00 Gflop/s, 0.00 GB/s, tuned Mon Sep 23 17:41:35 2013
16x16x16x10	N4quda13fermion_force13SideLinkShortI7double2S2_EE	threads=20480,prec=8,recon=18,sig=0,mu=1	544	1	1	38	1	1	9831	# 0.00 Gflop/s, 0.00 GB/s, tuned Mon Sep 23 17:40:15 2013
16x16x16x10	N4quda13fermion_force13SideLinkShortI7double2S2_EE	threads=20480,prec=8,recon=18,sig=0,mu=2	544	1	1	38	1	1	8193	# 0.00 Gflop/s, 0.00 GB/s, tuned Mon Sep 23 17:40:16 2013
16x16x16x10	N4quda13fermion_force13SideLinkShortI7double2S2_EE	threads=20480,prec=8,recon=18,sig=0,mu=3	544	1	1	38	1	1	9831	# 0.00 Gflop/s, 0.00 GB/s, tuned Mon Sep 23 17:40:17 2013
16x16x16x10	N4quda13fermion_force13SideLinkShortI7double2S2_EE	threads=20480,prec=8,recon=18,sig=0,mu=4	544	1	1	38	1	1	24577	# 0.00 Gflop/s, 0.00 GB/s, tuned Mon Sep 23 17:40:17 2013
16x16x16x10	N4quda13fermion_force13SideLinkShortI7double2S2_EE	threads=20480,prec=8,recon=18,sig=0,mu=5	544	1	1	38	1	1	16385	# 0.00 Gflop/s, 0.00 GB/s, tuned Mon Sep 23 17:40:18 2013
16x16x16x10	N4quda13fermion_force13SideLinkShortI7double2S2_EE	threads=20480,prec=8,recon=18,sig=0,mu=6	544	1	1	38	1	1	16385	# 0.00 Gflop/s, 0.00 GB/s, tuned Mon Sep 23 17:40:18 2013
16x16x16x10	N4quda13fermion_force13SideLinkShortI7double2S2_EE	threads=20480,prec=8,recon=18,sig=1,mu=0	544	1	1	38	1	1	24577	# 0.00 Gflop/s, 0.00 GB/s, tuned Mon Sep 23 17:40:20 2013
16x16x16x10	N4quda13fermion_force13SideLinkShortI7double2S2_EE	threads=20480,prec=8,recon=18,sig=1,mu=2	576	1	1	36	1	1	0	# 0.00 Gflop/s, 0.00 GB/s, tuned Mon Sep 23 17:40:21 2013
16x16x16x10	N4quda13fermion_force13SideLinkShortI7double2S2_EE	threads=20480,prec=8,recon=18,sig=1,mu=3	544	1	1	38	1	1	8193	# 0.00 Gflop/s, 0.00 GB/s, tuned Mon Sep 23 17:40:21 2013
16x16x16x10	N4quda13fermion_force13SideLinkShortI7double2S2_EE	threads=20480,prec=8,recon=18,sig=1,mu=4	544	1	1	38	1	1	12289	# 0.00 Gflop/s, 0.00 GB/s, tuned Mon Sep 23 17:40:22 2013
16x16x16x10	N4quda13fermion_force13SideLinkShortI7double2S2_EE	threads=20480,prec=8,recon=18,sig=1,mu=5	32	1	1	640	1	1	12289	# 0.00 Gflop/s, 0.00 GB/s, tuned Mon Sep 23 17:40:22 2013
16x16x16x10	N4quda13fermion_force13SideLinkShortI7double2S2_EE	threads=20480,prec=8,recon=18,sig=1,mu=7	32	1	1	640	1	1	7022	# 0.00 Gflop/s, 0.00 GB/s, tuned Mon Sep 23 17:40:23 2013
16x16x16x10	N4quda13fermion_force13SideLinkShortI7double2S2_EE	threads=20480,prec=8,recon=18,sig=2,mu=0	544	1	1	38	1	1	16385	# 0.00 Gflop/s, 0.00 GB/s, tuned Mon Sep 23 17:40:25 2013
16x16x16x10	N4quda13fermion_force13SideLinkShortI7double2S2_EE	threads=20480,prec=8,recon=18,sig=2,mu=1	544	1	1	38	1	1	9831	# 0.00 Gflop/s, 0.00 GB/s, tuned Mon Sep 23 17:40:26 2013
16x16x16x10	N4quda13fermion_force13SideLinkShortI7double2S2_EE	threads=20480,prec=8,recon=18,sig=2,mu=3	544	1	1	38	1	1	16385	# 0.00 Gflop/s, 0.00 GB/s, tuned Mon Sep 23 17:40:26 2013
16x16x16x10	N4quda13fermion_force13SideLinkShortI7double2S2_EE	threads=20480,prec=8,recon=18,sig=2,mu=4	32	1	1	640	1	1	9831	# 0.00 Gflop/s, 0.00 GB/s, tuned Mon Sep 23 17:40:27 2013
16x16x16x10	N4quda13fermion_force13SideLinkShortI7double2S2_EE	threads=20480,prec=8,recon=18,sig=2,mu=6	32	1	1	640	1	1	12289	# 0.00 Gflop/s, 0.00 GB/s, tuned Mon Sep 23 17:40:27 2013
16x16x16x10	N4quda13fermion_force13SideLinkShortI7double2S2_EE	threads=20480,prec=8,recon=18,sig=2,mu=7	544	1	1	38	1	1	6145	# 0.00 Gflop/s, 0.00 GB/s, tuned Mon Sep 23 17:40:28 2013
16x16x16x10	N4quda13fermion_force13SideLinkShortI7double2S2_EE	threads=20480,prec=8,recon=18,sig=3,mu=0	544	1	1	38	1	1	7022	# 0.00 Gflop/s, 0.00 GB/s, tuned Mon Sep 23 17:40:30 2013
16x16x16x10	N4quda13fermion_force13SideLinkShortI7double2S2_EE	threads=20480,prec=8,recon=18,sig=3,mu=1	32	1	1	640	1	1	9831	# 0.00 Gflop/s, 0.00 GB/s, tuned Mon Sep 23 17:40:31 2013
16x16x16x10	N4quda13fermion_force13SideLinkShortI7double2S2_EE	threads=20480,prec=8,recon=18,sig=3,mu=2	544	1	1	38	1	1	7022	# 0.00 Gflop/s, 0.00 GB/s, tuned Mon Sep 23 17:40:31 2013
16x16x16x10	N4quda13fermion_force13SideLinkShortI7double2S2_EE	threads=20480,prec=8,recon=18,sig=3,mu=5	544	1	1	38	1	1	12289	# 0.00 Gflop/s, 0.00 GB/s, tuned Mon Sep 23 17:40:32 2013
16x16x16x10	N4quda13fermion_force13SideLinkShortI7double2S2_EE	threads=20480,prec=8,recon=18,sig=3,mu=6	544	1	1	38	1	1	12289	# 0.00 Gflop/s, 0.00 GB/s, tuned Mon Sep 23 17:40:32 2013
16x16x16x10	N4quda13fermion_force13SideLinkShortI7double2S2_EE	threads=20480,prec=8,recon=18,sig=3,mu=7	544	1	1	38	1	1	16385	# 0.00 Gflop/s, 0.00 GB/s, tuned Mon Sep 23 17:40:33 2013
16x16x16x10	N4quda13fermion_force13SideLinkShortI7double2S2_EE	threads=20480,prec=8,recon=18,sig=4,mu=0	544	1	1	38	1	1	7022	# 0.00 Gflop/s, 0.00 GB/s, tuned Mon Sep 23 17:40:35 2013
16x16x16x10	N4quda13fermion_force13SideLinkShortI7double2S2_EE	threads=20480,prec=8,recon=18,sig=4,mu=1	544	1	1	38	1	1	12289	# 0.00 Gflop/s, 0.00 GB/s, tuned Mon Sep 23 17:40:36 2013
16x16x16x10	N4quda13fermion_force13SideLinkShortI7double2S2_EE	threads=20480,prec=8,recon=18,sig=4,mu=2	544	1	1	38	1	1	12289	# 0.00 Gflop/s, 0.00 GB/s, tuned Mon Sep 23 17:40:36 2013
16x16x16x10	N4quda13fermion_force13SideLinkShortI7double2S2_EE	threads=20480,prec=8,recon=18,sig=4,mu=5	544	1	1	38	1	1	16385	# 0.00 Gflop/s, 0.00 GB/s, tuned Mon Sep 23 17:40:37 2013
16x16x16x10	N4quda13fermion_force13SideLinkShortI7double2S2_EE	threads=20480,prec=8,recon=18,sig=4,mu=6	544	1	1	38	1	1	7022	# 0.00 Gflop/s, 0.00 GB/s, tuned Mon Sep 23 17:40:37 2013
16x16x16x10	N4quda13fermion_force13SideLinkShortI7double2S2_EE	threads=20480,prec=8,recon=18,sig=4,mu=7	544	1	1	38	1	1	6145	# 0.00 Gflop/s, 0.00 GB/s, tuned Mon Sep 23 17:40:37 2013
16x16x16x10	N4quda13fermion_force13SideLinkShortI7double2S2_EE	threads=20480,prec=8,recon=18,sig=5,mu=0	544	1	1	38	1	1	12289	# 0.00 Gflop/s, 0.00 GB/s, tuned Mon Sep 23 17:40:39 2013
16x16x16x10	N4quda13fermion_force13SideLinkShortI7double2S2_EE	threads=20480,prec=8,recon=18,sig=5,mu=1	544	1	1	38	1	1	24577	# 0.00 Gflop/s, 0.00 GB/s, tuned Mon Sep 23 17:40:41 2013
16x16x16x10	N4quda13fermion_force13SideLinkShortI7double2S2_EE	threads=20480,prec=8,recon=18,sig=5,mu=3	544	1	1	38	1	1	6145	# 0.00 Gflop/s, 0.00 GB/s, tuned Mon Sep 23 17:40:41 2013
16x16x16x10	N4quda13fermion_force13SideLinkShortI7double2S2_EE	threads=20480,prec=8,recon=18,sig=5,mu=4	32	1	1	640	1	1	12289	# 0.00 Gflop/s, 0.00 GB/s, tuned Mon Sep 23 17:40:41 2013
16x16x16x10	N4quda13fermion_force13SideLinkShortI7double2S2_EE	threads=20480,prec=8,recon=18,sig=5,mu=6	32	1	1	640	1	1	12289	# 0.00 Gflop/s, 0.00 GB/s, tuned Mon Sep 23 17:40:42 2013
16x16x16x10	N4quda13fermion_force13SideLinkShortI7double2S2_EE	threads=20480,prec=8,recon=18,sig=5,mu=7	544	1	1	38	1	1	12289	# 0.00 Gflop/s, 0.00 GB/s, tuned Mon Sep 23 17:40:42 2013
16x16x16x10	N4quda13fermion_force13SideLinkShortI7double2S2_EE	threads=20480,prec=8,recon=18,sig=6,mu=0	32	1	1	640	1	1	8193	# 0.00 Gflop/s, 0.00 GB/s, tuned Mon Sep 23 17:40:44 2013
16x16x16x10	N4quda13fermion_force13SideLinkShortI7double2S2_EE	threads=20480,prec=8,recon=18,sig=6,mu=2	544	1	1	38	1	1	8193	# 0.00 Gflop/s, 0.00 GB/s, tuned Mon Sep 23 17:40:45 2013
16x16x16x10	N4quda13fermion_force13SideLinkShortI7double2S2_EE	threads=20480,prec=8,recon=18,sig=6,mu=3	544	1	1	38	1	1	12289	# 0.00 Gflop/s, 0.00 GB/s, tuned Mon Sep 23 17:40:46 2013
16x16x16x10	N4quda13fermion_force13SideLinkShortI7double2S2_EE	threads=20480,prec=8,recon=18,sig=6,mu=4	32	1	1	640	1	1	8193	# 0.00 Gflop/s, 0.00 GB/s, tuned Mon Sep 23 17:40:46 2013
16x16x16x10	N4quda13fermion_force13SideLinkShortI7double2S2_EE	threads=20480,prec=8,recon=18,sig=6,mu=5	544	1	1	38	1	1	8193	# 0.00 Gflop/s, 0.00 GB/s, tuned Mon Sep 23 17:40:47 2013
16x16x16x10	N4quda13fermion_force13SideLinkShortI7double2S2_EE	threads=20480,prec=8,recon=18,sig=6,mu=7	544	1	1	38	1	1	24577	# 0.00 Gflop/s, 0.00 GB/s, tuned Mon Sep 23 17:40:47 2013
16x16x16x10	N4quda13fermion_force13SideLinkShortI7double2S2_EE	threads=20480,prec=8,recon=18,sig=7,mu=1	32	1	1	640	1	1	24577	# 0.00 Gflop/s, 0.00 GB/s, tuned Mon Sep 23 17:40:49 2013
16x16x16x10	N4quda13fermion_force13SideLinkShortI7double2S2_EE	threads=20480,prec=8,recon=18,sig=7,mu=2	544	1	1	38	1	1	16385	# 0.00 Gflop/s, 0.00 GB/s, tuned Mon Sep 23 17:40:50 2013
16x16x16x10	N4quda13fermion_force13SideLinkShortI7double2S2_EE	threads=20480,prec=8,recon=18,sig=7,mu=3	32	1	1	640	1	1	9831	# 0.00 Gflop/s, 0.00 GB/s, tuned Mon Sep 23 17:40:51 2013
16x16x16x10	N4quda13fermion_force13SideLinkShortI7double2S2_EE	threads=20480,prec=8,recon=18,sig=7,mu=4	32	1	1	640	1	1	9831	# 0.00 Gflop/s, 0.00 GB/s, tuned Mon Sep 23 17:40:51 2013
16x16x16x10	N4quda13fermion_force13SideLinkShortI7double2S2_EE	threads=20480,prec=8,recon=18,sig=7,mu=5	32	1	1	640	1	1	9831	# 0.00 Gflop/s, 0.00 GB/s, tuned Mon Sep 23 17:40:51 2013
16x16x16x10	N4quda13fermion_force13SideLinkShortI7double2S2_EE	threads=20480,prec=8,recon=18,sig=7,mu=6	544	1	1	38	1	1	6145	# 0.00 Gflop/s, 0.00 GB/s, tuned Mon Sep 23 17:40:52 2013
16x16x16x10	N4quda13fermion_force7AllLinkI7double2S2_EE	threads=20480,prec=8,recon=12,sig=0,mu=1	128	1	1	160	1	1	24577	# 0.00 Gflop/s, 0.00 GB/s, tuned Mon Sep 23 17:41:11 2013
16x16x16x10	N4quda13fermion_force7AllLinkI7double2S2_EE	threads=20480,prec=8,recon=12,sig=0,mu=2	32	1	1	640	1	1	7022	# 0.00 Gflop/s, 0.00 GB/s, tuned Mon Sep 23 17:41:10 2013
16x16x16x10	N4quda13fermion_force7AllLinkI7double2S2_EE	threads=20480,prec=8,recon=12,sig=0,mu=3	64	1	1	320	1	1	8193	# 0.00 Gflop/s, 0.00 GB/s, tuned Mon Sep 23 17:41:10 2013
16x16x16x10	N4quda13fermion_force7AllLinkI7double2S2_EE	threads=20480,prec=8,recon=12,sig=0,mu=4	64	1	1	320	1	1	9831	# 0.00 Gflop/s, 0.00 GB/s, tuned Mon Sep 23 17:41:10 2013
16x16x16x10	N4quda13fermion_force7AllLinkI7double2S2_EE	threads=20480,prec=8,recon=12,sig=0,mu=5	32	1	1	640	1	1	16385	# 0.00 Gflop/s, 0.00 GB/s, tuned Mon Sep 23 17:41:10 2013
16x16x16x10	N4quda13fermion_force7AllLinkI7double2S2_EE	threads=20480,prec=8,recon=12,sig=0,mu=6	32	1	1	640	1	1	8193	# 0.00 Gflop/s, 0.00 GB/s, tuned Mon Sep 23 17:41:12 2013
16x16x16x10	N4quda13fermion_force7AllLinkI7double2S2_EE	threads=20480,prec=8,recon=12,sig=1,mu=0	64	1	1	320	1	1	24577	# 0.00 Gflop/s, 0.00 GB/s, tuned Mon Sep 23 17:41:15 2013
16x16x16x10	N4quda13fermion_force7AllLinkI7double2S2_EE	threads=20480,prec=8,recon=12,sig=1,mu=2	32	1	1	640	1	1	9831	# 0.00 Gflop/s, 0.00 GB/s, tuned Mon Sep 23 17:41:14 2013
16x16x16x10	N4quda13fermion_force7AllLinkI7double2S2_EE	threads=20480,prec=8,recon=12,sig=1,mu=3	128	1	1	160	1	1	0	# 0.00 Gflop/s, 0.00 GB/s, tuned Mon Sep 23 17:41:13 2013
16x16x16x10	N4quda13fermion_force7AllLinkI7double2S2_EE	threads=20480,prec=8,recon=12,sig=1,mu=4	32	1	1	640	1	1	12289	# 0.00 Gflop/s, 0.00 GB/s, tuned Mon Sep 23 17:41:13 2013
16x16x16x10	N4quda13fermion_force7AllLinkI7double2S2_EE	threads=20480,prec=8,recon=12,sig=1,mu=5	32	1	1	640	1	1	7022	# 0.00 Gflop/s, 0.00 GB/s, tuned Mon Sep 23 17:41:14 2013
16x16x16x10	N4quda13fermion_force7AllLinkI7double2S2_EE	threads=20480,prec=8,recon=12,sig=1,mu=7	32	1	1	640	1	1	7022	# 0.00 Gflop/s, 0.00 GB/s, tuned Mon Sep 23 17:41:15 2013
16x16x16x10	N4quda13fermion_force7AllLinkI7double2S2_EE	threads=20480,prec=8,recon=12,sig=2,mu=0	32	1	1	640	1	1	24577	# 0.00 Gflop/s, 0.00 GB/s, tuned Mon Sep 23 17:41:18 2013
16x16x16x10	N4quda13fermion_force7AllLinkI7double2S2_EE	threads=20480,prec=8,recon=12,sig=2,mu=1	32	1	1	640	1	1	9831	# 0.00 Gflop/s, 0.00 GB/s, tuned Mon Sep 23 17:41:17 2013
16x16x16x10	N4quda13fermion_force7AllLinkI7double2S2_EE	threads=20480,prec=8,recon=12,sig=2,mu=3	32	1	1	640	1	1	9831	# 0.00 Gflop/s, 0.00 GB/s, tuned Mon Sep 23 17:41:16 2013
16x16x16x10	N4quda13fermion_force7AllLinkI7double2S2_EE	threads=20480,prec=8,recon=12,sig=2,mu=4	128	1	1	160	1	1	24577	# 0.00 Gflop/s, 0.00 GB/s, tuned Mon Sep 23 17:41:17 2013
16x16x16x10	N4quda13fermion_force7AllLinkI7double2S2_EE	threads=20480,prec=8,recon=12,sig=2,mu=6	32	1	1	640	1	1	16385	# 0.00 Gflop/s, 0.00 GB/s, tuned Mon Sep 23 17:41:17 2013
16x16x16x10	N4quda13fermion_force7AllLinkI7double2S2_EE	threads=20480,prec=8,recon=12,sig=2,mu=7	32	1	1	640	1	1	9831	# 0.00 Gflop/s, 0.00 GB/s, tuned Mon Sep 23 17:41:18 2013
16x16x16x10	N4quda13fermion_force7AllLinkI7double2S2_EE	threads=20480,prec=8,recon=12,sig=3,mu=0	32	1	1	640	1	1	8193	# 0.00 Gflop/s, 0.00 GB/s, tuned Mon Sep 23 17:41:21 2013
16x16x16x10	N4quda13fermion_force7AllLinkI7double2S2_EE	threads=20480,prec=8,recon=12,sig=3,mu=1	32	1	1	640	1	1	6145	# 0.00 Gflop/s, 0.00 GB/s, tuned Mon Sep 23 17:41:20 2013
16x16x16x10	N4quda13fermion_force7AllLinkI7double2S2_EE	threads=20480,prec=8,recon=12,sig=3,mu=2	64	1	1	320	1	1	12289	# 0.00 Gflop/s, 0.00 GB/s, tuned Mon Sep 23 17:41:20 2013
16x16x16x10	N4quda13fermion_force7AllLinkI7double2S2_EE	threads=20480,prec=8,recon=12,sig=3,mu=5	64	1	1	320	1	1	12289	# 0.00 Gflop/s, 0.00 GB/s, tuned Mon Sep 23 17:41:20 2013
16x16x16x10	N4quda13fermion_force7AllLinkI7double2S2_EE	threads=20480,prec=8,recon=12,sig=3,mu=6	32	1	1	640	1	1	8193	# 0.00 Gflop/s, 0.00 GB/s, tuned Mon Sep 23 17:41:20 2013
16x16x16x10	N4quda13fermion_force7AllLinkI7double2S2_EE	threads=20480,prec=8,recon=12,sig=3,mu=7	64	1	1	320	1	1	16385	# 0.00 Gflop/s, 0.00 GB/s, tuned Mon Sep 23 17:41:22 2013
16x16x16x10	N4quda13fermion_force7AllLinkI7double2S2_EE	threads=20480,prec=8,recon=12,sig=4,mu=0	32	1	1	640	1	1	9831	# 0.00 Gflop/s, 0.00 GB/s, tuned Mon Sep 23 17:41:25 2013
16x16x16x10	N4quda13fermion_force7AllLinkI7double2S2_EE	threads=20480,prec=8,recon=12,sig=4,mu=1	32	1	1	640	1	1	12289	# 0.00 Gflop/s, 0.00 GB/s, tuned Mon Sep 23 17:41:23 2013
16x16x16x10	N4quda13fermion_force7AllLinkI7double2S2_EE	threads=20480,prec=8,recon=12,sig=4,mu=2	32	1	1	640	1	1	8193	# 0.00 Gflop/s, 0.00 GB/s, tuned Mon Sep 23 17:41:23 2013
16x16x16x10	N4quda13fermion_force7AllLinkI7double2S2_EE	threads=20480,prec=8,recon=12,sig=4,mu=5	160	1	1	128	1	1	9831	# 0.00 Gflop/s, 0.00 GB/s, tuned Mon Sep 23 17:41:23 2013
16x16x16x10	N4quda13fermion_force7AllLinkI7double2S2_EE	threads=20480,prec=8,recon=12,sig=4,mu=6	160	1	1	128	1	1	0	# 0.00 Gflop/s, 0.00 GB/s, tuned Mon Sep 23 17:41:24 2013
16x16x16x10	N4quda13fermion_force7AllLinkI7double2S2_EE	threads=20480,prec=8,recon=12,sig=4,mu=7	160	1	1	128	1	1	12289	# 0.00 Gflop/s, 0.00 GB/s, tuned Mon Sep 23 17:41:25 2013
16x16x16x10	N4quda13fermion_force7AllLinkI7double2S2_EE	threads=20480,prec=8,recon=12,sig=5,mu=0	32	1	1	640	1	1	16385	# 0.00 Gflop/s, 0.00 GB/s, tuned Mon Sep 23 17:41:28 2013
16x16x16x10	N4quda13fermion_force7AllLinkI7double2S2_EE	threads=20480,prec=8,recon=12,sig=5,mu=1	32	1	1	640	1	1	8193	# 0.00 Gflop/s, 0.00 GB/s, tuned Mon Sep 23 17:41:27 2013
16x16x16x10	N4quda13fermion_force7AllLinkI7double2S2_EE	threads=20480,prec=8,recon=12,sig=5,mu=3	32	1	1	640	1	1	9831	# 0.00 Gflop/s, 0.00 GB/s, tuned Mon Sep 23 17:41:26 2013
16x16x16x10	N4quda13fermion_force7AllLinkI7double2S2_EE	threads=20480,prec=8,recon=12,sig=5,mu=4	160	1	1	128	1	1	6145	# 0.00 Gflop/s, 0.00 GB/s, tuned Mon Sep 23 17:41:26 2013
16x16x16x10	N4quda13fermion_force7AllLinkI7double2S2_EE	threads=20480,prec=8,recon=12,sig=5,mu=6	160	1	1	128	1	1	7022	# 0.00 Gflop/s, 0.00 GB/s, tuned Mon Sep 23 17:41:27 2013
16x16x16x10	N4quda13fermion_force7AllLinkI7double2S2_EE	threads=20480,prec=8,recon=12,sig=5,mu=7	160	1	1	128	1	1	8193	# 0.00 Gflop/s, 0.00 GB/s, tuned Mon Sep 23 17:41:28 2013
16x16x16x10	N4quda13fermion_force7AllLinkI7double2S2_EE	threads=20480,prec=8,recon=12,sig=6,mu=0	32	1	1	640	1	1	8193	# 0.00 Gflop/s, 0.00 GB/s, tuned Mon Sep 23 17:41:31 2013
16x16x16x10	N4quda13fermion_force7AllLinkI7double2S2_EE	threads=20480,prec=8,recon=12,sig=6,mu=2	64	1	1	320	1	1	12289	# 0.00 Gflop/s, 0.00 GB/s, tuned Mon Sep 23 17:41:30 2013
16x16x16x10	N4quda13fermion_force7AllLinkI7double2S2_EE	threads=20480,prec=8,recon=12,sig=6,mu=3	32	1	1	640	1	1	24577	# 0.00 Gflop/s, 0.00 GB/s, tuned Mon Sep 23 17:41:29 2013
16x16x16x10	N4quda13fermion_force7AllLinkI7double2S2_EE	threads=20480,prec=8,recon=12,sig=6,mu=4	160	1	1	128	1	1	0	# 0.00 Gflop/s, 0.00 GB/s, tuned Mon Sep 23 17:41:30 2013
16x16x16x10	N4quda13fermion_force7AllLinkI7double2S2_EE	threads=20480,prec=8,recon=12,sig=6,mu=5	160	1	1	128	1	1	9831	# 0.00 Gflop/s, 0.00 GB/s, tuned Mon Sep 23 17:41:30 2013
16x16x16x10	N4quda13fermion_force7AllLinkI7double2S2_EE	threads=20480,prec=8,recon=12,sig=6,mu=7	160	1	1	128	1	1	0	# 0.00 Gflop/s, 0.00 GB/s, tuned Mon Sep 23 17:41:31 2013
16x16x16x10	N4quda13fermion_force7AllLinkI7double2S2_EE	threads=20480,prec=8,recon=12,sig=7,mu=1	32	1	1	640	1	1	7022	# 0.00 Gflop/s, 0.00 GB/s, tuned Mon Sep 23 17:41:34 2013
16x16x16x10	N4quda13fermion_force7AllLinkI7double2S2_EE	threads=20480,prec=8,recon=12,sig=7,mu=2	32	1	1	640	1	1	24577	# 0.00 Gflop/s, 0.00 GB/s, tuned Mon Sep 23 17:41:33 2013
16x16x16x10	N4quda13fermion_force7AllLinkI7double2S2_EE	threads=20480,prec=8,recon=12,sig=7,mu=3	32	1	1	640	1	1	8193	# 0.00 Gflop/s, 0.00 GB/s, tuned Mon Sep 23 17:41:33 2013
16x16x16x10	N4quda13fermion_force7AllLinkI7double2S2_EE	threads=20480,prec=8,recon=12,sig=7,mu=4	160	1	1	128	1	1	0	# 0.00 Gflop/s, 0.00 GB/s, tuned Mon Sep 23 17:41:33 2013
16x16x16x10	N4quda13fermion_force7AllLinkI7double2S2_EE	threads=20480,prec=8,recon=12,sig=7,mu=5	160	1	1	128	1	1	6145	# 0.00 Gflop/s, 0.00 GB/s, tuned Mon Sep 23 17:41:33 2013
16x16x16x10	N4quda13fermion_force7AllLinkI7double2S2_EE	threads=20480,prec=8,recon=12,sig=7,mu=6	160	1	1	128	1	1	7022	# 0.00 Gflop/s, 0.00 GB/s, tuned Mon Sep 23 17:41:34 2013
16x16x16x10	N4quda13fermion_force7AllLinkI7double2S2_EE	threads=20480,prec=8,recon=18,sig=0,mu=1	32	1	1	640	1	1	9831	# 0.00 Gflop/s, 0.00 GB/s, tuned Mon Sep 23 17:40:15 2013
16x16x16x10	N4quda13fermion_force7AllLinkI7double2S2_EE	threads=20480,prec=8,recon=18,sig=0,mu=2	64	1	1	320	1	1	6145	# 0.00 Gflop/s, 0.00 GB/s, tuned Mon Sep 23 17:40:14 2013
16x16x16x10	N4quda13fermion_force7AllLinkI7double2S2_EE	threads=20480,prec=8,recon=18,sig=0,mu=3	32	1	1	640	1	1	0	# 0.00 Gflop/s, 0.00 GB/s, tuned Mon Sep 23 17:40:13 2013
16x16x16x10	N4quda13fermion_force7AllLinkI7double2S2_EE	threads=20480,prec=8,recon=18,sig=0,mu=4	32	1	1	640	1	1	8193	# 0.00 Gflop/s, 0.00 GB/s, tuned Mon Sep 23 17:40:14 2013
16x16x16x10	N4quda13fermion_force7AllLinkI7double2S2_EE	threads=20480,prec=8,recon=18,sig=0,mu=5	128	1	1	160	1	1	9831	# 0.00 Gflop/s, 0.00 GB/s, tuned Mon Sep 23 17:40:14 2013
16x16x16x10	N4quda13fermion_force7AllLinkI7double2S2_EE	threads=20480,prec=8,recon=18,sig=0,mu=6	32	1	1	640	1	1	9831	# 0.00 Gflop/s, 0.00 GB/s, tuned Mon Sep 23 17:40:16 2013
16x16x16x10	N4quda13fermion_force7AllLinkI7double2S2_EE	threads=20480,prec=8,recon=18,sig=1,mu=0	32	1	1	640	1	1	16385	# 0.00 Gflop/s, 0.00 GB/s, tuned Mon Sep 23 17:40:20 2013
16x16x16x10	N4quda13fermion_force7AllLinkI7double2S2_EE	threads=20480,prec=8,recon=18,sig=1,mu=2	32	1	1	640	1	1	24577	# 0.00 Gflop/s, 0.00 GB/s, tuned Mon Sep 23 17:40:19 2013
16x16x16x10	N4quda13fermion_force7AllLinkI7double2S2_EE	threads=20480,prec=8,recon=18,sig=1,mu=3	32	1	1	640	1	1	8193	# 0.00 Gflop/s, 0.00 GB/s, tuned Mon Sep 23 17:40:18 2013
16x16x16x10	N4quda13fermion_force7AllLinkI7double2S2_EE	threads=20480,prec=8,recon=18,sig=1,mu=4	32	1	1	640	1	1	12289	# 0.00 Gflop/s, 0.00 GB/s, tuned Mon Sep 23 17:40:18 2013
16x16x16x10	N4quda13fermion_force7AllLinkI7double2S2_EE	threads=20480,prec=8,recon=18,sig=1,mu=5	128	1	1	160	1	1	0	# 0.00 Gflop/s, 0.00 GB/s, tuned Mon Sep 23 17:40:19 2013
16x16x16x10	N4quda13fermion_force7AllLinkI7double2S2_EE	threads=20480,prec=8,recon=18,sig=1,mu=7	128	1	1	160	1	1	6145	# 0.00 Gflop/s, 0.00 GB/s, tuned Mon Sep 23 17:40:20 2013
16x16x16x10	N4quda13fermion_force7AllLinkI7double2S2_EE	threads=20480,prec=8,recon=18,sig=2,mu=0	64	1	1	320	1	1	12289	# 0.00 Gflop/s, 0.00 GB/s, tuned Mon Sep 23 17:40:25 2013
16x16x16x10	N4quda13fermion_force7AllLinkI7double2S2_EE	threads=20480,prec=8,recon=18,sig=2,mu=1	32	1	1	640	1	1	16385	# 0.00 Gflop/s, 0.00 GB/s, tuned Mon Sep 23 17:40:24 2013
16x16x16x10	N4quda13fermion_force7AllLinkI7double2S2_EE	threads=20480,prec=8,recon=18,sig=2,mu=3	64	1	1	320	1	1	0	# 0.00 Gflop/s, 0.00 GB/s, tuned Mon Sep 23 17:40:23 2013
16x16x16x10	N4quda13fermion_force7AllLinkI7double2S2_EE	threads=20480,prec=8,recon=18,sig=2,mu=4	128	1	1	160	1	1	0	# 0.00 Gflop/s, 0.00 GB/s, tuned Mon Sep 23 17:40:23 2013
16x16x16x10	N4quda13fermion_force7AllLinkI7double2S2_EE	threads=20480,prec=8,recon=18,sig=2,mu=6	64	1	1	320	1	1	7022	# 0.00 Gflop/s, 0.00 GB/s, tuned Mon Sep 23 17:40:24 2013
16x16x16x10	N4quda13fermion_force7AllLinkI7double2S2_EE	threads=20480,prec=8,recon=18,sig=2,mu=7	64	1	1	320	1	1	7022	# 0.00 Gflop/s, 0.00 GB/s, tuned Mon Sep 23 17:40:25 2013
16x16x16x10	N4quda13fermion_force7AllLinkI7double2S2_EE	threads=20480,prec=8,recon=18,sig=3,mu=0	32	1	1	640	1	1	9831	# 0.00 Gflop/s, 0.00 GB/s, tuned Mon Sep 23 17:40:30 2013
16x16x16x10	N4quda13fermion_force7AllLinkI7double2S2_EE	threads=20480,prec=8,recon=18,sig=3,mu=1	64	1	1	320	1	1	9831	# 0.00 Gflop/s, 0.00 GB/s, tuned Mon Sep 23 17:40:29 2013
16x16x16x10	N4quda13fermion_force7AllLinkI7double2S2_EE	threads=20480,prec=8,recon=18,sig=3,mu=2	32	1	1	640	1	1	12289	# 0.00 Gflop/s, 0.00 GB/s, tuned Mon Sep 23 17:40:28 2013
16x16x16x10	N4quda13fermion_force7AllLinkI7double2S2_EE	threads=20480,prec=8,recon=18,sig=3,mu=5	128	1	1	160	1	1	16385	# 0.00 Gflop/s, 0.00 GB/s, tuned Mon Sep 23 17:40:28 2013
16x16x16x10	N4quda13fermion_force7AllLinkI7double2S2_EE	threads=20480,prec=8,recon=18,sig=3,mu=6	32	1	1	640	1	1	24577	# 0.00 Gflop/s, 0.00 GB/s, tuned Mon Sep 23 17:40:29 2013
16x16x16x10	N4quda13fermion_force7AllLinkI7double2S2_EE	threads=20480,prec=8,recon=18,sig=3,mu=7	64	1	1	320	1	1	8193	# 0.00 Gflop/s, 0.00 GB/s, tuned Mon Sep 23 17:40:30 2013
16x16x16x10	N4quda13fermion_force7AllLinkI7double2S2_EE	threads=20480,prec=8,recon=18,sig=4,mu=0	320	1	1	64	1	1	0	# 0.00 Gflop/s, 0.00 GB/s, tuned Mon Sep 23 17:40:35 2013
16x16x16x10	N4quda13fermion_force7AllLinkI7double2S2_EE	threads=20480,prec=8,recon=18,sig=4,mu=1	160	1	1	128	1	1	7022	# 0.00 Gflop/s, 0.00 GB/s, tuned Mon Sep 23 17:40:34 2013
16x16x16x10	N4quda13fermion_force7AllLinkI7double2S2_EE	threads=20480,prec=8,recon=18,sig=4,mu=2	160	1	1	128	1	1	16385	# 0.00 Gflop/s, 0.00 GB/s, tuned Mon Sep 23 17:40:33 2013
16x16x16x10	N4quda13fermion_force7AllLinkI7double2S2_EE	threads=20480,prec=8,recon=18,sig=4,mu=5	416	1	1	50	1	1	0	# 0.00 Gflop/s, 0.00 GB/s, tuned Mon Sep 23 17:40:33 2013
16x16x16x10	N4quda13fermion_force7AllLinkI7double2S2_EE	threads=20480,prec=8,recon=18,sig=4,mu=6	416	1	1	50	1	1	12289	# 0.00 Gflop/s, 0.00 GB/s, tuned Mon Sep 23 17:40:34 2013
16x16x16x10	N4quda13fermion_force7AllLinkI7double2S2_EE	threads=20480,prec=8,recon=18,sig=4,mu=7	416	1	1	50	1	1	12289	# 0.00 Gflop/s, 0.00 GB/s, tuned Mon Sep 23 17:40:35 2013
16x16x16x10	N4quda13fermion_force7AllLinkI7double2S2_EE	threads=20480,prec=8,recon=18,sig=5,mu=0	160	1	1	128	1	1	24577	# 0.00 Gflop/s, 0.00 GB/s, tuned Mon Sep 23 17:40:40 2013
16x16x16x10	N4quda13fermion_force7AllLinkI7double2S2_EE	threads=20480,prec=8,recon=18,sig=5,mu=1	320	1	1	64	1	1	9831	# 0.00 Gflop/s, 0.00 GB/s, tuned Mon Sep 23 17:40:38 2013
16x16x16x10	N4quda13fermion_force7AllLinkI7double2S2_EE	threads=20480,prec=8,recon=18,sig=5,mu=3	320	1	1	64	1	1	24577	# 0.00 Gflop/s, 0.00 GB/s, tuned Mon Sep 23 17:40:38 2013
16x16x16x10	N4quda13fermion_force7AllLinkI7double2S2_EE	threads=20480,prec=8,recon=18,sig=5,mu=4	416	1	1	50	1	1	9831	# 0.00 Gflop/s, 0.00 GB/s, tuned Mon Sep 23 17:40:38 2013
16x16x16x10	N4quda13fermion_force7AllLinkI7double2S2_EE	threads=20480,prec=8,recon=18,sig=5,mu=6	416	1	1	50	1	1	16385	# 0.00 Gflop/s, 0.00 GB/s, tuned Mon Sep 23 17:40:38 2013
16x16x16x10	N4quda13fermion_force7AllLinkI7double2S2_EE	threads=20480,prec=8,recon=18,sig=5,mu=7	416	1	1	50	1	1	12289	# 0.00 Gflop/s, 0.00 GB/s, tuned Mon Sep 23 17:40:40 2013
16x16x16x10	N4quda13fermion_force7AllLinkI7double2S2_EE	threads=20480,prec=8,recon=18,sig=6,mu=0	320	1	1	64	1	1	0	# 0.00 Gflop/s, 0.00 GB/s, tuned Mon Sep 23 17:40:45 2013
16x16x16x10	N4quda13fermion_force7AllLinkI7double2S2_EE	threads=20480,prec=8,recon=18,sig=6,mu=2	160	1	1	128	1	1	16385	# 0.00 Gflop/s, 0.00 GB/s, tuned Mon Sep 23 17:40:43 2013
16x16x16x10	N4quda13fermion_force7AllLinkI7double2S2_EE	threads=20480,prec=8,recon=18,sig=6,mu=3	320	1	1	64	1	1	9831	# 0.00 Gflop/s, 0.00 GB/s, tuned Mon Sep 23 17:40:43 2013
16x16x16x10	N4quda13fermion_force7AllLinkI7double2S2_EE	threads=20480,prec=8,recon=18,sig=6,mu=4	416	1	1	50	1	1	7022	# 0.00 Gflop/s, 0.00 GB/s, tuned Mon Sep 23 17:40:43 2013
16x16x16x10	N4quda13fermion_force7AllLinkI7double2S2_EE	threads=20480,prec=8,recon=18,sig=6,mu=5	416	1	1	50	1	1	16385	# 0.00 Gflop/s, 0.00 GB/s, tuned Mon Sep 23 17:40:43 2013
16x16x16x10	N4quda13fermion_force7AllLinkI7double2S2_EE	threads=20480,prec=8,recon=18,sig=6,mu=7	224	1	1	92	1	1	0	# 0.00 Gflop/s, 0.00 GB/s, tuned Mon Sep 23 17:40:45 2013
16x16x16x10	N4quda13fermion_force7AllLinkI7double2S2_EE	threads=20480,prec=8,recon=18,sig=7,mu=1	320	1	1	64	1	1	9831	# 0.00 Gflop/s, 0.00 GB/s, tuned Mon Sep 23 17:40:49 2013
16x16x16x10	N4quda13fermion_force7AllLinkI7double2S2_EE	threads=20480,prec=8,recon=18,sig=7,mu=2	320	1	1	64	1	1	8193	# 0.00 Gflop/s, 0.00 GB/s, tuned Mon Sep 23 17:40:48 2013
16x16x16x10	N4quda13fermion_force7AllLinkI7double2S2_EE	threads=20480,prec=8,recon=18,sig=7,mu=3	320	1	1	64	1	1	24577	# 0.00 Gflop/s, 0.00 GB/s, tuned Mon Sep 23 17:40:47 2013
16x16x16x10	N4quda13fermion_force7AllLinkI7double2S2_EE	threads=20480,prec=8,recon=18,sig=7,mu=4	320	1	1	64	1	1	7022	# 0.00 Gflop/s, 0.00 GB/s, tuned Mon Sep 23 17:40:48 2013
16x16x16x10	N4quda13fermion_force7AllLinkI7double2S2_EE	threads=20480,prec=8,recon=18,sig=7,mu=5	320	1	1	64	1	1	16385	# 0.00 Gflop/s, 0.00 GB/s, tuned Mon Sep 23 17:40:48 2013
16x16x16x10	N4quda13fermion_force7AllLinkI7double2S2_EE	threads=20480,prec=8,recon=18,sig=7,mu=6	416	1	1	50	1	1	16385	# 0.00 Gflop/s, 0.00 GB/s, tuned Mon Sep 23 17:40:50 2013
16x16x16x10	N4quda13fermion_force8SideLinkI7double2S2_EE	threads=20480,prec=8,recon=12,sig=0,mu=1	416	1	1	50	1	1	9831	# 0.00 Gflop/s, 0.00 GB/s, tuned Mon Sep 23 17:41:11 2013
16x16x16x10	N4quda13fermion_force8SideLinkI7double2S2_EE	threads=20480,prec=8,recon=12,sig=0,mu=2	416	1	1	50	1	1	8193	# 0.00 Gflop/s, 0.00 GB/s, tuned Mon Sep 23 17:41:10 2013
16x16x16x10	N4quda13fermion_force8SideLinkI7double2S2_EE	threads=20480,prec=8,recon=12,sig=0,mu=3	416	1	1	50	1	1	8193	# 0.00 Gflop/s, 0.00 GB/s, tuned Mon Sep 23 17:41:10 2013
16x16x16x10	N4quda13fermion_force8SideLinkI7double2S2_EE	threads=20480,prec=8,recon=12,sig=0,mu=4	416	1	1	50	1	1	6145	# 0.00 Gflop/s, 0.00 GB/s, tuned Mon Sep 23 17:41:11 2013
16x16x16x10	N4quda13fermion_force8SideLinkI7double2S2_EE	threads=20480,prec=8,recon=12,sig=0,mu=5	224	1	1	92	1	1	24577	# 0.00 Gflop/s, 0.00 GB/s, tuned Mon Sep 23 17:41:11 2013
16x16x16x10	N4quda13fermion_force8SideLinkI7double2S2_EE	threads=20480,prec=8,recon=12,sig=0,mu=6	416	1	1	50	1	1	7022	# 0.00 Gflop/s, 0.00 GB/s, tuned Mon Sep 23 17:41:12 2013
16x16x16x10	N4quda13fermion_force8SideLinkI7double2S2_EE	threads=20480,prec=8,recon=12,sig=1,mu=0	416	1	1	50	1	1	0	# 0.00 Gflop/s, 0.00 GB/s, tuned Mon Sep 23 17:41:15 2013
16x16x16x10	N4quda13fermion_force8SideLinkI7double2S2_EE	threads=20480,prec=8,recon=12,sig=1,mu=2	448	1	1	46	1	1	16385	# 0.00 Gflop/s, 0.00 GB/s, tuned Mon Sep 23 17:41:13 2013
16x16x16x10	N4quda13fermion_force8SideLinkI7double2S2_EE	threads=20480,prec=8,recon=12,sig=1,mu=3	416	1	1	50	1	1	8193	# 0.00 Gflop/s, 0.00 GB/s, tuned Mon Sep 23 17:41:14 2013
16x16x16x10	N4quda13fermion_force8SideLinkI7double2S2_EE	threads=20480,prec=8,recon=12,sig=1,mu=4	416	1	1	50	1	1	12289	# 0.00 Gflop/s, 0.00 GB/s, tuned Mon Sep 23 17:41:14 2013
16x16x16x10	N4quda13fermion_force8SideLinkI7double2S2_EE	threads=20480,prec=8,recon=12,sig=1,mu=5	416	1	1	50	1	1	6145	# 0.00 Gflop/s, 0.00 GB/s, tuned Mon Sep 23 17:41:14 2013
16x16x16x10	N4quda13fermion_force8SideLinkI7double2S2_EE	threads=20480,prec=8,recon=12,sig=1,mu=7	416	1	1	50	1	1	6145	# 0.00 Gflop/s, 0.00 GB/s, tuned Mon Sep 23 17:41:15 2013
16x16x16x10	N4quda13fermion_force8SideLinkI7double2S2_EE	threads=20480,prec=8,recon=12,sig=2,mu=0	416	1	1	50	1	1	24577	# 0.00 Gflop/s, 0.00 GB/s, tuned Mon Sep 23 17:41:18 2013
16x16x16x10	N4quda13fermion_force8SideLinkI7double2S2_EE	threads=20480,prec=8,recon=12,sig=2,mu=1	416	1	1	50	1	1	6145	# 0.00 Gflop/s, 0.00 GB/s, tuned Mon Sep 23 17:41:17 2013
16x16x16x10	N4quda13fermion_force8SideLinkI7double2S2_EE	threads=20480,prec=8,recon=12,sig=2,mu=3	448	1	1	46	1	1	7022	# 0.00 Gflop/s, 0.00 GB/s, tuned Mon Sep 23 17:41:17 2013
16x16x16x10	N4quda13fermion_force8SideLinkI7double2S2_EE	threads=20480,prec=8,recon=12,sig=2,mu=4	416	1	1	50	1	1	24577	# 0.00 Gflop/s, 0.00 GB/s, tuned Mon Sep 23 17:41:17 2013
16x16x16x10	N4quda13fermion_force8SideLinkI7double2S2_EE	threads=20480,prec=8,recon=12,sig=2,mu=6	416	1	1	50	1	1	12289	# 0.00 Gflop/s, 0.00 GB/s, tuned Mon Sep 23 17:41:18 2013
16x16x16x10	N4quda13fermion_force8SideLinkI7double2S2_EE	threads=20480,prec=8,recon=12,sig=2,mu=7	416	1	1	50	1	1	0	# 0.00 Gflop/s, 0.00 GB/s, tuned Mon Sep 23 17:41:18 2013
16x16x16x10	N4quda13fermion_force8SideLinkI7double2S2_EE	threads=20480,prec=8,recon=12,sig=3,mu=0	416	1	1	50	1	1	9831	# 0.00 Gflop/s, 0.00 GB/s, tuned Mon Sep 23 17:41:21 2013
16x16x16x10	N4quda13fermion_force8SideLinkI7double2S2_EE	threads=20480,prec=8,recon=12,sig=3,mu=1	224	1	1	92	1	1	8193	# 0.00 Gflop/s, 0.00 GB/s, tuned Mon Sep 23 17:41:20 2013
16x16x16x10	N4quda13fermion_force8SideLinkI7double2S2_EE	threads=20480,prec=8,recon=12,sig=3,mu=2	416	1	1	50	1	1	16385	# 0.00 Gflop/s, 0.00 GB/s, tuned Mon Sep 23 17:41:20 2013
16x16x16x10	N4quda13fermion_force8SideLinkI7double2S2_EE	threads=20480,prec=8,recon=12,sig=3,mu=5	224	1	1	92	1	1	0	# 0.00 Gflop/s, 0.00 GB/s, tuned Mon Sep 23 17:41:21 2013
16x16x16x10	N4quda13fermion_force8SideLinkI7double2S2_EE	threads=20480,prec=8,recon=12,sig=3,mu=6	416	1	1	50	1	1	0	# 0.00 Gflop/s, 0.00 GB/s, tuned Mon Sep 23 17:41:21 2013
16x16x16x10	N4quda13fermion_force8SideLinkI7double2S2_EE	threads=20480,prec=8,recon=12,sig=3,mu=7	416	1	1	50	1	1	7022	# 0.00 Gflop/s, 0.00 GB/s, tuned Mon Sep 23 17:41:22 2013
16x16x16x10	N4quda13fermion_force8SideLinkI7double2S2_EE	threads=20480,prec=8,recon=12,sig=4,mu=0	416	1	1	50	1	1	12289	# 0.00 Gflop/s, 0.00 GB/s, tuned Mon Sep 23 17:41:25 2013
16x16x16x10	N4quda13fermion_force8SideLinkI7double2S2_EE	threads=20480,prec=8,recon=12,sig=4,mu=1	416	1	1	50	1	1	16385	# 0.00 Gflop/s, 0.00 GB/s, tuned Mon Sep 23 17:41:23 2013
16x16x16x10	N4quda13fermion_force8SideLinkI7double2S2_EE	threads=20480,prec=8,recon=12,sig=4,mu=2	416	1	1	50	1	1	24577	# 0.00 Gflop/s, 0.00 GB/s, tuned Mon Sep 23 17:41:24 2013
16x16x16x10	N4quda13fermion_force8SideLinkI7double2S2_EE	threads=20480,prec=8,recon=12,sig=4,mu=5	416	1	1	50	1	1	16385	# 0.00 Gflop/s, 0.00 GB/s, tuned Mon Sep 23 17:41:24 2013
16x16x16x10	N4quda13fermion_force8SideLinkI7double2S2_EE	threads=20480,prec=8,recon=12,sig=4,mu=6	224	1	1	92	1	1	6145	# 0.00 Gflop/s, 0.00 GB/s, tuned Mon Sep 23 17:41:24 2013
16x16x16x10	N4quda13fermion_force8SideLinkI7double2S2_EE	threads=20480,prec=8,recon=12,sig=4,mu=7	416	1	1	50	1	1	8193	# 0.00 Gflop/s, 0.00 GB/s, tuned Mon Sep 23 17:41:25 2013
16x16x16x10	N4quda13fermion_force8SideLinkI7double2S2_EE	threads=20480,prec=8,recon=12,sig=5,mu=0	416	1	1	50	1	1	12289	# 0.00 Gflop/s, 0.00 GB/s, tuned Mon Sep 23 17:41:28 2013
16x16x16x10	N4quda13fermion_force8SideLinkI7double2S2_EE	threads=20480,prec=8,recon=12,sig=5,mu=1	416	1	1	50	1	1	8193	# 0.00 Gflop/s, 0.00 GB/s, tuned Mon Sep 23 17:41:26 2013
16x16x16x10	N4quda13fermion_force8SideLinkI7double2S2_EE	threads=20480,prec=8,recon=12,sig=5,mu=3	448	1	1	46	1	1	8193	# 0.00 Gflop/s, 0.00 GB/s, tuned Mon Sep 23 17:41:27 2013
16x16x16x10	N4quda13fermion_force8SideLinkI7double2S2_EE	threads=20480,prec=8,recon=12,sig=5,mu=4	416	1	1	50	1	1	7022	# 0.00 Gflop/s, 0.00 GB/s, tuned Mon Sep 23 17:41:27 2013
16x16x16x10	N4quda13fermion_force8SideLinkI7double2S2_EE	threads=20480,prec=8,recon=12,sig=5,mu=6	416	1	1	50	1	1	0	# 0.00 Gflop/s, 0.00 GB/s, tuned Mon Sep 23 17:41:27 2013
16x16x16x10	N4quda13fermion_force8SideLinkI7double2S2_EE	threads=20480,prec=8,recon=12,sig=5,mu=7	416	1	1	50	1	1	12289	# 0.00 Gflop/s, 0.00 GB/s, tuned Mon Sep 23 17:41:28 2013
16x16x16x10	N4quda13fermion_force8SideLinkI7double2S2_EE	threads=20480,prec=8,recon=12,sig=6,mu=0	416	1	1	50	1	1	0	# 0.00 Gflop/s, 0.00 GB/s, tuned Mon Sep 23 17:41:31 2013
16x16x16x10	N4quda13fermion_force8SideLinkI7double2S2_EE	threads=20480,prec=8,recon=12,sig=6,mu=2	416	1	1	50	1	1	9831	# 0.00 Gflop/s, 0.00 GB/s, tuned Mon Sep 23 17:41:30 2013
16x16x16x10	N4quda13fermion_force8SideLinkI7double2S2_EE	threads=20480,prec=8,recon=12,sig=6,mu=3	416	1	1	50	1	1	8193	# 0.00 Gflop/s, 0.00 GB/s, tuned Mon Sep 23 17:41:30 2013
16x16x16x10	N4quda13fermion_force8SideLinkI7double2S2_EE	threads=20480,prec=8,recon=12,sig=6,mu=4	224	1	1	92	1	1	9831	# 0.00 Gflop/s, 0.00 GB/s, tuned Mon Sep 23 17:41:30 2013
16x16x16x10	N4quda13fermion_force8SideLinkI7double2S2_EE	threads=20480,prec=8,recon=12,sig=6,mu=5	224	1	1	92	1	1	12289	# 0.00 Gflop/s, 0.00 GB/s, tuned Mon Sep 23 17:41:30 2013
16x16x16x10	N4quda13fermion_force8SideLinkI7double2S2_EE	threads=20480,prec=8,recon=12,sig=6,mu=7	416	1	1	50	1	1	7022	# 0.00 Gflop/s, 0.00 GB/s, tuned Mon Sep 23 17:41:31 2013
16x16x16x10	N4quda13fermion_force8SideLinkI7double2S2_EE	threads=20480,prec=8,recon=12,sig=7,mu=1	416	1	1	50	1	1	8193	# 0.00 Gflop/s, 0.00 GB/s, tuned Mon Sep 23 17:41:34 2013
16x16x16x10	N4quda13fermion_force8SideLinkI7double2S2_EE	threads=20480,prec=8,recon=12,sig=7,mu=2	416	1	1	50	1	1	9831	# 0.00 Gflop/s, 0.00 GB/s, tuned Mon Sep 23 17:41:33 2013
16x16x16x10	N4quda13fermion_force8SideLinkI7double2S2_EE	threads=20480,prec=8,recon=12,sig=7,mu=3	416	1	1	50	1	1	0	# 0.00 Gflop/s, 0.00 GB/s, tuned Mon Sep 23 17:41:33 2013
16x16x16x10	N4quda13fermion_force8SideLinkI7double2S2_EE	threads=20480,prec=8,recon=12,sig=7,mu=4	224	1	1	92	1	1	8193	# 0.00 Gflop/s, 0.00 GB/s, tuned Mon Sep 23 17:41:33 2013
16x16x16x10	N4quda13fermion_force8SideLinkI7double2S2_EE	threads=20480,prec=8,recon=12,sig=7,mu=5	416	1	1	50	1	1	0	# 0.00 Gflop/s, 0.00 GB/s, tuned Mon Sep 23 17:41:34 2013
16x16x16x10	N4quda13fermion_force8SideLinkI7double2S2_EE	threads=20480,prec=8,recon=12,sig=7,mu=6	416	1	1	50	1	1	8193	# 0.00 Gflop/s, 0.00 GB/s, tuned Mon Sep 23 17:41:34 2013
16x16x16x10	N4quda13fermion_force8SideLinkI7double2S2_EE	threads=20480,prec=8,recon=18,sig=0,mu=1	416	1	1	50	1	1	7022	# 0.00 Gflop/s, 0.00 GB/s, tuned Mon Sep 23 17:40:15 2013
16x16x16x10	N4quda13fermion_force8SideLinkI7double2S2_EE	threads=20480,prec=8,recon=18,sig=0,mu=2	544	1	1	38	1	1	7022	# 0.00 Gflop/s, 0.00 GB/s, tuned Mon Sep 23 17:40:14 2013
16x16x16x10	N4quda13fermion_force8SideLinkI7double2S2_EE	threads=20480,prec=8,recon=18,sig=0,mu=3	544	1	1	38	1	1	9831	# 0.00 Gflop/s, 0.00 GB/s, tuned Mon Sep 23 17:40:14 2013
16x16x16x10	N4quda13fermion_force8SideLinkI7double2S2_EE	threads=20480,prec=8,recon=18,sig=0,mu=4	416	1	1	50	1	1	9831	# 0.00 Gflop/s, 0.00 GB/s, tuned Mon Sep 23 17:40:14 2013
16x16x16x10	N4quda13fermion_force8SideLinkI7double2S2_EE	threads=20480,prec=8,recon=18,sig=0,mu=5	416	1	1	50	1	1	6145	# 0.00 Gflop/s, 0.00 GB/s, tuned Mon Sep 23 17:40:15 2013
16x16x16x10	N4quda13fermion_force8SideLinkI7double2S2_EE	threads=20480,prec=8,recon=18,sig=0,mu=6	448	1	1	46	1	1	6145	# 0.00 Gflop/s, 0.00 GB/s, tuned Mon Sep 23 17:40:16 2013
16x16x16x10	N4quda13fermion_force8SideLinkI7double2S2_EE	threads=20480,prec=8,recon=18,sig=1,mu=0	544	1	1	38	1	1	7022	# 0.00 Gflop/s, 0.00 GB/s, tuned Mon Sep 23 17:40:20 2013
16x16x16x10	N4quda13fermion_force8SideLinkI7double2S2_EE	threads=20480,prec=8,recon=18,sig=1,mu=2	544	1	1	38	1	1	7022	# 0.00 Gflop/s, 0.00 GB/s, tuned Mon Sep 23 17:40:19 2013
16x16x16x10	N4quda13fermion_force8SideLinkI7double2S2_EE	threads=20480,prec=8,recon=18,sig=1,mu=3	416	1	1	50	1	1	16385	# 0.00 Gflop/s, 0.00 GB/s, tuned Mon Sep 23 17:40:19 2013
16x16x16x10	N4quda13fermion_force8SideLinkI7double2S2_EE	threads=20480,prec=8,recon=18,sig=1,mu=4	416	1	1	50	1	1	24577	# 0.00 Gflop/s, 0.00 GB/s, tuned Mon Sep 23 17:40:19 2013
16x16x16x10	N4quda13fermion_force8SideLinkI7double2S2_EE	threads=20480,prec=8,recon=18,sig=1,mu=5	544	1	1	38	1	1	8193	# 0.00 Gflop/s, 0.00 GB/s, tuned Mon Sep 23 17:40:20 2013
16x16x16x10	N4quda13fermion_force8SideLinkI7double2S2_EE	threads=20480,prec=8,recon=18,sig=1,mu=7	544	1	1	38	1	1	7022	# 0.00 Gflop/s, 0.00 GB/s, tuned Mon Sep 23 17:40:21 2013
16x16x16x10	N4quda13fermion_force8SideLinkI7double2S2_EE	threads=20480,prec=8,recon=18,sig=2,mu=0	416	1	1	50	1	1	7022	# 0.00 Gflop/s, 0.00 GB/s, tuned Mon Sep 23 17:40:25 2013
16x16x16x10	N4quda13fermion_force8SideLinkI7double2S2_EE	threads=20480,prec=8,recon=18,sig=2,mu=1	416	1	1	50	1	1	16385	# 0.00 Gflop/s, 0.00 GB/s, tuned Mon Sep 23 17:40:23 2013
16x16x16x10	N4quda13fermion_force8SideLinkI7double2S2_EE	threads=20480,prec=8,recon=18,sig=2,mu=3	416	1	1	50	1	1	6145	# 0.00 Gflop/s, 0.00 GB/s, tuned Mon Sep 23 17:40:24 2013
16x16x16x10	N4quda13fermion_force8SideLinkI7double2S2_EE	threads=20480,prec=8,recon=18,sig=2,mu=4	416	1	1	50	1	1	7022	# 0.00 Gflop/s, 0.00 GB/s, tuned Mon Sep 23 17:40:24 2013
16x16x16x10	N4quda13fermion_force8SideLinkI7double2S2_EE	threads=20480,prec=8,recon=18,sig=2,mu=6	544	1	1	38	1	1	7022	# 0.00 Gflop/s, 0.00 GB/s, tuned Mon Sep 23 17:40:24 2013
16x16x16x10	N4quda13fermion_force8SideLinkI7double2S2_EE	threads=20480,prec=8,recon=18,sig=2,mu=7	544	1	1	38	1	1	12289	# 0.00 Gflop/s, 0.00 GB/s, tuned Mon Sep 23 17:40:26 2013
16x16x16x10	N4quda13fermion_force8SideLinkI7double2S2_EE	threads=20480,prec=8,recon=18,sig=3,mu=0	544	1	1	38	1	1	0	# 0.00 Gflop/s, 0.00 GB/s, tuned Mon Sep 23 17:40:30 2013
16x16x16x10	N4quda13fermion_force8SideLinkI7double2S2_EE	threads=20480,prec=8,recon=18,sig=3,mu=1	416	1	1	50	1	1	8193	# 0.00 Gflop/s, 0.00 GB/s, tuned Mon Sep 23 17:40:28 2013
16x16x16x10	N4quda13fermion_force8SideLinkI7double2S2_EE	threads=20480,prec=8,recon=18,sig=3,mu=2	544	1	1	38	1	1	24577	# 0.00 Gflop/s, 0.00 GB/s, tuned Mon Sep 23 17:40:29 2013
16x16x16x10	N4quda13fermion_force8SideLinkI7double2S2_EE	threads=20480,prec=8,recon=18,sig=3,mu=5	416	1	1	50	1	1	16385	# 0.00 Gflop/s, 0.00 GB/s, tuned Mon Sep 23 17:40:29 2013
16x16x16x10	N4quda13fermion_force8SideLinkI7double2S2_EE	threads=20480,prec=8,recon=18,sig=3,mu=6	544	1	1	38	1	1	0	# 0.00 Gflop/s, 0.00 GB/s, tuned Mon Sep 23 17:40:29 2013
16x16x16x10	N4quda13fermion_force8SideLinkI7double2S2_EE	threads=20480,prec=8,recon=18,sig=3,mu=7	544	1	1	38	1	1	16385	# 0.00 Gflop/s, 0.00 GB/s, tuned Mon Sep 23 17:40:30 2013
16x16x16x10	N4quda13fermion_force8SideLinkI7double2S2_EE	threads=20480,prec=8,recon=18,sig=4,mu=0	544	1	1	38	1	1	8193	# 0.00 Gflop/s, 0.00 GB/s, tuned Mon Sep 23 17:40:35 2013
16x16x16x10	N4quda13fermion_force8SideLinkI7double2S2_EE	threads=20480,prec=8,recon=18,sig=4,mu=1	416	1	1	50	1	1	6145	# 0.00 Gflop/s, 0.00 GB/s, tuned Mon Sep 23 17:40:33 2013
16x16x16x10	N4quda13fermion_force8SideLinkI7double2S2_EE	threads=20480,prec=8,recon=18,sig=4,mu=2	544	1	1	38	1	1	16385	# 0.00 Gflop/s, 0.00 GB/s, tuned Mon Sep 23 17:40:34 2013
16x16x16x10	N4quda13fermion_force8SideLinkI7double2S2_EE	threads=20480,prec=8,recon=18,sig=4,mu=5	544	1	1	38	1	1	6145	# 0.00 Gflop/s, 0.00 GB/s, tuned Mon Sep 23 17:40:34 2013
16x16x16x10	N4quda13fermion_force8SideLinkI7double2S2_EE	threads=20480,prec=8,recon=18,sig=4,mu=6	544	1	1	38	1	1	0	# 0.00 Gflop/s, 0.00 GB/s, tuned Mon Sep 23 17:40:34 2013
16x16x16x10	N4quda13fermion_force8SideLinkI7double2S2_EE	threads=20480,prec=8,recon=18,sig=4,mu=7	416	1	1	50	1	1	6145	# 0.00 Gflop/s, 0.00 GB/s, tuned Mon Sep 23 17:40:35 2013
16x16x16x10	N4quda13fermion_force8SideLinkI7double2S2_EE	threads=20480,prec=8,recon=18,sig=5,mu=0	544	1	1	38	1	1	8193	# 0.00 Gflop/s, 0.00 GB/s, tuned Mon Sep 23 17:40:40 2013
16x16x16x10	N4quda13fermion_force8SideLinkI7double2S2_EE	threads=20480,prec=8,recon=18,sig=5,mu=1	416	1	1	50	1	1	9831	# 0.00 Gflop/s, 0.00 GB/s, tuned Mon Sep 23 17:40:38 2013
16x16x16x10	N4quda13fermion_force8SideLinkI7double2S2_EE	threads=20480,prec=8,recon=18,sig=5,mu=3	544	1	1	38	1	1	0	# 0.00 Gflop/s, 0.00 GB/s, tuned Mon Sep 23 17:40:39 2013
16x16x16x10	N4quda13fermion_force8SideLinkI7double2S2_EE	threads=20480,prec=8,recon=18,sig=5,mu=4	416	1	1	50	1	1	24577	# 0.00 Gflop/s, 0.00 GB/s, tuned Mon Sep 23 17:40:39 2013
16x16x16x10	N4quda13fermion_force8SideLinkI7double2S2_EE	threads=20480,prec=8,recon=18,sig=5,mu=6	544	1	1	38	1	1	7022	# 0.00 Gflop/s, 0.00 GB/s, tuned Mon Sep 23 17:40:39 2013
16x16x16x10	N4quda13fermion_force8SideLinkI7double2S2_EE	threads=20480,prec=8,recon=18,sig=5,mu=7	416	1	1	50	1	1	16385	# 0.00 Gflop/s, 0.00 GB/s, tuned Mon Sep 23 17:40:40 2013
16x16x16x10	N4quda13fermion_force8SideLinkI7double2S2_EE	threads=20480,prec=8,recon=18,sig=6,mu=0	544	1	1	38	1	1	7022	# 0.00 Gflop/s, 0.00 GB/s, tuned Mon Sep 23 17:40:45 2013
16x16x16x10	N4quda13fermion_force8SideLinkI7double2S2_EE	threads=20480,prec=8,recon=18,sig=6,mu=2	544	1	1	38	1	1	24577	# 0.00 Gflop/s, 0.00 GB/s, tuned Mon Sep 23 17:40:43 2013
16x16x16x10	N4quda13fermion_force8SideLinkI7double2S2_EE	threads=20480,prec=8,recon=18,sig=6,mu=3	544	1	1	38	1	1	16385	# 0.00 Gflop/s, 0.00 GB/s, tuned Mon Sep 23 17:40:43 2013
16x16x16x10	N4quda13fermion_force8SideLinkI7double2S2_EE	threads=20480,prec=8,recon=18,sig=6,mu=4	448	1	1	46	1	1	7022	# 0.00 Gflop/s, 0.00 GB/s, tuned Mon Sep 23 17:40:44 2013
16x16x16x10	N4quda13fermion_force8SideLinkI7double2S2_EE	threads=20480,prec=8,recon=18,sig=6,mu=5	544	1	1	38	1	1	7022	# 0.00 Gflop/s, 0.00 GB/s, tuned Mon Sep 23 17:40:44 2013
16x16x16x10	N4quda13fermion_force8SideLinkI7double2S2_EE	threads=20480,prec=8,recon=18,sig=6,mu=7	544	1	1	38	1	1	24577	# 0.00 Gflop/s, 0.00 GB/s, tuned Mon Sep 23 17:40:45 2013
16x16x16x10	N4quda13fermion_force8SideLinkI7double2S2_EE	threads=20480,prec=8,recon=18,sig=7,mu=1	544	1	1	38	1	1	16385	# 0.00 Gflop/s, 0.00 GB/s, tuned Mon Sep 23 17:40:49 2013
16x16x16x10	N4quda13fermion_force8SideLinkI7double2S2_EE	threads=20480,prec=8,recon=18,sig=7,mu=2	288	1	1	72	1	1	6145	# 0.00 Gflop/s, 0.00 GB/s, tuned Mon Sep 23 17:40:48 2013
16x16x16x10	N4quda13fermion_force8SideLinkI7double2S2_EE	threads=20480,prec=8,recon=18,sig=7,mu=3	544	1	1	38	1	1	12289	# 0.00 Gflop/s, 0.00 GB/s, tuned Mon Sep 23 17:40:48 2013
16x16x16x10	N4quda13fermion_force8SideLinkI7double2S2_EE	threads=20480,prec=8,recon=18,sig=7,mu=4	448	1	1	46	1	1	6145	# 0.00 Gflop/s, 0.00 GB/s, tuned Mon Sep 23 17:40:48 2013
16x16x16x10	N4quda13fermion_force8SideLinkI7double2S2_EE	threads=20480,prec=8,recon=18,sig=7,mu=5	544	1	1	38	1	1	24577	# 0.00 Gflop/s, 0.00 GB/s, tuned Mon Sep 23 17:40:49 2013
16x16x16x10	N4quda13fermion_force8SideLinkI7double2S2_EE	threads=20480,prec=8,recon=18,sig=7,mu=6	416	1	1	50	1	1	8193	# 0.00 Gflop/s, 0.00 GB/s, tuned Mon Sep 23 17:40:50 2013
16x16x16x12	N4quda13fermion_force10MiddleLinkI7double2S2_EE	threads=24576,prec=8,recon=12,sig=0,mu=1	256	1	1	96	1	1	8193	# 0.00 Gflop/s, 0.00 GB/s, tuned Mon Sep 23 17:41:10 2013
16x16x16x12	N4quda13fermion_force10MiddleLinkI7double2S2_EE	threads=24576,prec=8,recon=12,sig=0,mu=2	256	1	1	96	1	1	0	# 0.00 Gflop/s, 0.00 GB/s, tuned Mon Sep 23 17:41:11 2013
16x16x16x12	N4quda13fermion_force10MiddleLinkI7double2S2_EE	threads=24576,prec=8,recon=12,sig=0,mu=3	256	1	1	96	1	1	16385	# 0.00 Gflop/s, 0.00 GB/s, tuned Mon Sep 23 17:41:12 2013
16x16x16x12	N4quda13fermion_force10MiddleLinkI7double2S2_EE	threads=24576,prec=8,recon=12,sig=0,mu=4	224	1	1	110	1	1	9831	# 0.00 Gflop/s, 0.00 GB/s, tuned Mon Sep 23 17:41:12 2013
16x16x16x12	N4quda13fermion_force10MiddleLinkI7double2S2_EE	threads=24576,prec=8,recon=12,sig=0,mu=5	256	1	1	96	1	1	6145	# 0.00 Gflop/s, 0.00 GB/s, tuned Mon Sep 23 17:41:12 2013
16x16x16x12	N4quda13fermion_force10MiddleLinkI7double2S2_EE	threads=24576,prec=8,recon=12,sig=0,mu=6	256	1	1	96	1	1	0	# 0.00 Gflop/s, 0.00 GB/s, tuned Mon Sep 23 17:41:13 2013
16x16x16x12	N4quda13fermion_force10MiddleLinkI7double2S2_EE	threads=24576,prec=8,recon=12,sig=1,mu=0	256	1	1	96	1	1	6145	# 0.00 Gflop/s, 0.00 GB/s, tuned Mon Sep 23 17:41:13 2013
16x16x16x12	N4quda13fermion_force10MiddleLinkI7double2S2_EE	threads=24576,prec=8,recon=12,sig=1,mu=2	224	1	1	110	1	1	7022	# 0.00 Gflop/s, 0.00 GB/s, tuned Mon Sep 23 17:41:14 2013
16x16x16x12	N4quda13fermion_force10MiddleLinkI7double2S2_EE	threads=24576,prec=8,recon=12,sig=1,mu=3	256	1	1	96	1	1	7022	# 0.00 Gflop/s, 0.00 GB/s, tuned Mon Sep 23 17:41:15 2013
16x16x16x12	N4quda13fermion_force10MiddleLinkI7double2S2_EE	threads=24576,prec=8,recon=12,sig=1,mu=4	256	1	1	96	1	1	16385	# 0.00 Gflop/s, 0.00 GB/s, tuned Mon Sep 23 17:41:16 2013
16x16x16x12	N4quda13fermion_force10MiddleLinkI7double2S2_EE	threads=24576,prec=8,recon=12,sig=1,mu=5	256	1	1	96	1	1	6145	# 0.00 Gflop/s, 0.00 GB/s, tuned Mon Sep 23 17:41:16 2013
16x16x16x12	N4quda13fermion_force10MiddleLinkI7double2S2_EE	threads=24576,prec=8,recon=12,sig=1,mu=7	224	1	1	110	1	1	7022	# 0.00 Gflop/s, 0.00 GB/s, tuned Mon Sep 23 17:41:16 2013
16x16x16x12	N4quda13fermion_force10MiddleLinkI7double2S2_EE	threads=24576,prec=8,recon=12,sig=2,mu=0	256	1	1	96	1	1	12289	# 0.00 Gflop/s, 0.00 GB/s, tuned Mon Sep 23 17:41:16 2013
16x16x16x12	N4quda13fermion_force10MiddleLinkI7double2S2_EE	threads=24576,prec=8,recon=12,sig=2,mu=1	256	1	1	96	1	1	8193	# 0.00 Gflop/s, 0.00 GB/s, tuned Mon Sep 23 17:41:18 2013
16x16x16x12	N4quda13fermion_force10MiddleLinkI7double2S2_EE	threads=24576,prec=8,recon=12,sig=2,mu=3	256	1	1	96	1	1	16385	# 0.00 Gflop/s, 0.00 GB/s, tuned Mon Sep 23 17:41:19 2013
16x16x16x12	N4quda13fermion_force10MiddleLinkI7double2S2_EE	threads=24576,prec=8,recon=12,sig=2,mu=4	320	1	1	77	1	1	9831	# 0.00 Gflop/s, 0.00 GB/s, tuned Mon Sep 23 17:41:19 2013
16x16x16x12	N4quda13fermion_force10MiddleLinkI7double2S2_EE	threads=24576,prec=8,recon=12,sig=2,mu=6	256	1	1	96	1	1	12289	# 0.00 Gflop/s, 0.00 GB/s, tuned Mon Sep 23 17:41:19 2013
16x16x16x12	N4quda13fermion_force10MiddleLinkI7double2S2_EE	threads=24576,prec=8,recon=12,sig=2,mu=7	256	1	1	96	1	1	8193	# 0.00 Gflop/s, 0.00 GB/s, tuned Mon Sep 23 17:41:19 2013
16x16x16x12	N4quda13fermion_force10MiddleLinkI7double2S2_EE	threads=24576,prec=8,recon=12,sig=3,mu=0	256	1	1	96	1	1	6145	# 0.00 Gflop/s, 0.00 GB/s, tuned Mon Sep 23 17:41:20 2013
16x16x16x12	N4quda13fermion_force10MiddleLinkI7double2S2_EE	threads=24576,prec=8,recon=12,sig=3,mu=1	288	1	1	86	1	1	9831	# 0.00 Gflop/s, 0.00 GB/s, tuned Mon Sep 23 17:41:21 2013
16x16x16x12	N4quda13fermion_force10MiddleLinkI7double2S2_EE	threads=24576,prec=8,recon=12,sig=3,mu=2	224	1	1	110	1	1	6145	# 0.00 Gflop/s, 0.00 GB/s, tuned Mon Sep 23 17:41:22 2013
16x16x16x12	N4quda13fermion_force10MiddleLinkI7double2S2_EE	threads=24576,prec=8,recon=12,sig=3,mu=5	256	1	1	96	1	1	7022	# 0.00 Gflop/s, 0.00 GB/s, tuned Mon Sep 23 17:41:22 2013
16x16x16x12	N4quda13fermion_force10MiddleLinkI7double2S2_EE	threads=24576,prec=8,recon=12,sig=3,mu=6	256	1	1	96	1	1	24577	# 0.00 Gflop/s, 0.00 GB/s, tuned Mon Sep 23 17:41:22 2013
16x16x16x12	N4quda13fermion_force10MiddleLinkI7double2S2_EE	threads=24576,prec=8,recon=12,sig=3,mu=7	256	1	1	96	1	1	0	# 0.00 Gflop/s, 0.00 GB/s, tuned Mon Sep 23 17:41:23 2013
16x16x16x12	N4quda13fermion_force10MiddleLinkI7double2S2_EE	threads=24576,prec=8,recon=12,sig=4,mu=0	256	1	1	96	1	1	16385	# 0.00 Gflop/s, 0.00 GB/s, tuned Mon Sep 23 17:41:23 2013
16x16x16x12	N4quda13fermion_force10MiddleLinkI7double2S2_EE	threads=24576,prec=8,recon=12,sig=4,mu=1	256	1	1	96	1	1	8193	# 0.00 Gflop/s, 0.00 GB/s, tuned Mon Sep 23 17:41:24 2013
16x16x16x12	N4quda13fermion_force10MiddleLinkI7double2S2_EE	threads=24576,prec=8,recon=12,sig=4,mu=2	256	1	1	96	1	1	24577	# 0.00 Gflop/s, 0.00 GB/s, tuned Mon Sep 23 17:41:25 2013
16x16x16x12	N4quda13fermion_force10MiddleLinkI7double2S2_EE	threads=24576,prec=8,recon=12,sig=4,mu=5	256	1	1	96	1	1	6145	# 0.00 Gflop/s, 0.00 GB/s, tuned Mon Sep 23 17:41:25 2013
16x16x16x12	N4quda13fermion_force10MiddleLinkI7double2S2_EE	threads=24576,prec=8,recon=12,sig=4,mu=6	256	1	1	96	1	1	16385	# 0.00 Gflop/s, 0.00 GB/s, tuned Mon Sep 23 17:41:26 2013
16x16x16x12	N4quda13fermion_force10MiddleLinkI7double2S2_EE	threads=24576,prec=8,recon=12,sig=4,mu=7	256	1	1	96	1	1	8193	# 0.00 Gflop/s, 0.00 GB/s, tuned Mon Sep 23 17:41:26 2013
16x16x16x12	N4quda13fermion_force10MiddleLinkI7double2S2_EE	threads=24576,prec=8,recon=12,sig=5,mu=0	256	1	1	96	1	1	16385	# 0.00 Gflop/s, 0.00 GB/s, tuned Mon Sep 23 17:41:26 2013
16x16x16x12	N4quda13fermion_force10MiddleLinkI7double2S2_EE	threads=24576,prec=8,recon=12,sig=5,mu=1	256	1	1	96	1	1	8193	# 0.00 Gflop/s, 0.00 GB/s, tuned Mon Sep 23 17:41:27 2013
16x16x16x12	N4quda13fermion_force10MiddleLinkI7double2S2_EE	threads=24576,prec=8,recon=12,sig=5,mu=3	256	1	1	96	1	1	8193	# 0.00 Gflop/s, 0.00 GB/s, tuned Mon Sep 23 17:41:28 2013
16x16x16x12	N4quda13fermion_force10MiddleLinkI7double2S2_EE	threads=24576,prec=8,recon=12,sig=5,mu=4	256	1	1	96	1	1	0	# 0.00 Gflop/s, 0.00 GB/s, tuned Mon Sep 23 17:41:29 2013
16x16x16x12	N4quda13fermion_force10MiddleLinkI7double2S2_EE	threads=24576,prec=8,recon=12,sig=5,mu=6	256	1	1	96	1	1	12289	# 0.00 Gflop/s, 0.00 GB/s, tuned Mon Sep 23 17:41:29 2013
16x16x16x12	N4quda13fermion_force10MiddleLinkI7double2S2_EE	threads=24576,prec=8,recon=12,sig=5,mu=7	224	1	1	110	1	1	9831	# 0.00 Gflop/s, 0.00 GB/s, tuned Mon Sep 23 17:41:29 2013
16x16x16x12	N4quda13fermion_force10MiddleLinkI7double2S2_EE	threads=24576,prec=8,recon=12,sig=6,mu=0	256	1	1	96	1	1	8193	# 0.00 Gflop/s, 0.00 GB/s, tuned Mon Sep 23 17:41:29 2013
16x16x16x12	N4quda13fermion_force10MiddleLinkI7double2S2_EE	threads=24576,prec=8,recon=12,sig=6,mu=2	224	1	1	110	1	1	12289	# 0.00 Gflop/s, 0.00 GB/s, tuned Mon Sep 23 17:41:31 2013
16x16x16x12	N4quda13fermion_force10MiddleLinkI7double2S2_EE	threads=24576,prec=8,recon=12,sig=6,mu=3	256	1	1	96	1	1	0	# 0.00 Gflop/s, 0.00 GB/s, tuned Mon Sep 23 17:41:31 2013
16x16x16x12	N4quda13fermion_force10MiddleLinkI7double2S2_EE	threads=24576,prec=8,recon=12,sig=6,mu=4	256	1	1	96	1	1	12289	# 0.00 Gflop/s, 0.00 GB/s, tuned Mon Sep 23 17:41:32 2013
16x16x16x12	N4quda13fermion_force10MiddleLinkI7double2S2_EE	threads=24576,prec=8,recon=12,sig=6,mu=5	256	1	1	96	1	1	16385	# 0.00 Gflop/s, 0.00 GB/s, tuned Mon Sep 23 17:41:32 2013
16x16x16x12	N4quda13fermion_force10MiddleLinkI7double2S2_EE	threads=24576,prec=8,recon=12,sig=6,mu=7	224	1	1	110	1	1	9831	# 0.00 Gflop/s, 0.00 GB/s, tuned Mon Sep 23 17:41:32 2013
16x16x16x12	N4quda13fermion_force10MiddleLinkI7double2S2_EE	threads=24576,prec=8,recon=12,sig=7,mu=1	224	1	1	110	1	1	7022	# 0.00 Gflop/s, 0.00 GB/s, tuned Mon Sep 23 17:41:32 2013
16x16x16x12	N4quda13fermion_force10MiddleLinkI7double2S2_EE	threads=24576,prec=8,recon=12,sig=7,mu=2	320	1	1	77	1	1	16385	# 0.00 Gflop/s, 0.00 GB/s, tuned Mon Sep 23 17:41:34 2013
16x16x16x12	N4quda13fermion_force10MiddleLinkI7double2S2_EE	threads=24576,prec=8,recon=12,sig=7,mu=3	256	1	1	96	1	1	9831	# 0.00 Gflop/s, 0.00 GB/s, tuned Mon Sep 23 17:41:35 2013
16x16x16x12	N4quda13fermion_force10MiddleLinkI7double2S2_EE	threads=24576,prec=8,recon=12,sig=7,mu=4	256	1	1	96	1	1	9831	# 0.00 Gflop/s, 0.00 GB/s, tuned Mon Sep 23 17:41:35 2013
16x16x16x12	N4quda13fermion_force10MiddleLinkI7double2S2_EE	threads=24576,prec=8,recon=12,sig=7,mu=5	320	1	1	77	1	1	7022	# 0.00 Gflop/s, 0.00 GB/s, tuned Mon Sep 23 17:41:35 2013
16x16x16x12	N4quda13fermion_force10MiddleLinkI7double2S2_EE	threads=24576,prec=8,recon=12,sig=7,mu=6	224	1	1	110	1	1	8193	# 0.00 Gflop/s, 0.00 GB/s, tuned Mon Sep 23 17:41:35 2013
16x16x16x12	N4quda13fermion_force10MiddleLinkI7double2S2_EE	threads=24576,prec=8,recon=18,sig=0,mu=1	256	1	1	96	1	1	8193	# 0.00 Gflop/s, 0.00 GB/s, tuned Mon Sep 23 17:40:13 2013
16x16x16x12	N4quda13fermion_force10MiddleLinkI7double2S2_EE	threads=24576,prec=8,recon=18,sig=0,mu=2	224	1	1	110	1	1	8193	# 0.00 Gflop/s, 0.00 GB/s, tuned Mon Sep 23 17:40:15 2013
16x16x16x12	N4quda13fermion_force10MiddleLinkI7double2S2_EE	threads=24576,prec=8,recon=18,sig=0,mu=3	224	1	1	110	1	1	9831	# 0.00 Gflop/s, 0.00 GB/s, tuned Mon Sep 23 17:40:16 2013
16x16x16x12	N4quda13fermion_force10MiddleLinkI7double2S2_EE	threads=24576,prec=8,recon=18,sig=0,mu=4	256	1	1	96	1	1	0	# 0.00 Gflop/s, 0.00 GB/s, tuned Mon Sep 23 17:40:17 2013
16x16x16x12	N4quda13fermion_force10MiddleLinkI7double2S2_EE	threads=24576,prec=8,recon=18,sig=0,mu=5	256	1	1	96	1	1	16385	# 0.00 Gflop/s, 0.00 GB/s, tuned Mon Sep 23 17:40:17 2013
16x16x16x12	N4quda13fermion_force10MiddleLinkI7double2S2_EE	threads=24576,prec=8,recon=18,sig=0,mu=6	256	1	1	96	1	1	16385	# 0.00 Gflop/s, 0.00 GB/s, tuned Mon Sep 23 17:40:18 2013
16x16x16x12	N4quda13fermion_force10MiddleLinkI7double2S2_EE	threads=24576,prec=8,recon=18,sig=1,mu=0	256	1	1	96	1	1	8193	# 0.00 Gflop/s, 0.00 GB/s, tuned Mon Sep 23 17:40:18 2013
16x16x16x12	N4quda13fermion_force10MiddleLinkI7double2S2_EE	threads=24576,prec=8,recon=18,sig=1,mu=2	256	1	1	96	1	1	7022	# 0.00 Gflop/s, 0.00 GB/s, tuned Mon Sep 23 17:40:20 2013
16x16x16x12	N4quda13fermion_force10MiddleLinkI7double2S2_EE	threads=24576,prec=8,recon=18,sig=1,mu=3	256	1	1	96	1	1	16385	# 0.00 Gflop/s, 0.00 GB/s, tuned Mon Sep 23 17:40:21 2013
16x16x16x12	N4quda13fermion_force10MiddleLinkI7double2S2_EE	threads=24576,prec=8,recon=18,sig=1,mu=4	256	1	1	96	1	1	12289	# 0.00 Gflop/s, 0.00 GB/s, tuned Mon Sep 23 17:40:22 2013
16x16x16x12	N4quda13fermion_force10MiddleLinkI7double2S2_EE	threads=24576,prec=8,recon=18,sig=1,mu=5	256	1	1	96	1	1	0	# 0.00 Gflop/s, 0.00 GB/s, tuned Mon Sep 23 17:40:22 2013
16x16x16x12	N4quda13fermion_force10MiddleLinkI7double2S2_EE	threads=24576,prec=8,recon=18,sig=1,mu=7	256	1	1	96	1	1	12289	# 0.00 Gflop/s, 0.00 GB/s, tuned Mon Sep 23 17:40:23 2013
16x16x16x12	N4quda13fermion_force10MiddleLinkI7double2S2_EE	threads=24576,prec=8,recon=18,sig=2,mu=0	224	1	1	110	1	1	12289	# 0.00 Gflop/s, 0.00 GB/s, tuned Mon Sep 23 17:40:23 2013
16x16x16x12	N4quda13fermion_force10MiddleLinkI7double2S2_EE	threads=24576,prec=8,recon=18,sig=2,mu=1	256	1	1	96	1	1	8193	# 0.00 Gflop/s, 0.00 GB/s, tuned Mon Sep 23 17:40:25 2013
16x16x16x12	N4quda13fermion_force10MiddleLinkI7double2S2_EE	threads=24576,prec=8,recon=18,sig=2,mu=3	256	1	1	96	1	1	8193	# 0.00 Gflop/s, 0.00 GB/s, tuned Mon Sep 23 17:40:26 2013
16x16x16x12	N4quda13fermion_force10MiddleLinkI7double2S2_EE	threads=24576,prec=8,recon=18,sig=2,mu=4	224	1	1	110	1	1	16385	# 0.00 Gflop/s, 0.00 GB/s, tuned Mon Sep 23 17:40:27 2013
16x16x16x12	N4quda13fermion_force10MiddleLinkI7double2S2_EE	threads=24576,prec=8,recon=18,sig=2,mu=6	256	1	1	96	1	1	8193	# 0.00 Gflop/s, 0.00 GB/s, tuned Mon Sep 23 17:40:27 2013
16x16x16x12	N4quda13fermion_force10MiddleLinkI7double2S2_EE	threads=24576,prec=8,recon=18,sig=2,mu=7	256	1	1	96	1	1	7022	# 0.00 Gflop/s, 0.00 GB/s, tuned Mon Sep 23 17:40:27 2013
16x16x16x12	N4quda13fermion_force10MiddleLinkI7double2S2_EE	threads=24576,prec=8,recon=18,sig=3,mu=0	256	1	1	96	1	1	24577	# 0.00 Gflop/s, 0.00 GB/s, tuned Mon Sep 23 17:40:28 2013
16x16x16x12	N4quda13fermion_force10MiddleLinkI7double2S2_EE	threads=24576,prec=8,recon=18,sig=3,mu=1	224	1	1	110	1	1	24577	# 0.00 Gflop/s, 0.00 GB/s, tuned Mon Sep 23 17:40:30 2013
16x16x16x12	N4quda13fermion_force10MiddleLinkI7double2S2_EE	threads=24576,prec=8,recon=18,sig=3,mu=2	256	1	1	96	1	1	9831	# 0.00 Gflop/s, 0.00 GB/s, tuned Mon Sep 23 17:40:31 2013
16x16x16x12	N4quda13fermion_force10MiddleLinkI7double2S2_EE	threads=24576,prec=8,recon=18,sig=3,mu=5	256	1	1	96	1	1	12289	# 0.00 Gflop/s, 0.00 GB/s, tuned Mon Sep 23 17:40:31 2013
16x16x16x12	N4quda13fermion_force10MiddleLinkI7double2S2_EE	threads=24576,prec=8,recon=18,sig=3,mu=6	256	1	1	96	1	1	6145	# 0.00 Gflop/s, 0.00 GB/s, tuned Mon Sep 23 17:40:32 2013
16x16x16x12	N4quda13fermion_force10MiddleLinkI7double2S2_EE	threads=24576,prec=8,recon=18,sig=3,mu=7	256	1	1	96	1	1	0	# 0.00 Gflop/s, 0.00 GB/s, tuned Mon Sep 23 17:40:32 2013
16x16x16x12	N4quda13fermion_force10MiddleLinkI7double2S2_EE	threads=24576,prec=8,recon=18,sig=4,mu=0	256	1	1	96	1	1	12289	# 0.00 Gflop/s, 0.00 GB/s, tuned Mon Sep 23 17:40:33 2013
16x16x16x12	N4quda13fermion_force10MiddleLinkI7double2S2_EE	threads=24576,prec=8,recon=18,sig=4,mu=1	256	1	1	96	1	1	6145	# 0.00 Gflop/s, 0.00 GB/s, tuned Mon Sep 23 17:40:35 2013
16x16x16x12	N4quda13fermion_force10MiddleLinkI7double2S2_EE	threads=24576,prec=8,recon=18,sig=4,mu=2	224	1	1	110	1	1	0	# 0.00 Gflop/s, 0.00 GB/s, tuned Mon Sep 23 17:40:36 2013
16x16x16x12	N4quda13fermion_force10MiddleLinkI7double2S2_EE	threads=24576,prec=8,recon=18,sig=4,mu=5	256	1	1	96	1	1	12289	# 0.00 Gflop/s, 0.00 GB/s, tuned Mon Sep 23 17:40:36 2013
16x16x16x12	N4quda13fermion_force10MiddleLinkI7double2S2_EE	threads=24576,prec=8,recon=18,sig=4,mu=6	256	1	1	96	1	1	8193	# 0.00 Gflop/s, 0.00 GB/s, tuned Mon Sep 23 17:40:37 2013
16x16x16x12	N4quda13fermion_force10MiddleLinkI7double2S2_EE	threads=24576,prec=8,recon=18,sig=4,mu=7	256	1	1	96	1	1	9831	# 0.00 Gflop/s, 0.00 GB/s, tuned Mon Sep 23 17:40:37 2013
16x16x16x12	N4quda13fermion_force10MiddleLinkI7double2S2_EE	threads=24576,prec=8,recon=18,sig=5,mu=0	256	1	1	96	1	1	24577	# 0.00 Gflop/s, 0.00 GB/s, tuned Mon Sep 23 17:40:38 2013
16x16x16x12	N4quda13fermion_force10MiddleLinkI7double2S2_EE	threads=24576,prec=8,recon=18,sig=5,mu=1	256	1	1	96	1	1	0	# 0.00 Gflop/s, 0.00 GB/s, tuned Mon Sep 23 17:40:39 2013
16x16x16x12	N4quda13fermion_force10MiddleLinkI7double2S2_EE	threads=24576,prec=8,recon=18,sig=5,mu=3	256	1	1	96	1	1	12289	# 0.00 Gflop/s, 0.00 GB/s, tuned Mon Sep 23 17:40:41 2013
16x16x16x12	N4quda13fermion_force10MiddleLinkI7double2S2_EE	threads=24576,prec=8,recon=18,sig=5,mu=4	256	1	1	96	1	1	8193	# 0.00 Gflop/s, 0.00 GB/s, tuned Mon Sep 23 17:40:41 2013
16x16x16x12	N4quda13fermion_force10MiddleLinkI7double2S2_EE	threads=24576,prec=8,recon=18,sig=5,mu=6	256	1	1	96	1	1	7022	# 0.00 Gflop/s, 0.00 GB/s, tuned Mon Sep 23 17:40:42 2013
16x16x16x12	N4quda13fermion_force10MiddleLinkI7double2S2_EE	threads=24576,prec=8,recon=18,sig=5,mu=7	256	1	1	96	1	1	8193	# 0.00 Gflop/s, 0.00 GB/s, tuned Mon Sep 23 17:40:42 2013
16x16x16x12	N4quda13fermion_force10MiddleLinkI7double2S2_EE	threads=24576,prec=8,recon=18,sig=6,mu=0	256	1	1	96	1	1	9831	# 0.00 Gflop/s, 0.00 GB/s, tuned Mon Sep 23 17:40:42 2013
16x16x16x12	N4quda13fermion_force10MiddleLinkI7double2S2_EE	threads=24576,prec=8,recon=18,sig=6,mu=2	256	1	1	96	1	1	7022	# 0.00 Gflop/s, 0.00 GB/s, tuned Mon Sep 23 17:40:44 2013
16x16x16x12	N4quda13fermion_force10MiddleLinkI7double2S2_EE	threads=24576,prec=8,recon=18,sig=6,mu=3	256	1	1	96	1	1	9831	# 0.00 Gflop/s, 0.00 GB/s, tuned Mon Sep 23 17:40:45 2013
16x16x16x12	N4quda13fermion_force10MiddleLinkI7double2S2_EE	threads=24576,prec=8,recon=18,sig=6,mu=4	256	1	1	96	1	1	24577	# 0.00 Gflop/s, 0.00 GB/s, tuned Mon Sep 23 17:40:46 2013
16x16x16x12	N4quda13fermion_force10MiddleLinkI7double2S2_EE	threads=24576,prec=8,recon=18,sig=6,mu=5	256	1	1	96	1	1	16385	# 0.00 Gflop/s, 0.00 GB/s, tuned Mon Sep 23 17:40:46 2013
16x16x16x12	N4quda13fermion_force10MiddleLinkI7double2S2_EE	threads=24576,prec=8,recon=18,sig=6,mu=7	256	1	1	96	1	1	0	# 0.00 Gflop/s, 0.00 GB/s, tuned Mon Sep 23 17:40:47 2013
16x16x16x12	N4quda13fermion_force10MiddleLinkI7double2S2_EE	threads=24576,prec=8,recon=18,sig=7,mu=1	256	1	1	96	1	1	24577	# 0.00 Gflop/s, 0.00 GB/s, tuned Mon Sep 23 17:40:47 2013
16x16x16x12	N4quda13fermion_force10MiddleLinkI7double2S2_EE	threads=24576,prec=8,recon=18,sig=7,mu=2	256	1	1	96	1	1	24577	# 0.00 Gflop/s, 0.00 GB/s, tuned Mon Sep 23 17:40:49 2013
16x16x16x12	N4quda13fermion_force10MiddleLinkI7double2S2_EE	threads=24576,prec=8,recon=18,sig=7,mu=3	256	1	1	96	1	1	24577	# 0.00 Gflop/s, 0.00 GB/s, tuned Mon Sep 23 17:40:50 2013
16x16x16x12	N4quda13fermion_force10MiddleLinkI7double2S2_EE	threads=24576,prec=8,recon=18,sig=7,mu=4	256	1	1	96	1	1	7022	# 0.00 Gflop/s, 0.00 GB/s, tuned Mon Sep 23 17:40:51 2013
16x16x16x12	N4quda13fermion_force10MiddleLinkI7double2S2_EE	threads=24576,prec=8,recon=18,sig=7,mu=5	256	1	1	96	1	1	8193	# 0.00 Gflop/s, 0.00 GB/s, tuned Mon Sep 23 17:40:51 2013
16x16x16x12	N4quda13fermion_force10MiddleLinkI7double2S2_EE	threads=24576,prec=8,recon=18,sig=7,mu=6	256	1	1	96	1	1	0	# 0.00 Gflop/s, 0.00 GB/s, tuned Mon Sep 23 17:40:52 2013
16x16x16x12	N4quda13fermion_force16LepageMiddleLinkI7double2S2_EE	threads=24576,prec=8,recon=18,sig=0,mu=1	384	1	1	64	1	1	12289	# 0.00 Gflop/s, 0.00 GB/s, tuned Mon Sep 23 17:40:15 2013
16x16x16x12	N4quda13fermion_force16LepageMiddleLinkI7double2S2_EE	threads=24576,prec=8,recon=18,sig=0,mu=2	384	1	1	64	1	1	16385	# 0.00 Gflop/s, 0.00 GB/s, tuned Mon Sep 23 17:40:16 2013
16x16x16x12	N4quda13fermion_force16LepageMiddleLinkI7double2S2_EE	threads=24576,prec=8,recon=18,sig=0,mu=3	320	1	1	77	1	1	8193	# 0.00 Gflop/s, 0.00 GB/s, tuned Mon Sep 23 17:40:16 2013
16x16x16x12	N4quda13fermion_force16LepageMiddleLinkI7double2S2_EE	threads=24576,prec=8,recon=18,sig=0,mu=4	224	1	1	110	1	1	16385	# 0.00 Gflop/s, 0.00 GB/s, tuned Mon Sep 23 17:40:17 2013
16x16x16x12	N4quda13fermion_force16LepageMiddleLinkI7double2S2_EE	threads=24576,prec=8,recon=18,sig=0,mu=5	224	1	1	110	1	1	7022	# 0.00 Gflop/s, 0.00 GB/s, tuned Mon Sep 23 17:40:17 2013
16x16x16x12	N4quda13fermion_force16LepageMiddleLinkI7double2S2_EE	threads=24576,prec=8,recon=18,sig=0,mu=6	256	1	1	96	1	1	6145	# 0.00 Gflop/s, 0.00 GB/s, tuned Mon Sep 23 17:40:18 2013
16x16x16x12	N4quda13fermion_force16LepageMiddleLinkI7double2S2_EE	threads=24576,prec=8,recon=18,sig=1,mu=0	384	1	1	64	1	1	16385	# 0.00 Gflop/s, 0.00 GB/s, tuned Mon Sep 23 17:40:20 2013
16x16x16x12	N4quda13fermion_force16LepageMiddleLinkI7double2S2_EE	threads=24576,prec=8,recon=18,sig=1,mu=2	320	1	1	77	1	1	16385	# 0.00 Gflop/s, 0.00 GB/s, tuned Mon Sep 23 17:40:21 2013
16x16x16x12	N4quda13fermion_force16LepageMiddleLinkI7double2S2_EE	threads=24576,prec=8,recon=18,sig=1,mu=3	256	1	1	96	1	1	7022	# 0.00 Gflop/s, 0.00 GB/s, tuned Mon Sep 23 17:40:21 2013
16x16x16x12	N4quda13fermion_force16LepageMiddleLinkI7double2S2_EE	threads=24576,prec=8,recon=18,sig=1,mu=4	256	1	1	96	1	1	16385	# 0.00 Gflop/s, 0.00 GB/s, tuned Mon Sep 23 17:40:22 2013
16x16x16x12	N4quda13fermion_force16LepageMiddleLinkI7double2S2_EE	threads=24576,prec=8,recon=18,sig=1,mu=5	256	1	1	96	1	1	7022	# 0.00 Gflop/s, 0.00 GB/s, tuned Mon Sep 23 17:40:22 2013
16x16x16x12	N4quda13fermion_force16LepageMiddleLinkI7double2S2_EE	threads=24576,prec=8,recon=18,sig=1,mu=7	256	1	1	96	1	1	12289	# 0.00 Gflop/s, 0.00 GB/s, tuned Mon Sep 23 17:40:23 2013
16x16x16x12	N4quda13fermion_force16LepageMiddleLinkI7double2S2_EE	threads=24576,prec=8,recon=18,sig=2,mu=0	384	1	1	64	1	1	12289	# 0.00 Gflop/s, 0.00 GB/s, tuned Mon Sep 23 17:40:25 2013
16x16x16x12	N4quda13fermion_force16LepageMiddleLinkI7double2S2_EE	threads=24576,prec=8,recon=18,sig=2,mu=1	384	1	1	64	1	1	16385	# 0.00 Gflop/s, 0.00 GB/s, tuned Mon Sep 23 17:40:26 2013
16x16x16x12	N4quda13fermion_force16LepageMiddleLinkI7double2S2_EE	threads=24576,prec=8,recon=18,sig=2,mu=3	256	1	1	96	1	1	8193	# 0.00 Gflop/s, 0.00 GB/s, tuned Mon Sep 23 17:40:26 2013
16x16x16x12	N4quda13fermion_force16LepageMiddleLinkI7double2S2_EE	threads=24576,prec=8,recon=18,sig=2,mu=4	224	1	1	110	1	1	24577	# 0.00 Gflop/s, 0.00 GB/s, tuned Mon Sep 23 17:40:27 2013
16x16x16x12	N4quda13fermion_force16LepageMiddleLinkI7double2S2_EE	threads=24576,prec=8,recon=18,sig=2,mu=6	224	1	1	110	1	1	0	# 0.00 Gflop/s, 0.00 GB/s, tuned Mon Sep 23 17:40:27 2013
16x16x16x12	N4quda13fermion_force16LepageMiddleLinkI7double2S2_EE	threads=24576,prec=8,recon=18,sig=2,mu=7	224	1	1	110	1	1	24577	# 0.00 Gflop/s, 0.00 GB/s, tuned Mon Sep 23 17:40:28 2013
16x16x16x12	N4quda13fermion_force16LepageMiddleLinkI7double2S2_EE	threads=24576,prec=8,recon=18,sig=3,mu=0	256	1	1	96	1	1	6145	# 0.00 Gflop/s, 0.00 GB/s, tuned Mon Sep 23 17:40:29 2013
16x16x16x12	N4quda13fermion_force16LepageMiddleLinkI7double2S2_EE	threads=24576,prec=8,recon=18,sig=3,mu=1	352	1	1	70	1	1	7022	# 0.00 Gflop/s, 0.00 GB/s, tuned Mon Sep 23 17:40:31 2013
16x16x16x12	N4quda13fermion_force16LepageMiddleLinkI7double2S2_EE	threads=24576,prec=8,recon=18,sig=3,mu=2	384	1	1	64	1	1	6145	# 0.00 Gflop/s, 0.00 GB/s, tuned Mon Sep 23 17:40:31 2013
16x16x16x12	N4quda13fermion_force16LepageMiddleLinkI7double2S2_EE	threads=24576,prec=8,recon=18,sig=3,mu=5	224	1	1	110	1	1	9831	# 0.00 Gflop/s, 0.00 GB/s, tuned Mon Sep 23 17:40:32 2013
16x16x16x12	N4quda13fermion_force16LepageMiddleLinkI7double2S2_EE	threads=24576,prec=8,recon=18,sig=3,mu=6	256	1	1	96	1	1	8193	# 0.00 Gflop/s, 0.00 GB/s, tuned Mon Sep 23 17:40:32 2013
16x16x16x12	N4quda13fermion_force16LepageMiddleLinkI7double2S2_EE	threads=24576,prec=8,recon=18,sig=3,mu=7	224	1	1	110	1	1	0	# 0.00 Gflop/s, 0.00 GB/s, tuned Mon Sep 23 17:40:32 2013
16x16x16x12	N4quda13fermion_force16LepageMiddleLinkI7double2S2_EE	threads=24576,prec=8,recon=18,sig=4,mu=0	320	1	1	77	1	1	0	# 0.00 Gflop/s, 0.00 GB/s, tuned Mon Sep 23 17:40:34 2013
16x16x16x12	N4quda13fermion_force16LepageMiddleLinkI7double2S2_EE	threads=24576,prec=8,recon=18,sig=4,mu=1	384	1	1	64	1	1	7022	# 0.00 Gflop/s, 0.00 GB/s, tuned Mon Sep 23 17:40:35 2013
16x16x16x12	N4quda13fermion_force16LepageMiddleLinkI7double2S2_EE	threads=24576,prec=8,recon=18,sig=4,mu=2	320	1	1	77	1	1	16385	# 0.00 Gflop/s, 0.00 GB/s, tuned Mon Sep 23 17:40:36 2013
16x16x16x12	N4quda13fermion_force16LepageMiddleLinkI7double2S2_EE	threads=24576,prec=8,recon=18,sig=4,mu=5	320	1	1	77	1	1	12289	# 0.00 Gflop/s, 0.00 GB/s, tuned Mon Sep 23 17:40:36 2013
16x16x16x12	N4quda13fermion_force16LepageMiddleLinkI7double2S2_EE	threads=24576,prec=8,recon=18,sig=4,mu=6	320	1	1	77	1	1	9831	# 0.00 Gflop/s, 0.00 GB/s, tuned Mon Sep 23 17:40:37 2013
16x16x16x12	N4quda13fermion_force16LepageMiddleLinkI7double2S2_EE	threads=24576,prec=8,recon=18,sig=4,mu=7	352	1	1	70	1	1	6145	# 0.00 Gflop/s, 0.00 GB/s, tuned Mon Sep 23 17:40:37 2013
16x16x16x12	N4quda13fermion_force16LepageMiddleLinkI7double2S2_EE	threads=24576,prec=8,recon=18,sig=5,mu=0	320	1	1	77	1	1	24577	# 0.00 Gflop/s, 0.00 GB/s, tuned Mon Sep 23 17:40:39 2013
16x16x16x12	N4quda13fermion_force16LepageMiddleLinkI7double2S2_EE	threads=24576,prec=8,recon=18,sig=5,mu=1	320	1	1	77	1	1	0	# 0.00 Gflop/s, 0.00 GB/s, tuned Mon Sep 23 17:40:40 2013
16x16x16x12	N4quda13fermion_force16LepageMiddleLinkI7double2S2_EE	threads=24576,prec=8,recon=18,sig=5,mu=3	352	1	1	70	1	1	12289	# 0.00 Gflop/s, 0.00 GB/s, tuned Mon Sep 23 17:40:41 2013
16x16x16x12	N4quda13fermion_force16LepageMiddleLinkI7double2S2_EE	threads=24576,prec=8,recon=18,sig=5,mu=4	320	1	1	77	1	1	0	# 0.00 Gflop/s, 0.00 GB/s, tuned Mon Sep 23 17:40:41 2013
16x16x16x12	N4quda13fermion_force16LepageMiddleLinkI7double2S2_EE	threads=24576,prec=8,recon=18,sig=5,mu=6	320	1	1	77	1	1	9831	# 0.00 Gflop/s, 0.00 GB/s, tuned Mon Sep 23 17:40:42 2013
16x16x16x12	N4quda13fermion_force16LepageMiddleLinkI7double2S2_EE	threads=24576,prec=8,recon=18,sig=5,mu=7	320	1	1	77	1	1	12289	# 0.00 Gflop/s, 0.00 GB/s, tuned Mon Sep 23 17:40:42 2013
16x16x16x12	N4quda13fermion_force16LepageMiddleLinkI7double2S2_EE	threads=24576,prec=8,recon=18,sig=6,mu=0	320	1	1	77	1	1	16385	# 0.00 Gflop/s, 0.00 GB/s, tuned Mon Sep 23 17:40:44 2013
16x16x16x12	N4quda13fermion_force16LepageMiddleLinkI7double2S2_EE	threads=24576,prec=8,recon=18,sig=6,mu=2	320	1	1	77	1	1	7022	# 0.00 Gflop/s, 0.00 GB/s, tuned Mon Sep 23 17:40:45 2013
16x16x16x12	N4quda13fermion_force16LepageMiddleLinkI7double2S2_EE	threads=24576,prec=8,recon=18,sig=6,mu=3	128	1	1	192	1	1	24577	# 0.00 Gflop/s, 0.00 GB/s, tuned Mon Sep 23 17:40:46 2013
16x16x16x12	N4quda13fermion_force16LepageMiddleLinkI7double2S2_EE	threads=24576,prec=8,recon=18,sig=6,mu=4	352	1	1	70	1	1	6145	# 0.00 Gflop/s, 0.00 GB/s, tuned Mon Sep 23 17:40:46 2013
16x16x16x12	N4quda13fermion_force16LepageMiddleLinkI7double2S2_EE	threads=24576,prec=8,recon=18,sig=6,mu=5	320	1	1	77	1	1	24577	# 0.00 Gflop/s, 0.00 GB/s, tuned Mon Sep 23 17:40:46 2013
16x16x16x12	N4quda13fermion_force16LepageMiddleLinkI7double2S2_EE	threads=24576,prec=8,recon=18,sig=6,mu=7	320	1	1	77	1	1	24577	# 0.00 Gflop/s, 0.00 GB/s, tuned Mon Sep 23 17:40:47 2013
16x16x16x12	N4quda13fermion_force16LepageMiddleLinkI7double2S2_EE	threads=24576,prec=8,recon=18,sig=7,mu=1	320	1	1	77	1	1	16385	# 0.00 Gflop/s, 0.00 GB/s, tuned Mon Sep 23 17:40:49 2013
16x16x16x12	N4quda13fermion_force16LepageMiddleLinkI7double2S2_EE	threads=24576,prec=8,recon=18,sig=7,mu=2	320	1	1	77	1	1	9831	# 0.00 Gflop/s, 0.00 GB/s, tuned Mon Sep 23 17:40:50 2013
16x16x16x12	N4quda13fermion_force16LepageMiddleLinkI7double2S2_EE	threads=24576,prec=8,recon=18,sig=7,mu=3	224	1	1	110	1	1	0	# 0.00 Gflop/s, 0.00 GB/s, tuned Mon Sep 23 17:40:50 2013
16x16x16x12	N4quda13fermion_force16LepageMiddleLinkI7double2S2_EE	threads=24576,prec=8,recon=18,sig=7,mu=4	320	1	1	77	1	1	16385	# 0.00 Gflop/s, 0.00 GB/s, tuned Mon Sep 23 17:40:51 2013
16x16x16x12	N4quda13fermion_force16LepageMiddleLinkI7double2S2_EE	threads=24576,prec=8,recon=18,sig=7,mu=5	320	1	1	77	1	1	0	# 0.00 Gflop/s, 0.00 GB/s, tuned Mon Sep 23 17:40:51 2013
16x16x16x12	N4quda13fermion_force16LepageMiddleLinkI7double2S2_EE	threads=24576,prec=8,recon=18,sig=7,mu=6	320	1	1	77	1	1	16385	# 0.00 Gflop/s, 0.00 GB/s, tuned Mon Sep 23 17:40:52 2013
16x16x16x12	N4quda13fermion_force8SideLinkI7double2S2_EE	threads=24576,prec=8,recon=18,sig=0,mu=1	384	1	1	64	1	1	16385	# 0.00 Gflop/s, 0.00 GB/s, tuned Mon Sep 23 17:40:15 2013
16x16x16x12	N4quda13fermion_force8SideLinkI7double2S2_EE	threads=24576,prec=8,recon=18,sig=0,mu=2	512	1	1	48	1	1	16385	# 0.00 Gflop/s, 0.00 GB/s, tuned Mon Sep 23 17:40:16 2013
16x16x16x12	N4quda13fermion_force8SideLinkI7double2S2_EE	threads=24576,prec=8,recon=18,sig=0,mu=3	480	1	1	52	1	1	6145	# 0.00 Gflop/s, 0.00 GB/s, tuned Mon Sep 23 17:40:16 2013
16x16x16x12	N4quda13fermion_force8SideLinkI7double2S2_EE	threads=24576,prec=8,recon=18,sig=0,mu=4	480	1	1	52	1	1	24577	# 0.00 Gflop/s, 0.00 GB/s, tuned Mon Sep 23 17:40:17 2013
16x16x16x12	N4quda13fermion_force8SideLinkI7double2S2_EE	threads=24576,prec=8,recon=18,sig=0,mu=5	512	1	1	48	1	1	24577	# 0.00 Gflop/s, 0.00 GB/s, tuned Mon Sep 23 17:40:17 2013
16x16x16x12	N4quda13fermion_force8SideLinkI7double2S2_EE	threads=24576,prec=8,recon=18,sig=0,mu=6	480	1	1	52	1	1	12289	# 0.00 Gflop/s, 0.00 GB/s, tuned Mon Sep 23 17:40:18 2013
16x16x16x12	N4quda13fermion_force8SideLinkI7double2S2_EE	threads=24576,prec=8,recon=18,sig=1,mu=0	256	1	1	96	1	1	0	# 0.00 Gflop/s, 0.00 GB/s, tuned Mon Sep 23 17:40:20 2013
16x16x16x12	N4quda13fermion_force8SideLinkI7double2S2_EE	threads=24576,prec=8,recon=18,sig=1,mu=2	384	1	1	64	1	1	12289	# 0.00 Gflop/s, 0.00 GB/s, tuned Mon Sep 23 17:40:21 2013
16x16x16x12	N4quda13fermion_force8SideLinkI7double2S2_EE	threads=24576,prec=8,recon=18,sig=1,mu=3	480	1	1	52	1	1	6145	# 0.00 Gflop/s, 0.00 GB/s, tuned Mon Sep 23 17:40:21 2013
16x16x16x12	N4quda13fermion_force8SideLinkI7double2S2_EE	threads=24576,prec=8,recon=18,sig=1,mu=4	448	1	1	55	1	1	8193	# 0.00 Gflop/s, 0.00 GB/s, tuned Mon Sep 23 17:40:22 2013
16x16x16x12	N4quda13fermion_force8SideLinkI7double2S2_EE	threads=24576,prec=8,recon=18,sig=1,mu=5	512	1	1	48	1	1	24577	# 0.00 Gflop/s, 0.00 GB/s, tuned Mon Sep 23 17:40:22 2013
16x16x16x12	N4quda13fermion_force8SideLinkI7double2S2_EE	threads=24576,prec=8,recon=18,sig=1,mu=7	480	1	1	52	1	1	8193	# 0.00 Gflop/s, 0.00 GB/s, tuned Mon Sep 23 17:40:23 2013
16x16x16x12	N4quda13fermion_force8SideLinkI7double2S2_EE	threads=24576,prec=8,recon=18,sig=2,mu=0	512	1	1	48	1	1	8193	# 0.00 Gflop/s, 0.00 GB/s, tuned Mon Sep 23 17:40:25 2013
16x16x16x12	N4quda13fermion_force8SideLinkI7double2S2_EE	threads=24576,prec=8,recon=18,sig=2,mu=1	480	1	1	52	1	1	9831	# 0.00 Gflop/s, 0.00 GB/s, tuned Mon Sep 23 17:40:26 2013
16x16x16x12	N4quda13fermion_force8SideLinkI7double2S2_EE	threads=24576,prec=8,recon=18,sig=2,mu=3	480	1	1	52	1	1	24577	# 0.00 Gflop/s, 0.00 GB/s, tuned Mon Sep 23 17:40:26 2013
16x16x16x12	N4quda13fermion_force8SideLinkI7double2S2_EE	threads=24576,prec=8,recon=18,sig=2,mu=4	448	1	1	55	1	1	16385	# 0.00 Gflop/s, 0.00 GB/s, tuned Mon Sep 23 17:40:27 2013
16x16x16x12	N4quda13fermion_force8SideLinkI7double2S2_EE	threads=24576,prec=8,recon=18,sig=2,mu=6	512	1	1	48	1	1	0	# 0.00 Gflop/s, 0.00 GB/s, tuned Mon Sep 23 17:40:27 2013
16x16x16x12	N4quda13fermion_force8SideLinkI7double2S2_EE	threads=24576,prec=8,recon=18,sig=2,mu=7	480	1	1	52	1	1	16385	# 0.00 Gflop/s, 0.00 GB/s, tuned Mon Sep 23 17:40:28 2013
16x16x16x12	N4quda13fermion_force8SideLinkI7double2S2_EE	threads=24576,prec=8,recon=18,sig=3,mu=0	480	1	1	52	1	1	9831	# 0.00 Gflop/s, 0.00 GB/s, tuned Mon Sep 23 17:40:30 2013
16x16x16x12	N4quda13fermion_force8SideLinkI7double2S2_EE	threads=24576,prec=8,recon=18,sig=3,mu=1	384	1	1	64	1	1	24577	# 0.00 Gflop/s, 0.00 GB/s, tuned Mon Sep 23 17:40:31 2013
16x16x16x12	N4quda13fermion_force8SideLinkI7double2S2_EE	threads=24576,prec=8,recon=18,sig=3,mu=2	512	1	1	48	1	1	16385	# 0.00 Gflop/s, 0.00 GB/s, tuned Mon Sep 23 17:40:31 2013
16x16x16x12	N4quda13fermion_force8SideLinkI7double2S2_EE	threads=24576,prec=8,recon=18,sig=3,mu=5	512	1	1	48	1	1	7022	# 0.00 Gflop/s, 0.00 GB/s, tuned Mon Sep 23 17:40:32 2013
16x16x16x12	N4quda13fermion_force8SideLinkI7double2S2_EE	threads=24576,prec=8,recon=18,sig=3,mu=6	480	1	1	52	1	1	6145	# 0.00 Gflop/s, 0.00 GB/s, tuned Mon Sep 23 17:40:32 2013
16x16x16x12	N4quda13fermion_force8SideLinkI7double2S2_EE	threads=24576,prec=8,recon=18,sig=3,mu=7	480	1	1	52	1	1	9831	# 0.00 Gflop/s, 0.00 GB/s, tuned Mon Sep 23 17:40:33 2013
16x16x16x12	N4quda13fermion_force8SideLinkI7double2S2_EE	threads=24576,prec=8,recon=18,sig=4,mu=0	480	1	1	52	1	1	0	# 0.00 Gflop/s, 0.00 GB/s, tuned Mon Sep 23 17:40:34 2013
16x16x16x12	N4quda13fermion_force8SideLinkI7double2S2_EE	threads=24576,prec=8,recon=18,sig=4,mu=1	256	1	1	96	1	1	24577	# 0.00 Gflop/s, 0.00 GB/s, tuned Mon Sep 23 17:40:36 2013
16x16x16x12	N4quda13fermion_force8SideLinkI7double2S2_EE	threads=24576,prec=8,recon=18,sig=4,mu=2	384	1	1	64	1	1	9831	# 0.00 Gflop/s, 0.00 GB/s, tuned Mon Sep 23 17:40:36 2013
16x16x16x12	N4quda13fermion_force8SideLinkI7double2S2_EE	threads=24576,prec=8,recon=18,sig=4,mu=5	512	1	1	48	1	1	6145	# 0.00 Gflop/s, 0.00 GB/s, tuned Mon Sep 23 17:40:36 2013
16x16x16x12	N4quda13fermion_force8SideLinkI7double2S2_EE	threads=24576,prec=8,recon=18,sig=4,mu=6	480	1	1	52	1	1	8193	# 0.00 Gflop/s, 0.00 GB/s, tuned Mon Sep 23 17:40:37 2013
16x16x16x12	N4quda13fermion_force8SideLinkI7double2S2_EE	threads=24576,prec=8,recon=18,sig=4,mu=7	512	1	1	48	1	1	16385	# 0.00 Gflop/s, 0.00 GB/s, tuned Mon Sep 23 17:40:37 2013
16x16x16x12	N4quda13fermion_force8SideLinkI7double2S2_EE	threads=24576,prec=8,recon=18,sig=5,mu=0	480	1	1	52	1	1	16385	# 0.00 Gflop/s, 0.00 GB/s, tuned Mon Sep 23 17:40:39 2013
16x16x16x12	N4quda13fermion_force8SideLinkI7double2S2_EE	threads=24576,prec=8,recon=18,sig=5,mu=1	480	1	1	52	1	1	8193	# 0.00 Gflop/s, 0.00 GB/s, tuned Mon Sep 23 17:40:40 2013
16x16x16x12	N4quda13fermion_force8SideLinkI7double2S2_EE	threads=24576,prec=8,recon=18,sig=5,mu=3	480	1	1	52	1	1	6145	# 0.00 Gflop/s, 0.00 GB/s, tuned Mon Sep 23 17:40:41 2013
16x16x16x12	N4quda13fermion_force8SideLinkI7double2S2_EE	threads=24576,prec=8,recon=18,sig=5,mu=4	480	1	1	52	1	1	24577	# 0.00 Gflop/s, 0.00 GB/s, tuned Mon Sep 23 17:40:41 2013
16x16x16x12	N4quda13fermion_force8SideLinkI7double2S2_EE	threads=24576,prec=8,recon=18,sig=5,mu=6	480	1	1	52	1	1	7022	# 0.00 Gflop/s, 0.00 GB/s, tuned Mon Sep 23 17:40:42 2013
16x16x16x12	N4quda13fermion_force8SideLinkI7double2S2_EE	threads=24576,prec=8,recon=18,sig=5,mu=7	480	1	1	52	1	1	0	# 0.00 Gflop/s, 0.00 GB/s, tuned Mon Sep 23 17:40:42 2013
16x16x16x12	N4quda13fermion_force8SideLinkI7double2S2_EE	threads=24576,prec=8,recon=18,sig=6,mu=0	256	1	1	96	1	1	6145	# 0.00 Gflop/s, 0.00 GB/s, tuned Mon Sep 23 17:40:44 2013
16x16x16x12	N4quda13fermion_force8SideLinkI7double2S2_EE	threads=24576,prec=8,recon=18,sig=6,mu=2	480	1	1	52	1	1	16385	# 0.00 Gflop/s, 0.00 GB/s, tuned Mon Sep 23 17:40:45 2013
16x16x16x12	N4quda13fermion_force8SideLinkI7double2S2_EE	threads=24576,prec=8,recon=18,sig=6,mu=3	224	1	1	110	1	1	0	# 0.00 Gflop/s, 0.00 GB/s, tuned Mon Sep 23 17:40:46 2013
16x16x16x12	N4quda13fermion_force8SideLinkI7double2S2_EE	threads=24576,prec=8,recon=18,sig=6,mu=4	224	1	1	110	1	1	9831	# 0.00 Gflop/s, 0.00 GB/s, tuned Mon Sep 23 17:40:46 2013
16x16x16x12	N4quda13fermion_force8SideLinkI7double2S2_EE	threads=24576,prec=8,recon=18,sig=6,mu=5	512	1	1	48	1	1	16385	# 0.00 Gflop/s, 0.00 GB/s, tuned Mon Sep 23 17:40:47 2013
16x16x16x12	N4quda13fermion_force8SideLinkI7double2S2_EE	threads=24576,prec=8,recon=18,sig=6,mu=7	480	1	1	52	1	1	0	# 0.00 Gflop/s, 0.00 GB/s, tuned Mon Sep 23 17:40:47 2013
16x16x16x12	N4quda13fermion_force8SideLinkI7double2S2_EE	threads=24576,prec=8,recon=18,sig=7,mu=1	384	1	1	64	1	1	7022	# 0.00 Gflop/s, 0.00 GB/s, tuned Mon Sep 23 17:40:49 2013
16x16x16x12	N4quda13fermion_force8SideLinkI7double2S2_EE	threads=24576,prec=8,recon=18,sig=7,mu=2	480	1	1	52	1	1	24577	# 0.00 Gflop/s, 0.00 GB/s, tuned Mon Sep 23 17:40:50 2013
16x16x16x12	N4quda13fermion_force8SideLinkI7double2S2_EE	threads=24576,prec=8,recon=18,sig=7,mu=3	224	1	1	110	1	1	0	# 0.00 Gflop/s, 0.00 GB/s, tuned Mon Sep 23 17:40:51 2013
16x16x16x12	N4quda13fermion_force8SideLinkI7double2S2_EE	threads=24576,prec=8,recon=18,sig=7,mu=4	448	1	1	55	1	1	9831	# 0.00 Gflop/s, 0.00 GB/s, tuned Mon Sep 23 17:40:51 2013
16x16x16x12	N4quda13fermion_force8SideLinkI7double2S2_EE	threads=24576,prec=8,recon=18,sig=7,mu=5	480	1	1	52	1	1	0	# 0.00 Gflop/s, 0.00 GB/s, tuned Mon Sep 23 17:40:51 2013
16x16x16x12	N4quda13fermion_force8SideLinkI7double2S2_EE	threads=24576,prec=8,recon=18,sig=7,mu=6	512	1	1	48	1	1	0	# 0.00 Gflop/s, 0.00 GB/s, tuned Mon Sep 23 17:40:52 2013
16x16x16x12x	N4quda13fermion_force18UnitarizeForceCudaE	threads=49152,prec=8stride=24576	64	1	1	768	1	1	7022	# 0.00 Gflop/s, 0.00 GB/s, tuned Mon Sep 23 17:19:57 2013
16x16x16x16	N4quda13fermion_force11OneLinkTermI7double2S2_EE	threads=32768,prec=8,sig=0,coeff=0	32	1	1	1024	1	1	0	# 0.00 Gflop/s, 0.00 GB/s, tuned Mon Sep 23 18:09:12 2013
16x16x16x16	N4quda13fermion_force11OneLinkTermI7double2S2_EE	threads=32768,prec=8,sig=0,coeff=0.125	160	1	1	205	1	1	24577	# 0.00 Gflop/s, 0.00 GB/s, tuned Mon Sep 23 18:10:46 2013
16x16x16x16	N4quda13fermion_force11OneLinkTermI7double2S2_EE	threads=32768,prec=8,sig=1,coeff=0	32	1	1	1024	1	1	9831	# 0.00 Gflop/s, 0.00 GB/s, tuned Mon Sep 23 18:09:12 2013
16x16x16x16	N4quda13fermion_force11OneLinkTermI7double2S2_EE	threads=32768,prec=8,sig=1,coeff=0.125	32	1	1	1024	1	1	9831	# 0.00 Gflop/s, 0.00 GB/s, tuned Mon Sep 23 18:10:46 2013
16x16x16x16	N4quda13fermion_force11OneLinkTermI7double2S2_EE	threads=32768,prec=8,sig=2,coeff=0	448	1	1	74	1	1	7022	# 0.00 Gflop/s, 0.00 GB/s, tuned Mon Sep 23 18:09:12 2013
16x16x16x16	N4quda13fermion_force11OneLinkTermI7double2S2_EE	threads=32768,prec=8,sig=2,coeff=0.125	96	1	1	342	1	1	6145	# 0.00 Gflop/s, 0.00 GB/s, tuned Mon Sep 23 18:10:46 2013
16x16x16x16	N4quda13fermion_force11OneLinkTermI7double2S2_EE	threads=32768,prec=8,sig=3,coeff=0	288	1	1	114	1	1	9831	# 0.00 Gflop/s, 0.00 GB/s, tuned Mon Sep 23 18:09:13 2013
16x16x16x16	N4quda13fermion_force11OneLinkTermI7double2S2_EE	threads=32768,prec=8,sig=3,coeff=0.125	32	1	1	1024	1	1	16385	# 0.00 Gflop/s, 0.00 GB/s, tuned Mon Sep 23 18:10:46 2013
16x16x16x16	N4quda13fermion_force12LongLinkTermI7double2S2_EE	threads=32768,prec=8,sig=0	64	1	1	512	1	1	16385	# 0.00 Gflop/s, 0.00 GB/s, tuned Mon Sep 23 18:10:41 2013
16x16x16x16	N4quda13fermion_force12LongLinkTermI7double2S2_EE	threads=32768,prec=8,sig=1	64	1	1	512	1	1	12289	# 0.00 Gflop/s, 0.00 GB/s, tuned Mon Sep 23 18:10:42 2013
16x16x16x16	N4quda13fermion_force12LongLinkTermI7double2S2_EE	threads=32768,prec=8,sig=2	32	1	1	1024	1	1	24577	# 0.00 Gflop/s, 0.00 GB/s, tuned Mon Sep 23 18:10:42 2013
16x16x16x16	N4quda13fermion_force12LongLinkTermI7double2S2_EE	threads=32768,prec=8,sig=3	32	1	1	1024	1	1	24577	# 0.00 Gflop/s, 0.00 GB/s, tuned Mon Sep 23 18:10:42 2013
16x16x16x16	N4quda13fermion_force13CompleteForceI7double2S2_EE	threads=32768,prec=8,sig=0	320	1	1	103	1	1	6145	# 0.00 Gflop/s, 0.00 GB/s, tuned Mon Sep 23 18:11:30 2013
16x16x16x16	N4quda13fermion_force13CompleteForceI7double2S2_EE	threads=32768,prec=8,sig=1	320	1	1	103	1	1	6145	# 0.00 Gflop/s, 0.00 GB/s, tuned Mon Sep 23 18:11:30 2013
16x16x16x16	N4quda13fermion_force13CompleteForceI7double2S2_EE	threads=32768,prec=8,sig=2	128	1	1	256	1	1	0	# 0.00 Gflop/s, 0.00 GB/s, tuned Mon Sep 23 18:11:30 2013
16x16x16x16	N4quda13fermion_force13CompleteForceI7double2S2_EE	threads=32768,prec=8,sig=3	160	1	1	205	1	1	0	# 0.00 Gflop/s, 0.00 GB/s, tuned Mon Sep 23 18:11:30 2013
16x16x16x16	N4quda19StaggeredDslashCudaI6float2S1_6float4fEE	type=exterior_t,comm=0001,reconstruct=18	224	1	1	147	1	1	5376	# 1036.66 Gflop/s, 0.00 GB/s, tuned Mon Sep 23 18:08:32 2013
16x16x16x16	N4quda19StaggeredDslashCudaI6float2S1_6float4fEE	type=exterior_t,comm=0001,reconstruct=18,Axpy	480	1	1	69	1	1	16385	# 1068.28 Gflop/s, 0.00 GB/s, tuned Mon Sep 23 18:08:32 2013
16x16x16x16	N4quda19StaggeredDslashCudaI6float2S1_6float4fEE	type=interior,comm=0001,ghost=0001,reconstruct=18	96	1	1	342	1	1	2304	# 118.42 Gflop/s, 0.00 GB/s, tuned Mon Sep 23 18:08:32 2013
16x16x16x16	N4quda19StaggeredDslashCudaI6float2S1_6float4fEE	type=interior,comm=0001,ghost=0001,reconstruct=18,Axpy	128	1	1	256	1	1	3072	# 116.49 Gflop/s, 0.00 GB/s, tuned Mon Sep 23 18:08:32 2013
16x16x16x16	N4quda19StaggeredDslashCudaI7double2S1_S1_dEE	type=exterior_t,comm=0001,reconstruct=18	960	1	1	35	1	1	46080	# 705.23 Gflop/s, 0.00 GB/s, tuned Mon Sep 23 18:08:38 2013
16x16x16x16	N4quda19StaggeredDslashCudaI7double2S1_S1_dEE	type=exterior_t,comm=0001,reconstruct=18,Axpy	512	1	1	64	1	1	24576	# 702.90 Gflop/s, 0.00 GB/s, tuned Mon Sep 23 18:08:38 2013
16x16x16x16	N4quda19StaggeredDslashCudaI7double2S1_S1_dEE	type=interior,comm=0001,ghost=0001,reconstruct=18	224	1	1	147	1	1	16385	# 60.38 Gflop/s, 0.00 GB/s, tuned Mon Sep 23 18:08:38 2013
16x16x16x16	N4quda19StaggeredDslashCudaI7double2S1_S1_dEE	type=interior,comm=0001,ghost=0001,reconstruct=18,Axpy	224	1	1	147	1	1	16385	# 59.93 Gflop/s, 0.00 GB/s, tuned Mon Sep 23 18:08:38 2013
16x16x16x18	N4quda13fermion_force10MiddleLinkI7double2S2_EE	threads=36864,prec=8,recon=12,sig=0,mu=1	256	1	1	144	1	1	6145	# 0.00 Gflop/s, 0.00 GB/s, tuned Mon Sep 23 18:10:49 2013
16x16x16x18	N4quda13fermion_force10MiddleLinkI7double2S2_EE	threads=36864,prec=8,recon=12,sig=0,mu=2	288	1	1	128	1	1	16385	# 0.00 Gflop/s, 0.00 GB/s, tuned Mon Sep 23 18:10:47 2013
16x16x16x18	N4quda13fermion_force10MiddleLinkI7double2S2_EE	threads=36864,prec=8,recon=12,sig=0,mu=3	224	1	1	165	1	1	6145	# 0.00 Gflop/s, 0.00 GB/s, tuned Mon Sep 23 18:10:47 2013
16x16x16x18	N4quda13fermion_force10MiddleLinkI7double2S2_EE	threads=36864,prec=8,recon=12,sig=0,mu=4	288	1	1	128	1	1	16385	# 0.00 Gflop/s, 0.00 GB/s, tuned Mon Sep 23 18:10:48 2013
16x16x16x18	N4quda13fermion_force10MiddleLinkI7double2S2_EE	threads=36864,prec=8,recon=12,sig=0,mu=5	224	1	1	165	1	1	24577	# 0.00 Gflop/s, 0.00 GB/s, tuned Mon Sep 23 18:10:48 2013
16x16x16x18	N4quda13fermion_force10MiddleLinkI7double2S2_EE	threads=36864,prec=8,recon=12,sig=0,mu=6	224	1	1	165	1	1	8193	# 0.00 Gflop/s, 0.00 GB/s, tuned Mon Sep 23 18:10:50 2013
16x16x16x18	N4quda13fermion_force10MiddleLinkI7double2S2_EE	threads=36864,prec=8,recon=12,sig=1,mu=0	224	1	1	165	1	1	8193	# 0.00 Gflop/s, 0.00 GB/s, tuned Mon Sep 23 18:10:55 2013
16x16x16x18	N4quda13fermion_force10MiddleLinkI7double2S2_EE	threads=36864,prec=8,recon=12,sig=1,mu=2	256	1	1	144	1	1	16385	# 0.00 Gflop/s, 0.00 GB/s, tuned Mon Sep 23 18:10:52 2013
16x16x16x18	N4quda13fermion_force10MiddleLinkI7double2S2_EE	threads=36864,prec=8,recon=12,sig=1,mu=3	320	1	1	116	1	1	7022	# 0.00 Gflop/s, 0.00 GB/s, tuned Mon Sep 23 18:10:53 2013
16x16x16x18	N4quda13fermion_force10MiddleLinkI7double2S2_EE	threads=36864,prec=8,recon=12,sig=1,mu=4	320	1	1	116	1	1	9831	# 0.00 Gflop/s, 0.00 GB/s, tuned Mon Sep 23 18:10:54 2013
16x16x16x18	N4quda13fermion_force10MiddleLinkI7double2S2_EE	threads=36864,prec=8,recon=12,sig=1,mu=5	256	1	1	144	1	1	0	# 0.00 Gflop/s, 0.00 GB/s, tuned Mon Sep 23 18:10:54 2013
16x16x16x18	N4quda13fermion_force10MiddleLinkI7double2S2_EE	threads=36864,prec=8,recon=12,sig=1,mu=7	224	1	1	165	1	1	9831	# 0.00 Gflop/s, 0.00 GB/s, tuned Mon Sep 23 18:10:55 2013
16x16x16x18	N4quda13fermion_force10MiddleLinkI7double2S2_EE	threads=36864,prec=8,recon=12,sig=2,mu=0	320	1	1	116	1	1	8193	# 0.00 Gflop/s, 0.00 GB/s, tuned Mon Sep 23 18:11:00 2013
16x16x16x18	N4quda13fermion_force10MiddleLinkI7double2S2_EE	threads=36864,prec=8,recon=12,sig=2,mu=1	224	1	1	165	1	1	0	# 0.00 Gflop/s, 0.00 GB/s, tuned Mon Sep 23 18:10:58 2013
16x16x16x18	N4quda13fermion_force10MiddleLinkI7double2S2_EE	threads=36864,prec=8,recon=12,sig=2,mu=3	256	1	1	144	1	1	7022	# 0.00 Gflop/s, 0.00 GB/s, tuned Mon Sep 23 18:10:58 2013
16x16x16x18	N4quda13fermion_force10MiddleLinkI7double2S2_EE	threads=36864,prec=8,recon=12,sig=2,mu=4	256	1	1	144	1	1	0	# 0.00 Gflop/s, 0.00 GB/s, tuned Mon Sep 23 18:10:59 2013
16x16x16x18	N4quda13fermion_force10MiddleLinkI7double2S2_EE	threads=36864,prec=8,recon=12,sig=2,mu=6	224	1	1	165	1	1	12289	# 0.00 Gflop/s, 0.00 GB/s, tuned Mon Sep 23 18:10:59 2013
16x16x16x18	N4quda13fermion_force10MiddleLinkI7double2S2_EE	threads=36864,prec=8,recon=12,sig=2,mu=7	288	1	1	128	1	1	6145	# 0.00 Gflop/s, 0.00 GB/s, tuned Mon Sep 23 18:11:01 2013
16x16x16x18	N4quda13fermion_force10MiddleLinkI7double2S2_EE	threads=36864,prec=8,recon=12,sig=3,mu=0	256	1	1	144	1	1	12289	# 0.00 Gflop/s, 0.00 GB/s, tuned Mon Sep 23 18:11:06 2013
16x16x16x18	N4quda13fermion_force10MiddleLinkI7double2S2_EE	threads=36864,prec=8,recon=12,sig=3,mu=1	224	1	1	165	1	1	9831	# 0.00 Gflop/s, 0.00 GB/s, tuned Mon Sep 23 18:11:03 2013
16x16x16x18	N4quda13fermion_force10MiddleLinkI7double2S2_EE	threads=36864,prec=8,recon=12,sig=3,mu=2	256	1	1	144	1	1	24577	# 0.00 Gflop/s, 0.00 GB/s, tuned Mon Sep 23 18:11:04 2013
16x16x16x18	N4quda13fermion_force10MiddleLinkI7double2S2_EE	threads=36864,prec=8,recon=12,sig=3,mu=5	256	1	1	144	1	1	6145	# 0.00 Gflop/s, 0.00 GB/s, tuned Mon Sep 23 18:11:05 2013
16x16x16x18	N4quda13fermion_force10MiddleLinkI7double2S2_EE	threads=36864,prec=8,recon=12,sig=3,mu=6	224	1	1	165	1	1	24577	# 0.00 Gflop/s, 0.00 GB/s, tuned Mon Sep 23 18:11:05 2013
16x16x16x18	N4quda13fermion_force10MiddleLinkI7double2S2_EE	threads=36864,prec=8,recon=12,sig=3,mu=7	256	1	1	144	1	1	16385	# 0.00 Gflop/s, 0.00 GB/s, tuned Mon Sep 23 18:11:07 2013
16x16x16x18	N4quda13fermion_force10MiddleLinkI7double2S2_EE	threads=36864,prec=8,recon=12,sig=4,mu=0	224	1	1	165	1	1	6145	# 0.00 Gflop/s, 0.00 GB/s, tuned Mon Sep 23 18:11:11 2013
16x16x16x18	N4quda13fermion_force10MiddleLinkI7double2S2_EE	threads=36864,prec=8,recon=12,sig=4,mu=1	224	1	1	165	1	1	8193	# 0.00 Gflop/s, 0.00 GB/s, tuned Mon Sep 23 18:11:09 2013
16x16x16x18	N4quda13fermion_force10MiddleLinkI7double2S2_EE	threads=36864,prec=8,recon=12,sig=4,mu=2	224	1	1	165	1	1	12289	# 0.00 Gflop/s, 0.00 GB/s, tuned Mon Sep 23 18:11:09 2013
16x16x16x18	N4quda13fermion_force10MiddleLinkI7double2S2_EE	threads=36864,prec=8,recon=12,sig=4,mu=5	224	1	1	165	1	1	7022	# 0.00 Gflop/s, 0.00 GB/s, tuned Mon Sep 23 18:11:10 2013
16x16x16x18	N4quda13fermion_force10MiddleLinkI7double2S2_EE	threads=36864,prec=8,recon=12,sig=4,mu=6	224	1	1	165	1	1	8193	# 0.00 Gflop/s, 0.00 GB/s, tuned Mon Sep 23 18:11:10 2013
16x16x16x18	N4quda13fermion_force10MiddleLinkI7double2S2_EE	threads=36864,prec=8,recon=12,sig=4,mu=7	224	1	1	165	1	1	6145	# 0.00 Gflop/s, 0.00 GB/s, tuned Mon Sep 23 18:11:12 2013
16x16x16x18	N4quda13fermion_force10MiddleLinkI7double2S2_EE	threads=36864,prec=8,recon=12,sig=5,mu=0	224	1	1	165	1	1	0	# 0.00 Gflop/s, 0.00 GB/s, tuned Mon Sep 23 18:11:16 2013
16x16x16x18	N4quda13fermion_force10MiddleLinkI7double2S2_EE	threads=36864,prec=8,recon=12,sig=5,mu=1	224	1	1	165	1	1	16385	# 0.00 Gflop/s, 0.00 GB/s, tuned Mon Sep 23 18:11:14 2013
16x16x16x18	N4quda13fermion_force10MiddleLinkI7double2S2_EE	threads=36864,prec=8,recon=12,sig=5,mu=3	224	1	1	165	1	1	9831	# 0.00 Gflop/s, 0.00 GB/s, tuned Mon Sep 23 18:11:15 2013
16x16x16x18	N4quda13fermion_force10MiddleLinkI7double2S2_EE	threads=36864,prec=8,recon=12,sig=5,mu=4	224	1	1	165	1	1	16385	# 0.00 Gflop/s, 0.00 GB/s, tuned Mon Sep 23 18:11:15 2013
16x16x16x18	N4quda13fermion_force10MiddleLinkI7double2S2_EE	threads=36864,prec=8,recon=12,sig=5,mu=6	224	1	1	165	1	1	9831	# 0.00 Gflop/s, 0.00 GB/s, tuned Mon Sep 23 18:11:16 2013
16x16x16x18	N4quda13fermion_force10MiddleLinkI7double2S2_EE	threads=36864,prec=8,recon=12,sig=5,mu=7	224	1	1	165	1	1	16385	# 0.00 Gflop/s, 0.00 GB/s, tuned Mon Sep 23 18:11:17 2013
16x16x16x18	N4quda13fermion_force10MiddleLinkI7double2S2_EE	threads=36864,prec=8,recon=12,sig=6,mu=0	224	1	1	165	1	1	7022	# 0.00 Gflop/s, 0.00 GB/s, tuned Mon Sep 23 18:11:22 2013
16x16x16x18	N4quda13fermion_force10MiddleLinkI7double2S2_EE	threads=36864,prec=8,recon=12,sig=6,mu=2	224	1	1	165	1	1	0	# 0.00 Gflop/s, 0.00 GB/s, tuned Mon Sep 23 18:11:19 2013
16x16x16x18	N4quda13fermion_force10MiddleLinkI7double2S2_EE	threads=36864,prec=8,recon=12,sig=6,mu=3	224	1	1	165	1	1	12289	# 0.00 Gflop/s, 0.00 GB/s, tuned Mon Sep 23 18:11:20 2013
16x16x16x18	N4quda13fermion_force10MiddleLinkI7double2S2_EE	threads=36864,prec=8,recon=12,sig=6,mu=4	224	1	1	165	1	1	12289	# 0.00 Gflop/s, 0.00 GB/s, tuned Mon Sep 23 18:11:21 2013
16x16x16x18	N4quda13fermion_force10MiddleLinkI7double2S2_EE	threads=36864,prec=8,recon=12,sig=6,mu=5	224	1	1	165	1	1	6145	# 0.00 Gflop/s, 0.00 GB/s, tuned Mon Sep 23 18:11:21 2013
16x16x16x18	N4quda13fermion_force10MiddleLinkI7double2S2_EE	threads=36864,prec=8,recon=12,sig=6,mu=7	256	1	1	144	1	1	12289	# 0.00 Gflop/s, 0.00 GB/s, tuned Mon Sep 23 18:11:22 2013
16x16x16x18	N4quda13fermion_force10MiddleLinkI7double2S2_EE	threads=36864,prec=8,recon=12,sig=7,mu=1	224	1	1	165	1	1	9831	# 0.00 Gflop/s, 0.00 GB/s, tuned Mon Sep 23 18:11:27 2013
16x16x16x18	N4quda13fermion_force10MiddleLinkI7double2S2_EE	threads=36864,prec=8,recon=12,sig=7,mu=2	224	1	1	165	1	1	12289	# 0.00 Gflop/s, 0.00 GB/s, tuned Mon Sep 23 18:11:25 2013
16x16x16x18	N4quda13fermion_force10MiddleLinkI7double2S2_EE	threads=36864,prec=8,recon=12,sig=7,mu=3	224	1	1	165	1	1	16385	# 0.00 Gflop/s, 0.00 GB/s, tuned Mon Sep 23 18:11:25 2013
16x16x16x18	N4quda13fermion_force10MiddleLinkI7double2S2_EE	threads=36864,prec=8,recon=12,sig=7,mu=4	224	1	1	165	1	1	6145	# 0.00 Gflop/s, 0.00 GB/s, tuned Mon Sep 23 18:11:26 2013
16x16x16x18	N4quda13fermion_force10MiddleLinkI7double2S2_EE	threads=36864,prec=8,recon=12,sig=7,mu=5	224	1	1	165	1	1	9831	# 0.00 Gflop/s, 0.00 GB/s, tuned Mon Sep 23 18:11:26 2013
16x16x16x18	N4quda13fermion_force10MiddleLinkI7double2S2_EE	threads=36864,prec=8,recon=12,sig=7,mu=6	224	1	1	165	1	1	8193	# 0.00 Gflop/s, 0.00 GB/s, tuned Mon Sep 23 18:11:28 2013
16x16x16x18	N4quda13fermion_force10MiddleLinkI7double2S2_EE	threads=36864,prec=8,recon=18,sig=0,mu=1	224	1	1	165	1	1	6145	# 0.00 Gflop/s, 0.00 GB/s, tuned Mon Sep 23 18:09:16 2013
16x16x16x18	N4quda13fermion_force10MiddleLinkI7double2S2_EE	threads=36864,prec=8,recon=18,sig=0,mu=2	224	1	1	165	1	1	0	# 0.00 Gflop/s, 0.00 GB/s, tuned Mon Sep 23 18:09:13 2013
16x16x16x18	N4quda13fermion_force10MiddleLinkI7double2S2_EE	threads=36864,prec=8,recon=18,sig=0,mu=3	224	1	1	165	1	1	6145	# 0.00 Gflop/s, 0.00 GB/s, tuned Mon Sep 23 18:09:14 2013
16x16x16x18	N4quda13fermion_force10MiddleLinkI7double2S2_EE	threads=36864,prec=8,recon=18,sig=0,mu=4	224	1	1	165	1	1	24577	# 0.00 Gflop/s, 0.00 GB/s, tuned Mon Sep 23 18:09:14 2013
16x16x16x18	N4quda13fermion_force10MiddleLinkI7double2S2_EE	threads=36864,prec=8,recon=18,sig=0,mu=5	224	1	1	165	1	1	6145	# 0.00 Gflop/s, 0.00 GB/s, tuned Mon Sep 23 18:09:15 2013
16x16x16x18	N4quda13fermion_force10MiddleLinkI7double2S2_EE	threads=36864,prec=8,recon=18,sig=0,mu=6	224	1	1	165	1	1	8193	# 0.00 Gflop/s, 0.00 GB/s, tuned Mon Sep 23 18:09:17 2013
16x16x16x18	N4quda13fermion_force10MiddleLinkI7double2S2_EE	threads=36864,prec=8,recon=18,sig=1,mu=0	288	1	1	128	1	1	12289	# 0.00 Gflop/s, 0.00 GB/s, tuned Mon Sep 23 18:09:24 2013
16x16x16x18	N4quda13fermion_force10MiddleLinkI7double2S2_EE	threads=36864,prec=8,recon=18,sig=1,mu=2	224	1	1	165	1	1	9831	# 0.00 Gflop/s, 0.00 GB/s, tuned Mon Sep 23 18:09:21 2013
16x16x16x18	N4quda13fermion_force10MiddleLinkI7double2S2_EE	threads=36864,prec=8,recon=18,sig=1,mu=3	224	1	1	165	1	1	6145	# 0.00 Gflop/s, 0.00 GB/s, tuned Mon Sep 23 18:09:22 2013
16x16x16x18	N4quda13fermion_force10MiddleLinkI7double2S2_EE	threads=36864,prec=8,recon=18,sig=1,mu=4	224	1	1	165	1	1	8193	# 0.00 Gflop/s, 0.00 GB/s, tuned Mon Sep 23 18:09:23 2013
16x16x16x18	N4quda13fermion_force10MiddleLinkI7double2S2_EE	threads=36864,prec=8,recon=18,sig=1,mu=5	224	1	1	165	1	1	12289	# 0.00 Gflop/s, 0.00 GB/s, tuned Mon Sep 23 18:09:23 2013
16x16x16x18	N4quda13fermion_force10MiddleLinkI7double2S2_EE	threads=36864,prec=8,recon=18,sig=1,mu=7	224	1	1	165	1	1	12289	# 0.00 Gflop/s, 0.00 GB/s, tuned Mon Sep 23 18:09:25 2013
16x16x16x18	N4quda13fermion_force10MiddleLinkI7double2S2_EE	threads=36864,prec=8,recon=18,sig=2,mu=0	224	1	1	165	1	1	6145	# 0.00 Gflop/s, 0.00 GB/s, tuned Mon Sep 23 18:09:32 2013
16x16x16x18	N4quda13fermion_force10MiddleLinkI7double2S2_EE	threads=36864,prec=8,recon=18,sig=2,mu=1	224	1	1	165	1	1	0	# 0.00 Gflop/s, 0.00 GB/s, tuned Mon Sep 23 18:09:29 2013
16x16x16x18	N4quda13fermion_force10MiddleLinkI7double2S2_EE	threads=36864,prec=8,recon=18,sig=2,mu=3	224	1	1	165	1	1	7022	# 0.00 Gflop/s, 0.00 GB/s, tuned Mon Sep 23 18:09:30 2013
16x16x16x18	N4quda13fermion_force10MiddleLinkI7double2S2_EE	threads=36864,prec=8,recon=18,sig=2,mu=4	224	1	1	165	1	1	12289	# 0.00 Gflop/s, 0.00 GB/s, tuned Mon Sep 23 18:09:31 2013
16x16x16x18	N4quda13fermion_force10MiddleLinkI7double2S2_EE	threads=36864,prec=8,recon=18,sig=2,mu=6	224	1	1	165	1	1	12289	# 0.00 Gflop/s, 0.00 GB/s, tuned Mon Sep 23 18:09:31 2013
16x16x16x18	N4quda13fermion_force10MiddleLinkI7double2S2_EE	threads=36864,prec=8,recon=18,sig=2,mu=7	224	1	1	165	1	1	12289	# 0.00 Gflop/s, 0.00 GB/s, tuned Mon Sep 23 18:09:33 2013
16x16x16x18	N4quda13fermion_force10MiddleLinkI7double2S2_EE	threads=36864,prec=8,recon=18,sig=3,mu=0	224	1	1	165	1	1	9831	# 0.00 Gflop/s, 0.00 GB/s, tuned Mon Sep 23 18:09:40 2013
16x16x16x18	N4quda13fermion_force10MiddleLinkI7double2S2_EE	threads=36864,prec=8,recon=18,sig=3,mu=1	224	1	1	165	1	1	0	# 0.00 Gflop/s, 0.00 GB/s, tuned Mon Sep 23 18:09:37 2013
16x16x16x18	N4quda13fermion_force10MiddleLinkI7double2S2_EE	threads=36864,prec=8,recon=18,sig=3,mu=2	224	1	1	165	1	1	12289	# 0.00 Gflop/s, 0.00 GB/s, tuned Mon Sep 23 18:09:38 2013
16x16x16x18	N4quda13fermion_force10MiddleLinkI7double2S2_EE	threads=36864,prec=8,recon=18,sig=3,mu=5	224	1	1	165	1	1	0	# 0.00 Gflop/s, 0.00 GB/s, tuned Mon Sep 23 18:09:39 2013
16x16x16x18	N4quda13fermion_force10MiddleLinkI7double2S2_EE	threads=36864,prec=8,recon=18,sig=3,mu=6	224	1	1	165	1	1	9831	# 0.00 Gflop/s, 0.00 GB/s, tuned Mon Sep 23 18:09:39 2013
16x16x16x18	N4quda13fermion_force10MiddleLinkI7double2S2_EE	threads=36864,prec=8,recon=18,sig=3,mu=7	224	1	1	165	1	1	12289	# 0.00 Gflop/s, 0.00 GB/s, tuned Mon Sep 23 18:09:41 2013
16x16x16x18	N4quda13fermion_force10MiddleLinkI7double2S2_EE	threads=36864,prec=8,recon=18,sig=4,mu=0	224	1	1	165	1	1	6145	# 0.00 Gflop/s, 0.00 GB/s, tuned Mon Sep 23 18:09:49 2013
16x16x16x18	N4quda13fermion_force10MiddleLinkI7double2S2_EE	threads=36864,prec=8,recon=18,sig=4,mu=1	288	1	1	128	1	1	6145	# 0.00 Gflop/s, 0.00 GB/s, tuned Mon Sep 23 18:09:45 2013
16x16x16x18	N4quda13fermion_force10MiddleLinkI7double2S2_EE	threads=36864,prec=8,recon=18,sig=4,mu=2	288	1	1	128	1	1	0	# 0.00 Gflop/s, 0.00 GB/s, tuned Mon Sep 23 18:09:46 2013
16x16x16x18	N4quda13fermion_force10MiddleLinkI7double2S2_EE	threads=36864,prec=8,recon=18,sig=4,mu=5	224	1	1	165	1	1	16385	# 0.00 Gflop/s, 0.00 GB/s, tuned Mon Sep 23 18:09:47 2013
16x16x16x18	N4quda13fermion_force10MiddleLinkI7double2S2_EE	threads=36864,prec=8,recon=18,sig=4,mu=6	224	1	1	165	1	1	7022	# 0.00 Gflop/s, 0.00 GB/s, tuned Mon Sep 23 18:09:47 2013
16x16x16x18	N4quda13fermion_force10MiddleLinkI7double2S2_EE	threads=36864,prec=8,recon=18,sig=4,mu=7	224	1	1	165	1	1	9831	# 0.00 Gflop/s, 0.00 GB/s, tuned Mon Sep 23 18:09:49 2013
16x16x16x18	N4quda13fermion_force10MiddleLinkI7double2S2_EE	threads=36864,prec=8,recon=18,sig=5,mu=0	288	1	1	128	1	1	7022	# 0.00 Gflop/s, 0.00 GB/s, tuned Mon Sep 23 18:09:56 2013
16x16x16x18	N4quda13fermion_force10MiddleLinkI7double2S2_EE	threads=36864,prec=8,recon=18,sig=5,mu=1	224	1	1	165	1	1	16385	# 0.00 Gflop/s, 0.00 GB/s, tuned Mon Sep 23 18:09:53 2013
16x16x16x18	N4quda13fermion_force10MiddleLinkI7double2S2_EE	threads=36864,prec=8,recon=18,sig=5,mu=3	288	1	1	128	1	1	16385	# 0.00 Gflop/s, 0.00 GB/s, tuned Mon Sep 23 18:09:54 2013
16x16x16x18	N4quda13fermion_force10MiddleLinkI7double2S2_EE	threads=36864,prec=8,recon=18,sig=5,mu=4	224	1	1	165	1	1	12289	# 0.00 Gflop/s, 0.00 GB/s, tuned Mon Sep 23 18:09:55 2013
16x16x16x18	N4quda13fermion_force10MiddleLinkI7double2S2_EE	threads=36864,prec=8,recon=18,sig=5,mu=6	224	1	1	165	1	1	24577	# 0.00 Gflop/s, 0.00 GB/s, tuned Mon Sep 23 18:09:55 2013
16x16x16x18	N4quda13fermion_force10MiddleLinkI7double2S2_EE	threads=36864,prec=8,recon=18,sig=5,mu=7	224	1	1	165	1	1	7022	# 0.00 Gflop/s, 0.00 GB/s, tuned Mon Sep 23 18:09:57 2013
16x16x16x18	N4quda13fermion_force10MiddleLinkI7double2S2_EE	threads=36864,prec=8,recon=18,sig=6,mu=0	224	1	1	165	1	1	0	# 0.00 Gflop/s, 0.00 GB/s, tuned Mon Sep 23 18:10:04 2013
16x16x16x18	N4quda13fermion_force10MiddleLinkI7double2S2_EE	threads=36864,prec=8,recon=18,sig=6,mu=2	288	1	1	128	1	1	6145	# 0.00 Gflop/s, 0.00 GB/s, tuned Mon Sep 23 18:10:01 2013
16x16x16x18	N4quda13fermion_force10MiddleLinkI7double2S2_EE	threads=36864,prec=8,recon=18,sig=6,mu=3	224	1	1	165	1	1	24577	# 0.00 Gflop/s, 0.00 GB/s, tuned Mon Sep 23 18:10:02 2013
16x16x16x18	N4quda13fermion_force10MiddleLinkI7double2S2_EE	threads=36864,prec=8,recon=18,sig=6,mu=4	224	1	1	165	1	1	12289	# 0.00 Gflop/s, 0.00 GB/s, tuned Mon Sep 23 18:10:03 2013
16x16x16x18	N4quda13fermion_force10MiddleLinkI7double2S2_EE	threads=36864,prec=8,recon=18,sig=6,mu=5	224	1	1	165	1	1	0	# 0.00 Gflop/s, 0.00 GB/s, tuned Mon Sep 23 18:10:03 2013
16x16x16x18	N4quda13fermion_force10MiddleLinkI7double2S2_EE	threads=36864,prec=8,recon=18,sig=6,mu=7	224	1	1	165	1	1	0	# 0.00 Gflop/s, 0.00 GB/s, tuned Mon Sep 23 18:10:05 2013
16x16x16x18	N4quda13fermion_force10MiddleLinkI7double2S2_EE	threads=36864,prec=8,recon=18,sig=7,mu=1	288	1	1	128	1	1	8193	# 0.00 Gflop/s, 0.00 GB/s, tuned Mon Sep 23 18:10:12 2013
16x16x16x18	N4quda13fermion_force10MiddleLinkI7double2S2_EE	threads=36864,prec=8,recon=18,sig=7,mu=2	224	1	1	165	1	1	6145	# 0.00 Gflop/s, 0.00 GB/s, tuned Mon Sep 23 18:10:09 2013
16x16x16x18	N4quda13fermion_force10MiddleLinkI7double2S2_EE	threads=36864,prec=8,recon=18,sig=7,mu=3	288	1	1	128	1	1	9831	# 0.00 Gflop/s, 0.00 GB/s, tuned Mon Sep 23 18:10:10 2013
16x16x16x18	N4quda13fermion_force10MiddleLinkI7double2S2_EE	threads=36864,prec=8,recon=18,sig=7,mu=4	224	1	1	165	1	1	16385	# 0.00 Gflop/s, 0.00 GB/s, tuned Mon Sep 23 18:10:11 2013
16x16x16x18	N4quda13fermion_force10MiddleLinkI7double2S2_EE	threads=36864,prec=8,recon=18,sig=7,mu=5	224	1	1	165	1	1	6145	# 0.00 Gflop/s, 0.00 GB/s, tuned Mon Sep 23 18:10:11 2013
16x16x16x18	N4quda13fermion_force10MiddleLinkI7double2S2_EE	threads=36864,prec=8,recon=18,sig=7,mu=6	224	1	1	165	1	1	7022	# 0.00 Gflop/s, 0.00 GB/s, tuned Mon Sep 23 18:10:13 2013
16x16x16x18	N4quda13fermion_force13SideLinkShortI7double2S2_EE	threads=36864,prec=8,recon=12,sig=0,mu=1	544	1	1	68	1	1	9831	# 0.00 Gflop/s, 0.00 GB/s, tuned Mon Sep 23 18:10:49 2013
16x16x16x18	N4quda13fermion_force13SideLinkShortI7double2S2_EE	threads=36864,prec=8,recon=12,sig=0,mu=2	544	1	1	68	1	1	7022	# 0.00 Gflop/s, 0.00 GB/s, tuned Mon Sep 23 18:10:50 2013
16x16x16x18	N4quda13fermion_force13SideLinkShortI7double2S2_EE	threads=36864,prec=8,recon=12,sig=0,mu=3	544	1	1	68	1	1	24577	# 0.00 Gflop/s, 0.00 GB/s, tuned Mon Sep 23 18:10:51 2013
16x16x16x18	N4quda13fermion_force13SideLinkShortI7double2S2_EE	threads=36864,prec=8,recon=12,sig=0,mu=4	544	1	1	68	1	1	7022	# 0.00 Gflop/s, 0.00 GB/s, tuned Mon Sep 23 18:10:51 2013
16x16x16x18	N4quda13fermion_force13SideLinkShortI7double2S2_EE	threads=36864,prec=8,recon=12,sig=0,mu=5	544	1	1	68	1	1	8193	# 0.00 Gflop/s, 0.00 GB/s, tuned Mon Sep 23 18:10:51 2013
16x16x16x18	N4quda13fermion_force13SideLinkShortI7double2S2_EE	threads=36864,prec=8,recon=12,sig=0,mu=6	544	1	1	68	1	1	7022	# 0.00 Gflop/s, 0.00 GB/s, tuned Mon Sep 23 18:10:52 2013
16x16x16x18	N4quda13fermion_force13SideLinkShortI7double2S2_EE	threads=36864,prec=8,recon=12,sig=1,mu=0	544	1	1	68	1	1	6145	# 0.00 Gflop/s, 0.00 GB/s, tuned Mon Sep 23 18:10:54 2013
16x16x16x18	N4quda13fermion_force13SideLinkShortI7double2S2_EE	threads=36864,prec=8,recon=12,sig=1,mu=2	544	1	1	68	1	1	12289	# 0.00 Gflop/s, 0.00 GB/s, tuned Mon Sep 23 18:10:56 2013
16x16x16x18	N4quda13fermion_force13SideLinkShortI7double2S2_EE	threads=36864,prec=8,recon=12,sig=1,mu=3	544	1	1	68	1	1	24577	# 0.00 Gflop/s, 0.00 GB/s, tuned Mon Sep 23 18:10:56 2013
16x16x16x18	N4quda13fermion_force13SideLinkShortI7double2S2_EE	threads=36864,prec=8,recon=12,sig=1,mu=4	544	1	1	68	1	1	6145	# 0.00 Gflop/s, 0.00 GB/s, tuned Mon Sep 23 18:10:57 2013
16x16x16x18	N4quda13fermion_force13SideLinkShortI7double2S2_EE	threads=36864,prec=8,recon=12,sig=1,mu=5	544	1	1	68	1	1	6145	# 0.00 Gflop/s, 0.00 GB/s, tuned Mon Sep 23 18:10:57 2013
16x16x16x18	N4quda13fermion_force13SideLinkShortI7double2S2_EE	threads=36864,prec=8,recon=12,sig=1,mu=7	544	1	1	68	1	1	8193	# 0.00 Gflop/s, 0.00 GB/s, tuned Mon Sep 23 18:10:57 2013
16x16x16x18	N4quda13fermion_force13SideLinkShortI7double2S2_EE	threads=36864,prec=8,recon=12,sig=2,mu=0	544	1	1	68	1	1	16385	# 0.00 Gflop/s, 0.00 GB/s, tuned Mon Sep 23 18:11:00 2013
16x16x16x18	N4quda13fermion_force13SideLinkShortI7double2S2_EE	threads=36864,prec=8,recon=12,sig=2,mu=1	544	1	1	68	1	1	16385	# 0.00 Gflop/s, 0.00 GB/s, tuned Mon Sep 23 18:11:01 2013
16x16x16x18	N4quda13fermion_force13SideLinkShortI7double2S2_EE	threads=36864,prec=8,recon=12,sig=2,mu=3	544	1	1	68	1	1	24577	# 0.00 Gflop/s, 0.00 GB/s, tuned Mon Sep 23 18:11:02 2013
16x16x16x18	N4quda13fermion_force13SideLinkShortI7double2S2_EE	threads=36864,prec=8,recon=12,sig=2,mu=4	544	1	1	68	1	1	6145	# 0.00 Gflop/s, 0.00 GB/s, tuned Mon Sep 23 18:11:02 2013
16x16x16x18	N4quda13fermion_force13SideLinkShortI7double2S2_EE	threads=36864,prec=8,recon=12,sig=2,mu=6	544	1	1	68	1	1	7022	# 0.00 Gflop/s, 0.00 GB/s, tuned Mon Sep 23 18:11:02 2013
16x16x16x18	N4quda13fermion_force13SideLinkShortI7double2S2_EE	threads=36864,prec=8,recon=12,sig=2,mu=7	544	1	1	68	1	1	6145	# 0.00 Gflop/s, 0.00 GB/s, tuned Mon Sep 23 18:11:03 2013
16x16x16x18	N4quda13fermion_force13SideLinkShortI7double2S2_EE	threads=36864,prec=8,recon=12,sig=3,mu=0	544	1	1	68	1	1	24577	# 0.00 Gflop/s, 0.00 GB/s, tuned Mon Sep 23 18:11:05 2013
16x16x16x18	N4quda13fermion_force13SideLinkShortI7double2S2_EE	threads=36864,prec=8,recon=12,sig=3,mu=1	544	1	1	68	1	1	16385	# 0.00 Gflop/s, 0.00 GB/s, tuned Mon Sep 23 18:11:07 2013
16x16x16x18	N4quda13fermion_force13SideLinkShortI7double2S2_EE	threads=36864,prec=8,recon=12,sig=3,mu=2	544	1	1	68	1	1	24577	# 0.00 Gflop/s, 0.00 GB/s, tuned Mon Sep 23 18:11:07 2013
16x16x16x18	N4quda13fermion_force13SideLinkShortI7double2S2_EE	threads=36864,prec=8,recon=12,sig=3,mu=5	544	1	1	68	1	1	12289	# 0.00 Gflop/s, 0.00 GB/s, tuned Mon Sep 23 18:11:08 2013
16x16x16x18	N4quda13fermion_force13SideLinkShortI7double2S2_EE	threads=36864,prec=8,recon=12,sig=3,mu=6	544	1	1	68	1	1	16385	# 0.00 Gflop/s, 0.00 GB/s, tuned Mon Sep 23 18:11:08 2013
16x16x16x18	N4quda13fermion_force13SideLinkShortI7double2S2_EE	threads=36864,prec=8,recon=12,sig=3,mu=7	544	1	1	68	1	1	24577	# 0.00 Gflop/s, 0.00 GB/s, tuned Mon Sep 23 18:11:08 2013
16x16x16x18	N4quda13fermion_force13SideLinkShortI7double2S2_EE	threads=36864,prec=8,recon=12,sig=4,mu=0	544	1	1	68	1	1	6145	# 0.00 Gflop/s, 0.00 GB/s, tuned Mon Sep 23 18:11:11 2013
16x16x16x18	N4quda13fermion_force13SideLinkShortI7double2S2_EE	threads=36864,prec=8,recon=12,sig=4,mu=1	544	1	1	68	1	1	6145	# 0.00 Gflop/s, 0.00 GB/s, tuned Mon Sep 23 18:11:12 2013
16x16x16x18	N4quda13fermion_force13SideLinkShortI7double2S2_EE	threads=36864,prec=8,recon=12,sig=4,mu=2	576	1	1	64	1	1	8193	# 0.00 Gflop/s, 0.00 GB/s, tuned Mon Sep 23 18:11:13 2013
16x16x16x18	N4quda13fermion_force13SideLinkShortI7double2S2_EE	threads=36864,prec=8,recon=12,sig=4,mu=5	544	1	1	68	1	1	24577	# 0.00 Gflop/s, 0.00 GB/s, tuned Mon Sep 23 18:11:13 2013
16x16x16x18	N4quda13fermion_force13SideLinkShortI7double2S2_EE	threads=36864,prec=8,recon=12,sig=4,mu=6	544	1	1	68	1	1	24577	# 0.00 Gflop/s, 0.00 GB/s, tuned Mon Sep 23 18:11:13 2013
16x16x16x18	N4quda13fermion_force13SideLinkShortI7double2S2_EE	threads=36864,prec=8,recon=12,sig=4,mu=7	544	1	1	68	1	1	8193	# 0.00 Gflop/s, 0.00 GB/s, tuned Mon Sep 23 18:11:14 2013
16x16x16x18	N4quda13fermion_force13SideLinkShortI7double2S2_EE	threads=36864,prec=8,recon=12,sig=5,mu=0	576	1	1	64	1	1	16385	# 0.00 Gflop/s, 0.00 GB/s, tuned Mon Sep 23 18:11:16 2013
16x16x16x18	N4quda13fermion_force13SideLinkShortI7double2S2_EE	threads=36864,prec=8,recon=12,sig=5,mu=1	544	1	1	68	1	1	8193	# 0.00 Gflop/s, 0.00 GB/s, tuned Mon Sep 23 18:11:18 2013
16x16x16x18	N4quda13fermion_force13SideLinkShortI7double2S2_EE	threads=36864,prec=8,recon=12,sig=5,mu=3	544	1	1	68	1	1	16385	# 0.00 Gflop/s, 0.00 GB/s, tuned Mon Sep 23 18:11:18 2013
16x16x16x18	N4quda13fermion_force13SideLinkShortI7double2S2_EE	threads=36864,prec=8,recon=12,sig=5,mu=4	544	1	1	68	1	1	7022	# 0.00 Gflop/s, 0.00 GB/s, tuned Mon Sep 23 18:11:18 2013
16x16x16x18	N4quda13fermion_force13SideLinkShortI7double2S2_EE	threads=36864,prec=8,recon=12,sig=5,mu=6	544	1	1	68	1	1	9831	# 0.00 Gflop/s, 0.00 GB/s, tuned Mon Sep 23 18:11:19 2013
16x16x16x18	N4quda13fermion_force13SideLinkShortI7double2S2_EE	threads=36864,prec=8,recon=12,sig=5,mu=7	544	1	1	68	1	1	6145	# 0.00 Gflop/s, 0.00 GB/s, tuned Mon Sep 23 18:11:19 2013
16x16x16x18	N4quda13fermion_force13SideLinkShortI7double2S2_EE	threads=36864,prec=8,recon=12,sig=6,mu=0	544	1	1	68	1	1	9831	# 0.00 Gflop/s, 0.00 GB/s, tuned Mon Sep 23 18:11:21 2013
16x16x16x18	N4quda13fermion_force13SideLinkShortI7double2S2_EE	threads=36864,prec=8,recon=12,sig=6,mu=2	544	1	1	68	1	1	24577	# 0.00 Gflop/s, 0.00 GB/s, tuned Mon Sep 23 18:11:23 2013
16x16x16x18	N4quda13fermion_force13SideLinkShortI7double2S2_EE	threads=36864,prec=8,recon=12,sig=6,mu=3	544	1	1	68	1	1	0	# 0.00 Gflop/s, 0.00 GB/s, tuned Mon Sep 23 18:11:23 2013
16x16x16x18	N4quda13fermion_force13SideLinkShortI7double2S2_EE	threads=36864,prec=8,recon=12,sig=6,mu=4	544	1	1	68	1	1	6145	# 0.00 Gflop/s, 0.00 GB/s, tuned Mon Sep 23 18:11:24 2013
16x16x16x18	N4quda13fermion_force13SideLinkShortI7double2S2_EE	threads=36864,prec=8,recon=12,sig=6,mu=5	544	1	1	68	1	1	6145	# 0.00 Gflop/s, 0.00 GB/s, tuned Mon Sep 23 18:11:24 2013
16x16x16x18	N4quda13fermion_force13SideLinkShortI7double2S2_EE	threads=36864,prec=8,recon=12,sig=6,mu=7	544	1	1	68	1	1	6145	# 0.00 Gflop/s, 0.00 GB/s, tuned Mon Sep 23 18:11:24 2013
16x16x16x18	N4quda13fermion_force13SideLinkShortI7double2S2_EE	threads=36864,prec=8,recon=12,sig=7,mu=1	544	1	1	68	1	1	9831	# 0.00 Gflop/s, 0.00 GB/s, tuned Mon Sep 23 18:11:27 2013
16x16x16x18	N4quda13fermion_force13SideLinkShortI7double2S2_EE	threads=36864,prec=8,recon=12,sig=7,mu=2	544	1	1	68	1	1	8193	# 0.00 Gflop/s, 0.00 GB/s, tuned Mon Sep 23 18:11:28 2013
16x16x16x18	N4quda13fermion_force13SideLinkShortI7double2S2_EE	threads=36864,prec=8,recon=12,sig=7,mu=3	544	1	1	68	1	1	7022	# 0.00 Gflop/s, 0.00 GB/s, tuned Mon Sep 23 18:11:28 2013
16x16x16x18	N4quda13fermion_force13SideLinkShortI7double2S2_EE	threads=36864,prec=8,recon=12,sig=7,mu=4	544	1	1	68	1	1	12289	# 0.00 Gflop/s, 0.00 GB/s, tuned Mon Sep 23 18:11:29 2013
16x16x16x18	N4quda13fermion_force13SideLinkShortI7double2S2_EE	threads=36864,prec=8,recon=12,sig=7,mu=5	544	1	1	68	1	1	12289	# 0.00 Gflop/s, 0.00 GB/s, tuned Mon Sep 23 18:11:29 2013
16x16x16x18	N4quda13fermion_force13SideLinkShortI7double2S2_EE	threads=36864,prec=8,recon=12,sig=7,mu=6	544	1	1	68	1	1	9831	# 0.00 Gflop/s, 0.00 GB/s, tuned Mon Sep 23 18:11:30 2013
16x16x16x18	N4quda13fermion_force13SideLinkShortI7double2S2_EE	threads=36864,prec=8,recon=18,sig=0,mu=1	576	1	1	64	1	1	0	# 0.00 Gflop/s, 0.00 GB/s, tuned Mon Sep 23 18:09:16 2013
16x16x16x18	N4quda13fermion_force13SideLinkShortI7double2S2_EE	threads=36864,prec=8,recon=18,sig=0,mu=2	544	1	1	68	1	1	8193	# 0.00 Gflop/s, 0.00 GB/s, tuned Mon Sep 23 18:09:18 2013
16x16x16x18	N4quda13fermion_force13SideLinkShortI7double2S2_EE	threads=36864,prec=8,recon=18,sig=0,mu=3	544	1	1	68	1	1	24577	# 0.00 Gflop/s, 0.00 GB/s, tuned Mon Sep 23 18:09:18 2013
16x16x16x18	N4quda13fermion_force13SideLinkShortI7double2S2_EE	threads=36864,prec=8,recon=18,sig=0,mu=4	544	1	1	68	1	1	6145	# 0.00 Gflop/s, 0.00 GB/s, tuned Mon Sep 23 18:09:19 2013
16x16x16x18	N4quda13fermion_force13SideLinkShortI7double2S2_EE	threads=36864,prec=8,recon=18,sig=0,mu=5	544	1	1	68	1	1	9831	# 0.00 Gflop/s, 0.00 GB/s, tuned Mon Sep 23 18:09:20 2013
16x16x16x18	N4quda13fermion_force13SideLinkShortI7double2S2_EE	threads=36864,prec=8,recon=18,sig=0,mu=6	544	1	1	68	1	1	9831	# 0.00 Gflop/s, 0.00 GB/s, tuned Mon Sep 23 18:09:21 2013
16x16x16x18	N4quda13fermion_force13SideLinkShortI7double2S2_EE	threads=36864,prec=8,recon=18,sig=1,mu=0	544	1	1	68	1	1	6145	# 0.00 Gflop/s, 0.00 GB/s, tuned Mon Sep 23 18:09:24 2013
16x16x16x18	N4quda13fermion_force13SideLinkShortI7double2S2_EE	threads=36864,prec=8,recon=18,sig=1,mu=2	544	1	1	68	1	1	24577	# 0.00 Gflop/s, 0.00 GB/s, tuned Mon Sep 23 18:09:26 2013
16x16x16x18	N4quda13fermion_force13SideLinkShortI7double2S2_EE	threads=36864,prec=8,recon=18,sig=1,mu=3	544	1	1	68	1	1	24577	# 0.00 Gflop/s, 0.00 GB/s, tuned Mon Sep 23 18:09:26 2013
16x16x16x18	N4quda13fermion_force13SideLinkShortI7double2S2_EE	threads=36864,prec=8,recon=18,sig=1,mu=4	544	1	1	68	1	1	16385	# 0.00 Gflop/s, 0.00 GB/s, tuned Mon Sep 23 18:09:27 2013
16x16x16x18	N4quda13fermion_force13SideLinkShortI7double2S2_EE	threads=36864,prec=8,recon=18,sig=1,mu=5	544	1	1	68	1	1	9831	# 0.00 Gflop/s, 0.00 GB/s, tuned Mon Sep 23 18:09:28 2013
16x16x16x18	N4quda13fermion_force13SideLinkShortI7double2S2_EE	threads=36864,prec=8,recon=18,sig=1,mu=7	544	1	1	68	1	1	24577	# 0.00 Gflop/s, 0.00 GB/s, tuned Mon Sep 23 18:09:29 2013
16x16x16x18	N4quda13fermion_force13SideLinkShortI7double2S2_EE	threads=36864,prec=8,recon=18,sig=2,mu=0	544	1	1	68	1	1	6145	# 0.00 Gflop/s, 0.00 GB/s, tuned Mon Sep 23 18:09:32 2013
16x16x16x18	N4quda13fermion_force13SideLinkShortI7double2S2_EE	threads=36864,prec=8,recon=18,sig=2,mu=1	544	1	1	68	1	1	0	# 0.00 Gflop/s, 0.00 GB/s, tuned Mon Sep 23 18:09:34 2013
16x16x16x18	N4quda13fermion_force13SideLinkShortI7double2S2_EE	threads=36864,prec=8,recon=18,sig=2,mu=3	576	1	1	64	1	1	8193	# 0.00 Gflop/s, 0.00 GB/s, tuned Mon Sep 23 18:09:35 2013
16x16x16x18	N4quda13fermion_force13SideLinkShortI7double2S2_EE	threads=36864,prec=8,recon=18,sig=2,mu=4	544	1	1	68	1	1	8193	# 0.00 Gflop/s, 0.00 GB/s, tuned Mon Sep 23 18:09:35 2013
16x16x16x18	N4quda13fermion_force13SideLinkShortI7double2S2_EE	threads=36864,prec=8,recon=18,sig=2,mu=6	544	1	1	68	1	1	6145	# 0.00 Gflop/s, 0.00 GB/s, tuned Mon Sep 23 18:09:36 2013
16x16x16x18	N4quda13fermion_force13SideLinkShortI7double2S2_EE	threads=36864,prec=8,recon=18,sig=2,mu=7	544	1	1	68	1	1	8193	# 0.00 Gflop/s, 0.00 GB/s, tuned Mon Sep 23 18:09:37 2013
16x16x16x18	N4quda13fermion_force13SideLinkShortI7double2S2_EE	threads=36864,prec=8,recon=18,sig=3,mu=0	544	1	1	68	1	1	12289	# 0.00 Gflop/s, 0.00 GB/s, tuned Mon Sep 23 18:09:40 2013
16x16x16x18	N4quda13fermion_force13SideLinkShortI7double2S2_EE	threads=36864,prec=8,recon=18,sig=3,mu=1	544	1	1	68	1	1	24577	# 0.00 Gflop/s, 0.00 GB/s, tuned Mon Sep 23 18:09:42 2013
16x16x16x18	N4quda13fermion_force13SideLinkShortI7double2S2_EE	threads=36864,prec=8,recon=18,sig=3,mu=2	544	1	1	68	1	1	7022	# 0.00 Gflop/s, 0.00 GB/s, tuned Mon Sep 23 18:09:43 2013
16x16x16x18	N4quda13fermion_force13SideLinkShortI7double2S2_EE	threads=36864,prec=8,recon=18,sig=3,mu=5	544	1	1	68	1	1	6145	# 0.00 Gflop/s, 0.00 GB/s, tuned Mon Sep 23 18:09:43 2013
16x16x16x18	N4quda13fermion_force13SideLinkShortI7double2S2_EE	threads=36864,prec=8,recon=18,sig=3,mu=6	544	1	1	68	1	1	16385	# 0.00 Gflop/s, 0.00 GB/s, tuned Mon Sep 23 18:09:44 2013
16x16x16x18	N4quda13fermion_force13SideLinkShortI7double2S2_EE	threads=36864,prec=8,recon=18,sig=3,mu=7	544	1	1	68	1	1	8193	# 0.00 Gflop/s, 0.00 GB/s, tuned Mon Sep 23 18:09:45 2013
16x16x16x18	N4quda13fermion_force13SideLinkShortI7double2S2_EE	threads=36864,prec=8,recon=18,sig=4,mu=0	544	1	1	68	1	1	7022	# 0.00 Gflop/s, 0.00 GB/s, tuned Mon Sep 23 18:09:48 2013
16x16x16x18	N4quda13fermion_force13SideLinkShortI7double2S2_EE	threads=36864,prec=8,recon=18,sig=4,mu=1	544	1	1	68	1	1	6145	# 0.00 Gflop/s, 0.00 GB/s, tuned Mon Sep 23 18:09:50 2013
16x16x16x18	N4quda13fermion_force13SideLinkShortI7double2S2_EE	threads=36864,prec=8,recon=18,sig=4,mu=2	576	1	1	64	1	1	7022	# 0.00 Gflop/s, 0.00 GB/s, tuned Mon Sep 23 18:09:51 2013
16x16x16x18	N4quda13fermion_force13SideLinkShortI7double2S2_EE	threads=36864,prec=8,recon=18,sig=4,mu=5	544	1	1	68	1	1	12289	# 0.00 Gflop/s, 0.00 GB/s, tuned Mon Sep 23 18:09:51 2013
16x16x16x18	N4quda13fermion_force13SideLinkShortI7double2S2_EE	threads=36864,prec=8,recon=18,sig=4,mu=6	544	1	1	68	1	1	7022	# 0.00 Gflop/s, 0.00 GB/s, tuned Mon Sep 23 18:09:52 2013
16x16x16x18	N4quda13fermion_force13SideLinkShortI7double2S2_EE	threads=36864,prec=8,recon=18,sig=4,mu=7	544	1	1	68	1	1	7022	# 0.00 Gflop/s, 0.00 GB/s, tuned Mon Sep 23 18:09:53 2013
16x16x16x18	N4quda13fermion_force13SideLinkShortI7double2S2_EE	threads=36864,prec=8,recon=18,sig=5,mu=0	544	1	1	68	1	1	9831	# 0.00 Gflop/s, 0.00 GB/s, tuned Mon Sep 23 18:09:56 2013
16x16x16x18	N4quda13fermion_force13SideLinkShortI7double2S2_EE	threads=36864,prec=8,recon=18,sig=5,mu=1	544	1	1	68	1	1	8193	# 0.00 Gflop/s, 0.00 GB/s, tuned Mon Sep 23 18:09:58 2013
16x16x16x18	N4quda13fermion_force13SideLinkShortI7double2S2_EE	threads=36864,prec=8,recon=18,sig=5,mu=3	544	1	1	68	1	1	8193	# 0.00 Gflop/s, 0.00 GB/s, tuned Mon Sep 23 18:09:59 2013
16x16x16x18	N4quda13fermion_force13SideLinkShortI7double2S2_EE	threads=36864,prec=8,recon=18,sig=5,mu=4	544	1	1	68	1	1	16385	# 0.00 Gflop/s, 0.00 GB/s, tuned Mon Sep 23 18:09:59 2013
16x16x16x18	N4quda13fermion_force13SideLinkShortI7double2S2_EE	threads=36864,prec=8,recon=18,sig=5,mu=6	544	1	1	68	1	1	12289	# 0.00 Gflop/s, 0.00 GB/s, tuned Mon Sep 23 18:10:00 2013
16x16x16x18	N4quda13fermion_force13SideLinkShortI7double2S2_EE	threads=36864,prec=8,recon=18,sig=5,mu=7	544	1	1	68	1	1	16385	# 0.00 Gflop/s, 0.00 GB/s, tuned Mon Sep 23 18:10:01 2013
16x16x16x18	N4quda13fermion_force13SideLinkShortI7double2S2_EE	threads=36864,prec=8,recon=18,sig=6,mu=0	544	1	1	68	1	1	12289	# 0.00 Gflop/s, 0.00 GB/s, tuned Mon Sep 23 18:10:04 2013
16x16x16x18	N4quda13fermion_force13SideLinkShortI7double2S2_EE	threads=36864,prec=8,recon=18,sig=6,mu=2	544	1	1	68	1	1	12289	# 0.00 Gflop/s, 0.00 GB/s, tuned Mon Sep 23 18:10:06 2013
16x16x16x18	N4quda13fermion_force13SideLinkShortI7double2S2_EE	threads=36864,prec=8,recon=18,sig=6,mu=3	544	1	1	68	1	1	9831	# 0.00 Gflop/s, 0.00 GB/s, tuned Mon Sep 23 18:10:07 2013
16x16x16x18	N4quda13fermion_force13SideLinkShortI7double2S2_EE	threads=36864,prec=8,recon=18,sig=6,mu=4	544	1	1	68	1	1	7022	# 0.00 Gflop/s, 0.00 GB/s, tuned Mon Sep 23 18:10:07 2013
16x16x16x18	N4quda13fermion_force13SideLinkShortI7double2S2_EE	threads=36864,prec=8,recon=18,sig=6,mu=5	544	1	1	68	1	1	6145	# 0.00 Gflop/s, 0.00 GB/s, tuned Mon Sep 23 18:10:08 2013
16x16x16x18	N4quda13fermion_force13SideLinkShortI7double2S2_EE	threads=36864,prec=8,recon=18,sig=6,mu=7	544	1	1	68	1	1	9831	# 0.00 Gflop/s, 0.00 GB/s, tuned Mon Sep 23 18:10:09 2013
16x16x16x18	N4quda13fermion_force13SideLinkShortI7double2S2_EE	threads=36864,prec=8,recon=18,sig=7,mu=1	544	1	1	68	1	1	7022	# 0.00 Gflop/s, 0.00 GB/s, tuned Mon Sep 23 18:10:12 2013
16x16x16x18	N4quda13fermion_force13SideLinkShortI7double2S2_EE	threads=36864,prec=8,recon=18,sig=7,mu=2	544	1	1	68	1	1	8193	# 0.00 Gflop/s, 0.00 GB/s, tuned Mon Sep 23 18:10:14 2013
16x16x16x18	N4quda13fermion_force13SideLinkShortI7double2S2_EE	threads=36864,prec=8,recon=18,sig=7,mu=3	544	1	1	68	1	1	6145	# 0.00 Gflop/s, 0.00 GB/s, tuned Mon Sep 23 18:10:14 2013
16x16x16x18	N4quda13fermion_force13SideLinkShortI7double2S2_EE	threads=36864,prec=8,recon=18,sig=7,mu=4	544	1	1	68	1	1	6145	# 0.00 Gflop/s, 0.00 GB/s, tuned Mon Sep 23 18:10:15 2013
16x16x16x18	N4quda13fermion_force13SideLinkShortI7double2S2_EE	threads=36864,prec=8,recon=18,sig=7,mu=5	544	1	1	68	1	1	0	# 0.00 Gflop/s, 0.00 GB/s, tuned Mon Sep 23 18:10:16 2013
16x16x16x18	N4quda13fermion_force13SideLinkShortI7double2S2_EE	threads=36864,prec=8,recon=18,sig=7,mu=6	544	1	1	68	1	1	24577	# 0.00 Gflop/s, 0.00 GB/s, tuned Mon Sep 23 18:10:17 2013
16x16x16x18	N4quda13fermion_force7AllLinkI7double2S2_EE	threads=36864,prec=8,recon=12,sig=0,mu=1	128	1	1	288	1	1	7022	# 0.00 Gflop/s, 0.00 GB/s, tuned Mon Sep 23 18:10:49 2013
16x16x16x18	N4quda13fermion_force7AllLinkI7double2S2_EE	threads=36864,prec=8,recon=12,sig=0,mu=2	128	1	1	288	1	1	8193	# 0.00 Gflop/s, 0.00 GB/s, tuned Mon Sep 23 18:10:47 2013
16x16x16x18	N4quda13fermion_force7AllLinkI7double2S2_EE	threads=36864,prec=8,recon=12,sig=0,mu=3	64	1	1	576	1	1	9831	# 0.00 Gflop/s, 0.00 GB/s, tuned Mon Sep 23 18:10:47 2013
16x16x16x18	N4quda13fermion_force7AllLinkI7double2S2_EE	threads=36864,prec=8,recon=12,sig=0,mu=4	128	1	1	288	1	1	6145	# 0.00 Gflop/s, 0.00 GB/s, tuned Mon Sep 23 18:10:47 2013
16x16x16x18	N4quda13fermion_force7AllLinkI7double2S2_EE	threads=36864,prec=8,recon=12,sig=0,mu=5	64	1	1	576	1	1	8193	# 0.00 Gflop/s, 0.00 GB/s, tuned Mon Sep 23 18:10:48 2013
16x16x16x18	N4quda13fermion_force7AllLinkI7double2S2_EE	threads=36864,prec=8,recon=12,sig=0,mu=6	128	1	1	288	1	1	9831	# 0.00 Gflop/s, 0.00 GB/s, tuned Mon Sep 23 18:10:50 2013
16x16x16x18	N4quda13fermion_force7AllLinkI7double2S2_EE	threads=36864,prec=8,recon=12,sig=1,mu=0	128	1	1	288	1	1	12289	# 0.00 Gflop/s, 0.00 GB/s, tuned Mon Sep 23 18:10:55 2013
16x16x16x18	N4quda13fermion_force7AllLinkI7double2S2_EE	threads=36864,prec=8,recon=12,sig=1,mu=2	64	1	1	576	1	1	16385	# 0.00 Gflop/s, 0.00 GB/s, tuned Mon Sep 23 18:10:53 2013
16x16x16x18	N4quda13fermion_force7AllLinkI7double2S2_EE	threads=36864,prec=8,recon=12,sig=1,mu=3	128	1	1	288	1	1	16385	# 0.00 Gflop/s, 0.00 GB/s, tuned Mon Sep 23 18:10:52 2013
16x16x16x18	N4quda13fermion_force7AllLinkI7double2S2_EE	threads=36864,prec=8,recon=12,sig=1,mu=4	32	1	1	1152	1	1	12289	# 0.00 Gflop/s, 0.00 GB/s, tuned Mon Sep 23 18:10:52 2013
16x16x16x18	N4quda13fermion_force7AllLinkI7double2S2_EE	threads=36864,prec=8,recon=12,sig=1,mu=5	64	1	1	576	1	1	8193	# 0.00 Gflop/s, 0.00 GB/s, tuned Mon Sep 23 18:10:53 2013
16x16x16x18	N4quda13fermion_force7AllLinkI7double2S2_EE	threads=36864,prec=8,recon=12,sig=1,mu=7	32	1	1	1152	1	1	12289	# 0.00 Gflop/s, 0.00 GB/s, tuned Mon Sep 23 18:10:55 2013
16x16x16x18	N4quda13fermion_force7AllLinkI7double2S2_EE	threads=36864,prec=8,recon=12,sig=2,mu=0	64	1	1	576	1	1	6145	# 0.00 Gflop/s, 0.00 GB/s, tuned Mon Sep 23 18:11:01 2013
16x16x16x18	N4quda13fermion_force7AllLinkI7double2S2_EE	threads=36864,prec=8,recon=12,sig=2,mu=1	64	1	1	576	1	1	12289	# 0.00 Gflop/s, 0.00 GB/s, tuned Mon Sep 23 18:10:59 2013
16x16x16x18	N4quda13fermion_force7AllLinkI7double2S2_EE	threads=36864,prec=8,recon=12,sig=2,mu=3	128	1	1	288	1	1	7022	# 0.00 Gflop/s, 0.00 GB/s, tuned Mon Sep 23 18:10:58 2013
